keyword, count
"anti virus",2204009
"norton anti virus",1225964
"anti virus software",1047945
"free anti virus",636839
"avg anti virus",352630
"free anti virus software",276734
"anti virus download",223100
"spyware anti virus",173300
"panda anti virus",130656
"virus anti",121647
"anti virus downloads",103229
"anti virus protection",102605
"anti virus program",89110
"anti virus programs",87843
"anti virus norton",80813
"mcafee anti virus",74886
"free anti virus download",73038
"software anti virus",70691
"free anti virus downloads",69969
"free anti virus spyware",61533
"norton anti virus scanner",53654
"free mcaffee anti virus software downloads",40183
"norton anti virus software",34457
"free norton anti virus",29268
"anti virus gratuit",27338
"norton anti virus download",27039
"nortons anti virus",24983
"best anti virus",23797
"free anti virus program",23488
"symantec anti virus",23142
"anti virus free",23006
"anti virus scan",22994
"anti virus online",21861
"mcafee anti virus software",21512
"free anti virus software download",20695
"download anti virus software",20440
"norton anti virus 2003",20229
"best anti virus software",18688
"kaspersky anti virus",16214
"download anti virus",14870
"free anti virus scan",14692
"anti virus solution",14626
"free anti virus protection",13958
"anti virus products",13742
"nortan anti virus",13672
"anti virus software review",13489
"norten anti virus",13142
"anti virus gratis",13083
"symantec anti virus software",12742
"free anti virus software downloads",12699
"avg anti virus software",12437
"anti virus free download",12157
"norton anti virus free download",12127
"norton anti virus symantec",11824
"anti virus free trial",11794
"anti virus software free",11669
"norton anti virus protection",11429
"norton anti virus 2004",11090
"computer anti virus software",11005
"norton anti virus 2005",10461
"computer anti virus",10394
"norton anti virus update",9789
"avast anti virus",9769
"mcaffee anti virus",9640
"download norton anti virus free",9521
"macafee anti virus",9200
"anti free software spyware virus",9059
"avg anti virus free edition",8705
"stinger anti virus",8649
"symantec norton anti virus",8621
"spyware anti virus software",8595
"linux anti virus",8572
"housecall anti virus",8126
"anti virus on line",8110
"free download anti virus",7940
"anti virus share ware",7928
"compare anti virus software",7901
"free downloadable anti virus software",7726
"agv anti virus",7581
"anti virus software download",7557
"anti virus free ware",7240
"panda anti virus software",6932
"free download norton anti virus",6897
"mcafee anti virus download",6876
"norton anti virus scan",6867
"microsoft anti virus",6837
"norton anti virus 2002",6775
"anti computer software virus",6633
"kaza anti virus",6593
"yahoo anti virus",6582
"macafee anti virus software",6321
"microsoft anti virus spyware",6318
"anti virus freeware",6314
"anti virus software ratings",6254
"avg anti virus free",6228
"free avg anti virus",6058
"anti software virus",5964
"free norton anti virus software",5945
"server anti virus",5683
"avg anti virus free download",5676
"etrust anti virus",5673
"norton anti virus free trial",5605
"free mcafee anti virus",5600
"anti virus protection software",5573
"online anti virus software",5512
"anti+virus",5388
"adware and spyware anti virus",5384
"anti virus review",5335
"anti virus scanner",5316
"free norton anti virus 2003 edition",5286
"norton anti virus corporate edition",5168
"avg free anti virus",5052
"norton anti virus program",4984
"download norton anti virus",4980
"anti download free spyware virus",4964
"avg free anti virus software",4932
"nortin anti virus",4868
"anti virus software rating",4801
"cheap anti virus software",4796
"anti virus software comparison",4637
"linux anti virus software",4584
"norton anti virus free",4496
"best free anti virus software",4486
"best anti virus and spyware software",4375
"server anti virus software",4375
"ez anti virus",4362
"anti removal software spyware virus",4314
"anti virus comparison",4225
"anti virus spyware gratis",4206
"sophos anti virus",4193
"avg6 anti virus",4187
"free microsoft spyware anti virus",4142
"anti virus security",4141
"anti anti spyware virus",4105
"anti virus software free download",4074
"free anti virus programs",4052
"trojan anti virus",4045
"kaspersky anti virus personal",4034
"nortons anti virus software",4008
"online anti virus",3918
"anti free software virus",3855
"free panda anti virus software",3700
"house call anti virus",3663
"trend anti virus",3649
"anti norton virus",3565
"kaspersky anti virus software",3531
"anti free virus",3526
"best anti virus program",3399
"norton+anti+virus",3387
"anti mcaffee software virus",3385
"mcafee anti virus program",3378
"free anti virus software nortons",3355
"shareware anti virus",3353
"anti virus software comparisons",3253
"norton anti virus spyware",3247
"anti buy software virus",3224
"microsoft anti virus software",3210
"free trial anti virus software",3205
"panda anti virus download",3192
"review anti virus software",3151
"anti code registration spyware virus",3146
"free anti virus protection software",3129
"anti virus antispam",3114
"anti virus firewall",3106
"crack norton anti virus 2005",3084
"anti virus para xp gratis",3070
"command anti virus software",3069
"nortan anti virus software",3046
"anti virus xp",3040
"anti virus software reviews",3031
"avast anti virus software",3027
"anti free mac software virus",3014
"avg free anti virus software download",3010
"free panda anti virus",2995
"anti virus softwear",2993
"what is the best anti virus software",2988
"anti virus software downloads",2982
"anti virus gold",2980
"aspyware anti virus",2936
"free anti virus software for window xp",2899
"gratis anti virus software",2896
"anti virus mail server",2865
"mcafee anti virus update",2844
"mcaffee anti virus download",2843
"afree anti virus software",2825
"anti discount software virus",2816
"anti macafee software virus",2810
"norton anti virus trial",2798
"mcfee anti virus",2787
"free microsoft anti virus software",2768
"free anti virus software xp",2757
"free anti virus and spyware protection",2745
"norton anti virus gratis",2737
"download norton anti virus software",2709
"free trial norton anti virus downloads",2696
"isp anti virus",2664
"free anti virus anti spyware download",2663
"anti gold spyware virus",2656
"network anti virus software",2623
"download stinger anti virus mcafee",2620
"anti virus software or program",2616
"anti norton removal spyware virus",2606
"norton anti virus 2002 upgrade",2578
"virus anti virus software",2575
"best anti virus software for",2563
"free ware anti virus software",2557
"top 0 anti virus software",2553
"norton symantec anti virus software",2539
"free computer anti virus",2538
"anti cheap norton software virus",2507
"free online anti virus",2501
"anti program spyware virus",2493
"anti virus vs spyware",2492
"anti virus and spyware removal free",2488
"anti virus softwares",2488
"norton anti virus 2005 cd key",2479
"anti virus avg",2462
"norton anti virus upgrade",2455
"avg anti virus download",2399
"anti virus software program",2398
"mac anti virus software",2390
"online anti virus scan",2384
"free anti virus software review",2379
"anti virus software anti virus",2376
"norton anti virus downloads",2373
"free mcafee anti virus download",2360
"computer anti virus protection",2355
"anti norton spyware virus",2347
"windows 2000 server anti virus software",2342
"anti free macintosh software virus",2329
"norman anti virus",2323
"anti download norton spyware virus",2311
"top anti virus software",2267
"free anti virus software mcafee",2257
"norton anti virus for window xp",2254
"anti virus tools",2240
"anti virus trial",2232
"anti software spyware virus",2225
"free norton anti virus download",2192
"anti virus da scaricare",2177
"anti virus update",2173
"ez trust anti virus",2167
"anti free software uk virus",2160
"norton anti virus live update",2158
"noton anti virus",2142
"trial anti virus software",2123
"anti nortan software virus",2119
"anti firewall spyware virus",2105
"norton anti virus software download",2101
"anti virus antispam free software",2099
"telecharger anti virus",2093
"anti free removal software virus",2082
"anti free nortons software virus",2077
"command anti virus",2072
"anti virus gratuito",2069
"norton anti virus scanners",2054
"anti virus software for mac",2049
"anti download spyware virus",2043
"software gratis anti virus",2042
"kaspersky anti virus personal pro",2037
"anti firewall linux virus",2028
"anti spyware and virus protection",2021
"free online anti virus software",2003
"anti best free software virus",1986
"trend anti virus software",1986
"macintosh anti virus software",1955
"nova anti spyware and virus",1942
"the best anti virus software",1942
"anti avg download free virus",1934
"anti downloading free software virus",1928
"download free norton anti virus software",1924
"avast free anti virus software",1907
"shield anti virus",1905
"anti computer spyware virus",1904
"anti virus software uk",1896
"nortons anti virus free trial",1896
"freeware anti virus",1890
"anti spyware virus downloads",1885
"norton anti virus 2001",1875
"anti virus en ligne",1868
"anti download removal spyware virus",1857
"norton anti virus 2005 download",1852
"panda anti virus titanium",1852
"anti virus spyware win",1848
"free anti virus and spyware program",1841
"anti macafee virus",1840
"anti downloads free spyware virus",1838
"mcaffee anti virus software",1838
"adware anti spyware virus virus",1835
"anti download free norton virus window xp",1829
"free anti spyware and anti virus",1829
"downloadable anti virus software",1821
"anti rating spyware virus",1820
"10 anti software top virus",1817
"free anti virus software program",1810
"adaware anti virus",1804
"agv anti software virus",1796
"anti virus product",1783
"window anti virus software",1781
"anti virus scans",1771
"pccillin anti virus",1764
"norton anti virus 2002 download",1763
"anti free norton software virus",1762
"anti+virus+software",1757
"norton anti virus 2005 software",1746
"avp anti virus",1739
"anti antispam free software virus",1736
"anti anti free free software virus virus",1735
"free spyware anti virus scan",1731
"free online anti virus scan",1725
"spyware doctor anti virus",1725
"anti pc software virus",1718
"anti panda virus",1672
"spyware anti virus review",1666
"anti virus shareware",1660
"anti mac software virus",1654
"mcafee anti virus programs",1643
"avg anti virus system",1641
"panda anti virus platinum",1640
"anti norton software virus",1635
"anti virus software and",1627
"free anti virus software for server",1618
"northon anti virus",1602
"anti virus 2005",1595
"mcaffe anti virus",1595
"avg anti virus protection",1591
"anti free software trojan virus",1590
"anti business small software virus",1578
"anti virus software company",1572
"anti buy com software virus",1562
"anti download free macafee virus",1550
"2003 anti best software virus",1549
"anti virus system",1520
"anti cillin pc software virus",1517
"panda anti virus gratis",1513
"download anti virus mcafee",1512
"anti virus software and spam filter spyware remo",1511
"anti remover spyware virus",1505
"free anti virus download grisoft",1504
"free ware anti virus download software",1504
"anti virus and firewall software",1499
"how to remove mcafee anti virus",1493
"grisoft anti virus",1492
"anti virus software for windows 95",1490
"free anti virus programms",1489
"anti virus spyware",1483
"anti computer free software virus",1472
"anti firewall free software virus",1471
"download free anti virus software",1468
"anti virus for computer",1466
"anti policy software virus",1465
"anti virus systems",1459
"cheap symantec anti virus software",1446
"download free anti virus",1436
"panda software anti virus",1434
"spyware+anti+virus",1427
"free anti virus scanner",1426
"xp anti virus software",1426
"free norton anti virus 2005",1422
"anti removal spyware virus",1413
"free firewall anti virus software",1410
"macfee anti virus",1399
"anti software virus yahoo",1395
"free norton anti virus downloads",1394
"anti spyware virus",1384
"anti spyware, anti virus, spybot search and destroy",1381
"anti virus software sales",1380
"anti kaspersky software virus",1377
"norton anti virus product key",1377
"free yahoo anti virus",1375
"anti associate computer software virus",1369
"symantic anti virus",1369
"mcafee norton anti virus",1363
"norton anti virus 2000",1360
"free download anti virus software",1359
"anti avg free software virus",1351
"free anti virus ezarmor",1351
"adware anti spyware virus",1350
"cheap free downloadable anti virus software",1350
"free yahoo anti virus software",1347
"anti dell kopen software virus",1343
"norton anti virus 2003 download",1341
"anti free spyware virus",1339
"cheap pocket pc anti virus software",1330
"pocket pc anti virus software",1330
"cheap free anti virus software from microsoft",1328
"vet anti virus",1323
"cheap download norton anti virus software",1321
"firewall and anti virus software",1318
"anti best review software virus",1313
"anti fre software virus",1313
"free anti virus software linux",1304
"anti dell software virus",1283
"desktop anti virus software",1273
"free trial anti virus",1270
"anti virus software test",1268
"program anti virus",1265
"teste anti virus",1262
"free linux anti virus software",1260
"panda anti virus online",1256
"anti virus free downloads",1255
"anti download macafee virus",1250
"kasperkys anti virus personal",1248
"cheap norton symantec anti virus software",1245
"norton anti virus 2006",1242
"anti free program software virus",1237
"norton anti virus will not auto protect",1236
"anti mcafee software virus",1234
"etrust ez anti virus",1234
"activation anti number panda titanium virus",1228
"anti virus free software",1228
"downloadable free anti virus software",1223
"anti virus software linux",1218
"agv anti virus software",1206
"discount anti virus software",1198
"2004 anti review software virus",1195
"anti downloads software virus",1188
"free anti virus scans",1184
"free anti virus remover",1166
"anti virus software for linux",1158
"free anti virus online",1156
"avg anti virus program",1142
"anti virus panda",1139
"norton anti virus free trail",1139
"anti download mcaffee virus",1123
"panda titanium anti virus",1122
"anti downloads free software virus",1121
"defender pro anti virus",1121
"anti email hosting virus",1114
"norton anti virus renewal",1112
"free anti virus software for mac",1107
"anti download free software virus",1106
"computer anti virus softwares",1106
"top rated anti virus software",1105
"2004 anti norton software virus",1104
"norton anti virus for xp",1104
"download norton anti virus 2002",1103
"uninstall norton anti virus",1102
"mcaffee anti virus scan",1095
"anti virus ezarmour",1094
"anti virus programm",1093
"aanbieding anti dell software virus",1086
"cheap anti virus software download",1084
"anti rate software virus",1079
"cheap free ware anti virus download software",1074
"free mcafee anti virus software",1070
"anti free share software virus ware",1068
"panda anti virus scan",1066
"anti mcaffee virus",1061
"anti virus computer software",1060
"avg anti virus free addition",1060
"macfee anti virus free software",1060
"mcafee anti virus free",1058
"managed anti virus software",1056
"mcafee anti virus protection",1051
"anti virus coolweb serachj",1050
"dowload free anti virus",1042
"anti virus trojan",1041
"free anti virus software anti virus",1041
"computer security anti virus",1038
"free+anti+virus",1031
"norton anti virus 2004 download",1030
"free anti virus removal",1028
"anti virus reviews",1020
"free norton anti virus protection",1020
"anti computer virus programs",1018
"anti free software virus window",1013
"norton anti virus definition",1012
"anti free panda software virus",1010
"solo anti virus",1008
"cheap anti discount norton software virus",994
"free anti virus avg",992
"norton anti virus help",989
"panda anti virus free download",984
"sophos anti virus software",974
"best anti virus protection",969
"norto anti virus",969
"anti download free virus",957
"anti find free software virus",951
"free mcafee anti virus scan",951
"anti free free software thefreesite.com virus ware",949
"stop sign anti virus",943
"norton anti virus 2005 serial",941
"norton anti virus keygen",939
"norton anti virus updates",935
"free software anti virus",933
"norton anti virus corporate",933
"best free anti virus",931
"f secure anti virus",919
"free anti virus software windows xp",917
"norton anti virus 2005 keygen",917
"anti free software totally virus",909
"win anti virus",907
"anti virus symantec",906
"rav anti virus",905
"anti virus guard",904
"anti virus software trial",899
"free anti virus software to download",895
"anti virus 26 anti spyware programs",888
"anti checker software spam virus",873
"free nortons anti virus",871
"norton anti virus support",866
"free download anti virus protection",865
"anti virus avast",863
"download free anti virus program",862
"anti stinger virus",860
"anti virus protection program",858
"trend micro anti virus",857
"anti free from microsoft software virus",856
"norton anti virus pro",855
"anti avg virus",854
"anti computer virus",849
"anti free scan software virus",845
"free norton anti virus program",842
"anti virus 2003",841
"free anti virus protection downloads",834
"anti avg free virus",832
"free norton anti virus 2004",828
"anti virus downloadss",827
"free mac anti virus software",827
"anti dell goedkoop software virus",824
"anti free software trial virus",824
"free avg anti virus download",824
"anti best software virus",822
"zone alarm anti virus",822
"2005 anti cd key norton virus",821
"norton anti virus firewall",821
"anti free online software virus",818
"anti virus norton 2002",817
"9.0 anti groupware sav symantec virus",816
"norton anti virus 2004 serial",814
"norton anti virus technical support",813
"norton anti virus 2005 product key",809
"free anti virus soft ware",808
"norton anti virus crack",805
"anti virus software mcafee",802
"anti virus scan free",801
"anti virus mcfee",790
"norton anti virus key",786
"anti package software virus",783
"anti virus software mac",782
"free norton anti virus scan",781
"anti free panda virus ware",777
"free anti virus and firewall",776
"kasperski anti virus",776
"avg anti virus professional",771
"anti virus and firewall protection",768
"anti virus download free",768
"free avg 7.0 anti virus",768
"anti computer free protection virus",767
"adware anti virus",764
"free anti virus software scan",760
"eztrust anti virus",753
"anti pc pocket software virus",747
"pc cillin anti virus",747
"free downloadable anti virus programs",745
"free download of norton anti virus",745
"free avg anti virus software",744
"computer anti virus program",742
"free avg anti virus protection",742
"free anti virus house call",733
"anti free remover spyware virus",731
"anti avg software virus",728
"anti virus software download free",728
"norton anti virus 2005 crack",728
"anti download free norton virus",724
"anti virus program downloads for free",722
"norton anti virus free scan",719
"norton anti virus uk",719
"window 2000 server anti virus software",715
"free downloadable norton anti virus software trial",710
"norton anti virus trial version",709
"anti free msn software virus",708
"phone number for symantec norton anti virus",708
"anti msn software virus",706
"online anti virus scanner",705
"buy norton anti virus",704
"free anti virus check",703
"anti macintosh software virus",699
"anti virus live updates",696
"norton anti virus tech support",694
"avg downloads anti virus software",688
"what is a anti virus",688
"anti free remover software virus",687
"anti associate computer free virus",685
"anti virus window xp",685
"update norton anti virus",684
"anti virus free scan",678
"free avg anti virus downloads",676
"free edition avg anti virus download",676
"anti free protection virus",675
"anti avast virus",670
"anti virus to download",670
"microsoft free anti virus download",669
"computer associate anti virus",667
"gratis anti virus",667
"downloads anti virus",666
"panda anti virus program",666
"anti free free software virus ware",663
"anti virus mcafee",661
"free downloads anti virus",660
"norton anti virus phone number",659
"rate anti virus software",658
"stinger anti virus software",658
"cheap anti panda software titanium virus",656
"free download norton anti virus 2004",655
"anti software top virus",654
"macafee anti virus download",654
"norton anti virus free downloads",651
"remove norton anti virus",646
"avast anti virus download",644
"online anti virus check",644
"anti virus online scan",641
"anti free mcafee protection virus",639
"windows anti virus",636
"anti virus scanners",634
"anti free mcafee software virus",632
"freeware anti virus software",632
"mcafe anti virus",632
"test anti virus software",632
"kaspersky anti virus key",631
"anti virus mac",629
"norton anti virus 2006crack",628
"small business anti virus software",627
"anti housecall virus",623
"macintosh anti virus",623
"norton anti virus 2004 product key",623
"free nortons anti virus software",622
"free avg anti virus program",616
"panda anti virus platinum 7.0",616
"anti virus 2002",614
"anti dell software verkoop virus",613
"anti virus software for servers",613
"kaspersky anti virus 5.0.142 key",612
"firewall anti virus software",611
"symantec norton anti virus 2005",611
"anti free scan virus",609
"anti virus software freeware",607
"anti software symantec virus",606
"anti virus gateway",605
"download anti virus protection",605
"free anti virus removal software",604
"norton 2003 anti virus software",603
"download free anti virus and deleter",601
"free linux anti virus",600
"symantec norton anti virus software down",600
"anti protection virus",599
"norton anti virus website",598
"norton anti virus professional",595
"anti server software virus",594
"norton anti virus trial download",594
"free anti virus trial",593
"download free anti virus scan",592
"free norton anti virus 2003",592
"anti norman virus",590
"anti virus software for macintosh",589
"housecall anti virus scan",589
"anti software test virus",587
"norton anti virus cd key",586
"norton anti virus update download",584
"norton anti virus home page",582
"anti nortons virus",580
"2000 anti server software virus window",579
"anti free protection software virus",578
"free anti virus soft wear",578
"free version of norton anti virus",578
"stinger anti virus download",578
"anti free software virus ware",577
"download kaspersky anti virus free",577
"free anti virus bitdesender dowloand",577
"cheap norton anti virus",576
"comparison of anti virus software",576
"anti virus gratuits",575
"jeefo anti virus download",575
"anti free home software virus",573
"download avg anti virus",573
"symantic norton anti virus",573
"anti virus program download",571
"mcafee anti virus free download",571
"best anti virus software review",570
"anti virus for windows small business server 2003",569
"anti virus software symantec anti virus",568
"secure anti virus",566
"norton anti virus home",565
"anti virus detection",564
"grisoft avg anti virus",564
"norton anti virus for free",564
"network anti virus",562
"norton anti virus definition update",562
"free microsoft anti virus downloads",561
"install norton anti virus",561
"anti virus trial downloads",559
"anti panda software virus",556
"anti virus for mac",555
"anti firewall free protection virus",554
"norton anti virus scan free",554
"anti symantec virus",553
"kaspersky anti virus cd key",553
"avg anti virus license number",551
"free norton anti virus update",551
"free trial anti virus protection",551
"2005 norton anti virus",549
"avg anti virus review",549
"download mcafee anti virus",547
"norton anti virus 2004 pro",547
"e trust anti virus",545
"mcafee anti virus scan",545
"downlod anti virus",544
"norton anti virus 2004 software",543
"anti virus anti spyware software",540
"avg anti virus free downloads",538
"kapersky anti virus",536
"top 10 anti virus software",536
"anti download norton virus",535
"windows 2003 server anti virus software",535
"anti free norton scan virus",531
"avg anti virus free version",531
"mcafee anti virus download free",531
"totally free anti virus programs",531
"anti best software spyware virus",528
"anti download free microsoft virus",528
"anti virus test",527
"2005 anti norton virus",525
"anti microsoft virus",525
"best free anti virus protection",524
"anti virus software free downloads",523
"compare anti virus",521
"anti virus program review",519
"avg free anti virus download",519
"free online anti virus protection",518
"anti free protection spyware virus",516
"best rated anti virus software",516
"anti virus software free trial",515
"anti virus spice bot",513
"anti free software virus xp",512
"anti avg download software virus",511
"penicillin anti virus",511
"norton anti virus 2004 keygen",510
"norton anti virus mac",510
"2004 anti norton virus",509
"windows 95 anti virus software",507
"anti download software virus",505
"anti virus software 20",505
"best computer anti virus protection",505
"anti online virus",504
"norton mcafee anti virus software",504
"anti norton online scan virus",503
"free online anti virus check",503
"remove norton anti virus 2004",501
"anti virus macfee",500
"anti virus firewall software",498
"telecharger anti virus internet",498
"anti free review software virus",495
"anti cheap software virus",494
"anti virus program free",493
"trojan horse anti virus",493
"norton anti virus activation key",492
"anti virus protections",490
"anti ez virus",489
"anti virus coolweb serach",489
"software utility norton anti virus",489
"anti virus linux",488
"per anti virus",487
"2005 anti norton software virus",485
"mcafee anti virus downloads",485
"yahoo anti virus protection",484
"anti download free norton software virus",483
"anti virus software avg",483
"norton anti virus free software",483
