keyword, count
"windows 2000 server anti virus",483
"crack norton anti virus",482
"norton symantec anti virus",481
"free download anti virus programs",480
"notron anti virus",478
"anti discount norton software virus",477
"norton anti virus for mac",477
"anti anti norton software virus virus",476
"anti virus worm",476
"panda anti virus online scan",476
"norton anti virus demo",475
"nortons anti virus download",475
"package force symantec anti virus corp def download",475
"free computer anti virus protection",474
"reinstall norton anti virus",474
"anti virus software cheap",473
"anti virus programme",472
"free download of anti virus protection",472
"anti rated software top virus",470
"mcafee free anti virus protection",469
"2004 anti gratis norton virus",468
"anti virus check",468
"anti virus scan online",468
"symantec anti virus corporate edition",468
"anti virus trend",467
"free anti virus and spyware",465
"anti trojan virus",463
"norton anti virus subscription",463
"free firewall and anti virus protection",461
"microsoft free anti virus",461
"norman anti virus software",461
"anti virus feeware",459
"free avg anti virus scan",459
"microsoft anti virus protection",459
"2004 norton anti virus",458
"anti virus scan symantec",458
"freeware anti virus scan",458
"northern anti virus",458
"recommended anti virus",458
"smb anti virus software solution",458
"norton anti virus 2005 key",457
"anti virus programmes",455
"2000 anti norton professional retail virus",454
"free anti norton virus",454
"avg anti virus pro",453
"avg anti virus scan",453
"antivirus software free anti virus",451
"anti computer free program virus",450
"free anti virus trojan software",450
"2000 anti server software virus",449
"anti microsoft software virus",449
"mcafee anti virus 90",449
"norton anti virus 2003 keygen",449
"norton anti virus 2005 upgrade",449
"anti virus uk",448
"nortons anti virus protection",448
"mcafee anti virus 2005",445
"norton anti virus install",445
"anti free norton scanner virus",443
"anti virus free down load",443
"software security symantec anti virus",443
"anti virus torrent",441
"free norton anti virus updates",441
"freeware anti virus programs",441
"panda anti virus serial",441
"anti virus software for window",440
"antivirus anti virus",439
"anti virus software solution",439
"free anti virus scan removal",439
"trial anti virus protection",439
"anti free norton online virus",438
"firewall anti virus",436
"norton free trial anti virus",436
"anti gratuit virus",435
"anti virus 2004",434
"anti software trojan virus",433
"2004 anti download free virus",432
"anti anti firewall program software spyware virus",432
"anti download firewall free virus",432
"norton anti virus patch",432
"avg anti virus 7",431
"anti downloads firewall free virus",430
"crack anti virus 2005",430
"free ware anti virus",430
"innoculate anti virus",430
"norton anti virus serial number",430
"download a free anti virus for my pc",429
"free downloadable anti virus",429
"mcafee download anti virus",429
"norton anti virus programs",428
"anti review software virus",427
"anti avg serial virus",425
"anti virus software buy",425
"bulldog anti virus",425
"free grisoft anti virus",425
"norton anti virus 2005 professional",425
"anti mcafee virus",424
"norton anti virus serial",424
"free computer anti virus software",423
"avg anti virus free software",422
"norton anti virus removal tool",422
"anti virus ratings",421
"software norton anti virus free",420
"kaspersky anti virus 06",419
"anti download norton software virus",418
"avg6 free anti virus downloads",418
"mcafee anti virus software download",418
"anti nortan virus",417
"anti virus software companies",417
"anti virus stinger software",417
"logiciel anti virus",417
"anti virus software online",416
"anti virus solutions",416
"exchange anti virus",416
"open source anti virus",416
"anti virus software share ware",415
"free anti spyware anti virus downloads",415
"freeware anti virus pocket pc",415
"norton anti virus free ware",415
"anti virus scanning",414
"anti associate computer ez virus",413
"anti online software virus",413
"anti virus program ratings",413
"antivirus force symantec anti virus corp def download",411
"mcafee anti virus oem version2c download",411
"mccafee anti virus",411
"avg anti virus professional single edition 7.0.302.433",409
"norton anti virus customer service",409
"antivirus protection mcaffee anti virus australia",407
"free anti virus download software",407
"anti avg free protection virus",406
"panda anti virus update",406
"avg anti virus free ware",405
"norton secrurity anti virus",405
"anti free norton symantec virus",404
"anti spybot virus",404
"avg, anti virus g",404
"software anti virus software",403
"free anti virus firewall",402
"avg anti virus 7.0",401
"mcafee free anti virus updates",398
"best anti virus programs",397
"download avg anti virus software",397
"free avarst anti virus software",397
"free nortan anti virus",395
"mac anti virus",395
"anti virus trial download",394
"free anti virus protector",394
"anti norton symantec virus",393
"computer associate anti virus software",393
"anti virus trojan horse",392
"software pc cillin anti virus",392
"anti free panda virus",391
"mcafee free anti virus software",391
"anti virus definition",389
"anti virus free protection",389
"avg anti virus system free edition",388
"mcafee anti virus programs removal",388
"mcafee anti virus protecton",388
"mcfee anti virus software",388
"anti virus software windows 2000 server compatible",387
"dr solomon anti virus",387
"housecalls anti virus",387
"download nortons anti virus",386
"free downloadable anti virus protection",386
"free trojan anti virus",386
"norton anti virus 2004 phone challenge code",386
"zone alarm anti virus review",386
"anti free program virus",385
"anti free trial virus",384
"antivirus 2004 symantec norton anti virus",384
"anti virus yahoo",384
"avg free anti virus downloads",384
"computer anti virus programs",384
"download anti virus mcafee for free",384
"norton anti virus web site",384
"anti free norton virus",383
"anti virus francais gratuit",383
"antivirus mcafee free anti virus software",383
"mcafee anti virus antivirus",383
"anti virus package",382
"free anti virus scanners",382
"panda anti virus free scan",382
"pc anti virus",382
"sophos anti virus free download",382
"virex anti virus software",382
"anti associate computer etrust virus",380
"anti virus product review",380
"free microsoft anti virus",380
"mcafee anti virus disc 2005",380
"free mcafee anti virus downloads",378
"free trial norton anti virus",378
"free window anti virus software",378
"pc cillin anti virus download",378
"uninstall mcafee anti virus program",378
"anti download virus",377
"mcafee com mcaffee anti virus",377
"kaspersky anti virus personal 2006",376
"anti virus software norton",375
"discount norton anti virus 2004",375
"adware anti norton virus",374
"anti program virus",374
"anti smb software virus",374
"norton anti virus 2004 key",374
"norton anti virus free trial download",374
"anti kaspersky virus",373
"anti norton virus update",373
"free nortin anti virus",373
"mcafee anti virus protection software",373
"2003 anti norton software virus",372
"house call anti virus scan",372
"looking for free anti virus",372
"macafee anti virus free download",372
"anti firewall software virus",371
"anti virus gratuis",371
"free anti virus scan software",371
"anti sophos virus",370
"anti virus downloads free",370
"free trial norton anti virus software",370
"sbc anti virus",370
"norton anti virus gratuit",369
"download norton anti virus 2004",368
"free download for anti virus protection",368
"norton anti virus xp",368
"stinker anti virus",368
"anti virus trojan.lodmedud",367
"etrust anti virus software",367
"registration codes for anti virus and spyware 376",367
"avast anti virus free download",366
"download norton anti virus gratis",366
"free anti virus program downloads",366
