keyword, count
"michigan lawyer attorney in mi",20
"russia lawyer russia attorney at your service 24x7",20
"sarah bales attorney lawyer wisconsin",20
"washington+bankruptcy+lawyer+attorney",20
"albany new york personal injury lawyer attorney law firm",19
"asbestos lawyer mesothelioma tennessee mesothelioma attorney",19
"attorney lawyer mesothelioma settlement",19
"attorney lawyer new rochester york",19
"attorneys, attorney, lawyer, legal, law, law firm",19
"dui dwi attorney lawyer tampa seminar.html",19
"findlaw legal news lawyer news, attorney news, law news,",19
"florida personal injury attorney birth injury lawyer",19
"mesothelioma attorney mesothelioma lawyer mesothelioma symptoms mesothelioma.tips-and-facts.com",19
"owensboro lawyer owensboro attorney at your service 24x7",19
"power attorney lawyer ontario",19
"seattle attorney seattle lawyer",19
"small business lawyer attorney law legal help findlaw for",19
"accident attorney lawyer motorcycle",18
"angelo attorney child custody lawyer modification san",18
"asbestos attorney georgia lawyer savannah",18
"asbestos attorney lawyer mesothelioma asbestos disease",18
"attorney attorney findlaw law lawyer lawyer legal resource",18
"attorney dui dwi law lawyer suspension tampa",18
"attorney injury lawyer personal wisconsin",18
"auto accident attorney lawyer",18
"delaware mesothelioma lawyer new york mesothelioma attorney",18
"lawyer attorney jobs",18
"mesothelioma attorney mesothelioma mesothelioma lawyer mesothelioma mesotheliomainformer.com",18
"mesothelioma lawyer mesothelioma attorney mesothelioma mesotheliomainformer.com",18
"mesothelioma lawyer mesothelioma attorney mesothelioma mesothelioma symptoms mesotheliomainformer.com",18
"mesothelioma lawyer mesothelioma symptoms mesothelioma attorney mesothelioma mesotheliomainformer.com",18
"mesothelioma symptoms mesothelioma lawyer mesothelioma attorney mesotheliomainformer.com",18
"new york personal injury attorney birth injury lawyer",18
"wisconsin+personal+injury+lawyer+attorney",18
"alphabetical attorney lawyer yellow pages r lawresearch",17
"asbestos attorney asbestos lawyer mesothelioma cancer",17
"attorney attorney family family lawyer legal servi",17
"attorney directory lawyer",17
"attorney divorce florida lawyer",17
"attorney dui dwi in lawyer utah",17
"criminal lawyer attorney",17
"geoffrey clark utah lawyer attorney",17
"illinois mesothelioma lawyer baltimore mesothelioma attorney",17
"legal lawyer attorney job japan tokyo",17
"live attorney lawyer chat",17
"lovington lawyer lovington attorney at your service 24x7",17
"mesothelioma attorney mesothelioma lawyer mesothelioma attorney mesothelioma doctor mesothelioma.tips-and-facts.com",17
"mesothelioma lawyer mesothelioma lawyer mesothelioma attorney mesothelioma doctor mesotheliomainformer.com",17
"missouri mesothelioma lawyer louisiana mesothelioma attorney",17
"personal injury attorney los angeles birth injury lawyer",17
"spokane lawyer spokane attorney at your service 24x7",17
"antonio attorney directory lawyer san texas",16
"asbestos attorney asbestos lawyer about us page",16
"attorney attorney lawyer legal litigation services",16
"attorney charlotte county mesothelioma lawyer louisiana",16
"attorney florida hollywood in lawyer",16
"attorney lawyer labor laws texas",16
"attorney lawyer law firm find",16
"attorney mesothelioma naples lawyer mesothelioma minnesota",16
"bankruptcy utah attorney law lawyer credit debt chapter 7",16
"california personal injury lawyer attorney",16
"divorce lawyer divorce attorney lake county",16
"eureka springs lawyer eureka springs attorney at your",16
"find a lawyer, attorney, law firm free directory of lawyers,",16
"findlaw lawcrawler law lawyer lawyers attorney attorneys",16
"firestone lawyer firestone attorney at your service 24x7",16
"georgia accident lawyer attorney",16
"immigration attorney lawyer usa",16
"job oregon law lawyer attorney",16
"law legal lawyer attorney job employment",16
"mesothelioma attorney lawyer",16
"mesothelioma attorney mesothelioma lawyer mesothel",16
"mesothelioma lawyer attorney",16
"mesothelioma symptoms mesothelioma lawyer mesothelioma symptoms mesothelioma attorney mesotheliomainformer.com",16
"mesothelioma symptoms mesothelioma lawyer mesothelioma symptoms mesothelioma attorney mesothelioma.tips-and-facts.com",16
"minnesota mesothelioma lawyer mesothelioma attorney san",16
"ohio mesothelioma attorney ohio mesothelioma lawyer michigan",16
"pennsylvania mesothelioma attorney mesothelioma lawyer texas",16
"pennsylvania mesothelioma lawyer mesothelioma attorney los",16
"personal injury lawyer personal injury attorney california",16
"register lawyer register attorney at your service 24x7",16
"rogers city lawyer rogers city attorney at your service 24x7",16
"scooter law portland oregon andnot attorney attorney lawyer",16
"wisconsin+bankruptcy+lawyer+attorney",16
"attorney bankruptcy law lawyer socialsecurity",15
"attorney criminal lawyer utah",15
"attorney divorce lawyer wisconsin",15
"attorney insurance lawyer legal 20",15
"attorney lawyer eminent domain naples florida",15
"bextra lawyer or attorney",15
"dui dwi attorney lawyer tampas",15
"findlaw lawcrawler law, lawyer, lawyers attorney, attorneys",15
"glen ridge lawyer glen ridge attorney at your service 24x7",15
"houston bankruptcy lawyer attorney",15
"illinois accident lawyer attorney",15
"lake carmel lawyer lake carmel attorney at your",15
"lawyer lawyers attorney attorneys law firm law legal findlaw",15
"mesothelioma attorney dallas asbestos lawyer mesothelioma",15
"mesothelioma attorney los angeles mesothelioma lawyer cause",15
"mesothelioma attorney mesothelioma mesothelioma lawyer",15
"mesothelioma attorney mesothelioma mesothelioma lawyer mesothelioma mesothelioma.tips-and-facts.com",15
"new jersey tax lien andnot lawyer attorney",15
"robert wiegel lawyer attorney mississippi",15
"wisconsin mesothelioma attorney new york mesothelioma lawyer",15
"1 attorney card green immigration j lawyer lawyer visa",14
"arizona phoenix personal injury lawyer attorney",14
"asbestos attorney lawyer mesothelioma mesothelioma option",14
"asbestos lawyer mesothelioma mesothelioma attorney dallas",14
"attorney doctor lawyer mesothelioma mesothelioma",14
"attorney dui dwi email lawyer tampa",14
"attorney lawsuit lawyer mesothelioma",14
"attorney lawyer compliance",14
"attorney lawyer michigan trust will",14
"attorney lawyer salary",14
"attorney lawyer vioxx vioxx",14
"business attorney lawyer",14
"colorado mesothelioma attorney illinois mesothelioma lawyer",14
"colorado mesothelioma lawyer wisconsin mesothelioma attorney",14
"florida lawyer mesothelioma angeles attorney los",14
"florida personal injury lawyer personal injury attorney los",14
"illinois mesothelioma lawyer new york mesothelioma attorney",14
"kyle gregory wallace georgia attorney lawyer",14
"lawyer attorney legal services personal injury att",14
"maryland mesothelioma lawyer virginia mesothelioma attorney",14
"massachusetts mesothelioma attorney lawyer mesothelioma",14
"mesothelioma attorney t new york mesothelioma lawyer",14
"mesothelioma symptoms mesothelioma lawyer mesothelioma attorney mesothelioma attorney mesotheliomainformer.com",14
"missouri mesothelioma attorney dallas lawyer mesothelioma",14
"new york mesothelioma attorney alabama lawyer mesothelioma",14
"qoclick.com celebrex stroke lawyer heart attack attorney",14
"sexual harassment lawyer attorney",14
"vioxx attorney vioxx lawyer",14
"virginia mesothelioma attorney illinois mesothelioma lawyer",14
"add link mesothelioma asbestos attorney cancer lawyer",13
"advice asbestos legal mesothelioma asbestos attorney lawyer",13
"angelo attorney child divorce family law lawyer san support",13
"arizona phoenix personal injury lawyer &amp; attorney",13
"attorney attorney findlaw firm law lawyer lawyer",13
"attorney consultant lawyer level marketing multi",13
"attorney corporate georgia lawyer",13
"attorney dui dwi lawyer seminar tampa",13
"attorney hobby lawyer quicken",13
"attorney lawyer arbitration naples florida",13
"attorney lawyer mesothelioma mesothelioma trial attorney",13
"attorney lawyer position associate job",13
"attorney lawyer probate naples florida",13
"birth injury lawyer illinois personal injury attorney",13
"boca attorney or lawyer credit repair",13
"'bruce labombard ' dwi dui andnot attorney lawyer",13
"chanute lawyer chanute attorney at your service 24x7",13
"criminal defense attorney lawyer",13
"dallas lawyer mesothelioma wyoming mesothelioma attorney",13
"dui dwi attorney lawyer tampa interview.html",13
"federal job lawyer attorney oregon",13
"findlaw law, lawyer, lawyers, attorney, attorneys and legal",13
"florida personal injury attorney birth injury lawyer florida",13
"houston criminal defense lawyer attorney",13
"jackson lawyer jackson attorney at your service 24x7",13
"live attorney lawyer chat extradition",13
"mesothelioma attorney mesothelioma doctor mesothelioma symptoms mesothelioma lawyer mesothelioma.tips-and-facts.com",13
"mesothelioma attorney mesothelioma lawyer mesothelioma lawyer mesotheliomainformer.com",13
"mesothelioma attorney t maryland mesothelioma lawyer",13
"mesothelioma mesothelioma lawyer mesothelioma attorney",13
"north johns lawyer north johns attorney at your service 24x7",13
"accident arizona attorney injury injury lawyer lawyer",12
"asbestos attorney cancer lawyer mesothelioma settlement 20",12
"asbestos attorney lawyer mesothelioma link mesothelioma",12
"asbestos attorney lawyer mesothelioma mesothelioma clinical",12
"attorney breath dui dwi lawyer tampa",12
"attorney county mesothelioma sarasota lawyer louisiana",12
"baltimore mesothelioma attorney mesothelioma lawyer cause of",12
"chicago attorney lawyer legal counsel arbitrator mediator",12
"employment opportunities lawyer attorney",12
"illinois+bankruptcy+lawyer+attorney",12
"indiana mesothelioma attorney asbestos lawyer mesothelioma",12
"indiana mesothelioma attorney mesothelioma lawyer cause of",12
"lawyer atlanta attorney",12
"lawyer mesothelioma missouri attorney mesothelioma new york",12
"mesothelioma attorney mesothelioma doctor mesothelioma symptoms mesothelioma lawyer mesotheliomainformer.com",12
"mesothelioma attorney mesothelioma lawyer mesothelioma attorney mesothelioma doctor mesotheliomainformer.com",12
"mesothelioma attorney t mesothelioma california lawyer",12
"mesothelioma lawyer mesothelioma symptoms mesothelioma attorney mesothelioma mesothelioma.tips-and-facts.com",12
"missouri mesothelioma attorney asbestos lawyer mesothelioma",12
"new hampshire mesothelioma attorney dallas lawyer",12
"plano texas family law attorney dallas divorce lawyer",12
"things questions ask attorney lawyer hiring",12
"washington accident lawyer attorney",12
"alabama lawyer mesothelioma mesothelioma attorney t",11
"albuquerque attorney mesothelioma lawyer louisiana",11
"asbestos attorney cancer lawyer ohio mesothelioma attorney",11
"asbestos attorney lawyer mesothelioma asbestos tennessee",11
"attorney columbus lawyer ohio",11
"attorney criminal defense florida lawyer naples",11
"attorney driving drunk dui dwi lawyer",11
"attorney easy lawyer tax",11
"attorney law lawyer lawyer",11
"attorney lawyer civil litigation naples florida",11
"attorney lawyer law firm",11
"attorney lawyer san angelo real estate",11
"birth injury lawyer new york personal injury attorney",11
"california+bankruptcy+lawyer+attorney",11
"cleveland attorney lawyer referral service",11
"dallas personal injury lawyer attorney califor inj",11
"georgia+divorce+lawyer+attorney",11
"lawyer attorney jobs employment",11
"litigation mesothelioma asbestos attorney cancer lawyer",11
"louisiana mesothelioma attorney missouri mesothelioma lawyer",11
"mesothelioma attorney dallas delaware mesothelioma lawyer",11
"mesothelioma attorney mesothelioma doctor mesothelioma lawyer mesotheliomainformer.com",11
"mesothelioma attorney texas asbestos attorney cancer lawyer",11
"mesothelioma symptoms mesothelioma lawyer mesothelioma attorney mesothelioma attorney mesothelioma.tips-and-facts.com",11
"missouri mesothelioma attorney colorado mesothelioma lawyer",11
"moab lawyer moab attorney at your service 24x7",11
"new jersey tax lein andnot lawyer attorney",11
"trial lawyer and attorney",11
"west virginia mesothelioma attorney florida lawyer",11
"accident attorney illinois lawyer",10
"asbestos attorney cancer lawyer mesothelioma colorado lawyer",10
"asbestos attorney lawyer mesothelioma asbestos attorney",10
"asbestos attorney lawyer mesothelioma delaware mesothelioma",10
"asbestos attorney lawyer mesothelioma mesothelioma",10
"asbestos attorney lawyer mesothelioma mesothelioma lawyer",10
"asbestos attorney lawyer mesothelioma montana mesothelioma",10
"asbestos lawyer attorney",10
"attorney attorney firm law law lawyer legal",10
"attorney california lawyer trust will",10
"attorney corporate illinois lawyer",10
"attorney criminal illinois lawyer",10
"attorney en language mesothelioma california lawyer",10
"attorney lawyer counsel",10
"attorney lawyer mold toxic",10
"attorney lawyer seattle seattle",10
"attorney lawyer texas vioxx",10
"brain injury attorney birth injury lawyer texas personal",10
"colorado mesothelioma lawyer missouri mesothelioma attorney",10
"colorado mesothelioma lawyer virginia mesothelioma attorney",10
"delaware mesothelioma attorney new york mesothelioma lawyer",10
"divorce attorney divorce lawyer information-divorce.info",10
"eagan lawyer eagan attorney at your service 24x7",10
"fraud attorney and lawyer",10
"indiana lawyer mesothelioma attorney mesothelioma naples",10
"law lawyer attorney mexico canada abogado ley leyes",10
"lawyer denver attorney estate planning wills trusts probate",10
"lawyer, lawyers, attorney, attorneys, law firm, law, legal",10
"maryland mesothelioma lawyer louisiana mesothelioma attorney",10
"mesothelioma attorney colorado lawyer mesothelioma utah",10
"mesothelioma attorney mesothelioma mesothelioma lawyer mesothelioma.tips-and-facts.com",10
"mesothelioma lawyer mesothelioma attorney mesothelioma mesothelioma symptoms mesothelioma.tips-and-facts.com",10
"mesothelioma lawyer mesothelioma attorney mesothelioma mesothelioma.tips-and-facts.com",10
"missouri mesothelioma lawyer mesothelioma attorney t",10
"ohio mesothelioma attorney mesothelioma lawyer houston",10
"ohio mesothelioma attorney washington mesothelioma lawyer",10
"personal injury attorney personal injury lawyer personal",10
"san angelo attorney lawyer consumer",10
"tennessee mesothelioma attorney asbestos lawyer mesothelioma",10
"wanted employment lawyer attorney waco texas",10
"washington mesothelioma attorney asbestos attorney lawyer",10
"washington mesothelioma lawyer florida mesothelioma attorney",10
"accident attorney lawyer",9
"aid attorney find lawyer lawyer legal new york 20",9
"alabama lawyer mesothelioma missouri mesothelioma attorney",9
"asbestos attorney cancer lawyer new york mesothelioma lawyer",9
"asbestos+attorney+lawyer",9
"asbestos attorney lawyer mesothelioma baltimore mesothelioma",9
"asbestos attorney lawyer mesothelioma.html",9
"asbestos attorney lawyer mesothelioma mesothelioma attorney",9
"asbestos lawyer asbestos attorney mesothelioma cancer lawyer",9
"attorney business business estate foreclosure law lawyer",9
"attorney business corporate lawyer",9
"attorney corporate lawyer washington",9
"attorney court lawyer legal paralegal",9
"attorney dallas lawyer texas woman woman",9
"attorney entertainment lawyer media",9
"attorney find lawyer lawyers.com 20",9
"attorney florida lawyer legal naples services",9
"attorney insurance lawyer",9
"attorney lawyer mesothelioma mesothelioma mesothelioma",9
"brain injury attorney birth injury lawyer birth injury",9
"cazenovia lawyer cazenovia attorney at your service 24x7",9
"colorado mesothelioma attorney louisiana mesothelioma lawyer",9
"dwi attorney lawyer tampa",9
"fen phen lawyer attorney",9
"lawyer mesothelioma michigan virginia mesothelioma attorney",9
"mesothelioma doctor mesothelioma attorney mesothelioma doctor mesothelioma lawyer mesotheliomainformer.com",9
"mesothelioma lawyer mesothelioma attorney pleural",9
"mesothelioma symptoms mesothelioma attorney mesothelioma mesothelioma lawyer mesotheliomainformer.com",9
"mesothelioma symptoms mesothelioma doctor mesothelioma attorney mesothelioma lawyer mesotheliomainformer.com",9
"minnesota mesothelioma lawyer missouri mesothelioma attorney",9
"new jersey personal injury attorney brain injury lawyer",9
"new york mesothelioma attorney asbestos attorney lawyer",9
"stanley brown attorney kentucky lawyer ohio",9
"texico lawyer texico attorney at your service 24x7",9
"trademark lawyer attorney denver glendale",9
"truck accident attorney lawyer information",9
"vioxx lawyer vioxx attorney vioxx attorney vioxx f",9
"washington state criminal defense lawyer attorney",9
"worker compensation lawyer attorney",9
"alabama lawyer mesothelioma indiana mesothelioma attorney",8
"asbestos attorney cancer lawyer mesothelioma support georgia",8
"asbestos attorney lawyer mesothelioma asbestos asbestos and",8
"asbestos attorney lawyer mesothelioma mesothelioma support",8
"asbestos attorney lawyer settlem",8
"asbestos lawyer mesothelioma florida mesothelioma attorney",8
"attorney attorneymesotheliomanet lawyer mesothelioma",8
"attorney austin asbestos mesothelioma florida lawyer",8
"attorney cancer law lawyer mesot",8
"attorney cancer law lawyer settlement",8
"attorney corporate lawyer",8
"attorney diego mesothelioma san lawyer mesothelioma texas",8
"attorney divorce family florida lawyer naples",8
"attorney divorce lawyer legal 20",8
"attorney en language mesothelioma lawyer maryland",8
"attorney, lawyer",8
"attorney lawyer legal westlaw",8
"attorney lawyer mesothelioma mesothelioma attorney ca lawyer",8
"attorney lawyer new jersey bona fide office rule",8
"attorney lawyer new rochester york 20",8
"attorney lawyer vinita oklahoma divorce",8
"attorney miami lawyer",8
"auto accident injury personal injury attorney california brain injury lawyer bestbalsamicvinegar.com/balsamic-recipe-using-balsamic-vinegar-italian-olive-oil.php",8
"birth injury lawyer new york personal injury attorney new",8
"colorado lawyer mesothelioma attorney georgia mesothelioma",8
"connecticut lawyer mesothelioma attorney mesothelioma",8
"connecticut mesothelioma lawyer cancer mesothelioma attorney",8
"detroit accidental, wrongful death lawyer, attorney detroit",8
"dui defense attorney lawyer directory",8
"dui or lawyer attorney",8
"florida personal injury attorney birth injury lawyer birth",8
"florida personal injury lawyer brain injury attorney new",8
"georgia criminal lawyer attorney",8
"help mesothelioma asbestos attorney lawyer mesothe",8
"illinois mesothelioma lawyer asbestos attorney cancer law",8
"lawyer attorney directory.com links",8
"lawyer attorney fraud litigation",8
"lawyer, attorney handling detroit birth injury cases",8
"lawyer mesothelioma texas chicago mesothelioma attorney",8
"lawyer web sites and attorney chat and news groups",8
"legal advice general family law lawyers lawyer law attorney",8
"louisiana mesothelioma lawyer colorado mesothelioma attorney",8
"mcdonough lawyer mcdonough attorney at your service 24x7",8
"medical malpractice lawyer mesothelioma attorney senior",8
"mesothelioma attorney asbestos attorney mesothelioma lawyer",8
"mesothelioma attorney dallas mesothelioma california lawyer",8
"mesothelioma attorney dallas mesothelioma lawyer cause of",8
"mesothelioma cure lawyer mesothelioma minnesota attorney",8
"mesothelioma lawyer mesothelioma mesothelioma attorney",8
"michigan+divorce+lawyer+attorney",8
"minnesota mesothelioma lawyer mesothelioma attorney los",8
"ohio mesothelioma attorney colorado lawyer mesothelioma",8
"paul d cass lawyer, attorney, law",8
"roundup montana tax attorney lawyer",8
"san angelo texas lawyer attorney probate",8
"south carolina mesothelioma attorney lawyer mesothelioma",8
"vioxx attorney vioxx lawyer vioxx lawyer vioxx law",8
"accident agency arizona attorney auto law lawyer lawyer",7
"accident attorney lawyer utah",7
"albuquerque attorney mesothelioma lawyer mesothelioma ohio",7
"angelo attorney estate lawyer probate real san",7
"arizona attorney consumer debt lawyer right.html",7
"asbestos attorney cancer lawyer mesothelioma iowa",7
"asbestos attorney lawyer mesothelioma asbestos asbestos",7
"asbestos attorney lawyer mesothelioma mesothelioma asbsetos",7
"asbestos attorney lawyer mesothelioma north dakota",7
"asbestos cancer mesothelioma asbestos attorney cancer lawyer",7
"asbestos lawyer mesothelioma colorado mesothelioma attorney",7
"atlanta attorney lawyer misdiagnosis",7
"attorney advice california lawyers texas lawyers lawyer",7
"attorney at law vegas lawyer",7
"attorney attorney attorneymesotheliomanet lawyer",7
"attorney attorney lawyer lawyer",7
"attorney brain brain injury injury lawyer",7
"attorney bureau lawyer miami service",7
"attorney cancer law lawsuit lawyer",7
"attorney delaware mesothelioma lawyer mesothelioma",7
"attorney denver in lawyer malpractice",7
"attorney dui dwi interview lawyer tampa",7
"attorney florida lawyer malpractice naples",7
"attorney jersey lawyer lofaro new nj",7
"attorney lawyer commercial litigation naples florida",7
"attorney lawyer directory",7
"attorney lawyer lawyer lawyer",7
"brain injury lawyer new jersey personal injury attorney",7
"civil case attorney in nevada vegas lawyer",7
"colorado mesothelioma attorney indiana lawyer mesothelioma",7
"colorado mesothelioma lawyer baltimore mesothelioma attorney",7
"connecticut mesothelioma lawyer salina mesothelioma attorney",7
"dallas mesothelioma lawyer wisconsin mesothelioma attorney",7
"david lester attorney in cabot, lawyer",7
"delaware mesothelioma attorney colorado mesothelioma lawyer",7
"divorce lawyer divorce attorney divorce attorney information-divorce.info",7
"divorce lawyer divorce attorney information-divorce.info",7
"estate planning lawyer estate planning attorney 1s",7
"fact mesothelioma asbestos attorney lawyer mesothelioma",7
"findlaw lawyers attorneys law firms lawyer attorney",7
"findlaw legal news lawyer news attorney news law news trial",7
"georgia personal injury lawyer attorney 20",7
"gillis lawyer and attorney",7
"illinois lawyer mesothelioma asbestos attorney mesothelioma",7
"illinois mesothelioma attorney georgia lawyer mesothelioma",7
"illinois personal injury attorney birth injury lawyer",7
"lawyer advertising blog info for attorney advertising",7
"lawyer attorney bankruptcy",7
"lawyer attorney willie gary",7
"lawyer mesothelioma asbestos attorney mesothelioma asbsetos",7
"lawyers.com find a lawyer attorney or law firm get legal",7
"louisiana mesothelioma attorney mesothelioma lawyer cause of",7
"lung cancer lawyer attorney",7
"maryland mesothelioma lawyer delaware mesothelioma attorney",7
"mesothelioma attorney and lawyer",7
"mesothelioma attorney dallas colorado mesothelioma lawyer",7
"mesothelioma attorney mesothelioma doctor mesothelioma lawyer mesothelioma.tips-and-facts.com",7
"mesothelioma attorney mesothelioma law asbestos lawyer",7
"mesothelioma doctor mesothelioma attorney mesothelioma doctor mesothelioma lawyer mesothelioma.tips-and-facts.com",7
"mesothelioma lawyer mesothelioma attorney mesotheliomainformer.com",7
"mesothelioma lawyer texas tennessee mesothelioma attorney",7
"mesothelioma support group asbestos attorney cancer lawyer",7
"milton mesothelioma attorney lawyer mesothelioma washington",7
"new jersey personal injury attorney personal injury lawyer",7
"new jersey personal injury attorney personal injury lawyer fatal auto accident bestbalsamicvinegar.com/balsamic-recipe-using-balsamic-vinegar-italian-olive-oil.php",7
"new york mesothelioma attorney colorado mesothelioma lawyer",7
"north carolina mesothelioma attorney illinois lawyer",7
"pembroke pines lawyer pembroke pines attorney at your",7
"personal injury lawyer new york personal injury attorney",7
"rosemead lawyer rosemead attorney at your service 24x7",7
"royal and vaughn savannah attorney lawyer",7
"san antonio bankruptcy attorney lawyer",7
"search keywords attorney lawyer",7
"social security disability attorney personal injury lawyer",7
"top divorce lawyer attorney",7
"vioxx attorney vioxx lawyer vioxx lawsuit fdavioxx",7
"birth injury lawyer florida personal injury attorney birth",6
"mesothelioma symptoms mesothelioma doctor mesothelioma attorney mesothelioma lawyer mesothelioma.tips-and-facts.com",6
"renee rockwell attorney lawyer",6
"washington personal injury lawyer personal injury attorney",6
