keyword, count
"attorney lawyer",18806
"lawyer attorney",11590
"accident attorney georgia lawyer motorcycle",4786
"florida corporate lawyer attorney",4662
"dui dwi attorney lawyer tampa",4499
"utah personal injury lawyer attorney",4440
"asbestos attorney lawyer mesothelioma",4392
"georgia divorce lawyer attorney",4296
"arizona personal injury lawyer attorney",4109
"dui dwi attorney lawyer tampa breath",3281
"asbestos attorney cancer lawsuit lawyer mesothelioma",2957
"georgia personal injury lawyer attorney",2841
"illinois trust wills lawyer attorney",2806
"florida bankruptcy lawyer attorney",2801
"attorney lawyer mesothelioma research",2622
"michigan divorce lawyer attorney",2392
"asbestos attorney cancer lawyer mesothelioma settlement",2360
"corporate law lawyer attorney law firm",2287
"san angelo texas lawyer attorney wills probate real estate",1863
"accident attorney auto georgia lawyer",1853
"asbestos attorney cancer law lawyer mesothelioma",1716
"california bankruptcy lawyer attorney",1677
"attorney lawyer bankruptcy",1650
"asbestos attorney cancer lawsuit lawyer settlement",1590
"attorney lawyer mesothelioma",1527
"attorney attorneymesothelioma.net lawyer mesothelioma",1490
"asbestos attorney law lawyer mesothelioma settlement",1482
"asbestos attorney lawsuit lawyer mesothelioma settlement",1399
"arizona divorce lawyer attorney",1386
"asbestos attorney law lawsuit lawyer settlement",1296
"attorney divorce family lawyer",1291
"angelo attorney divorce family law lawyer san texas",1235
"san angelo texas lawyer attorney wills probate",1178
"attorney georgia home lawyer negligence nursing",1134
"florida divorce lawyer attorney",1108
"asbestos attorney cancer law lawyer",1092
"asbestos attorney cancer law lawyer settlement",1030
"attorney criminal defense lawyer",1023
"asbestos attorney cancer lawyer mesothelioma",1016
"asbestos attorney lawsuit lawyer mesothelioma",1007
"hilo asbestos mesothelioma lawyer attorney",1001
"arizona bankruptcy lawyer attorney",977
"washington divorce lawyer attorney",969
"attorney cancer law lawyer mesothelioma settlement",924
"michigan corporate lawyer attorney",822
"california divorce lawyer attorney",797
"asbestos attorney lawyer mesothelioma settlement",787
"asbestos attorney law lawyer mesothelioma",771
"attorney bankruptcy lawyer michigan",766
"asbestos attorney cancer lawsuit lawyer",763
"san angelo texas attorney lawyer",761
"asbestos attorney lawyer",747
"georgia bankruptcy lawyer attorney",743
"arizona trust wills lawyer attorney",727
"illinois bankruptcy lawyer attorney",711
"asbestos attorney cancer lawyer settlement",698
"attorney law lawsuit lawyer mesothelioma settlement",687
"illinois divorce lawyer attorney",679
"florida trust wills lawyer attorney",677
"wisconsin bankruptcy lawyer attorney",664
"california criminal defense attorney lawyer",663
"attorney cancer lawsuit lawyer mesothelioma settlement",660
"michigan personal injury lawyer attorney",653
"utah divorce lawyer attorney",649
"washington bankruptcy lawyer attorney",643
"michigan trust wills lawyer attorney",641
"wisconsin corporate lawyer attorney",628
"asbestos attorney law lawyer settlement",609
"wisconsin divorce lawyer attorney",597
"utah bankruptcy lawyer attorney",595
"asbestos attorney cancer law lawsuit lawyer",580
"criminal lawyer reading berks attorney",572
"mesothelioma asbestos attorney lawyer",566
"attorney law lawsuit lawyer settlement",550
"michigan bankruptcy lawyer attorney",524
"asbestos attorney law lawsuit lawyer mesothelioma",501
"asbestos attorney law lawsuit lawyer",498
"florida attorney lawyer",486
"attorney cancer law lawsuit lawyer mesothelioma",485
"attorney cancer law lawsuit lawyer settlement",484
"attorney lawsuit lawyer mesothelioma settlement",469
"best divorce lawyer attorney orlando",457
"washington personal injury lawyer attorney",457
"arizona attorney consumer debt lawyer right",452
"attorney lawyer jobs",451
"employment lawyer attorney",422
"findlaw attorney attorneys lawyer lawye",408
"attorney law lawyer mesothelioma settlement",403
"asbestos attorney lawsuit lawyer settlement",397
"criminal defense lawyer and attorney directory",369
"personal injury attorney lawyer",364
"illinois corporate lawyer attorney",361
"wisconsin personal injury lawyer attorney",358
"malpractice attorney or lawyer",352
"san angelo texas lawyer attorney divorce family law",349
"asbestos attorney cancer lawyer",348
"asbestos attorney lawsuit lawyer",343
"illinois personal injury lawyer attorney",339
"california family law divorce attorney lawyer",338
"criminal attorney lawyer reading berks",334
"attorney bankruptcy illinois lawyer",328
"gwinnett ga dui lawyer attorney",328
"atlanta dui dwi attorney lawyer",327
"attorney cancer law lawyer mesothelioma",324
"mesothelioma lawyer attorney mesothelioma attorney",319
"personal injury lawyer attorney",316
"lawyer attorney dui drunk driving berks reading",315
"florida attorney lawyer position associate job",314
"georgia trust wills lawyer attorney",313
"top divorce lawyer attorney orlando",312
"employment lawyer labor attorney atlanta",311
"top dui lawyer attorney atlanta",311
"new jersey tax lien andnot lawyer or attorney",305
"real estate agent florida certification lawyer attorney",305
"attorney bankruptcy lawyer utah",304
"car accident attorney or lawyer",301
"auto accident attorney or lawyer",300
"employment opportunities lawyer attorney pennsylvania",300
"new jersey tax lein andnot lawyer or attorney",299
"attorney divorce lawyer legal",297
"social security attorney lawyer self employment",297
"washington criminal lawyer attorney",296
"attorney insurance lawyer legal",295
"attorney mesothelioma mesothelioma lawyer mesothelioma",294
"attorney locate lawyer",292
"attorney cancer lawyer mesothelioma settlement",290
"wilmington nc lawyer attorney criminal",290
"lawyer defense reading attorney berks",289
"mesothelioma lawyer mesothelioma research attorney",288
"attorney mesothelioma mesothelioma lawyer mesothel",287
"best law attorney lawyer free legal advice",284
"utah criminal lawyer attorney",283
"attorney lawyer free legal advice",276
"personal injury attorney or lawyer",276
"attorney business law lawyer",271
"lawyer attorney legal services",271
"richard perry lawyer attorney easton maryland",271
"divorce bankruptcy attorney atlanta lawyer gwinnett",265
"attorney lawyer job southern california",264
"virginia lawyer attorney solo practice foonberg",263
"mesothelioma lawyer attorney mesothelioma mesothel",257
"attorney lawyer criminal law denver",256
"california corporate lawyer attorney",255
"savannah georgia asbestos attorney lawyer",255
"lawyer attorney jasper texas",252
"black mountain swannanoa lawyer attorney",250
"find lawyers attorney lawyer legal",249
"deets lawyer indiana attorney",248
"immigration lawyer attorney",247
"wm lee robinson attorney lawyer georgia",245
"attorney colorado in lawyer sue who",244
"lawyer attorney discrimination knoxville tennessee",244
"brachial plexus attorney houston lawyer",243
"accidents truck michigan lawyer and attorney",242
"collection lawyer attorney",242
"attorney lawyer personal injury lawyer chicago lawyer jobs",238
"tennessee lawyer knoxville attorney taylor",238
"attorney lawyer television marketing commercials",236
"auburn lawyer attorney",234
"riverside and california and tenant and attorney or lawyer",233
"attorney lawyer legal advice wisconsin",232
"christian attorney and lawyer illinois",231
"theodore west patent attorney lawyer agent",231
"finding legal counseling advice lawyer attorney",230
"mesothelioma lawyer attorney mesothelioma mesothelioma",230
"shelley bennack san antonio lawyer attorney",230
"27brian barnard27 andnot flooring utah attorney lawyer",229
"27paul jacobs27 denver colorado attorney lawyer",228
"logo design attorney lawyer",226
"tax lawyer attorney",225
"connecticut recruiters attorney lawyer",224
"lawyer attorney surrogacy law surrogate mother laws ohio",224
"attorney and lawyer and denver and colorado",223
"power of attorney lawyer ontario",223
"jobs oregon law lawyer attorney",220
"geoffrey l clark utah lawyer attorney",219
"kyle wallace and georgia or attorney or lawyer",219
"lawyer or attorney and sample timesheet",218
"wisconsin law legal lawyer attorney job employment",218
"robert wiygul lawyer or attorney mississippi",217
"sarah bales and attorney or lawyer and wisconsin",217
"things questions to ask an attorney lawyer before hiring",216
"attorney law lawsuit lawyer mesothelioma",213
"injury lawyer las vegas attorney brent bryson",213
"robert wiygul lawyer or attorney and mississippi",213
"kyle gregory wallace and georgia or attorney or lawyer",212
"scooter law portland oregon andnot attorney attoneys lawyer",211
"legal lawyer attorney jobs japan tokyo",210
"austin lawyer attorney",203
"dallas injury lawyer attorney",203
"arizona corporate lawyer attorney",201
"federal jobs lawyer attorney oregon",201
"attorney lawyer labor laws in texas",196
"attorney lawyer florida jobs",194
"aid attorney find lawyer lawyer legal new york",185
"attorney cancer lawsuit lawyer mesothelioma",185
"attorney bankruptcy lawyer",183
"nj 'bruce labombard' dwi dui andnot attorney lawyer",183
"attorney in irs lawyer legal maryland services",181
"attorney lawyer vs",178
"lawyer law firms attorney",170
"dui dwi attorney lawyer tampa suspension law",167
"attorney construction law lawyer lien",166
"mesothelioma research mesothelioma lawyer attorney",158
"divorce lawyer attorney",157
"ohio mesothelioma lawyer michigan mesothelioma attorney",154
"attorney firm law lawyer legal",152
"washington corporate lawyer attorney",147
"defense attorney lawyer",146
"attorney mesothelioma mesothelioma lawyer attorney",145
"georgia corporate lawyer attorney",144
"attorney california in lawyer malpractice",142
"attorney attorney attorneymesothelioma.net lawyer",139
"attorney malpractice lawyer in colorado",139
"dui dwi attorney lawyer tampa interview",138
"power of attorney lawyer",135
"utah corporate lawyer attorney",135
"lawyer and attorney directory",134
"search keywords attorney dallas lawyer",134
"asbestos attorney lawyer mesothe",131
"attorney lawyer probate",130
"starting salary lawyer attorney",130
"lawyer arizona attorney consumer rights debt",128
"attorney employment labor lawyer",127
"arizona attorney bankruptcy lawyer",125
"asbestos attorney law lawyer mes",123
"asbestos attorney law lawyer",122
"attorney injury lawyer personal",120
"nj bruce labombard dwi dui andnot attorney lawyer",120
"attorney colorado in lawyer malpractice",119
"san angelo texas lawyer attorney probate will",115
"tax attorney lawyer",114
"dui dwi attorney lawyer tampa email",113
"findlaw - lawyers - attorneys - law firms - lawyer - attorney",112
"nj 'bruce labombard ' dwi dui andnot attorney lawyer",111
"mesothelioma lawsuit attorney and lawyer",109
"asbestos attorney lawyer settlement",108
"attorney org bextra lawyer link",106
"attorney copyright lawyer patent",105
"attorney intellectual lawyer property",105
"california trust wills lawyer attorney",104
"attorney bankruptcy california lawyer",103
"attorney bankruptcy florida lawyer",103
"dallas city planning zoning lawyer attorney",103
"find a lawyer attorney or law firm free lawyer",103
"attorney lawsuit lawyer mesothel",102
"car accident new york andnot lawyer attorney attorneys",100
"corporate lawyer attorney",100
"attorney bankruptcy georgia lawyer",99
"attorney lawyer mba tax",98
"attorney who sue lawyer",98
"dui dwi attorney lawyer tampa seminar",97
"attorney bankruptcy lawyer washington",94
"mesothelioma attorney mesothelioma lawyer mesothelioma",94
"angelo attorney estate lawyer probate real san texas",92
"attorney law lawyer mesothelioma",91
"bankruptcy lawyer attorney",90
"mesothelioma lawyer mesothelioma lawyer attorney",90
"attorney injury lawyer michigan personal",89
"the difference between a lawyer and an attorney is",87
"attorney bankruptcy lawyer wisconsin",84
"attorney in lawyer malpractice wyoming",82
"birth injury lawyer attorney",80
"san angelo texas lawyer attorney family law divorce child",80
"attorney estate lawyer trust will",79
"attorney or lawyer",79
"florida personal injury lawyer attorney",79
"attorney mesothelioma mesothelioma lawyer",77
"attorney+lawyer",76
"dui dwi defense attorney lawyer tampa interview thanks",76
"nyc custody attorney lawyer",76
"attorney attorney employment labor labor lawyer legal",74
"attorney lawyer san angelo texas divorce",74
"criminal lawyer dui personal injury crime felony attorney",74
"dui dwi attorney lawyer",73
"immigration attorney lawyer",73
"attorney california injury lawyer personal",71
"attorney malpractice lawyer in denver",71
"michigan accident lawyer attorney",71
"accident attorney florida lawyer",70
"attorney info lawyer directory",70
"lawyer attorney directory",69
"lawyer attorney dui reading berks drunk driving",69
"criminal defense lawyer service attorney law",68
"lawyer attorney clothing dress",68
"attorney law lawyer",67
"attorney estate lawyer real",66
"mesothelioma lawyer mesothelioma attorney mesothelioma",66
"san angelo texas lawyer attorney divorce child custody",66
"appeal attorney lawyer",65
"atlanta attorney lawyer",65
"attorney attorney business findlaw law law lawsuit lawyer",65
"attorney criminal lawyer",65
"attorney denver lawyer power",64
"attorney lawyer lawyers",64
"attorney lawyer mesothelioma directory",64
"mesothelioma lawyer mesothelioma lawyer attorney m",63
"attorney cancer lawyer mesothelioma",62
"lawyer or attorney",62
"attorney immigration lawyer michigan",61
"dwi dui attorney lawyer profile",61
"attorney attorney immigration immigration lawyer legal",59
"attorney lawyer decatur alabama divorce",59
"attorney lawyer oregon",58
"mesothelioma and asbestos attorney and lawyer references",58
"angelo attorney lawyer san texas",57
"attorney illinois lawyer trust will",57
"attorney lawyer job",57
"angelo attorney divorce lawyer san texas",56
"attorney bite dog georgia lawyer",56
"attorney debt lawyer negotiation settlement",56
"california lawyer magazine immigration law san francisco attorney certified specialist articles",56
"credit repair attorney lawyer",56
"lawyer attorney at your service 24x7",56
"asbestos attorney cancer lawyer mesothelioma settl",55
"attorney dui dwi lawyer tampa",55
"mesothelioma lawyer attorney mesothelioma",55
"angeles attorney compensation lawyer los stress worker",54
"arizona attorney divorce lawyer",54
"attorney georgia injury lawyer personal",54
"attorney lawyer liability product",53
"attorney lawyer paralegal",53
"mesothelioma lawyer mesothelioma attorney mesothelioma lawyer mesothelioma doctor mesothelioma.tips-and-facts.com",53
"accident attorney injury lawyer linkdomain personal",52
"attorney commercial lawyer litigation",52
"attorney domain eminent lawyer",52
"angelo attorney child custody divorce lawyer modification",51
"attorney criminal lawyer michigan",51
"attorney disability lawyer",51
"mesothelioma lawyer mesothelioma attorney mesothelioma lawyer mesothelioma doctor mesotheliomainformer.com",51
"montana attorney lawyer",51
"birth injury lawyer personal injury attorney los angeles",50
"attorney california in lawyer sue who",49
"brain injury attorney florida personal injury lawyer",49
"attorney comp lawyer worker",48
"attorney deliquency dependency lawyer",48
"attorney general lawyer practice",48
"attorney lawyer patent",48
"japan trademark lawyer attorney",48
"lawyer attorney divorce legal",48
"lawyer attorney office supplies",48
"attorney government lawyer",47
"california bankruptcy attorney lawyer",47
"cms generation attorney lawyer lawsuit",47
"trust wills lawyer attorney",47
"attorney lawyer bankruptcy naples florida",46
"florida accident lawyer attorney",46
"asbestos attorney cancer lawsuit lawyer mesothelio",45
"asbestos attorney lawsuit lawyer mesothelioma sett",45
"attorney attorney employment labor labor lawyer le",45
"attorney environmental lawyer",45
"divorce lawyer divorce attorney lake county il",45
"malpractice attorney lawyer",45
"arizona attorney injury lawyer personal",44
"attorney lawyer naturalization",44
"angelo attorney consumer lawyer san",43
"attorney attorney lawyer",43
"attorney criminal florida lawyer",43
"attorney lawyer san angelo divorce",43
"attorney lawyer trademark",43
"lawyer, lawyers, attorney, attorneys, law",43
"attorney civil lawyer litigation",42
"attorney corporate florida lawyer",42
"attorney divorce lawyer",42
"attorney job lawyer",42
"california accident lawyer attorney",42
"family law divorce attorney lawyer",42
"findlaw law lawyer lawyers attorney",42
"westminster colorado divorce attorney, family lawyer",42
"attorney finance lawyer taxation",41
"attorney lawyer security social",41
"lawyer lawyers attorney attorneys law",41
"san angelo texas attorney lawyer real estate family law",41
"attorney camp lawyer worker",40
"divorce attorney lawyer ga",40
"lawyer attorney handling birth injury c",40
"arbitration attorney lawyer",39
"attorney attorney immigration immigration lawyer l",39
"attorney in lawyer sue who wyoming",39
"attorney landlord lawyer tenant",39
"attorney lawyer legal services",39
"attorney or lawyer or counsel",39
"connecticut mesothelioma attorney mesothelioma lawyer",39
"dui dwi attorney lawyer breath",39
"attorney illinois dui lawyer",38
"attorney injury lawyer personal washington",38
"bankruptcy attorney lawyer for lancast",38
"bankruptcy lawyer lawyers attorney attorn",38
"attorney corporate lawyer michigan",37
"personal injury attorney california brain injury lawyer ohio",37
"willie attorney at law lawyer connection",37
"arizona+bankruptcy+lawyer+attorney",36
"attorney cancer lawsuit lawyer mesothelioma settle",36
"attorney denver in lawyer sue who",36
"florida criminal lawyer attorney",36
"grand prairie lawyer attorney",36
"lawyer attorney at your se",36
"asbestos attorney law lawyer mesothelioma settleme",35
"attorney attorneymesothelioma.net lawyer lawyer mesothelioma",35
"attorney california divorce lawyer",35
"attorney malpractice lawyer",35
"criminal lawyer lawyers attorney attorney",35
"dui attorney dui lawyer directory",35
"dui attorney lawyer paralegal",35
"illinois personal injury attorney birth injury lawyer new",35
"lawyer malpractice attorney in california",35
"power of attorney lawyer toronto",35
"attorney injury lawyer personal utah",34
"attorney lawyer referral service",34
"brain injury lawyer personal injury attorney california",34
"divorce attorney lawyer directory id",34
"michigan+bankruptcy+lawyer+attorney",34
"san angelo texas attorney lawyer family law divorce",34
"asbestos attorney law lawyer set",33
"attorney death lawyer wrongful",33
"denver attorney lawyer",33
"entertainment media attorney lawyer",33
"find a lawyer attorney law firm free direc",33
"lawyer attorney kuzmich law firm l",33
"mesothelioma lawyer mesothelioma attorney",33
"robert wiygul lawyer attorney mississippi",33
"utah+bankruptcy+lawyer+attorney",33
"vioxx recall lawyer attorney",33
"asbestos attorney lawyer mesothelioma ohio mesothelioma",32
"attorney law lawsuit lawyer mesothelioma settlemen",32
"find lawyer lawyers attorney attorneys",32
"lawyer malpractice attorney",32
"real estate attorney lawyer",32
"san angelo texas attorney lawyer child support",32
"san angelo texas attorney lawyer probate real estate",32
"wichita power of attorney lawyer",32
"attorney lawyer labor employment naples florida",31
"attorney lawyer tax",31
"divorce attorney custody lawyer fat",31
"florida lawyer attorney",31
"accidents truck michigan lawyer attorney",30
"angeles attorney compensation lawyer los stress wo",30
"angelo attorney deed lawyer san texas",30
"attorney defense dui dwi interview lawyer tampa thanks",30
"attorney lawyer asbestos mesotheloma",30
"corpus christi lawyer attorney",30
"dui dwi attorney lawyer tampa.html",30
"indiana mesothelioma attorney delaware mesothelioma lawyer",30
"lawyer attorney directory.com",30
"long beach lawyer attorney",30
"mesothelioma attorney texas mesothelioma lawyer texas",30
"san angelo texas lawyer attorney real estate deed",30
"accident attorney georgia lawyer",29
"attorney divorce lawyer michigan",29
"attorney florida lawyer sarasota",29
"florida+bankruptcy+lawyer+attorney",29
"frank jackson lawyer attorney new york",29
"intellectual property attorney lawyer",29
"lawyer malpractice attorney in wyoming",29
"mesothelioma attorney mesothelioma lawyer mesotheliomainformer.com",29
"partition action brooklyn experienced attorney lawyer",29
"toxic mold injury attorney lawyer california",29
"business corporate attorney lawyer",28
"cleveland lawyer attorney",28
"findlaw law, lawyer, lawyers, attorney,",28
"findlaw legal news lawyer news attorney news%",28
"findlaw legal news lawyer news, attorney news%",28
"lawyer attorney at y",28
"lawyer attorney sample timesheet",28
"lawyer malpractice attorney in denver",28
"mesothelioma lawyer mesothelioma attorney mesothel",28
"michigan criminal lawyer attorney",28
"tennessee attorney bar association lawyer",28
"wisconsin mesothelioma attorney missouri mesothelioma lawyer",28
"arizona attorney lawyer trust will",27
"attorney dallascom injury lawyer personal",27
"attorney florida lawyer trust will",27
"bankruptcy lawyer, lawyers, attorney, attorn",27
"difference between a lawyer attorney",27
"findlaw law lawyer lawyers attorney attorneys and legal",27
"lawyer attorney scotts",27
"mesothelioma attorney mesothelioma lawyer",27
"new jersey personal injury attorney injury lawyer",27
"pembroke pines lawyer pembroke pines attorney at y",27
"accident attorney auto lawyer",26
"bankruptcy attorney lawyer for palmdale, lancast",26
"california attorney illinois dui lawyer",26
"christian attorney lawyer illinois",26
"find attorney directory lawyer locator firm",26
"mesothelioma attorney mesothelioma lawyer mesothelioma symptoms mesotheliomainformer.com",26
"mesothelioma lawyer mesothelioma symptoms mesothelioma attorney mesotheliomainformer.com",26
"westminster lawyer attorney",26
"alabama lawyer mesothelioma mesothelioma attorney san diego",25
"asbestos attorney cancer lawsuit lawyer mesot",25
"attorney bureau chicago lawyer service",25
"attorney colorado lawyer sue who",25
"attorney corporate lawyer utah",25
"attorney divorce lawyer utah",25
"attorney illinois injury lawyer personal",25
"attorney lawyer napervil",25
"attorney legal law firm california lawyer",25
"detroit birth injury lawyer, attorney detroit",25
"escondido attorney, lawyer, law firm find ca",25
"kyle wallace georgia attorney lawyer",25
"riverside california tenant attorney lawyer",25
"torrance tax attorney houston tax lawyer",25
"willie gary attorney at law lawyer connection",25
"attorney divorce georgia lawyer",24
"attorney georgia lawyer trust will",24
"car accident attorney lawyer",24
"georgia criminal attorney lawyer law firm find ga attorney",24
"houston attorney lawyer benjamin hall attorney",24
"immigration lawyer and attorney",24
"lawyer malpractice attorney in colorado",24
"mesothelioma attorney dallas maryland mesothelioma lawyer",24
"oregon lawyer oregon attorney at your service 24x7",24
"wisconsin mesothelioma attorney alabama lawyer mesothelioma",24
"wrongful termination attorney or lawyer",24
"bailey lawyer bailey attorney at your service 24x7",23
"find your lawyer attorney or legal service online",23
"georgia+bankruptcy+lawyer+attorney",23
"illinois lemon law andnot attorney lawyer",23
"lawyer attorney legal services 20",23
"lawyer macomb attorney divorce",23
"malpractice lawyer attorney washington",23
"medical malpractice lawyer attorney",23
"mesothelioma attorney san diego mesothelioma lawyer cause of",23
"ohio mesothelioma lawyer michigan mesothelioma attorney well",23
"scottsdale lawyer, scottsdale attorney, scotts",23
"springfield lawyer springfield attorney at your se",23
"asbestos attorney law lawsuit lawyer mesothel",22
"attorney attorney lawyer legal litigation services trial",22
"attorney lawyer law firm find ca",22
"aurora lawyer aurora attorney at your service 24x7",22
"colorado divorce attorney, custody lawyer, fat",22
"criminal lawyer, lawyers, attorney, attorney",22
"dui attorney ohio dui lawyer directory",22
"find a lawyer, attorney, law firm free direc",22
"georgia+trust+wills+lawyer+attorney",22
"injury attorney columbus ohio accident lawyer",22
"injury lawyer vegas attorney brent bryson",22
"lawyer, attorney handling detroit birth injury c",22
"merced lawyer merced attorney at your service 24x7",22
"mesothelioma attorney mesothelioma lawyer mesothelioma.tips-and-facts.com",22
"naperville attorney naperville lawyer napervil",22
"seattle birth injury lawyer, attorney seattle",22
"angelo attorney landlord lawyer san tenant texas",21
"atlanta divorce attorney lawyer ga georgia",21
"attorney bankruptcy irs law lawyer security social",21
"attorney lawyer denver colorado",21
"dallas lawyer attorney kuzmich law firm dallas l",21
"internet legal resource guide law lawyer lawyers attorney",21
"lawyer attorney legal services personal injury attorney",21
"mesothelioma lawyer mesothelioma symptoms mesothelioma attorney mesothelioma.tips-and-facts.com",21
"south bend lawyer attorney",21
"accident attorney lawyer michigan",20
"angelo attorney estate lawyer probate real san texas will",20
"attorney attorney family family lawyer legal services",20
"attorney counsel defense lawyer legal suit",20
"attorney counsel lawyer",20
"attorney divorce illinois lawyer",20
"attorney dui lawyer com",20
"attorney immigration lawyer",20
"attorney lawyer associate",20
"connecticut mesothelioma lawyer mesothelioma attorney dallas",20
"florida+divorce+lawyer+attorney",20
"florida personal injury lawyer brain injury attorney",20
"idaho divorce attorney lawyer directory id",20
"mesothelioma lawyer mesothelioma lawyer mesothelioma attorney mesothelioma doctor mesothelioma.tips-and-facts.com",20
"mesothelioma mesothelioma attorney mesothelioma lawyer",20
"mesothelioma symptoms mesothelioma lawyer mesothelioma attorney mesothelioma.tips-and-facts.com",20
