keyword, count
"call center software",1918930
"call center",1635566
"call center outsourcing",818878
"call center services",174087
"call center service",103762
"inbound call center",97269
"call center solution",55012
"call center management",35930
"call center customer service",25601
"conference call center",23278
"call center jobs",19061
"call center technology",17711
"call center training",16970
"call+center+software",15857
"call center consultant",15404
"call center consulting",13418
"call center software uk",13356
"call+center+outsourcing",12200
"call center job",11350
"advanced call center",11011
"outbound call center",10850
"customer service call center",10275
"call center monitoring",10185
"telemarketing call center",10034
"call center conference",10025
"center call",10012
"call center bids",9514
"call center consultants",8868
"call+center",8770
"call center solutions",8054
"call center accesory",7622
"virtual call center",7618
"call center management software",7225
"call center employment",5728
"web enabled call center",5496
"outsourcing call center",5168
"call center conference teleconferencing",5111
"inbound call center services",4894
"call center operations",4776
"call center service ' call center service a",4727
"india call center",4512
"crm call center",4209
"bilingual call center",4180
"call center equipment",4180
"center call immigration",4100
"call center manager",4050
"web call center",3848
"inbound call center service",3717
"call center statistics",3642
"24 7 call center",3612
"offshore call center",3610
"call center in india",3542
"call center customer service practice",3473
"offshore outsourcing call center",3282
"call center representative",3219
"call customer center service",3197
"call center company",3165
"call center products",3161
"call center recording",3128
"call center staffing",3125
"call center scheduling software",3088
"outsource call center",3029
"call center design",2958
"customer care call center",2911
"call center sales training",2897
"medical call center",2896
"call center conference demo",2882
"call center benchmarking",2877
"call center headset",2770
"call center career",2758
"call center management system",2747
"director call center",2720
"call center furniture",2677
"call center inbound services",2645
"call center crm solution",2643
"call center magazine",2630
"call center information",2595
"call center telemarketing",2562
"call center employment home work",2559
"philippine call center",2544
"phone call center",2470
"call center job description",2449
"call center seminar",2383
"contact center call center",2372
"voip call center",2364
"outbound call center services",2350
"call customer center",2254
"call center careers",2251
"call center speaker",2228
"call center conferences",2188
"call center outbound inbound",2186
"call center philippines",2171
"call center agent",2157
"call center india",2140
"call center servicess",2140
"call center outsourcing services",2130
"insurance call center",2087
"call center metrics",2075
"call center outsource",2067
"apac call center",2065
"canadian call center",2064
"call center service' call center service a",2063
"call center software 1",2057
"call center generation lead philippine",2002
"call center offshore philippine",1991
"call center expert witness",1987
"call center directory",1962
"call center industry",1938
"call center provider",1911
"call center monitoring software",1889
"call center in the philippines",1888
"call center system",1885
"call center crm software",1881
"philippines call center",1876
"call center agencies",1864
"uk call center",1862
"indian call center services",1852
"call center agency",1849
"call center philippine",1844
"call center best practice",1840
"indian call center service",1834
"outbound call center service",1827
"philippines call center agencies",1823
"financial call center",1822
"outbound call center agencies",1821
"virtual call center jobs",1818
"inbound call center agencies",1809
"inbound call center agency",1802
"outbound call center agency",1796
"philippines call center agency",1796
"ohio call center",1793
"philippines call center services",1787
"south dakota call center",1787
"call center management report samples",1784
"indian call center agency",1784
"philippines call center service",1771
"indian call center agencies",1769
"customer call center",1768
"pennsylvania call center",1766
"call center softwares",1765
"minnesota call center",1708
"lead generation call center",1671
"call center benchmark",1660
"virtual call center job",1656
"call center network",1630
"call to center",1615
"call customer center service practice relationship",1611
"call center crm",1608
"help desk call center job jacksonville",1601
"call center application",1584
"call center support",1566
"call center management solution",1559
"call center consolidation",1555
"call center articles",1528
"call center quality",1518
"advanced call center software",1517
"call center operation",1506
"call center software solution",1503
"call center phone system",1496
"call center books",1494
"call center resume",1478
"free call center",1476
"work from home call center",1460
"call center performance management software",1451
"jobs in call center",1442
"call center uk",1435
"call center customer services",1421
"call center headsets",1415
"call center seminars",1412
"call center database software",1404
"call center canada",1399
"call center telecommunications",1385
"sample call center management report",1381
"inbound call center philippine",1362
"call center outsourcing philippine",1359
"call center scheduling",1355
"call center management training",1345
"call center colombia",1339
"call center association",1332
"applicant screening call center",1329
"free call center software",1319
"conference and registration call center",1314
"the evolution from call center to contact center is well",1307
"call center companies",1305
"call center management performance",1293
"call center management systems",1284
"call center management review",1275
"call center reporting",1262
"call center publication",1251
"call center offshore outsourcing",1250
"level i outbound representative call center",1239
"call center supervisor",1234
"call center workforce management",1232
"integrating the call center into a customer relationship",1227
"call center management jobs",1218
"call center service ' call center service a font color",1211
"call center recruiter",1205
"call center quality control",1195
"conference call learning center",1193
"outsourced call center",1189
"level iii inbound call center supervisor",1185
"outbound call center manager",1176
"get the most from your call center investment",1165
"call center customer support services",1160
"call center service 5c 27 3ecall center service 3c 2fa",1160
"level i inbound call center supervisor",1158
"call center best practices",1154
"call center store",1128
"inbound call center philippines",1124
"call center quality assurance",1115
"call center outbound services",1112
"level i outbound call center supervisor",1092
"call center lead generation philippine",1091
"call center crm cti software technology",1090
"indian call center",1089
"call center news",1072
"call center and outsource and india",1071
"chief call center executive",1070
"call center georgia",1068
"call center management uk",1067
"level iii outbound representative call center",1062
"call center phone",1044
"call center quality monitoring",1041
"call center health safety",1040
"offshore call center services",1035
"bangalore call center",1022
"international call center",1008
"level ii outbound call center supervisor",1000
"inbound call center manager",999
"properly designing a new call center is one of the",993
"level iii outbound call center supervisor",988
"level iv outbound representative call center",983
"level iv inbound representative call center",981
"call center services india",979
"call center tutorials",977
"call center inbound services philippine",973
"asian call center",971
"call center sales",965
"call center jobs in pakistan",962
"level ii outbound representative call center",957
"call center performance metrics",951
"call center training videos",945
"call center optimization",937
"level ii inbound call center supervisor",936
"call center school",928
"call center forums",925
"call center recording software",920
"call center calculator",915
"call center florida",912
"call center resource",906
"mortgage lead call center",906
"call center manager job description",898
"call center publications",894
"call center book",890
"call center knowledge base",888
"call center simulation training",876
"one call center",876
"call center expert",867
"royal carribean call center hiring springfield or",856
"offshore call center outsourcing",850
"contact center call",849
"business call center conference telecommunication",846
"call center service level",838
"customer service call center training",835
"call center setup",833
"call center technology consultant",830
"ivr call center phone system",827
"call center inbound software",826
"call center contact center",811
"call center solution in france",811
"call center telemarketing services",810
"what is a call center",807
"call center outsourcing philippines",806
"coastal call center",806
"call center service provider",805
"call center help desk",804
"call center web seminars",799
"call center services philippines",798
"west call center",795
"uk call center services",794
"wyndham hotel virtual call center",793
"call center consulting india",792
"top call center outsourcing",789
"call center quality control action plan",785
"call center management training course",783
"call center recruiters",777
"call center scripts",776
"call center infrastructure",772
"call customer center service practice",757
"call center certification",754
"incoming call center management",751
"call center applications",750
"crm call center technology",747
"call center predictive dialers",746
"speech recognition call center software",744
"internet call center solution",741
"call center contact",740
"call center recruitment",737
"call center in the philippine",733
"center aisle caedmon 's call review",733
"virtual call center employment",731
"free call center business plan",721
"global call center outsourcing",721
"work at home call center",721
"new call center",717
"call center industry events",712
"odessa texas call center",712
"call center leads",710
"911 call center",705
"software call center",705
"advanced call center crack",701
"call center data integration",697
"call center outsourcing india",695
"customer call center software",694
"call center routing system",693
"crm call center solution",693
"odessa texas call center hiring",693
"call center accessory",692
"call center france",691
"call center service call center service a font color",691
"answering services call center",690
"call center in canada",689
"services offered in call center",686
"academy call center philippine",684
"ip call center",676
"call center philippine telemarketing",675
"keywords call center software",675
"call center outsourcing services in philippines",671
"call center management operations",670
"call center solutions in asia",669
"agent call center home work",667
"software gestione call center",662
"call center solutions in philippines",657
"call center home job work",655
"grand junction choice hotels international call center",650
"call customer center service practices relationship",649
"call center resources",647
"call center resumes",647
"call center manager jobs",645
"call center india outbound services",644
"call center automation",642
"call center quality evaluation",636
"coastal vacations call center",634
"call center job search",630
"call center customer service practices",623
"call center operations philippines",618
"global call center services",618
"global call center customer services",617
"call center services philippine",611
"call center generation lead offshore",609
"call center operations philippine",608
"call center philippines india",608
"call center evaluation",606
"call center for sale",605
"call center web seminar",604
"call center training video",600
"call care center customer services",599
"call center quality control specialist",599
"call center forecasting",596
"mcdonald call center",596
"stategic call center outsourcing",594
"call center valley",593
"strategic call center services",593
"call center logging",591
"outsourced call center services",588
"call center consultant philippines",585
"consultants call center",584
"crm call center management",581
"call center services answering service",579
"call center customer relationship service",576
"call center free software",574
"call center phone training",574
"call center product",574
"call center standards",573
"alltel call center locations in tampa",570
"outbound call center philippine",570
"call center performance",569
"call center service call center service a",569
"call center motivation",568
"customer support call center",566
"call center solutions nextwest",565
"call ring center",559
"customer relationship call center service practices",559
"conference and call center",558
"outbound call center training",558
"call center management philippines",552
"911 call center software",551
"call center software solutions",547
"advance call center",546
"call center consultant philippine",544
"call center supervisor training",537
"verizon wireless call center",536
"call center management software workforce",535
"call center clerk customer data entry payroll representative",533
"nationalcity.com call center",533
"call center technologies",529
"call center europe",526
"call center manual training",526
"call center recorder",526
"call center jobs philippines",525
"call center photos",524
"customer service call center practices",521
"call center customer support india",519
"call center jobs uk",519
"philippine call center jobs",518
"financial services call center",517
"call center services telemarketing",516
"call center india job",515
"call center customer support service",514
"call center disaster recovery",514
"call center ireland job manager",513
"call center telecom",510
"call center in france",509
"call center from home job work",508
"call center jobs in bangalore",508
"new york call center",508
"call center jobs in chennai",507
"call center job postings",506
"call center direct sales",505
"call center inbound",505
"call center services strategic",504
"outsourcing customer service call center isp",504
"aol call center",502
"call center outbound services india",500
"bilingual call center inbound live operator stenocall",499
"call center description job supervisor",499
"call center incentive",498
"atlanta call center accounting help desk jobs",497
"call center in india job",497
"call center simulation",497
"call center india outsourcing",496
"call center referral service",496
"call center call flow management",495
"independent consultant in call center contact center",495
"call center customer satisfaction survey",494
"quality call center monitoring",494
"call center jokes",493
"call center business",491
"verizon call center",491
"web based call center",489
"call center call monitoring",487
"best call center training",486
"set up a call center",485
"v3 call center",483
"equifax and call center",482
"air france call center",481
"call center monitor",481
"mts call center address",481
"outsourcing call customer center service isp pertaining",478
"call center global outbound services",476
"call center database marketing",475
"about call center",470
"strategic call center inbound services",469
"call center mt resume",468
"call center survey",468
"call center chat online philippine",466
"call center consulting philippine",466
"global call center outbound services",465
"answering services call center support",464
"call center academy in the philippine",463
"strategic call center telemarketing",463
"call center equipment inbound",462
"hosted call center",462
"call center incoming management",461
"call center conference schedule",460
"call center manager resume",460
"call center ne resume",457
"workforce management in call center",455
"call center customer management service",454
"call center outsourcing services in philippine",454
"call center terminology",454
"outsourcing call center customer service practices",454
"outsourcing isp pertaining call customer center service",453
"remote agent call center",453
"call center inbound services strategic",447
"call center sony",447
"call center in mumbai",446
"call center performance management",446
"outsourcing customer service call center practices",445
"call center article",444
"call center nm resume",443
"call center lead generation",441
"call career center management",440
"call center telemarketing consultant",440
"call center terminal",439
"call center projects",438
"call center isp customer service",437
"call center coaching elearning",436
"call center software tracking",435
"philippine order taking call center",435
"call center stress management statistics",434
"call center akademie",433
"call center co resume",433
"call center logger",433
"call center resume ut",433
"call center university",433
"call center job opportunity",432
"advanced call center serial",430
"call center forum",430
"caedmon 's call center aisle lyrics",429
"call center customer support philippines",429
"call center jobs in india",428
"internet call center",428
"call center jobs from home",427
"call center marketing services",427
"call center management job",425
"call center mn resume",425
"strategic call center outbound services",425
"training call center employees",425
"call center documentation standards",424
"active call center",423
"call center management philippine",422
"call center order processing philippine",422
"call center work at home",422
"call center module ccm",419
"call center monitoring systems",419
"az call center resume",417
"call center customer data entry payroll representative",417
"call center home job",417
"call center in job london",414
"ge call center",414
"call center lists for outsourcing",413
"delray and bluegreen and call center",413
"call center definition",412
"customer service call center isp",412
"call center hotel uk",409
"call center software 20",409
"outsourcing in data entry call center",409
"call center training software",408
"call center job descriptions",406
"call center broker",403
"call center events",403
"call center in uk",403
"philippine online chat call center",403
"call center ohio",402
"what is call center",402
"call center agents",401
"call center provider india",401
"call center sales training colorado",401
"call center crack",400
"call center fast forward management",400
"call center interview",400
"outsourcing american voice call center",400
"best call center in practice",399
"call center ia resume",397
"call center cos27e8",396
"call center free training",395
"call center industry standards",395
"pc help call center",395
"workforce management software call center",395
"call center best practices monitoring forms",394
"call center in bangalore",394
"rfp call center",394
"china customer service isp call center",393
"outsourcing call center help",393
"resume example for call center",392
"center outsourcing call centre services in india",390
"answering call center service",389
"call center dell india",389
"call center outsourcing 26 thailand",388
"call center download",387
"high roi call center software",387
"new frontier call center morocco",387
"strategic call center customer services",387
"advanced call center technologies",386
"association bc call center",386
"call center service 27 3ecall center service 3c 2fa 3e",386
"cingular wireless ashland call center grayson kentucky",386
"argentina call center",385
"call center consultant specialist",385
"comcast 2b call center",384
"workforce management solution call center",384
"call center online training",383
"customer service isp call center",383
"bell mobility and call center",382
"call and center and philippines",382
"call center manager operations",382
"customer relationship isp call center service",382
"offshore call center outbound services",382
"work at home call center jobs",382
"offshore call center customer services",380
"call center graph statistics",378
"call center intervista",378
"call center isp",378
"inbound outbound call center",378
"call center rfp",377
"call center humor",376
"global call center customer support",375
"311 call center software",374
"employee scheduling software call center",374
"accessory call center phone",373
"international call center jobs",373
"university recruitment call center",373
"call center surveys",372
"outsourcing to india call center",372
"call center customer services india",371
"call center mumbai",371
"association call center malaysia",370
"call center terms and definitions",370
"job call center",370
"law enforcement call center software",370
"offshore strategic call center services",370
"speech recognition call center",370
"call center demo",369
"picture call center",369
"at home call center agent",368
"call center specialist consultant",367
"list of call center outsourcing",367
"call center crm management",366
"call center data",365
"global call center consulting",365
"china customer relationship isp call center service",364
"isp pertaining call customer center service",364
"advanced call center 5.1.0.653",363
"call center coach training",363
"5.1 advanced call center",362
"call center customer retention",362
"call customer center service practices",362
"customer relationship call center service",362
"outsourcing asia call center",362
"sample call center resume",362
"call center consolidation and outsourcing",360
"call center provider philippines",360
"hmo call center customer service skills",360
"virtual call center jet blue",360
"call center jobs philippine",359
"india call center customer services",359
"pertaining to their customer call center service isp",358
"jobs call center",357
"pros and cons of call center outsourcing",357
"call center costs",356
"canada call center job",356
"crack advanced call center",356
"call center charleston sc verizon wireless",355
"the call center",354
"call center service ' call center service",353
"call center stress",353
"dell call center",353
"call center management in gprs",351
"call center teleconferencing",351
"tcs call center calculator",350
"agent call center from home work",349
"call center chennai",348
"call center expo",348
"caedmon 's call center aisle",347
"call center company outsourcing",347
"independent consultants in call center, contact center",347
"call center jobs toronto",346
"call center process",346
"call center contact recording",345
"global strategic call center services",345
"icici call center",345
"agent call center training",344
"call center outsourced services",344
"resume and call center",344
"siebel call center",344
"acd call center",343
"call center research",343
"call customer center service isp pertaining",343
"call center customer support philippine",342
"call center training in uk",342
"china isp pertaining call customer center service",342
"gulf consolidates call center",342
"911 call center customer service",341
"call center sales training denver",341
"call center stress report",341
"call center tutorial",341
"india outsourced call center",341
"jet blue virtual call center",339
"call center for english speech support",337
"call+center+service",337
"call center customer service training",336
"call center hyderabad",336
"isp call customer center service practices relationship",336
"call center career progression",335
"call center upselling philippines",335
"dell call center india",335
"call center phone systems",334
"lavoro call center",334
"call center bangalore",333
"call center solution voip",333
"hr call center employee satisfaction survey",333
"strategic call center consulting",333
"call center milano",332
"call center web chat",332
"answering call center services support",330
"call center outsourcing service",330
"resume acd call center or contact center",330
"avaya call center",329
"call center cubicles",329
"global call center",329
"bad call center customer service",328
"call center offshore services strategic",328
"china call customer center service isp pertaining",328
"china call center isp customer service",327
"ge career call center",326
"job philippine call center customer service representative",326
"rfp call customer center service isp pertaining",326
"inbound call center statistics",325
"average customer service representative call center pay",324
"call center outbound",324
"customer service financial services call center",324
"call center jobs in houston",322
"intenational call center",321
"call center 20",320
"airline call center phone systems",319
"az call center customer our present resume service us we",319
"call center operator philippine",319
"advanced call center 4",318
"los angeles call center training",318
"offshore call center consulting",318
"call center customer in service",317
"call center email management outsourced services software uk",317
"call center offshore services",317
"china customer service call center isp",317
"call center job london",316
"call center work stations",316
"countrywide home loans call center southern cal",316
"rfp isp pertaining call customer center service",316
"call center gurgaon",315
"health department call center software",315
"political call center",314
"symposium call center",314
"call center answering services",313
"customer relationship call center",313
"call center cartoons",312
"call center india outbound",312
"call center services help lines",312
"advanced call center 4.3",311
"list call center philippine",311
"setting up a call center",311
"countrywide home loans call center southern california",310
"csc customer relationship call center service practices",309
"advanced call center 4.1",307
"call center metrics operations",307
"call center trends",307
