keyword, count
"call the national jewish center learning and ldrshp",307
"fire call center software",307
"call center list",306
"how to set up a call center",306
"specific to the call center industry",306
"call center job toronto",305
"call center pbx",305
"call center provider philippine",305
"inbound call center technology",305
"rfp call customer center service practices relationship",305
"call center coaching",304
"call center management reports",304
"europe customer relationship call center service practices",304
"call center academy",303
"call center inbound philippine provider",303
"call center nashville",303
"call center wien",303
"domestic call center",303
"custom built call center software",302
"genesys call center",302
"starting a call center",302
"call center flowcharts",300
"call center monitoring sample form",300
"china pertaining to their customer call center service isp",300
"rfp customer service call center isp",300
"call center customer acquisition",299
"call center jobs ireland",299
"convergys call center",299
"philippine call center provider",299
"uob call center",299
"call center certification management",298
"csc call customer center service practices relationship",298
"call center order taking",297
"ciac certification offers call center professionals",296
"delhi call center",296
"rfp customer relationship call center service practices",295
"call center service 5c 5c 5c 27 3ecall center service",294
"call center software consulting",294
"rfp pertaining to their customer call center service isp",294
"windows based call center scheduling software",294
"call center mortgage leads for 245",293
"call center project",293
"office furniture for call center",293
"operatore call center",293
"support center call software",293
"call center : 0.098",292
"call center alliance",292
"call center cost",292
"call center cti services",292
"call center management tips",292
"call center work",292
"strategy planning for call center in india",292
"asia call center in solution",291
"call center consulting philippines",291
"call center customer outsourcing quebec service",291
"call center india training",291
"consulting call center management",291
"customer satisfaction call center",291
"europe call customer center service practices relationship",291
"provider call center management",291
"call center routing systems",290
"contact center customer clients service business call",290
"rmh call center closings",290
"swot report of call center",290
"call center architecture",289
"call center company from one services write",288
"call center jobs india",288
"computer based training call center",288
"business case call center",287
"call center berlin",287
"free work at home job virtual call center",287
"properly designing a call center is one of the most",287
"stenocall is a bilingual live operator inbound call center",287
"use software answering machine advanced call center",287
"call center monitoring best practice",286
"call center mortgage leads for 245 from india",286
"level i inbound representative call center",286
"allstate call center india",285
"ohio2c work2c home2c outsource2c call center",285
"aspect call center",284
"business objectives call center",284
"inbound call center direct",284
"best practice customer service call center practices",283
"delta air lines and call center",283
"free call center management guide",283
"used call center furniture",283
"advanced call center technology",282
"call center order processing",282
"bank call center",281
"call center consulting management",281
"call center customer service job",281
"call center employee incentives",281
"call center management for gprs",281
"call center or call centres or contact center or contact",281
"call center service' call center service a font color",281
"conan india call center",281
"call center dortmund",280
"independent consultants in call center2c contact center",280
"call center magazine solution",279
"call center services bpo2c b2b2c b2c usa",279
"call center training terreich",279
"latin america call center",279
"call center director operations",278
"inbound call center supervisor",278
"virtual call center work at home",278
"call center escalation",277
"call center escalation team",277
"call center morocco",277
"call center alitalia",276
"call center customer global support",276
"call center de",276
"call center software:",276
"customer service and call center job",276
"technical call center",276
"call center jobs in dubai",275
"call center profi",275
"call center games",274
"call center workstations",274
"hvac call center",274
"service call center statistics",274
"alltel customer service call center phoenix",273
"call center customer management relationship",273
"call center industry standard",273
"alltel customer service call center",272
"call center report seminar",272
"call+center+services",272
"competence call center",272
"csc call center customer service practices",272
"job search call center customer service",272
"predictive dialer call center",272
"rfp customer service call center practices",272
"telelink call center",272
"call center documentation guidelines",271
"inbound call center home agents houston",271
"telemarketing services call center consultant",271
"call center crm technology voip",270
"inbound+call+center",270
"mlm call center",270
"noticias call center",270
"our call center forum section is the place",270
"performance base call center service",270
"american express call center",269
"europe customer service call center practices",269
"mortgage call center wholesale",269
"call center development software",268
"call center job postings in georgia",268
"forecasting inbound call center traffic",268
"independent consultants in call center contact center",268
"one write company commercial printing call center",268
"baker 26 taylor call center",267
"meaning of call center service level",267
"bell mobility call center",266
"best practice call center customer service practices",266
"call center coverage data",266
"delivery service call center",266
"monarch services call center positions",266
"rfp call center customer service practices",266
"site for the new dell call center in okc",266
"wanted inbound call center",266
"call center employee dissatisfaction",265
"inbound call center directory",265
"indian outsourced call center",265
"24 hour call center for companies",264
"call center 27workforce management27",264
"europe call center customer service practices",264
"itc call center",264
"san antonio college call center management certificate",264
"call center charleston verizon",263
"call center dublin ireland job manager",263
"call center offshore",263
"life in a call center",263
"utility call center",263
"call center picture",262
"call center roma",262
"call center web chat philippine",262
"csc customer service call center practices",262
"operatori call center",262
"call center white papers",261
"sbc 2b call center",261
"call center design for lion financial services",260
"call center hyderabad in job",260
"call center marketing support",260
"gc services houston call center",260
"call center long distance",258
"call center spanish",258
"rfps bids for inbound call center services",258
"service goals for a technical support call center",258
"call center average cost of turnover",257
"call center direct response agent work home dr ivr",257
"setting up a customer service call center",257
"call center management services",256
"bilingual montreal quebec call center",255
"call center delhi",255
"call center in india service level",255
"india call center jobs",255
"jobs at northwest airline call center",255
"list of companies with call center seats",254
"advanced call center hack",253
"average cost of turnover for call center industry",253
"call center for technical support service goals",253
"call center services in new mexico",253
"florida call center jobs",253
"sample business reports for call center",253
"wanted rn phone insurance call center florida",253
"call center executive",252
"call center standard",252
"customer service remote call center agent",252
"customer service training call center",252
"association call center management",251
"call center employee union",251
"call center manager director",251
"call center technical support",251
"help desk call center flow charts",251
"call center christchurch",250
"call+center+management",250
"call center nz",250
"call center recruiters in tampa",250
"construct call center work stations",250
"call center executives",249
"call center hamburg",249
"call center jobs bangalore",249
"it call center management",249
"time warner customer call center",249
"helpdesk and call center",248
"national patient account services and call center",248
"call center quality employee incentives",247
"call center services b2b2c b2c2cbpo in usa",247
"examples of call center business reports",247
"download call center training presentations",246
"call center college",245
"call center options",245
"call center in delhi",244
"conference+call+center",244
"how much do call center services cost",244
"increased call volumes to customer center service practices",244
"setting service goals for call center",244
"countrywide home loans call center thousand oaks2c ca",243
"examples of call center business information reports",243
"ge call center application",243
"office depot and call center",242
"311 call center solution",241
"call center job titles",241
"call center message boards",241
"call center services directories in the usa",241
"help desk 2b call center 2b network 2b group",241
"t mobile call center salem oregon",241
"call center customer practice relationship service",240
"resume objective experience education skills call center",240
"outsourcing call center to india",239
"emc mortgage corporation call center",238
"training manual call center",238
"call center furniture or computer lab and furniture",237
"call center technology consulting avaya",237
"call center solution crm customer",236
"dell and customer support and indian call center",236
"call center scoring",235
"ge capital call center",235
"transportation call center consultants",235
"call center business plan",234
"call centers learning center",234
"call+center+solution",232
"inbound call center in lieu of inbound calling",232
"freight call center consultants",231
"level iii inbound representative call center",230
