keyword,count
"acs college loans",5
"alternative college loans",9
"alternative student loans for college education",4
"american general finance college loans",2
"aspire loans for college students",3
"astrive college loans",2
"auto loans college students",2
"bank auto loans college student",5
"bank of america + college loans",2
"bank of america college loans",3
"barry sorento college loans",2
"best interest rates, 12/3/08, college loans",2
"car loans for college students",2
"chase college loans",4
"christian college loans",4
"citibank college loans",2
"college and scholarships and computer or auto but not loans",2
"college consolidation loans",2
"college federal loans default",6
"college finacial aid loans",2
"college grants and loans",2
"college loans",262
"college loans and grants",2
"college loans for bad credit",2
"college loans sent to students",6
"college loans with bad credit",11
"college loans with no debt to income ratio guidelines",4
"college loans with no job",2
"college loans without school certification",2
"college student auto loans",6
"college student eauto loans",7
"college student loans",83
"college student loans with bad credit",21
"college tuition loans",3
"community college loans",4
"community college student loans",5
"compare college loans",2
"consolidate college loans",5
"consolidating college student loans",3
"defer paying college loans",2
"delaware technical and community college private loans",2
"did barack obama take out student loans to pay for college",2
"do student loans need to be repaid if you are in college",4
"economy affecting chiropractic college school loans",2
"economy college loans",3
"federal college loans",3
"federal loans for college",5
"fixed rate parent college loans",3
"getting loans to help pay expenses while in college",5
"government loans for college",2
"granite college loans",3
"grants and loans for college",2
"guarenteed student loans for college",2
"how do i find mn college grants loans",9
"intrest free college loans",2
"loan repayment for college loans",3
"loans bryan college station texas",4
"loans for college",16
"loans for college students",8
"loans for online college",2
"michelle obama college loans",2
"no credit college loans",4
"obama college loans",2
"parent college loans",46
"paying back college loans",5
"personal loans for college students",4
"quick college loans",2
"repay college loans with no job",5
"sally mae college loans",2
"should parents give loans to children for college",2
"stafford college loans",2
"student college loans",11
"student college loans verses parents income",5
"student loans college",2
"student loans for college",17
"student loans modesto junior college",2
"studnet college loans",2
"unable to pay college loans",4
"well fargo college loans",4
"wells fargo college loans",2
