keyword, count
"florida architects continuing education",313
"georgia institute of continuing legal education",313
"kansas continuing legal education commission",313
"radiologic technologist continuing education",313
"sacramento dental continuing education",313
"california continuing education insurance life",312
"continuing education art colleges",312
"continuing education free pharmacist",312
"continuing education student loans",312
"pay insurance continuing education",312
"pharmacy continuing education travel",312
"canadian continuing education deans",311
"continuing education for cosmetology",311
"continuing education for insurance agents",311
"continuing education units engineering",311
"free continuing education hours for nurses",311
"continuing education doctors",310
"free continuing education for pharmacy technicians",310
"continuing education free",309
"continuing education speech",309
"education radiology continuing",309
"montana health insurance continuing education",309
"case management continuing education",308
"continuing medical education texas",308
"professional engineer continuing education",308
"acupuncture continuing education",307
"continuing education for physical therapists",307
"continuing education georgia insurance",307
"continuing education insurance ohio",307
"continuing education florida engineers",306
"continuing education for texas court reporters",306
"continuing engineering education",306
"free dental online continuing education",306
"free respiratory care continuing education",306
"gauge continuing education",306
"acupuncture continuing education credit",305
"case manager continuing education",305
"continuing education ohio electrical license",305
"continuing medical education cme conference",305
"physical therapy continuing education online",305
"continuing education chicago",304
"continuing education technicians",304
"continuing medical education meeting",304
"radiology tech continuing education",304
"rockhurst university continuing education",304
"continuing education beauty field",303
"continuing education grant programs",303
"continuing education nurse online",303
"continuing education nursing texas",303
"free dental continuing education online for danb",303
"paramedic continuing education software",303
"police emt continuing education",303
"private investigator continuing education",303
"continuing education post partum depression",302
"ace continuing legal education",301
"continuing education free pharmacists",301
"continuing education interior designers",301
"continuing medical and nursing education",301
"director of continuing education",301
"nj continuing legal education",301
"non credit continuing education programs",301
"nursing continuing education courses in orlando florida",301
"radiology continuing education credit free",301
"usc medical continuing education",301
"accountant continuing professional education",300
"continuing education deans",300
"gi nursing continuing education",300
"medical continuing education free",300
"occupational therapy continuing education courses",300
"on line continuing education for nurses",300
"continuing education illinois insurance",299
"emergency medicine continuing education on cruise ships",299
"home study continuing education for nurses",299
"mortgage lending continuing education",299
"auburn university continuing education",298
"pharmacy and continuing and education",298
"texas nursing continuing education",298
"continuing education north carolina insurance",297
"continuing education tracking program",297
"nursing continuing education policy",297
"online continuing education courses for physical therapist",297
"ca continuing legal education",296
"continuing education free radiology",296
"continuing medical education courses in hawaii",296
"mobile continuing education",296
"national center of continuing education",296
"college continuing education",295
"ems continuing education challenges",295
"long term care continuing education nursing",295
"pediatric nursing continuing education",295
"tulane nursing continuing education",295
"appraiser continuing education on line",294
"brookline continuing education",294
"continuing education courses online for physical therapists",294
"continuing education distance courses in history",294
"nobel biocare dental continuing education",294
"continuing legal education delaware state bar",293
"insurance agent continuing education",293
"novartis continuing education",293
"blasting continuing education",292
"greater boston area continuing education",292
"hypothermia continuing education",292
"recreation therapy continuing education units",292
"travel grant south africa continuing education",292
"continuing education for social worker",291
"continuing education units for respiratory therapy",291
"university of new mexico continuing education",291
"continuing education in boston",290
"continuing education insurance pennsylvania",290
"continuing education insurance noble",289
"dentist continuing education new york",289
"free nurse continuing education",289
"mce mandatory continuing education",289
"army continuing education",288
"california mandatory continuing legal education",288
"continuing education online real estate michigan",288
"continuing education san diego psychologist",288
"education continuing education credits",288
"fall 2004 continuing education writing new jersey",288
"online continuing education for human resources",288
"why continuing education",288
"continuing legal education british columbia",287
"continuing professional education boston",287
"continuing education boulder",286
"continuing education estate indianapolis real",286
"cosmetology continuing education online ohio",286
"insurance continuing education mn",286
"ochsner nursing continuing education",286
"california continuing education insurance",285
"continuing education maryland real estate",285
"mo real estate license continuing education online",285
"south carolina bar of continuing legal education",285
"ubc continuing education",285
"adult continuing education seminar workshop",284
"california continuing legal education of the bar",284
"continuing education emergency medical technician",284
"continuing education indiana",284
"continuing education medical technologist",284
"continuing medical education hit",284
"real estate online continuing education",284
"continuing education in hospitals",283
"continuing education insurance nj",283
"continuing education units nursing",283
"online continuing education course for teacher",283
"online continuing education real estate ontario",283
"what are continuing education units",283
"continuing education questionnaire",282
"free medical continuing education",282
"insurance continuing education providers",282
"minnesota electrical continuing education seminars",282
"podiatry continuing medical education seminars",282
"university continuing education confernce",282
"broward community college continuing education",281
"continuing medical education new orleans",281
"ems continuing education iowa",281
"continuing course education physical therapist",280
"continuing education nj",280
"continuing medical education business investments",280
"continuing medical education colorado",280
"nursing on line continuing education",280
"army continuing education system",279
"continuing education mammography on line",279
"free continuing education pharmacy",279
"institute for continuing legal education",279
"board continuing district education school toronto",278
"continuing education course florida",278
"continuing education for dental hygienists",278
"florida aacme continuing education",278
"board of continuing legal education of teh nc state bar",277
"case management continuing education certificates",277
"continuing education california insurance brokers",277
"continuing education for architects",277
"continuing education in california",277
"continuing education insurance jersey new",277
"continuing education in veterinary medicine",277
"continuing legal education north carolina",277
"pharmacy continuing education credit",277
"continuing education mortgage brokers austin texas",276
"continuing legal education cle attorney north carolina",276
"continuing legal education intellectual property",276
"florida life insurance continuing education",276
"online construction continuing education",276
"seminars physical therapy continuing education courses",276
"certified registered nurse anesthetist continuing education",275
"florida real estate license continuing education course",275
"allnurses com nursing continuing education online",274
"continuing education free insurance",274
"dental hygienist continuing education",274
"new school continuing education",274
"nurse practitioner2c online continuing education",274
"what is continuing medical education",274
"continuing education in the workplace",273
"continuing education texas insurance noble",273
"free continuing legal education new york",273
"army continuing education services",272
"continuing education forensic nursing",272
"continuing education insurance companies",272
"continuing education insurance services",272
"continuing education spirituality",272
"continuing education tracking software",272
"jobs in continuing medical education",272
"amarillo college continuing education",271
"ny insurance continuing education courses",271
"texas insurance agent continuing education",271
"virginia insurance continuing education",271
"washington state insurance online continuing education",271
"ca continuing education insurance license",270
"find continuing education courses for pharmacy in birmingham",270
"florida acpe continuing education",270
"teaching continuing education course insurance colorado",270
"continuing education financial aid",269
"continuing education for allied health professionals",269
"continuing education insurance wyoming",269
"minnesota continuing education insurance",269
"occupational therapist continuing education",269
"southern methodist university adult continuing education",269
"albuquerque continuing education real estate",268
"continuing education insurance federal way",268
"continuing education on line course",268
"harvard medical continuing education",268
"jobs and continuing medical education",268
"adult continuing education scholarship",267
"checking continuing education units online",267
"continuing education hawaii medical",267
"graceland college continuing education lifelong learning",267
"home care administrator continuing education texas",267
"insurance continuing education ethics and fraud",267
"nursing continuing education video conferences",267
"ohio health insurance continuing education",267
"continuing legal education iowa",266
"florida mortgage broker continuing education online",266
"free online continuing education credits for dietitians",266
"hosting continuing education course insurance colorado",266
"mandatory continuing professional education",266
"california insurance continuing education book",265
"conestoga college continuing education",265
"continuing education for insurance license",265
"continuing education programs in new york city",265
"insurance continuing education video",265
"montana auditor insurance continuing education",265
"nursing continuing education credits online",265
"university programs real estate continuing education ca",265
"california ca insurance continuing education",264
"continuing education insurance pa",264
"georgia state university continuing education",264
"nih continuing education online",264
"nobis insurance continuing education",264
"continuing education florida medical",263
"continuing education nyu school",263
"continuing education trauma nursing",263
"continuing medical education whistler bc",263
"contractor continuing education",263
"santa fe community college continuing education",263
"teach professional continuing education",263
"continuing education and radiology technologist",262
"continuing education vancouver",262
"los angeles and continuing medical education",262
"online test for series 7 continuing education",262
"pennsylvania real estate continuing education credits",262
"continuing business education imadec",261
"continuing education fund",261
"continuing education insurance online",261
"free continuing education for nurses diversity",261
"mac continuing medical education programs",261
"tucson arizona continuing education meeting",261
"california continuing dental education",260
"continuing education chinese language new jersey",260
"definition of adult and continuing education",260
"edmonton public schools continuing education",260
"free online nursing continuing education credits",260
"hawaii continuing medical education",260
"insurance continuing education programs",260
"new mexico teacher continuing education",260
"pharmacy continuing education credits",260
"radiography continuing education online",260
"university san diego continuing education",260
"continuing education for nurse practitioners",259
"continuing education liberal studies degree",259
"continuing education occupational health",259
"free continuing education unit",259
"ice institute of continuing education",259
"insurance continuing education in north carolina",259
"medical transcription continuing education",259
"my continuing education status in south carolina",259
"north carolina insurance continuing education courses",259
"nursing online continuing education credits",259
"professional organizations continuing education requirements",259
"continuing education ibc 2003",258
"continuing education in healthcare law",258
"continuing education medical radiology",258
"cuesta college continuing education",258
"egenesis online training continuing education",258
"minnesota continuing education",258
"university continuing education association",258
"against continuing nursing education opinion",257
"continuing education for interior designers florida",257
"continuing professional education california",257
"dental hygiene interactive continuing education",257
"education 2b continuing 2b loan",257
"nursing continuing education programs",257
"continuing education mortgage lending 101 26 102",256
"continuing education new york professional engineer",256
"continuing education professional engineer texas",256
"continuing education schools for appraisers",256
"continuing medical education florida",256
"langley continuing education",256
"nurse practitioner continuing education 2b free",256
"online cme free continuing medical education",256
"sc dss continuing education workshops",256
"wisconsin nursing continuing education",256
"continuing education for texas mortgage brokers",255
"continuing education online psychology",255
"continuing medical education business",255
"continuing professional education effective writing",255
"continuing education for paramedics online",254
"continuing education for professional engineers",254
"court reporter continuing education",254
"duke continuing education",254
"mandatory continuing legal education credit",254
"real estate continuing education in michigan",254
"continuing education manchester history courses adult",253
"continuing teacher education courses",253
"cosmetology continuing professional education",253
"faulkner state college fairhope continuing education",253
"florida aapa continuing education",253
"free social work continuing education units",253
"nremt continuing medical education",253
"paralegal continuing education legal seattle",253
"pharmacist continuing medical education",253
"sydney university continuing education",253
"vancouver school board adult continuing education",253
"continuing courses education dot net",252
"continuing education computer programming",252
"continuing education for respiratory therapy",252
"continuing medical education live courses",252
"diabetes and continuing education",252
"montclair state college continuing education",252
"new westminster school board adult continuing education",252
"online fetal monitoring continuing education",252
"osteopathy 2b continuing medical education",252
"professional engineering continuing education",252
"burnaby school board adult continuing education",251
"cle continuing legal education ethics",251
"continuing education courses for occupational therapist",251
"continuing education for life insurance",251
"continuing education units for nurses",251
"continuing medical education whistler bc toronto",251
"continuing paralegal education",251
"mc continuing medical education programmed",251
"nursing professionalism continuing education",251
"respiratory therapy2bfree continuing education",251
"utah continuing education",251
"chiropractor class continuing education online",250
"colorado continuing education",250
"continuing education texarkana college",250
"continuing legal education society",250
"dental implants continuing education",250
"pharmacology continuing education for nurse practitioners",250
"streaming continuing professional education",250
"cme conference continuing education medical",249
"collin county continuing education community college",249
"continuing contractor education online",249
"continuing education haywood community college",249
"continuing medical education cme",249
"continuing medical education europe",249
"history texas teacher continuing professional education",249
"college fullfilling cosmetology continuing education courses",248
"continuing education colorado",248
"continuing education yvonne chadwick",248
"continuing medical education pittsburgh",248
"health care continuing education 2005",248
"nurse home study continuing education",248
"occupational therapy continuing education course",248
"pharmacy continuing education seminar",248
"philadelphia continuing medical education",248
"standford continuing education certificate programs",248
"continuing education course medical ekg",247
"continuing education for life insurance in wisconsin",247
"cosmetology continuing education online",247
"hamilton township adult continuing education",247
"medical continuing education conferences",247
"mercy health system continuing medical education",247
"new york state continuing legal education",247
"real estate continuing education arkansas",247
"speaking fees continuing medical education",247
"st ambrose university continuing education",247
"stanford continuing education certificate programs",247
"continuing course education internet type",246
"continuing education and psychologist and sacramento",246
"continuing education iowa",246
"continuing medical education ethics",246
"endowment continuing professional education self study",246
"infection control continuing education on line",246
"north shore continuing education",246
"pharmacy tech continuing education",246
"continuing education certificate programs",245
"continuing education courses2blexington2bkentucky",245
"national teacher continuing education credit standards",245
"mississauga adult continuing education",244
"wisconsin insurance continuing education",244
