keyword, count
"continuing education",2327506
"nursing continuing education",353150
"online continuing education",151859
"continuing medical education",121470
"continuing professional education",111051
"adult continuing education",83255
"continuing education online",76914
"adult and continuing education",55125
"continuing legal education",37346
"chiropractic continuing education",36479
"nurse continuing education",33699
"insurance continuing education",22513
"online nursing continuing education",22358
"nursing continuing education online",20353
"accounting continuing education",16642
"pharmacy continuing education",16141
"continuing education for nurse",15721
"radiology continuing education",15692
"online continuing medical education",12514
"online continuing education courses",11988
"continuing education credits",10073
"continuing+education",10055
"cpa continuing education",8444
"continuing education courses",8333
"continuing education course",8289
"online insurance continuing education",8147
"continuing education credit",7442
"dental continuing education",7280
"continuing education nursing",7120
"continuing education unit",6909
"online continuing legal education",6678
"online continuing education credits",6658
"nursing continuing education credit",6120
"continuing legal education online",5602
"accounting continuing professional education",5339
"continuing education for nurses",5107
"anursing continuing education",4741
"pharmacy technician continuing education",4670
"physical therapy continuing education",4644
"free continuing education",4480
"insurance continuing education course",4473
"benefit continuing education",4344
"continuing education 1",4148
"dental continuing education online",4092
"continuing education for insurance agent",3855
"continuing education units",3840
"continuing nursing education",3558
"continuing education class",3294
"construction continuing education",3243
"nyu continuing education",3196
"continuing education programs",3083
"continuing legal education seminar",3036
"continuing medical education conference",2949
"continuing education toronto",2879
"new york continuing legal education",2875
"continuing education houston",2807
"continuing education for adults",2773
"free nursing continuing education",2768
"pharmacist continuing education",2767
"ems continuing education",2727
"aadult continuing education",2666
"engineering continuing education",2634
"continuing education seminars",2611
"social work continuing education",2561
"nursing continuing education ,",2543
"continuing education in nursing",2461
"cpa continuing professional education",2453
"continuing education on line",2438
"real estate continuing education",2291
"continuing education insurance",2268
"asrt continuing education",2248
"noble continuing education",2150
"continuing education, business school",2076
"free pharmacy continuing education",2019
"ga continuing education",2019
"computer continuing education",2003
"emt continuing education",1965
"continuing education program",1958
"continuing education course online",1921
"online continuing education course",1886
"continuing adult education",1835
"nursing spectrum continuing education",1828
"medical continuing education",1818
"continuing professional education cpas",1810
"adult career and continuing education",1804
"nursing continuing education+,",1789
"center for continuing education",1781
"optometry continuing education",1774
"online continuing education credit",1757
"continuing education grant",1717
"continuing education training",1716
"florida nursing continuing education",1689
"free continuing medical education",1680
"school of continuing education",1673
"nursing continuing education course",1657
"continuing education line",1631
"continuing education loan",1624
"massage continuing education",1604
"free online continuing education",1599
"paralegal continuing education",1590
"nursing continuing education credits",1582
"nursing continuing education courses",1581
"dental hygiene continuing education",1578
"continuing education for nurse k",1545
"adult continuing education program",1535
"nursing continuing education unit",1528
"continuing professional education for accountants",1527
"nursing continuing education california",1515
"continuing professional education cpa",1507
"mandatory continuing legal education",1475
"continuing education division",1454
"teacher continuing education",1437
"continuing education classes",1423
"pharmacist continuing education free",1389
"occupational therapy continuing education",1378
"ohio continuing legal education",1374
"continuing education requirements",1369
"paramedic continuing education",1337
"continuing business education",1313
"harvard medical school continuing education",1310
"continuing dental education",1294
"physical therapy continuing education course",1287
"continuing medical education course",1281
"adult boston continuing education",1279
"adult continuing education online",1254
"edmonton continuing education",1251
"nyc adult and continuing education",1245
"diabetes continuing education",1231
"unm continuing education",1226
"surrey continuing education",1219
"continuing medical education courses",1218
"mammography continuing education",1209
"insurance agent continuing education in charlotte nc",1199
"california continuing legal education",1185
"continuing education nurse",1184
"continuing education florida",1173
"massage therapy continuing education",1165
"continuing nursing education online",1158
"continuing education available",1148
"online continuing education radiologic tech",1147
"anderson continuing education",1144
"continuing education staff",1140
"seeking continuing education",1136
"continuing education seminar",1128
"mandated continuing education",1128
"continuing education grants",1118
"continuing education documentaries",1106
"texas insurance continuing education",1095
"nurse practitioner continuing education",1092
"foster care continuing education online free",1088
"florida continuing education",1079
"adult continuing direction education new",1078
"live pharmacy continuing education",1078
"california continuing education of the bar",1072
"continuing education for nurse online",1068
"georgia continuing education",1062
"houston continuing education",1051
"continuing online teacher education course",1050
"class continuing education online",1046
"massachusetts continuing legal education",1023
"continuing education free insurance online risk",1009
"continuing education free online pharmacy",1003
"legal or law continuing education and las vegas",980
"continuing education worker comp",975
"pennsylvania insurance continuing education",974
"professional continuing education",974
"real estate continuing education online",974
"new york university continuing education",972
"chiropractic continuing education online",971
"veterinary continuing education",970
"health care continuing education",960
"cfp continuing education",959
"continuing pharmacy education",948
"journal of continuing education in nursing",944
"continuing medical education cruises",933
"nursing continuing education hours",931
"pennsylvania continuing legal education",922
"continuing education credit online",920
"florida mortgage broker continuing education",916
"rn continuing education",915
"university of memphis continuing education",905
"california dental continuing education",902
"continuing education for pharmacy technicians",902
"continuing education general business",897
"engineers continuing education",897
"accounting texas continuing education",894
"minnesota continuing legal education",889
"continuing education of the bar",887
"vancouver continuing education",886
"continuing course education insurance online",873
"florida contractor continuing online education",870
"continuing education insurance wisconsin",869
"pharmacy law continuing education",866
"cosmetology continuing education",863
"continuing education online radiology",860
"continuing medical education conferences",854
"professional continuing education online",848
"continuing education online class",839
"registered nurse continuing education",832
"california continuing education",831
"continuing education scholarship",826
"continuing medical education credit",826
"free continuing education credits",822
"continuing education free pharmacy technician",821
"continuing education hours",816
"respiratory therapy continuing education",816
"florida contractors continuing education",815
"dental continuing education course",814
"continuing education in dentistry",813
"continuing education pharmacy",804
"florida contractor continuing education",802
"nyu school of continuing education",802
"continuing education for pharmacy free",798
"continuing education medical",796
"texas continuing education",794
"calgary continuing education",791
"georgia insurance continuing education",788
"continuing education professional tracking",786
"clinical research continuing education",785
"texas continuing legal education",785
"adult 26 continuing education",782
"online continuing education emt",781
"florida insurance continuing education",779
"continuing education association",757
"continuing professional education pharmacy",752
"continuing education new york",751
"free continuing education for pharmacy technician",742
"accounting maine continuing education",741
"coquitlam continuing education",735
"psychology continuing education",732
"free continuing education courses",722
"new mexico emt continuing education",720
"university of toronto continuing education",718
"continuing education free online",716
"continuing education real estate online",715
"pharmacy continuing education cme",713
"why professional continuing education",713
"continuing education calgary",710
"continuing education online austin texas",709
"education continuing education",708
"dental continuing education courses",703
"florida insurance agent continuing education requirements",703
"continuing education los angeles",702
"free continuing education for nurse",701
"loan officer continuing education",700
"continuing education physical therapy",698
"colorado continuing legal education",696
"accreditation council for continuing medical education",694
"continuing education dental",694
"continuing education online physical therapy",693
"virginia continuing legal education",693
"diabetes continuing education pharmacy",691
"smu continuing education",690
"general contractor florida continuing education online",689
"nursing continuing education 2c",689
"continuing education adult education",685
"accounting florida continuing education",684
"creative writing continuing education program",682
"florida continuing legal education",681
"continuing education accounting",677
"vancouver school board continuing education",676
"dentistry continuing education",671
"seattle continuing education",670
"accounting pennsylvania continuing education",662
"constipation pharmacist continuing education",662
"continuing professional education for accountant",653
"kansas continuing legal education",651
"tax continuing education",651
"university of manitoba continuing education",651
"adhd online continuing education courses",648
"continuing education for psychologist",647
"nursing continuing education seminar",644
"continuing legal education colorado",643
"continuing education for opticians",642
"continuing education software",639
"continuing education vocabulary",635
"physical therapy continuing education courses",633
"college of continuing education",632
"employment labor continuing education",631
"continuing dental education online",630
"rn online continuing education",630
"alliance for continuing medical education",629
"continuing education units nurses",626
"continuing education loans",623
"continuing education nurses",621
"free online radiology continuing education points for sc",621
"new jersey institute for continuing legal education",620
"online continuing education for nurse",620
"continuing technical education",619
"dental online continuing education",617
"pharmacy continuing education florida",617
"12 continuing education hours",615
"continuing medical education online",614
"continuing education conferences diabetes",613
"insurance continuing education credit",612
"online pharmacy continuing education",612
"george brown college continuing education",609
"mandatory continuing education",608
"continuing music education study abroad in greece",606
"medical continuing education seminars",603
"bellevue community college continuing education",602
"continuing education free pharmacy tech",601
"continuing education university",599
"free continuing education for nu",595
"insurance continuing education florida",595
"continuing education unit online",587
"missouri continuing education insurance",584
"continuing education certification",583
"accounting michigan continuing education",582
"continuing education for teachers",582
"san diego continuing education",579
"florida professional engineer continuing education",576
"rockhurst university continuing education center",574
"continuing education insurance license",565
"nc insurance continuing education",560
"pharmacist live continuing education",554
"minnesota state board of continuing legal education",553
"byu continuing education",552
"nursing continuing education course online",551
"institute of continuing legal education",550
"pharmacist continuing education online",548
"nursing continuing education online pharmacology",547
"american association for adult and continuing education",546
"continuing education pharmacy tech",545
"boston university continuing education",544
"continuing adult education nj",544
"continuing distant education",544
"university of winnipeg continuing education",544
"continuing adult education scholarship",543
"continuing education for pharmacists",542
"georgia center for continuing education",542
"sheridan college continuing education",540
"continuing education human resource",534
"accounting ohio continuing education",532
"ryerson continuing education",531
"continuing credit education free nursing",530
"attorney continuing education",524
"continuing education free nursing unit",522
"conference continuing education nursing",521
"florida electrical contractor continuing education",521
"legal continuing education",519
"continuing education inc",514
"accredited continuing legal education",512
"continuing medical education seminars",512
"programs and continuing education",512
"accountants continuing education",511
"university of calgary continuing education",509
"nursing risk management continuing education",507
"continuing education legal",506
"free nursing continuing education online",504
"class continuing education nursing",500
"healthcare continuing education",499
"california insurance continuing education",496
"university of houston continuing education",496
"college continuing education georgia perimeter",495
"physical therapy online continuing education courses",495
"continuing law education",494
"medical continuing education seminar",493
"nursing home administrator continuing education",492
"continuing course education free nursing",490
"colorado continuing education insurance",489
"continuing education edmonton",489
"adult+continuing+education",488
"adult continuing education office",486
"radiology continuing medical education",483
"aia continuing education",481
"training and continuing education",481
"accredited ems continuing education",476
"online dental continuing education",475
"tennessee continuing legal education",471
"xray continuing education free",471
"continuing medical education seminar",470
"ca continuing education insurance",469
"continuing education insurance iowa",469
"occupational therapy and continuing education",468
"ohio insurance continuing education",468
"kennesaw state university continuing education",466
"online courses continuing education medicare reimbursement",465
"online continuing education occupational therapy",462
"mental health continuing education",459
"physician continuing medical education",459
"real estate continuing education course",459
"rice university continuing education",459
"adult college continuing education scholarship",458
"florida general contractor continuing education",457
"minnesota board of continuing legal education",457
"nursing continuing education online courses",454
"university of washington continuing education",453
"continuing education insurance oklahoma",448
"continuing education psychology",443
"accounting illinois continuing education",442
"california continuing education bar",442
"free grant money for online continuing education courses",441
"pediatric continuing medical education",441
"insurance license continuing education",440
"continuing legal education new york",437
"university of colorado continuing education",434
"adult and continuing education bc",433
"appraiser continuing education",433
"western school nursing continuing education online courses",429
"massage therapy online continuing education",427
"nursing continuing education on line",427
"online continuing education for emts",427
"continuing education occupational therapy",426
"columbia university continuing education",425
"continuing course education estate real",425
"nurses online continuing education courses",425
"continuing education onlin",422
"continuing legal education california",421
"continuing teacher education",421
"continuing education insurance virginia",420
"continuing medical education conferences seminars",420
"continuing profesional education",420
"online continuing education courses for physical therapists",420
"online continuing education online",420
"university of kansas continuing education",420
"california continuing legal education seminars",419
"continuing education course for nurse",419
"university of western ontario continuing education",419
"cme continuing medical education",418
"continuing education for dental",418
"university of utah continuing education",418
"new york university school of continuing education",416
"ohio nursing continuing education",416
"continuing education for private investigators",414
"history of continuing education",414
"nurses online continuing education",413
"online massage continuing education",409
"broker dealer continuing education",404
"continuing education insurance texas",404
"bioterrorism continuing education",403
"continuing education and nursing",403
"continuing education online courses",403
"university of akron continuing education",402
"continuing education medical online training",401
"continuing education unit ohio",401
"illinois institute for continuing legal education",400
"continuing education for massage therapy",399
"continuing education medicare reimbursement",397
"ems continuing education credits",397
"university of san diego continuing education",397
"university of wisconsin continuing education",396
"continuing education health care",395
"mount royal college continuing education",395
"compendium of continuing education in dentistry",394
"online clu continuing education",394
"online continuing education nursing",394
"continuing education online social work",393
"continuing professional education accountant",391
"cosmetology continuing education courses",391
"nursing continuing education units",391
"continuing education unit for nurse",390
"continuing education online university",389
"pharmacists continuing education credits",389
"continuing education tennessee real estate courses",387
"continuing medical education software",387
"north carolina real estate continuing education courses",387
"grants for continuing education",385
"central california school of continuing education",384
"continuing medical education program",384
"online continuing education for respiratory therapists",384
"continuing cpa education",383
"college scholarship adult continuing education",381
"boston continuing adult education",380
"continuing education coquitlam",380
"continuing education for stone massage fl",380
"nursing and continuing education",380
"boston continuing education",379
"louisiana real estate commission continuing education 2004",379
"medical malpractice and continuing medical education",379
"michigan real estate continuing education",379
"anesthesia continuing education",377
"continuing education courses for insurance",377
"continuing education for psychologists",377
"banking continuing education",376
"nurses continuing education",375
"tennessee real estate continuing education",375
"athletic training continuing education",372
"fanshawe college continuing education",371
"real estate continuing education courses",371
"continuing education for physical therapist",370
"hawaii real estate continuing education",370
"ohio state continuing education",370
"university of south alabama continuing education",370
"advantages of continuing education",369
"continuing+education+online",369
"nj continuing education programs",369
"continuing education physical therapist",367
"indiana continuing legal education",366
"north carolina continuing legal education",366
"continuing education in mammography",365
"continuing education pharmacists",364
"missouri continuing legal education",363
"mortgage broker continuing education washington state",362
"radiology continuing education credits",362
"continuing education courses for nurses",360
"online continuing education physical therapy",359
"continuing education dental hygiene",358
"continuing education insurance louisiana",358
"free radiologic technology continuing education credits",358
"california continuing education nursing",356
"radiologic technology continuing education",355
"continuing education credit for nurse",354
"continuing education insurance life",354
"continuing education real estate",354
"dean of continuing education",354
"illinois real estate continuing education",353
"online funeral service continuing education",352
"continuing education for registered nurses",347
"online continuing education for teacher",346
"phlebotomy continuing education",345
"continuing education center",344
"insurance continuing education courses",344
"systems engineering courses online continuing education",344
"continuing education dallas",343
"insurance virginia online continuing education",341
"live continuing education pharmacist",341
"ceu nursing continuing education",339
"illinois continuing legal education",339
"ohio health insurance online continuing education",339
"pharmacy continuing education diabetes",339
"university online continuing education",339
"continuing education law enforcement",338
"free continuing education credit",338
"life insurance continuing education",338
"online+continuing+education",338
"psychology continuing education distance learning",338
"continuing contractor education florida online",337
"continuing education insurance nc",337
"continuing education pharmacist",337
"online legal continuing education",337
"nursing professional continuing education",336
"professional continuing education tips",336
"florida optician continuing education",335
"university continuing education",335
"continuing legal education cle seminar",334
"abc insurance continuing education",333
"akron ohio insurance continuing education",333
"continuing education+",333
"continuing education florida insurance",333
"online continuing education physical therapist",333
"continuing education nursing free",332
"georgia continuing legal education",332
"georgia real estate appraiser continuing education",332
"abo continuing education hours online",331
"continuing education nursing pediatric",331
"baruch college continuing education",330
"concordia continuing education university",330
"continuing education guide",330
"continuing education insurance nj title",330
"government continuing education",329
"continuing education university of toronto",328
"dental implant continuing education",328
"nursing continuing education cruise",328
"online continuing education credit for occupational therapy",328
"pennsylvania bar continuing legal education",328
"ceu online nursing continuing education",327
"continuing education online professional",327
"continuing education ottawa",327
"continuing professional education 1968",327
"harvard medical school department of continuing education",327
"veterinary medicine continuing education",326
"florida engineering continuing education",325
"international association for continuing education and",325
"online certificate free course continuing education excel",325
"continuing education for mammograms",324
"continuing education in art schools",324
"continuing education medical professional",324
"continuing education nursing program",324
"ryerson university continuing education",324
"continuing education for dietitians",323
"continuing education indiana insurance",323
"free radiology continuing education",323
"minnesota continuing education real estate online",323
"ceu contact online nursing continuing education",321
"continuing education accounting web casts",321
"continuing education courses for teachers online",321
"continuing education law",321
"lawyer continuing education",321
"nurses and continuing education",321
"ca insurance continuing education",320
"concordia continuing education",320
"dental hygiene continuing education courses",320
"education continuing",320
"humber college continuing education",320
"online continuing education rdh",319
"continuing course dental education hygiene",318
"continuing education scholarships",318
"hunter college continuing education",318
"real estate continuing education courses richmond virginia",318
"social workers continuing education",318
"what is continuing education",318
"ohio continuing education real estate",317
"insurance 2b continuing education",316
"ubc continuing medical education",315
"livneh continuing professional education",314
"north carolina continuing education",314
"north carolina insurance continuing education",314
"radiology continuing education arizona",314
"continuing education online occupational therapy",313
