"discount prices on stanley furniture",398
"discount prices online furniture",1286
"discount prices patio furniture",244
"discount pulaski furniture",439
"discount quality furniture",206
"discount quality leather furniture",167
"discount ralph lauren furniture",225
"discount rattan furniture",2357
"discount rattan patio furniture",291
"discount rattan wicker furniture",1361
"discount ready to assemble furniture",285
"discount real wood bedroom furniture",220
"discount refurbish office furniture",693
"discount resin patio furniture",439
"discount restaurant furniture",131
"discount retro furniture",1822
"discount rowe furniture",1142
"discount rustic furniture",917
"discount rv furniture",478
"discount salon furniture",353
"discount samsonite patio furniture",249
"discount san antonio furniture store",231
"discount san marcos texas best furniture store",231
"discount sauder furniture",3064
"discount scandinavian furniture",320
"discount scandinavian reclining furniture",261
"discount school furniture",801
"discount sealy leather furniture",150
"discount shopping furniture stores in mcallen texas",228
"discount small kitchen furniture",246
"discount solid oak furniture",252
"discount southwest furniture",253
"discount stanley furniture",1876
"discount stickley furniture",1531
"discount sunroom furniture",130
"discount supplies brisbane buy office furniture",197
"discount teak furniture",3825
"discount teak garden furniture",277
"discount teak outdoor furniture",2761
"discount teak patio furniture",559
"discount teen furniture",275
"discount teen vinyl furniture",255
"discount thomasville furniture",2379
"discount thomasville nantucket furniture",239
"discount toscana on line store catalog home decor furniture",212
"discount unfinished furniture",6840
"discount unfinished furniture store houston",226
"discount unfinished wood furniture",236
"discount used furniture",183
"discount used furniture san jose",230
"discount used office furniture",376
"discount used office furniture california",247
"discount victorian dollhouse furniture",253
"discount warehouse furniture",348
"discount warehouses for furniture",289
"discount west indies furniture",240
"discount white kitchen furniture",261
"discount wicker furniture",10734
"discount wicker furniture online",335
"discount wicker furniture sale",249
"discount wicker patio furniture",1843
"discount wood bedroom furniture",294
"discount wood computer furniture",242
"discount wood furniture",619
"discount wood office furniture",396
"discount wood patio furniture",509
"discount wooden patio furniture",384
"discount wrought iron furniture",402
"discount wrought iron patio furniture",202
"discount youth bedroom furniture",287
"discount youth furniture",1896
"discount+furniture",1087
"discount+office+furniture",2729
"discounted prices discount bedroom furniture",230
"ethan allen discount furniture",234
"ethan allen furniture discount",1423
"european furniture discount",1034
"factory discount patio furniture",233
"family furniture discount center",303
"family furniture discount centers",144
"find thomasville furniture at discount prices",211
"florida discount furniture",281
"florida discount furniture stores",252
"french country furniture discount",118
"funky eclectic furniture discount",352
"furniture 2b discount",234
"furniture and discount",8352
"furniture and hotel and discount and store",308
"furniture and online and discount",418
"furniture at discount prices",232
"furniture bizchair discount office chair",272
"furniture computer work stations discount",238
"furniture dining room direct discount rectangle drop leaf",312
"furniture discount",54038
"furniture discount broyhill fontana",570
"furniture discount cat ranch",280
"furniture discount center",110
"furniture discount lazy boy",355
"furniture discount office",591
"furniture discount office supplies",200
"furniture discount online",4285
"furniture discount outlet",1098
"furniture discount quality restorations",250
"furniture discount south carolina",215
"furniture discount store",223
"furniture discount store lafayette louisiana",261
"furniture discount stores",1153
"furniture discount stores and hampton",235
"furniture discount stores and newport news",227
"furniture discount stores and va",407
"furniture discount texas",244
"furniture discount texas store",114
"furniture discount thomasville",265
"furniture discount warehouse",944
"furniture discount warehouse-leicester",271
"furniture discount white",759
"furniture entertainment discount",114
"furniture gautier bedroom discount lingerie chest",239
"furniture kitchen table and chairs discount",259
"furniture leather discount",194
"furniture on line discount ottoman",337
"furniture online discount",1715
"furniture online discount order",1272
"furniture outlet discount new york",242
"furniture philadelphia discount shopping",224
"furniture shopping discount north carolina",297
"furniture store discount",110
"furniture stores discount il",388
"furniture top of the line discount",715
"furniture warehouse discount living room sets",292
"gallery north carolina discount furniture",347
"garden furniture discount cedar benches",285
"gergia discount furniture stores",236
"grand discount furniture",359
"grand discount furniture stores va",256
"grand furniture discount store",266
"guaranteed lowest discount cat furniture",257
"hand painted furniture discount",322
"hank27s discount fine furniture",244
"hank27s discount fine furniture russellville arkansas",255
"hanks discount fine furniture",474
"hanks discount furniture",296
"hansen patio furniture discount",125
"harden furniture discount",1189
"haverty27s discount furniture store",245
"haverty27s discount furniture store in georgia",223
"henkel harris furniture discount",233
"henredon discount furniture",600
"henredon discount ralph lauren furniture",227
"high point discount furniture",451
"home furniture discount",1093
"home office furniture discount",555
"home theater furniture discount",1923
"hooker furniture discount",698
"house discount american furniture liquidation",253
"houston discount furniture",499
"houston discount office furniture",664
"indiana discount furniture",762
"jacksonville florida discount wood bedroom furniture",232
"japanese bedroom furniture discount cheap",136
"jessica mcclintock antique white furniture discount",254
"kids bedroom discount childrens furniture",315
"kids bedroom furniture discount",329
"kids discount furniture",2745
"kids furniture discount",327
"kincaid discount furniture",465
"kincaid discount furniture dealers",343
"kincaid furniture discount",261
"kincaid furniture discount california",237
"kincaid william lenoir discount furniture",331
"kitchen furniture discount",605
"kitchens appliances discount furniture",156
"kits discount dollhouse furniture",245
"klaussner furniture discount",257
"la z boy discount furniture stores",231
"lane discount furniture",389
"lane furniture discount",123
"large cat furniture discount cat furniture cat furniture",284
"large cat furniture discount cat furniture large cat",230
"las vegas discount furniture",115
"lawn furniture discount",3234
"lazy boy discount furniture",591
"leather furniture deep discount",429
"leather furniture discount",986
"leather furniture discount international",221
"legacy furniture cameo discount",349
"lexington furniture discount",213
"living room discount furniture",580
"living room discount furniture in las vegas",359
"living room discount furniture staten island",1643
"living room discount furniture yonkers",324
"living room furniture and discount",646
"living room furniture for sale discount",332
"louisiana discount furniture",117
"louisiana discount unfinished furniture",234
"lowest prices discount leather furniture",234
"ma furniture berkline recliner discount or bargain or sale",321
"macys furniture discount coupon",2503
"magnussen bathroom furniture discount",245
"marks 26 spencer haydock furniture discount",242
"mission furniture discount",1062
"mission oak discount furniture",262
"mission style discount bedroom furniture",227
"modern contemporary discount furniture",147
"modern contemporary in stock discount furniture",168
"modern discount furniture",441
"modern furniture at discount prices",212
"my bobs discount furniture",270
"nashville discount oak furniture entertainment center",272
"nationwide discount furniture store",247
"nc discount furniture",2488
"nc furniture discount",1970
"new jersey discount furniture",416
"new jersey discount furniture stores",321
"new york and discount and furniture",230
"nj discount furniture stores",431
"north california bathroom furniture discount",241
"north carolina discount bedroom furniture",160
"north carolina discount flexsteel furniture",226
"north carolina discount furniture",5910
"north carolina discount furniture outlet",219
"north carolina discount furniture outlets",159
"north carolina discount furniture shopping guide",234
"north carolina discount furniture store",484
"north carolina discount furniture stores",632
"north carolina discount pennsylvania house furniture",253
"north carolina discount stanley furniture",271
"north carolina furniture discount",3348
"north carolina furniture discount century",249
"north carolina furniture discount outlet",544
"north carolina furniture discount outlets",280
"north carolina furniture discount stores",404
"north carolina office furniture discount",253
"o27sullivan discount furniture",365
"oak furniture discount",385
"office furniture discount",2379
"office furniture discount sale",254
"ofs office furniture discount",498
"oklahoma city discount furniture",275
"oklahoma discount furniture",3275
"oklahoma discount furniture stores",426
"online discount baby furniture",285
"online discount furniture",14155
"online discount furniture free shipping",364
"online discount furniture store",197
"online discount furniture stores",932
"online discount furniture warehouse",500
"online discount loft furniture",756
"online furniture discount",1142
"online stores ashley discount furniture",303
"osullivan furniture discount",191
"outdoor furniture deep discount",307
"outdoor furniture discount",809
"outdoor patio furniture discount",425
"outlet discount youth bedroom furniture",226
"parafield discount city furniture",251
"patio and deck furniture at discount prices",210
"patio furniture and discount",770
"patio furniture covers2c discount",226
"patio furniture discount",3049
"patio furniture discount prices",238
"patio iron furniture discount",111
"patio outdoor furniture discount",1113
"pennsylvania house furniture discount",307
"philadelphia discount baby furniture stores",319
"philadelphia discount furniture",431
"pottery barn discount furniture",130
"preschool discount furniture",201
"prices discount furniture stores montreal",280
"prices hank27s discount fine furniture russellville arkansas",231
"quality country furniture discount",331
"quality discount bedroom furniture",230
"quality discount furniture",1670
"raleigh discount furniture stores",316
"raleigh nc discount furniture stores",341
"ralph lauren furniture discount",248
"reproduction furniture wholesale discount pennsylvania",216
"riverside discount office furniture",341
"roberts discount furniture",268
"rowe furniture discount",1054
"sales discount furniture stores",257
"san diego discount furniture",1186
"san francisco discount furniture store",255
"school furniture discount",246
"sculpted cat furniture discount cat furniture cat furniture",140
"sectional furniture discount",294
"sectional used discount furniture",209
"shaker style discount bedroom furniture",226
"sherrill furniture discount",267
"sherrill leather furniture discount",241
"shopping discount furniture",226
"simply discount furniture",684
"sofa beds and discount furniture for sale",218
"sofas discount flexsteel furniture",232
"south carolina discount furniture",420
"southern discount furniture",490
"st paul2c mn discount furniture",257
"stanley discount furniture",1130
"stanley furniture discount",1298
"star discount furniture",386
"stickley furniture at discount prices",310
"stickley furniture discount",1145
"storage furniture discount",607
"store discount furniture",411
"stores discount furniture in kansas city missouri",288
"stores discount furniture portland maine",258
"stores discount kincade furniture",254
"sydney discount furniture",1008
"teak discount patio furniture",711
"teak furniture discount",235
"tec discount furniture",594
"texas discount furniture",1864
"texas discount furniture at austin",704
"thomasville discount furniture",1631
"thomasville furniture at discount prices",239
"thomasville furniture bogart collection discount prices",224
"thomasville furniture discount",1182
"thomasville furniture discount prices",255
"thomasville furniture farm table buy discount",250
"thomasville furniture online discount",1043
"thomasville furniture sofas chairs discount prices",235
"thomasville furniture the bogart collection discount",214
"thomasville urban retreat furniture buy discount",240
"tommy bahama discount furniture",483
"town country discount furniture",129
"victorian discount furniture",322
"virginia furniture discount stores in nc",238
"warehouse discount bedroom furniture manufacturers",252
"warehouse discount furniture",224
"warehouse furniture discount club in mn",207
"western discount furniture",246
"where can i buy flexsteel furniture at a discount",197
"where can i buy hanamint patio furniture at a discount",625
"where to find lazy boy discount furniture in dallas texas",882
"wholesale and furniture and cheap and discount and hotels",258
"wholesale discount american furniture liquidation",219
"wholesale discount furniture",1384
"wholesale discount leather furniture",233
"wholesale discount patio outdoor furniture",695
"wholesale furniture with to the trade discount",241
"wicker discount patio furniture",231
"wicker furniture discount",589
"wicker outdoor furniture discount",130
"winston patio furniture discount",218
"wood furniture discount stores",261
"wrought iron discount patio furniture",262
