"al27s discount furniture",363
"albuquerque furniture warehouse discount",246
"als discount furniture",458
"aluminum cast discount furniture patio",127
"aluminum patio furniture discount",348
"american drew discount furniture",558
"american drew furniture discount",252
"amish discount furniture",1002
"amish discount oak furniture",347
"amish furniture discount",289
"angeles discount furniture los store",155
"arizona discount furniture",151
"arts and crafts furniture discount",184
"ashley discount furniture",1308
"ashley furniture discount",482
"ashley furniture discount and signature",320
"asian discount furniture",127
"asian furniture discount",1037
"atlanta discount furniture",937
"atlanta discount furniture store",114
"austin discount furniture",579
"austin texas discount furniture",130
"baby crib furniture sale discount buy",261
"baby discount furniture",686
"baby discount furniture store",234
"baby furniture and decorating discount table",271
"baby furniture and discount",619
"baby furniture discount",3053
"baker furniture discount",1169
"bamboo discount furniture",207
"barn discount furniture pottery",177
"bassett bedroom furniture discount",936
"bassett discount furniture",146
"bassett furniture discount",332
"bedding sets furniture store discount pali baby crib",249
"bedroom broyhill discount furniture",533
"bedroom discount furniture",1308
"bedroom discount furniture kid",300
"bedroom discount furniture modern",165
"bedroom discount furniture price",125
"bedroom discount furniture rattan wicker",117
"bedroom discount furniture store",161
"bedroom discount furniture wood",208
"bedroom furniture at a discount",407
"bedroom furniture discount",1461
"bedroom furniture discount nc",657
"bedroom furniture discount north carolina furniture",237
"bedroom furniture discount store",117
"bedroom furniture discount white",264
"bedroom furniture sets for discount prices",221
"bernhardt furniture discount",2739
"bernie and phils discount furniture",1238
"bernie and phils discount furniture kitchen islands",113
"bernie and phils discount furniture store",687
"bernie and phils discount furniture storews",242
"bernie and phyls discount furniture",498
"bernie phils discount furniture store",141
"best of the web discount furniture",226
"bob ''''s discount furniture",828
"bob connecticut discount furniture",145
"bob ct discount furniture",114
"bob discount furniture",6475
"bob discount furniture ma",110
"bob discount furniture store",1200
"bob s discount furniture",1390
"bob''''s discount furniture",2176
"bob''''s discount furniture store",127
"bob''''s discount furniture stores",372
"bob27s discount furniture",586
"bob27s discount furniture connecticut",750
"bob27s discount furniture store in ma",235
"bob27s discount furniture stores",247
"bobs discount furniture",30275
"bobs discount furniture ct",219
"bobs discount furniture employment",110
"bobs discount furniture ma",293
"bobs discount furniture maine",191
"bobs discount furniture massachusetts",225
"bobs discount furniture store",1628
"bobs discount furniture store massachusetts",107
"bobs discount furniture stores",423
"bobs discount furniture stores in",270
"bobs furniture discount",293
"bookshelves furniture nj discount",242
"boots furniture discount leather",237
"boston discount furniture",248
"bradington young discount furniture",269
"brand name discount furniture",244
"brand name furniture discount",741
"brevard nc discount furniture",550
"brown discount furniture jordan patio",129
"brown jordan discount patio furniture",231
"brown jordan2c discount patio furniture",223
"broyhill discount bedroom furniture",632
"broyhill discount fontana furniture",244
"broyhill discount furniture",1553
"broyhill furniture at a discount",203
"broyhill furniture discount",1816
"broyhill furniture discount online",854
"broyhill north carolina furniture discount",229
"broyhill sofas discount furniture",222
"bush furniture discount",251
"butcher block discount kitchen furniture",253
"buy ashley furniture discount",231
"buy bassett furniture discount",178
"buy discount furniture",201
"buy discount furniture online",540
"buy discount martha stuart patio furniture",250
"buy discount office furniture",161
"buy discount wrought iron patio furniture online",450
"california discount furniture",317
"california discount import furniture",1014
"carolina discount furniture",10802
"carolina discount furniture in north store",261
"carolina furniture discount",113
"castelle patio furniture discount prices",253
"cat furniture cat furniture discount cat furniture",108
"cat furniture discount",112
"cat furniture discount cat furniture cat furniture",132
"cd dvd storage cheap clearance discount furniture",274
"cedar discount furniture patio teak",117
"center discount entertainment furniture",253
"century furniture discount 27century furniture27",251
"chairs discount patio furniture",233
"chaise discount modern furniture",238
"chaise lounge discount furniture",246
"cheap discount cat furniture",271
"cheap discount furniture",182
"chicago discount american furniture liquidation",2124
"chicago discount furniture",1771
"child discount bedroom furniture",169
"children27s discount furniture",320
"childrens discount furniture",223
"childrens discount white bedroom furniture",227
"city discount furniture oklahoma",109
"clearance discount furniture bay city saginaw michigan",263
"computer desks discount office furniture",212
"computer furniture discount",375
"contemporary discount furniture",706
"contemporary discount furniture office",139
"contemporary furniture discount",1011
"contemporary furniture discount modern",409
"contemporary office furniture discount",357
"corner desk discount computer furniture",585
"cover discount furniture patio",197
"crib furniture discount cheap baby diapers",367
"cushion discount furniture patio",152
"dallas discount furniture",1098
"dallas discount furniture office",133
"dave ''''s discount furniture",108
"daves discount furniture",547
"day bed discount furniture",228
"daycare furniture discount",238
"deep discount bedroom furniture",137
"deep discount furniture",285
"designer bedroom furniture clearance and discount sites",209
"designer discount furniture",260
"desk discount furniture office",198
"dining room furniture discount",215
"direct discount furniture oklahoma",233
"discount 2b online 2b furniture",1127
"discount allen white furniture",267
"discount aluminum high back patio furniture",231
"discount aluminum patio furniture",815
"discount american drew furniture",264
"discount american furniture liquidation",1041
"discount amish furniture",494
"discount antique furniture",1029
"discount ashley furniture",1836
"discount asian furniture",1231
"discount baby and cribs and furniture",242
"discount baby furniture",17923
"discount baby furniture 26 bedding",250
"discount baby furniture items",318
"discount baby furniture order",245
"discount baby furniture philadelphia",292
"discount baby furniture stores philadelphia",297
"discount baby nursery furniture",427
"discount baby room furniture",152
"discount baker furniture",1074
"discount bamboo furniture",365
"discount bar furniture",635
"discount basketweave patio furniture 7",212
"discount bassett furniture",1188
"discount bathroom furniture",793
"discount beauty salon furniture",144
"discount bed furniture",309
"discount bed kids furniture",228
"discount bed room furniture",120
"discount bedroom furniture",42693
"discount bedroom furniture canopy",233
"discount bedroom furniture direct",234
"discount bedroom furniture free shipping",126
"discount bedroom furniture in denver",209
"discount bedroom furniture in melbourne florida",219
"discount bedroom furniture kid",913
"discount bedroom furniture kids",1249
"discount bedroom furniture manufacturers",272
"discount bedroom furniture online",3808
"discount bedroom furniture set",847
"discount bedroom furniture set platform",244
"discount bedroom furniture sets",416
"discount bedroom furniture uk",256
"discount bedroom suite furniture set",215
"discount berg furniture",428
"discount bernhardt furniture",1012
"discount brand furniture outlets",216
"discount bronze finish patio furniture",235
"discount broyhill attic heirloom furniture",333
"discount broyhill attic heirlooms furniture",334
"discount broyhill furniture",3550
"discount broyhill furniture dealers in pa",320
"discount broyhill heirloom furniture",335
"discount bush furniture",302
"discount buy furniture lexington",251
"discount cast aluminum patio furniture",374
"discount casual pool and patio furniture",208
"discount cat furniture",3907
"discount cat furniture cat furniture cat furniture",134
"discount cat furniture cat furniture discount cat furniture",120
"discount cat furniture cat furniture discounters.com",182
"discount cat furniture discount cat furniture cat",161
"discount cat furniture discount cat furniture cat furniture",112
"discount cat furniture discount cat furniture disc",176
"discount cat furniture discount cat furniture discount cat",132
"discount cat furniture pagoda",326
"discount cat furniture unique",247
"discount century brand furniture",236
"discount century furniture",1029
"discount cheap furniture",618
"discount cheap furniture stores on line",249
"discount cherry bookcase display furniture",256
"discount cherry office furniture",254
"discount child bedroom furniture",784
"discount child craft furniture",700
"discount child furniture",3227
"discount child''''s bedroom furniture",126
"discount childcraft nursery furniture",252
"discount children bedroom furniture",124
"discount children furniture",360
"discount children''''s bedroom furniture",189
"discount children''''s furniture",120
"discount children27s bedroom furniture",252
"discount children27s furniture",1178
"discount childrens bedroom furniture",457
"discount childrens furniture",1947
"discount childrens furniture wood storage",519
"discount childs bedroom furniture",151
"discount clearance baby furniture",238
"discount cochrane furniture",269
"discount computer desks home office furniture",281
"discount computer desks modular office furniture",210
"discount computer furniture",4104
"discount contemporary bedroom furniture",725
"discount contemporary furniture",11855
"discount contemporary furniture uk",412
"discount contemporary italian style furniture",294
"discount cottage furniture",161
"discount cottage white furniture",262
"discount country cottage dining room furniture",301
"discount country french furniture",247
"discount country furniture",201
"discount coupons for home office furniture",247
"discount coupons office max furniture",264
"discount dark walnut office furniture",268
"discount day care furniture",263
"discount deck furniture",2005
"discount deck furniture 26 accessories",221
"discount deco bedroom furniture",174
"discount designer bedroom furniture",273
"discount designer furniture",1616
"discount designer furniture australia",235
"discount dinec brand dining room furniture",299
"discount dining furniture",1877
"discount dining room furniture",4030
"discount dining room furniture atlanta ga",314
"discount diningroom furniture",1061
"discount dinning room furniture",389
"discount direct furniture",1020
"discount doll house furniture",163
"discount dollhouse furniture",351
"discount drexel heritage furniture",259
"discount entertainment center furniture",424
"discount equipale furniture",675
"discount ethan allen furniture",681
"discount euro furniture",878
"discount european furniture",1013
"discount find furniture",986
"discount fine executive furniture",253
"discount fine furniture",480
"discount fine furniture design and marketing",219
"discount fine furniture hanks",283
"discount fine furniture store",227
"discount fine office furniture",323
"discount fitted bedroom furniture",269
"discount flexsteel furniture",337
"discount free furniture shipping",341
"discount french country furniture",281
"discount french furniture",244
"discount furniture",2891663
"discount furniture 2b best price",249
"discount furniture 2b new jersey",250
"discount furniture accessories",240
"discount furniture alberta",247
"discount furniture and appliance store",210
"discount furniture and houston2c texas",237
"discount furniture and interiors design books",329
"discount furniture antique reproductions",257
"discount furniture arizona",123
"discount furniture armchairs",249
"discount furniture armless loveseat",230
"discount furniture atlanta",1835
"discount furniture austin",192
"discount furniture austin texas",287
"discount furniture bassett",730
"discount furniture bedroom",827
"discount furniture broyhill",3054
"discount furniture buckhead atlanta",397
"discount furniture buy online",16448
"discount furniture california",615
"discount furniture catalog",1115
"discount furniture chicago",371
"discount furniture chicago il",117
"discount furniture cincinnati oh",263
"discount furniture city",303
"discount furniture cleveland ohio",151
"discount furniture closeouts dining booths",265
"discount furniture colorado",271
"discount furniture companies",125
"discount furniture computer armoire",285
"discount furniture computer desk",355
"discount furniture cover",127
"discount furniture covers",223
"discount furniture curio cabinet white wash",244
"discount furniture dallas",984
"discount furniture dallas texas",116
"discount furniture dc",331
"discount furniture dealers",130
"discount furniture direct",1821
"discount furniture direct order",344
"discount furniture entertainment center",518
"discount furniture entertainment centers",132
"discount furniture factories in north carolina",206
"discount furniture florida",1705
"discount furniture for sale",144
"discount furniture free shipping",421
"discount furniture from north carolina",510
"discount furniture georgia",277
"discount furniture greensboro nc",484
"discount furniture hardware",1170
"discount furniture henkle harris",269
"discount furniture high point",265
"discount furniture high point north carolina",232
"discount furniture home office",209
"discount furniture house pennsylvania",107
"discount furniture houston",781
"discount furniture houston texas",241
"discount furniture houston tx",179
"discount furniture in alabama",247
"discount furniture in arizona",621
"discount furniture in atlanta",144
"discount furniture in austin",294
"discount furniture in connecticut",189
"discount furniture in florida",936
"discount furniture in forney texas",245
"discount furniture in georgia",1064
"discount furniture in houston",210
"discount furniture in houston2c texas",233
"discount furniture in los angeles",108
"discount furniture in massachusetts",125
"discount furniture in michigan",296
"discount furniture in milwaukee",236
"discount furniture in missouri",1163
"discount furniture in nashville2c tennessee",234
"discount furniture in nc",147
"discount furniture in north carolina",1254
"discount furniture in ny",1145
"discount furniture in oklahoma city",246
"discount furniture in sacramento",259
"discount furniture in st louis mo",422
"discount furniture in sunnyvale california",871
"discount furniture in syracuse ny",866
"discount furniture joliet illinois",938
"discount furniture las vegas",120
"discount furniture leather",151
"discount furniture lexington",341
"discount furniture los angeles",1961
"discount furniture loveseat",259
"discount furniture ma",1199
"discount furniture maine",113
"discount furniture mart",116
"discount furniture mart powell",335
"discount furniture maryland",378
"discount furniture massachusetts",365
"discount furniture mattress",115
"discount furniture melbourne",920
"discount furniture michigan",191
"discount furniture minneapolis",329
"discount furniture minnesota",128
"discount furniture nc",1881
"discount furniture new jersey",420
"discount furniture new york",851
"discount furniture nh",123
"discount furniture nj",233
"discount furniture north carolina",18571
"discount furniture office",1047
"discount furniture office uk",147
"discount furniture office used",162
"discount furniture office wood",165
"discount furniture ohio",356
"discount furniture oklahoma city",372
"discount furniture on line",497
"discount furniture on the web",273
"discount furniture online",33400
"discount furniture online bed",323
"discount furniture online shopping",384
"discount furniture online store",745
"discount furniture orlando",926
"discount furniture outdoor patio",113
"discount furniture outdoor patio wholesale",325
"discount furniture outdoor store",251
"discount furniture outdoor teak",163
"discount furniture outlet",32312
"discount furniture outlets",1223
"discount furniture outlets florida lifestyles",228
"discount furniture outlets in north carolina",222
"discount furniture outlets north carolina",254
"discount furniture outlets stores",251
"discount furniture pa",109
"discount furniture patio",484
"discount furniture patio teak",346
"discount furniture pennsylvania house",229
"discount furniture philadelphia",142
"discount furniture phoenix",752
"discount furniture portland oregon",298
"discount furniture prices teen beds",205
"discount furniture rattan wicker",131
"discount furniture rowe",905
"discount furniture sale",13443
"discount furniture sales",1064
"discount furniture sales 2b vancouver 2c bc",247
"discount furniture salon",134
"discount furniture san diego",110
"discount furniture san francisco",974
"discount furniture san francisco sofa beds",211
"discount furniture seattle",1543
"discount furniture sectional sofa",256
"discount furniture shopping",450
"discount furniture shopping online",653
"discount furniture sleigh bed",237
"discount furniture slip cover",482
"discount furniture slip covers",398
"discount furniture slipcover",187
"discount furniture slipcovers",201
"discount furniture sofa",179
"discount furniture southeast pa",251
"discount furniture store",31445
"discount furniture store atlanta",231
"discount furniture store columbus ohio",258
"discount furniture store fort worth2ctx",258
"discount furniture store in columbus2cohio",264
"discount furniture store in denver",233
"discount furniture store in north carolina",142
"discount furniture store maryland",855
"discount furniture store online",163
"discount furniture store sarasota florida",243
"discount furniture store st louis missouri",259
"discount furniture store st petersberg florida",244
"discount furniture store wilmington delaware",246
"discount furniture stores",10599
"discount furniture stores denver",238
"discount furniture stores florida",267
"discount furniture stores in albuquerque nm",234
"discount furniture stores in arizona",231
"discount furniture stores in atlanta",263
"discount furniture stores in atlanta2c ga",240
"discount furniture stores in ca",379
"discount furniture stores in charlotte north carolina",231
"discount furniture stores in charlotte2cnc",216
"discount furniture stores in columbus ohio",240
"discount furniture stores in dallas",222
"discount furniture stores in florida",610
"discount furniture stores in georgia",216
"discount furniture stores in los angeles",349
"discount furniture stores in louisville kentucky",215
"discount furniture stores in maryland",242
"discount furniture stores in massachusetts",114
"discount furniture stores in minnesota",227
"discount furniture stores in nashville",268
"discount furniture stores in new york city",393
"discount furniture stores in north carolina",600
"discount furniture stores in phoenix2c arizona",239
"discount furniture stores in san diego",223
"discount furniture stores in triad2c nc",233
"discount furniture stores las vegas",349
"discount furniture stores miami florida",256
"discount furniture stores montreal",272
"discount furniture stores new york city",109
"discount furniture stores north carolina",293
"discount furniture stores online",1008
"discount furniture stores portland maine",250
"discount furniture stores raleigh nc",348
"discount furniture stores selling habitat furniture uk",244
"discount furniture stores tampa2c fl",248
"discount furniture stores uk",418
"discount furniture teak",1866
"discount furniture texas",188
"discount furniture tn greenbrier",223
"discount furniture uk",472
"discount furniture unfinished oak",519
"discount furniture upholstery",289
"discount furniture virginia",937
"discount furniture warehouse",14267
"discount furniture warehouse in penna",207
"discount furniture warehouse orlando",639
"discount furniture warehouse raleigh",240
"discount furniture warehouses",389
"discount furniture wholesale",120
"discount furniture wholesale furniture",377
"discount furniture wholesale furniture nc",6604
"discount garden furniture",7118
"discount garden furniture uk",232
"discount henredon furniture",641
"discount hillsdale house furniture",234
"discount home bar furniture",311
"discount home furniture",1490
"discount home furniture in north carolina",202
"discount home furniture online",303
"discount home office furniture",15865
"discount home office furniture denver colorado",272
"discount home theater furniture",378
"discount hooker furniture",1866
"discount hotel furniture",604
"discount hotel furniture in ohio",278
"discount hub furniture stores",247
"discount import furniture",126
"discount italian furniture",1289
"discount kathy ireland dining furniture palace",224
"discount kid bedroom furniture",786
"discount kid furniture",1723
"discount kids bedroom furniture",757
"discount kids bedroom furniture nj",117
"discount kids furniture",2643
"discount kincaid furniture",853
"discount kitchen furniture",3317
"discount kitchen furniture sets in albuquerque nm",251
"discount lane furniture",1761
"discount laneventure furniture",1337
"discount lawn furniture",3969
"discount lazy boy furniture",302
"discount leather furniture",17598
"discount leather furniture in the south",214
"discount leather living room furniture",114
"discount lexington furniture",1301
"discount living room furniture",6887
"discount livingroom furniture",197
"discount log furniture",2326
"discount manufacturers north carolina furniture stores",254
"discount martin furniture",878
"discount mexican furniture",1208
"discount miami office furniture",1005
"discount miniature dollhouse furniture",261
"discount mission furniture",2950
"discount mission style furniture",2316
"discount modern baby furniture",128
"discount modern designer furniture",285
"discount modern furniture",9787
"discount modern furniture bedroom",321
"discount modern italian furniture in houston",284
"discount modular bedroom furniture",233
"discount name brand furniture",461
"discount natuzzi furniture",223
"discount nc furniture",1954
"discount nickel furniture hardware",729
"discount north carolina furniture",763
"discount north carolina furniture stores",241
"discount northern california rental office furniture stores",271
"discount nursery furniture",1088
"discount o27sullivan 2b sauder furniture",442
"discount oak bedroom furniture",345
"discount oak furniture",4227
"discount oak furniture carolina",231
"discount oak furniture savannah2c ga",253
"discount office furniture",229846
"discount office furniture and miami",2677
"discount office furniture atlanta",509
"discount office furniture brand name",341
"discount office furniture ca",309
"discount office furniture california",118
"discount office furniture canada",228
"discount office furniture chairs",313
"discount office furniture connecticut",239
"discount office furniture cubicles",1098
"discount office furniture dallas texas",187
"discount office furniture desks",264
"discount office furniture guest chair",520
"discount office furniture in north carolina",241
"discount office furniture in orange county california",212
"discount office furniture l shaped desk",232
"discount office furniture laminate",324
"discount office furniture long island new york",235
"discount office furniture los angeles",365
"discount office furniture massachusetts",137
"discount office furniture north carolina",246
"discount office furniture online",712
"discount office furniture pa",647
"discount office furniture phoenix",291
"discount office furniture prices current sales2c corner desk",237
"discount office furniture stores",252
"discount office furniture uk",2335
"discount office furniture warehouse",855
"discount office work stations centers furniture",255
"discount online furniture",250
"discount oriental furniture",149
"discount oriental furniture catalogs",216
"discount osullivan office furniture",253
"discount outdoor bamboo furniture",225
"discount outdoor furniture",9241
"discount outdoor furniture cushion",249
"discount outdoor furniture cushions",327
"discount outdoor furniture patio closeout",322
"discount outdoor patio furniture",1396
"discount outdoor patio furniture miami",11878
"discount outdoor wicker furniture",431
"discount outlet furniture",340
"discount outlets north carolina furniture",223
"discount palliser leather furniture",445
"discount patio furniture",39729
"discount patio furniture 2b free shipping",353
"discount patio furniture and cushions",325
"discount patio furniture china",292
"discount patio furniture cover",281
"discount patio furniture cushion",186
"discount patio furniture cushions",110
"discount patio furniture fabric",223
"discount patio furniture kmart",236
"discount patio furniture los angeles2c ca",214
"discount patio furniture maryland",236
"discount patio furniture on sale",334
"discount patio furniture set",469
"discount patio furniture sets",290
"discount pennsylvania house furniture",287
"discount philadelphia baby furniture stores",294
"discount pine furniture",585
"discount pine furniture north east",305
"discount pine log furniture",292
"discount pool furniture",645
"discount pottery barn furniture",409
"discount preschool furniture",196
"discount priced furniture",229
"discount prices bedroom furniture",294
"discount prices flexsteel furniture",328
"discount prices furniture",1092
"discount prices hotel furniture discounts",278
