keyword,count
"10 goal setting ideas",9
"101 achieve goal goal set setting",4
"7 steps to goal setting",3
"action words for goal setting",2
"activities related to goal setting and overcoming obstacles",5
"all about setting goal",12
"apple macitosh goal setting software",2
"barriers to goal setting",2
"behavioral goal setting with children",4
"benefits of setting a goal",5
"benefits of setting a goal in sales",3
"business goal setting",22
"career goal setting",13
"charts for goal setting",5
"children goal setting chart",13
"childrens literature teacing about goal setting",8
"childrens literature to teach goal setting",5
"christian goal setting",9
"classroom fun goal setting",12
"cognitive behavioral therapy techniques goal setting",2
"cognitive therapy structure agenda setting and goal setting",8
"college freshmen goal setting activity",2
"common mistakes when goal setting",2
"communication and business goal setting",2
"consequences of not having goal setting skills",2
"creative ways worksheet  for goal setting",2
"creative ways worksheet for goal setting",10
"define goal setting",16
"definition goal setting",15
"diet fitness goal setting",6
"dilbert on goal setting",11
"dream big goal setting",3
"dynamics of goal setting",2
"education goal setting teacher lesson plan",5
"effective goal setting",2
"effective goal setting skills",2
"elementary goal setting",6
"elementary lessons on goal setting",3
"elements of goal setting",11
"employee goal setting",14
"employee goal setting free templates",2
"employee goal setting system",3
"examples of goal setting",4
"excel developer goal setting",7
"expectancy theory versus goal setting theory",13
"expectancy versus goal setting theory",16
"ezra taft benson on goal setting",2
"fitness and exercise goal setting",6
"for goal setting to work effectively smart goals",9
"free + business goal setting + tools + examples",2
"free + goal setting + tools + examples",2
"free articles on goal setting",3
"free goal setting assessment",9
"free goal setting calander",2
"free goal setting ebook",5
"free goal setting forms",8
"free goal setting information",2
"free goal setting software",17
"free goal setting test",8
"free goal setting training programs",2
"free goal setting tutorials",2
"free goal setting worksheet",3
"free online goal setting tutorial",2
"free personal goal setting and organization software",2
"freeware goal setting",4
"goal - setting setting case studies",3
"goal goal setting",2
"goal minute one setting",11
"goal motivation setting theory",12
"goal new setting years",5
"goal setting",304
"goal setting  for small business",2
"goal setting  playful activities",4
"goal setting 'progress report paper'",2
"goal setting activities",20
"goal setting activities for educators",2
"goal setting activity",25
"goal setting activity kids",13
"goal setting after retirement",10
"goal setting and adjustment to spinal cord injury",12
"goal setting and motivation",2
"goal setting and networking",12
"goal setting and scale and occupational psychology",10
"goal setting and summary",11
"goal setting and time management",13
"goal setting articles",8
"goal setting at evaluation time",10
"goal setting chart",11
"goal setting classes",8
"goal setting definition",2
"goal setting dream with pictures",2
"goal setting electronic device mobile planner",2
"goal setting employee survey results lightning online survey",3
"goal setting employee survey results online",2
"goal setting employee survey results survey software online",3
"goal setting examples",8
"goal setting exercise",3
"goal setting exercises for students",3
"goal setting f i n d",14
"goal setting for adults",8
"goal setting for children",15
"goal setting for couples",12
"goal setting for kids",8
"goal setting for library clerks",2
"goal setting for middle schoolers",3
"goal setting for palm",3
"goal setting for skills",12
"goal setting for small business",11
"goal setting for students",18
"goal setting form",14
"goal setting form for children",2
"goal setting forms",37
"goal setting freeware",15
"goal setting games",3
"goal setting help",10
"goal setting in behavioral therapy",2
"goal setting in counseling",4
"goal setting in jiu jitsu",2
"goal setting in learning teams",2
"goal setting in organzations",2
"goal setting in psychotherapy with children",2
"goal setting in sport",10
"goal setting in sport studies",10
"goal setting in sports",3
"goal setting in the workplace effect communication",7
"goal setting is a road map",2
"goal setting lesson plan",2
"goal setting lesson plans",6
"goal setting lessons",10
"goal setting made easy",2
"goal setting maps",2
"goal setting martial arts",2
"goal setting meetings",3
"goal setting plan for small businesses",10
"goal setting plans",3
"goal setting post retirement",9
"goal setting powerpoint",9
"goal setting ppt",2
"goal setting presentations",2
"goal setting principles",2
"goal setting printable worksheets",13
"goal setting proformas",9
"goal setting program",10
"goal setting projects",10
"goal setting psychology",6
"goal setting questions",13
"goal setting questions and psychotherapy",12
"goal setting reflection",3
"goal setting research",3
"goal setting resources",5
"goal setting self-esteem",3
"goal setting seminar",2
"goal setting sheets",7
"goal setting shop",15
"goal setting short term",5
"goal setting skills",5
"goal setting software",44
"goal setting sports",10
"goal setting statistical data",4
"goal setting steps",5
"goal setting stratagies",3
"goal setting strategies",2
"goal setting surveys",2
"goal setting target",6
"goal setting team",2
"goal setting technics",8
"goal setting template",8
"goal setting templates",10
"goal setting theme party ideas",2
"goal setting theory",35
"goal setting theory case studies",2
"goal setting theory of motivation",2
"goal setting thermometers",2
"goal setting time management",3
"goal setting tips",23
"goal setting tips to success",2
"goal setting tools",3
"goal setting tools covey",4
"goal setting training",4
"goal setting using post it notes",2
"goal setting vocabulary",2
"goal setting with pictures",3
"goal setting worksheet",11
"goal setting worksheet for children",3
"goal setting worksheets",17
"goal setting writing and measurements",3
"group goal setting",4
"guided meditation on goal setting",11
"importance of goal setting",5
"individual goal setting example",3
"integrating goal setting across the curriculum",2
"lesson on goal setting",8
"lesson plans for goal setting",3
"let us now examine the goal setting principles",10
"locke and latham and goal setting and scale",11
"mac goal setting software",3
"magic lamp goal setting",6
"management training leadership training goal setting",2
"measuring and goal setting",10
"methods to use for goal setting",11
"monitoring behavior goal setting",2
"motivation + goal setting",2
"motivation and goal setting",14
"motivation and goal setting worksheet",12
"national kids goal setting week",6
"new dynamics of goal setting",10
"new years resolutions goal setting",2
"nursing career goal setting",3
"online goal setting tracking",2
"originator of smart goal setting",3
"originator of smarter goal setting",11
"passion coupled with goal setting is a formula for",8
"passion should dictate goal setting",7
"patient goal setting",3
"personal goal setting",28
"personal goal setting new years resolution",2
"personal goal setting quiz",2
"physical therapy goal setting",12
"pinders goal setting theory",2
"planning and goal setting",2
"planning and goal setting programs",18
"power point goal setting",5
"prioritizing & goal setting in marriage",6
"psychology goal setting theory",11
"quotes about goal setting",2
"real estate goal setting",2
"relationship between goal setting and networking",13
"sample therapeutic group goal setting",6
"selfmonitoring through goal setting scales",2
"selfmonitoring through goal setting scales athletics",2
"setting a goal weight",12
"setting and achieving goal",11
"setting career goal",11
"setting fluency aim goal",6
"setting goal",8
"setting goal motivation",11
"setting personal goal",4
"setting realistic goal",12
"setting work goal",2
"short term goal setting",2
"small business goal setting",2
"smart goal setting",16
"smartest goal setting",3
"sport studies on goal setting",7
"sports and goal setting",2
"sports goal setting",2
"steps for goal setting",13
"strategic planning goal setting",2
"student goal setting",19
"student goal setting worksheet",13
"teach goal setting",11
"team goal setting",6
"teen goal setting",6
"templates for goal setting",2
"the effect of goal setting on",13
"the magic lamp goal setting",9
"the smart model for goal setting",3
"theory of goal setting",25
"this entire process of goal setting motivation and f",12
"time management and goal setting",3
"training game for goal setting",2
"use of goal setting in therapy with children",2
"what are the factors in setting a goal",11
"what is goal setting",3
"what is goal setting in counseling",11
"what is setting a goal",2
"what is the  purpose of goal setting",3
"what is the blueprint in goal setting",2
"why is goal setting important",23
"world war ii + goal setting",2
