keyword, count
"home buying help for a disabled person",239
"home buying in arcadia fl",239
"home buying in kansas city missouri virtual tours",239
"information sheet for buying a new home",239
"is there any transfer tax when buying a home",239
"number1expert information sheet for buying a new home",239
"us home buying",239
"average cost of home buying",238
"buying a home in montgomery county2cmaryland",238
"buying a home in northern ontario",238
"buying a home in pittsburgh grants",238
"buying a manufactured home from individual",238
"buying home in millburn nj",238
"buying home in south orange nj",238
"cost for remodeling vs buying new home",238
"home buying government grants for",238
"home buying hot listings",238
"legalities of buying a home who pays what",238
"mobile home buying tip",238
"questions to ask when buying a new home",238
"single family home buying grants",238
"what to ask when buying a new home",238
"appraisers real estate home buying",237
"buying a home in irving2c tx",237
"buying a home in morocco",237
"buying a home need loan for downpayment",237
"buying a hud home in philadelphia",237
"buying fair oaks california ca fixer upper home",237
"buying or selling a home in philadelphia",237
"guide to buying a new manufactured home the ledger",237
"misrepresentation when buying a home in ontario",237
"questions ask real estate agent buying home",237
"web home buying",237
"buying a home for someone else in dallas2c tx",236
"buying a home in vermont",236
"buying a home section 8",236
"buying home insemination kits",236
"charity for buying a home",236
"choosing a good realitor2c buying a home",236
"buying a home for taxes owed",235
"buying a home in pittsburgh",235
"buying a home making an offer",235
"buying a home under contract",235
"buying a mobile home the peak district",235
"buying and selling hud home property listing",235
"buying a new front door for your home",235
"buying an existing home vs building",235
"buying home with cracked foundation",235
"financial aid government buying a home",235
"government grants for hispanics buying a home",235
"help buying a home for single mothers",235
"home buying real estate listings",235
"nurse buying first home",235
"nurse grant for buying a home",235
"articles on electronic home buying",234
"buying a home in fl",234
"buying a home in pulaski wisconsin",234
"buying a home in shermans dale pa",234
"buying a new park home in the uk",234
"buying a preconstruction home",234
"government grants for married couples buying a first home",234
"home buying for people with a disability",234
"hud2c buying a home",234
"nh first time home buying",234
"problems with buying a home with an inground pool",234
"sales tax on buying a home",234
"single mother home buying boise idaho",234
"buying a historic home",233
"buying a home in pearland texas",233
"buying a home in provence",233
"buying a home with a 600 credit score",233
"buying a new home and negotiating the price",233
"buying clothes at home",233
"buying va home loans",233
"do i qulify for buying a home",233
"home buying accepting a second contract real estate",233
"licensed dealer buying modular home direct from factory",233
"photos buying a home in morocco",233
"prayers for buying a home",233
"safe creative solutions home buying",233
"steps of buying a home",233
"buying a home help",232
"buying a home in as is condition",232
"buying a home in british columbia",232
"buying a home in egypt",232
"buying a home in new rochelle",232
"buying a home in northern utah",232
"buying a home in washington state",232
"buying a home with termite damage",232
"buying a reliable home plumbing liquefaction",232
"buying grant home money",232
"buying home in toronto",232
"buying used video poker machines for home use",232
"home buying with credit problems",232
"loan tips buying a home",232
"questions to ask a realtor while buying a home",232
"building an addition or buying another home",231
"buyers ask list of questions for buying a home",231
"buying a home in jacksonville2c nc",231
"buying a home in london2c ontario",231
"buying a home in mexico",231
"buying a home in portugal",231
"buying real estate folsom home",231
"buying selling lago vista home listings",231
"first time home buying alabama",231
"grants first time home buying",231
"questions to ask before buying a home",231
"buying a 51 home theatre",230
"buying a century home",230
"buying a home charlottesville2c va",230
"buying a home in off season",230
"buying a home in philadelphia",230
"buying a home theater",230
"buying a new home in atlanta",230
"buying a used mobile home texas",230
"buying marine fish for your home tank",230
"buying new home first time",230
"down payment options for buying a home",230
"home buying on staten island ny",230
"mesquite nevada and buying a new home",230
"mexico buying a home",230
"san diego2c ca and buying a home",230
"27laws for buying a home in ontario27",229
"buying and selling a home flowchart",229
"buying an established home based business",229
"buying a new home in columbus2c ohio",229
"buying a new home negotiations",229
"free guides for the complete home buying process",229
"home buying mortgage and gift",229
"home buying realty caldwell banker",229
"hud and home buying and north carolina and free",229
"buying a home with section 8",228
"buying home in summit nj",228
"criteria for buying a home",228
"exterior buying a new front door for your home",228
"grants for buying a home in philadelphia",228
"home buying programs for single moms",228
"tip on home buying",228
"buying a home computer system",227
"buying a home in portage county ohio",227
"buying a home just out of bankruptcy",227
"buying a home no money down",227
"buying home new tip when",227
"home buying listings paris france real estate",227
"questions to ask about buying a new home",227
"buying a home in nashville2c tn",226
"buying a home in new york state",226
"home buying titles for seminars",226
"middleton buying a home",226
"average cost of home buying in the usa",225
"home theaters buying guide",225
"land contract home buying",225
"buying canada home in",224
"calgary real estate home buying in calgary",224
"government help with buying a home",224
"home inspections when buying home",224
"single parents home buying",224
"bad buying credit down home money no",223
"buying a funeral home",223
"buying a home in livingston county2c ny",223
"home buying program for first time home buyers",223
"home buying san diego",223
"home buying expo in new york",222
"lease to own home buying",222
"process of buying land and building a home",222
"what to know about first time home buying",222
"federal first time home buying help",221
"free grants for buying a home",221
"what are the advantages of buying a new home",221
"buying the right home computer",220
"the process of buying a home",220
"buying an old home",219
"dallas home buying",219
"first time home buying housing fannie mae",219
"home buying grants for hispanics",219
"home buying mortgage qualification calculator",219
"cash offer home buying",218
"money making home buying",218
"buying new home ripoffs",217
"grants for buying home for business",217
"home buying and selling advice",217
"when buying a home how much is it worth",217
"buying a home in washington",216
"buying first home grants",216
"27 38 rule when buying a home",215
"buying a home low income",215
"corporate credit cards and buying a home",215
"first time home buying courses in northeast ma",215
"home buying renting versus",215
"women home buying",215
"austin buying home",214
"buying a home and lead paint",214
"buying a home forbes",214
"first time home buying in minnesota",214
"house real estate buying a home",214
"building a home vs buying a home",213
"buying a home projector",213
"buying folsom fixer upper home",213
"buying foreclosures ltd system home",213
"home buying and selling message board",213
"home buying for sale by owner",213
"information pages on buying a home",213
"buying a home in az",212
"buying a home offer",212
"buying a home on a land contract",212
"checklist for buying home florida",212
"buying a home in ct",211
"buying a home worksheets",211
"estate investor seminars on buying a home with no money",211
"getting started buying a home",211
"buying a home contract for deed",210
"buying a home nj",210
"buying a multi family home",210
"buying home illinois",210
"buying home renting versus",210
"essays on buying a home",210
"home buying federal and state grants",210
"home buying seminars in oshkosh wi",210
