keyword, count
"home buying",4244498
"buying a home",321282
"buying home",256861
"dsl home buying",45536
"buying a home with bad credit",45309
"home buying guide",41366
"first time home buying",40544
"low income home buying program",31997
"buying a new home",31552
"loan for home buying",27822
"home buying grant",24102
"california home buying",23268
"home buying uk",22205
"atlanta home buying",22143
"uk home buying",20565
"home buying illinois",18668
"home+buying",16436
"buying a home after bankruptcy",13304
"real estate home buying",13267
"buying first home",9814
"buying and selling a home",9351
"home buying info",9246
"buying a+home with bad credit",9139
"buying a new home in illinois",9098
"home buying advice",8522
"buying new home",8320
"buying a used home",8220
"buying foreclosed home",7888
"help buying home",7799
"steps to buying a home",7764
"buying financing home",7670
"first time home buying program",7642
"low income home buying",7176
"buying a second home",7060
"new home buying guide",7059
"eugene home buying",6685
"building buying home vs",6564
"steps in buying a home",6502
"buying home parent single",6449
"florida home buying",6133
"home buying interest rate",6120
"buying a mobile home",5887
"home buying ' home buying a font color",5854
"buying a manufactured home",5806
"home buying tips",5532
"home buying tip",5411
"buying holiday home florida",5331
"buying a vacation home",5096
"buying a home guide",5056
"buying a home in florida",5040
"buying a home for sale by owner",5028
"home buying process",4758
"buying a home computer",4753
"home buying checklist",4737
"home buying information",4711
"tip for buying a home",4708
"buying home mobile used",4649
"buying a home in spain",4418
"help buying a home",4381
"buying your first home",4362
"negotiating in buying a home",4274
"buying home mobile",4174
"information on buying a home",4112
"buying home spain",4088
"question to ask when buying a home",4050
"buying a hud home",4000
"buying a home how to",3897
"bankruptcy buying home",3843
"home buying program",3813
"buying selling home",3770
"buying foreclosure home",3705
"buying a home in california",3700
"buying home in foreclosure",3686
"buying home foreclosure",3684
"buying a home without a realtor",3659
"home buying new jersey",3603
"buying electronics guide home theater",3598
"buying construction home new",3586
"bad buying credit home",3583
"home buying grants",3578
"buying home selling",3572
"home buying for dummies",3558
"buying home highland ranch",3557
"home buying in new jersey",3538
"buying home va",3535
"tips for buying a home",3504
"buying an investment home",3491
"home buying atlanta",3446
"home buying how to",3435
"new home buying tips",3427
"tips on buying a home",3405
"new home buying tip",3386
"process of buying a home",3347
"buying a home with no money down",3322
"buying a home checklist",3268
"home buying question",3235
"buying home computer",3204
"home theater buying guide",3158
"home buying florida",2993
"alow income home buying program",2984
"buying vacation home",2905
"home buying in atlanta",2868
"denver buying a home",2856
"buying home with va",2845
"buying mobile home",2836
"asheville buying home new tip",2808
"metrowest buying a home",2789
"home buying for dummy",2764
"buying a home highland ranch",2730
"buying a home tips",2723
"buying forclosed home",2697
"agent agent buying estate flats home house let letting",2658
"home buying real estate",2603
"buying home manufactured",2591
"buying first home time",2580
"buying a home with poor credit",2516
"buying home system",2512
"buying home systems",2510
"buying a holiday home in florida",2422
"buying holiday home spain",2416
"home buying' home buying a font color",2372
"program for buying a home",2351
"buying grant home",2326
"buying colorado home",2272
"buying a home without an agent",2262
"buying home selling tip",2229
"help with home buying",2229
"buying a home without realtor",2198
"home buying orlando",2098
"buying a home in phoenix",2097
"buying free government grant home",2076
"answer auburn buying home question",2032
"buying home new",2027
"home buying questions",2026
"home buying seminar",2016
"buying a+home",2009
"home buying from owner",2000
"buying home look when",1942
"buying home house",1940
"buying home houses",1912
"first time home buying programs",1879
"buying guide home",1813
"after bankruptcy buying home",1804
"low income home buying programs",1776
"buying free grant home money",1775
"basics buying home",1754
"buying guide home smart",1753
"buying home tip",1711
"home buying real estates",1690
"grants for home buying",1656
"california teacher home buying program",1646
"colorado buying a home",1641
"buying florida home lake land o selling",1630
"buying a home after bankruptcies",1618
"buying a home without realtors",1604
"buying a home without an agents",1576
"home buying from owners",1575
"buying george home island process st",1564
"buying home income low program",1538
"home buying calculator",1531
"home buying processes",1528
"home buying programs",1507
"brookline buying free grant home",1486
"buying a home in san diego",1469
"buying new home illinois",1442
"buying expertise guide home home home improvement repair tip",1408
"new home buying",1403
"buying a foreclosed home",1392
"buying florida home",1392
"buying+a+home+with+bad+credit",1375
"advice buying new home",1363
"buying first home tip",1363
"loan+for+home+buying",1349
"home buying burlington",1342
"advice buying hayward home",1326
"home buying with bad credit",1308
"foreclosure buying home",1295
"austin buying home in process steps",1294
"first time home buying tip",1278
"home buying 5c 27 3ehome buying 3c 2fa 3e 3cfont",1194
"home buying home buying a font color",1192
"buying home time",1188
"home buying tips negotiating",1166
"buying checklist home",1164
"home buying inspection checklist",1152
"home buying search",1136
"101 buying home",1120
"mortgage lender california home buying",1110
"grants for buying a home",1108
"buying loomis california ca fixer upper home",1089
"mobile home buying guide",1067
"buying a home in atlanta",1064
"time home buying",1054
"vegas home buying",1027
"buying a used mobile home",1016
"buying a home after filing bankruptcy",993
"arizona buying a home",974
"buying home new york",974
"buying loomis fixer upper home",974
"home buying australia",974
"buying hud home",972
"buying or selling a home",965
"buying a home with no down payment",964
"buying loomis california ca home",956
"home buying contract",940
"tips on home buying",929
"buying real estate loomis home",927
"buying home steps",926
"home buying loan",915
"what to look for when buying a home",907
"buying government grant home",899
"buying home program",895
"las vegas home buying",885
"advice buying home",882
"government home buying program",879
"buying and selling home",868
"auction buying home",863
"home selling and buying",859
"buying a first home",855
"buying a motor home",853
"buying a home theater system",850
"home buying steps",844
"the home buying centre",833
"buying a home in chapel hill",832
"buying granite bay california ca fixer upper home",832
"buying home second",829
"buying home process",819
"home house insurance contents buying",797
"buying roseville fixer upper home",795
"home buying help",795
"buying an older home",784
"questions to ask when buying a home",778
"home buying kissimmee",773
"home buying 101",764
"mobile home buying",762
"buying real estate roseville home",754
"buying home in las vegas",748
"buying a home after foreclosure",738
"buying home bad credit",737
"buying federal grant home",729
"no money down home buying",727
"buying home new tip",726
"buying home in jersey new",713
"buying california home",712
"buying first guide home time",704
"buying granite bay california ca home",703
"home buying check list",702
"texas home buying",700
"buying+a+home",697
"atlanta buying home",696
"buying home uk",696
"home buying hamilton mountain",696
"buying down home money no",695
"buying second home",694
"buying first home loan time",692
"denver buying home",691
"buying a home in seattle",690
"buying home seminar",688
"buying dummy home",682
"idas for home buying",677
"buying a home in the uk",674
"free home buying seminar",674
"government grants for buying a home",672
"buying a home hud",670
"buying home bankruptcy",669
"buying granite bay fixer upper home",666
"buying a modular home",662
"onyx home buying",655
"renting vs buying a home",652
"buying a home in colorado",651
"chicago home buying",649
"buying roseville california ca fixer upper home",647
"buying a home boise",646
"buying roseville california ca home",643
"federal grants for buying a home",634
"buying calculator home",633
"houston home buying",633
"home buying in ohio",632
"tips on buying a new home",632
"buying construction home new tip",631
"home computer buying guide",631
"buying a home in suburb illinois",629
"home buying arlington texas",621
"buying and selling used mobile home",620
"federal home buying program",615
"bad buying credit help home",613
"buying a home in scottsdale",612
"buying home information",612
"buying home land in nw san antonio",611
"westminster colorado buying a home",605
"virginia home buying",599
"buying a home in ahwatukee",598
"buying a park home",598
"bad buying credit home program",597
"buying selling home oakville",597
"buying a for sale by owner home",596
"buying help home",596
"government grant for buying home",590
"buying a home tip",588
"home buying maryland",585
"buying modular home",584
"tips buying a home",583
"bad credit home buying",582
"home buying articles",581
"buying home vacation",579
"buying a home without a realitor",578
"buying real estate granite bay home",578
"buying guide home security",576
"buying a home on cd",573
"arvada buying a home",572
"boulder buying a home",571
"littleton buying a home",571
"buying guide home new",566
"buying a home in canada",559
"buying a home security system",559
"buying a used mobil home northern california",559
"buying a home in virginia",558
"tax benefits to buying a home",557
"highlands ranch buying a home",554
"trailer home buying",553
"buying a home in new jersey",552
"northglenn buying a home",550
"castle rock buying a home",546
"home buying in maryland",546
"nh home buying",545
"buying and renting home",543
"advice on buying home theater speaker systems",540
"cost of buying a home",539
"closing cost on buying home",537
"buying a home in maryland",532
"online home buying",531
"bankruptcy home buying",529
"home buying trends",528
"buying a home in dallas",527
"evergreen buying a home",523
"home buying las vegas",515
"buying a home in france",513
"broomfield buying a home",511
"buying home owners insurance",509
"buying home jersey new",508
"selling and buying a home",505
"buying first home time tip",503
"home buying money grant",503
"buying home schooling material",502
"buying rocklin california ca home",502
"buying home virginia",500
"buying home foreclosures",499
"computer games home buying",498
"buying home oakville selling",492
"buying villa holiday home cyprus",492
"carlsbad home buying",488
"buying guide home mobile",485
"dsl+home+buying",484
"renting versus buying a home",484
"austin home buying",480
"buying home in new york",479
"buying first grant home time",478
"home buying loans",478
"hawaii home buying guide",477
"buying home insurance",475
"us department of housing website buying a home",472
"buying home in memphis tenn",471
"home buying and selling",470
"buying home theater",466
"home buying boca raton florida real estate",464
"money saving tips on buying a mobile home",463
"buying rocklin fixer upper home",462
"guide to buying a home",460
"guide to buying a new home",457
"buying estate home real",456
"home buying services",455
"teacher home buying program",455
"home buying bad credit",454
"buying selling a home",449
"buying florida home in",445
"arizona home buying",444
"buying manufactured home",444
"business buying home selling",442
"buying a holiday home",440
"buying rocklin california ca fixer upper home",438
"buying a home in hawaii",436
"buying a home inspection checklist",436
"buying home question",435
"free home buying guide",435
"buying home buying home buying home buying home buying home",434
"buying home first tip",434
"home buying 27 3ehome buying 3c 2fa 3e 3cfont color",432
"checklist for home buying",429
"home buying in wilmington north carolina",428
"home buying in california",424
"buying home lease option",422
"home buying selling",422
"first time home buying grant",421
"buying cost home",417
"buying first home steps",412
"ask buying home question when",411
"renting versus buying home",411
"keywords home buying",410
"home buying first time",408
"home buying in wilmington nc",405
"buying a home in baton rouge louisiana",403
"home buying, pets, gardening, apartments",400
"maryland home buying",398
"home buying assistance",397
"buying a mobile home uk",396
"buying real estate rocklin home",394
"key players in buying a home print",390
"buying home with bad credit",389
"buying a home in arizona",388
"buying by home owner sale",385
"funny key players in buying a home",383
"buying home new thinking",382
"buying home appraisal service las vegas",381
"buying home gym equipment",381
"real estate buying a home",380
"buying a home in texas",377
"buying home inspection checklist",377
"buying a home for dummies",372
"home buying tools",370
"top 10 things to know before buying a new home",370
"home buying debt help",369
"a pre purchase home buying engineer",367
"home buying programs for single parents",367
"home buying virginia real estate",367
"kansas bar buying a home",367
"atlanta buying home in",366
"building vs buying a home",366
"buying a home florida",366
"buying home las vegas",366
"buying computer home",365
"buying home and land in houston texas",364
"home buying los angeles",364
"buying a home advice",362
"home buying guides",357
"bankruptcy and buying a home",356
"buying a forclosed home",355
"buying a home in los angeles",355
"types of loans for buying a home",355
"buying contract home",354
"advice on buying a home",353
"time home buying program",353
"australia buying home",351
"home buying seminars",351
"buying elk grove california ca home",350
"home buying for single mother",350
"buying home renting vs",349
"buying a vacation home in florida",347
"delavan wi home buying",347
"advice buying home computer",345
"home buying in new hanover county",345
"home buying service",345
"buying home loan",342
"buying a home online",341
"home buying virginia",339
"buying home abroad",338
"home buying and selling information",338
"home buying inspection",336
"buying a home in dallas texas",334
"home buying question to ask when a",334
"buying a home in utah",333
"step by step home buying process",333
"home computer buying",332
"home buying software",331
"whitney home buying",331
"buying a home in costa rica",330
"buying sacramento california ca fixer upper home",330
"government grants home buying",330
"buying a home in dallas tx",329
"buying home modular",329
"home buying pinon hills california",329
"houston buying a home",329
"buying a foreclosure home",327
"buying a home in foreclosure",327
"consumer info home buying",327
"home buying houston",327
"buying a home in baltimore md",326
"buying a home land contract",326
"buying home home selling",326
"home buying bubble",326
"spanish home buying problems",326
"beloit wi home buying",325
"buying denver home",325
"buying guide home theater",325
"buying home for sale by owner",325
"buying fair oaks fixer upper home",324
"buying dallas home",323
"home buying online",323
"home buying tips nz",323
"philadelphia region home buying upscale neighborhood",322
"buying a home from an owner",321
"buying government home program",320
"aurora buying a home",319
"buying home new steps",319
"home buying financing",319
"home buying process tulsa",319
"buying a second home as a rental",318
"patron saint for buying a home",317
"buying a home worksheet",316
"buying home income low",316
"buying a home in saugus",315
"home buying in america",315
"buying a home in birmingham",314
"summary of buying a home",314
"buying a home using va benifits",313
"buying a new mobile home",313
"home buying fairfield county",313
"buying a home direct from owner",312
"home buying bankruptcy and a",311
"mobile home buying consumer info florida",310
"benifts of buying a home",309
"buying real estate sacramento home",309
"buying sacramento fixer upper home",309
"buying a home in bulgaria",308
"buying a home in sandpoint idaho",307
"buying a home stevenson ranch",307
"section 8 buying home",307
"buying a furnace for home",306
"buying a home in israel",306
"buying a home with no furnace",306
"buying motor home for dummiescom",306
"tips for home buying",306
"buying a home in pearland",305
"buying fl home",305
"checklist for buying home",305
"contingencies on home buying",305
"no down payment home buying",305
"buying a home vs renting",304
"buying a new built home",304
"buying elk grove fixer upper home",304
"value of a home im buying",304
"buying a home on contract",303
"buying by guide home step step",303
"buying home computers",303
"outline on buying a home",303
"tips for buying a home computer",303
"buying a home on leased land",302
"resources for buying a home",302
"buying for the home inc",300
"buying home without realtor",300
"buying a home connecticut",297
"home buying offer",297
"teacher buying home",297
"buying a mobile home park",296
"buying a mobile home labelle florida",295
"buying eugene home",295
"buying a model home",294
"goverment home buying programs",294
"government home buying programs",294
"home buying texas",294
"buying a home in italy",293
"contract for buying home",293
"buying a home without a real estate agent",292
"buying grant home teacher",291
"home buying 5c 5c 5c 27 3ehome buying 3c 2fa",291
"buying a bathtub for a mobile home",290
"guide buying home computer",290
"home buying keyword",289
"home buying stress",289
"federal home buying grants",288
"buying home new jersey",287
"buying a home abroad",286
"tips on buying a home without a realtor",286
"buying a home question",285
"buying home greece",284
"buying home money",284
"lakewood colorado buying a home",284
"purchase aggreement for buying a home in texas",284
"buying a home in australia",282
"buying guide home motor",282
"buying home no down payment",282
"free feng shui buying a home",282
"buying a modular home in nc",281
"buying home maryland",281
"buying first guide home",280
"buying a historical home",279
"checklist for buying a home",279
"buying home italy",278
"home buying us",278
"single mother home buying",278
"phoenix home buying",277
"brodhead wi home buying",276
"buying foreclosure home in",276
"home buying costs",276
"englewood colorado buying a home",275
"msn money central top home buying mistakes",275
"buying a home information",273
"buying a log home",273
"home buying real estate a",273
"buying a home in middleburg hts ohio",272
"business buying a mobile home park",271
"buying a rental home",271
"buying dl hughley going home",271
"buying used mobile home",271
"factory direct mobile home buying",271
"home buying fha loans",271
"home buying texas real estate",271
"tips when buying a new home",271
"buying a home calculator",270
"buying a home on your own",269
"buying home depot",269
"buying selling listings home twin falls idaho real estate",269
"home buying in san diego",269
"seattle home buying",269
"buying a used manufactured home",268
"clinton wi home buying",268
"buying home realtor without",267
"buying real estate elk grove home",267
"home buying calculators",267
"home buying california",267
"real estate single mother home buying boise idaho",267
"aviara home buying",266
"buying a home for the first time",266
"denver home buying",266
"shipp grants hud home buying",265
"bankruptcy and home buying",264
"buying a home in connecticut",264
"buying foreclosure home laws",264
"modular home buying guide",264
"buying home depot stocks",263
"buying hospital bed for home use",263
"couple buying home",263
"buying a vacation home in california",262
"buying home in short hills nj",262
"buying real estate canada vancouver mobile home sales",262
"tips on buying a home computer",262
"1st buying home time",261
"buying a new home while in chapter 13 bankruptcy",261
"free home buying advice",261
"home buying first time program",261
"home buying for people with poor credit",261
"questions for buying a new home",261
"brooklyn home buying",260
"buying dallas home selling",260
"government grants for home buying",260
"northern nh home buying",260
"jacksonville florida single mother home buying programs",259
"louisville colorado buying a home",259
"advice home buying manufactured homes",258
"bond money buying home",258
"buying a brand new home",258
"buying a home first time",258
"darien wi home buying",258
"glendale home buying",258
"home buying in utah",258
"latinos home buying studies",258
"buying a home canada",257
"buying wholesale home decor",256
"home lunches vs buying lunch",256
"brazil home buying",255
"buying a holiday home in cornwall",255
"buying a home in north carolina",255
"buying a home listings",255
"buying a new home in phoenix",255
"buying selling real estate buy home",255
"first time home buying programs in florida",255
"hud home buying",255
"legal rights buying home",255
"buying a home direct from seller in florida",254
"buying down home no payment",254
"buying home closing checklist",254
"california teachers home buying program",254
"first time buying a home",254
"home buying guide saratoga county ny",254
"house home buying",254
"self home buying inspections",254
"steps to buying a manufactured home",254
"wheat ridge buying a home",254
"basic home buying terms",253
"buying a home direct from seller in the florida keys",253
"buying home after filing bankruptcy arizona",253
"buying a home in nicaragua",252
"buying first home program time",252
"buying mobile home parts",252
"buying new construction home",252
"buying prices mobile home skirting",252
"buying a home online in ca",251
"howards grove home buying",251
"is buying a home really an investment",251
"advice home buying",250
"buying a home in palm bay2c florida",250
"costs of buying a home",250
"discount home buying club",250
"seattle home buying seminar",250
"second marriage home buying",250
"buying a home questions",249
"buying a manufactured home in central florida",249
"buying financeseattle home housing seminar state washington",249
"buying real estate from home",249
"advantages of buying a home",248
"buying a home in a floodway",248
"buying a home out of code",248
"home buying real estate listings new york",248
"innovative home buying solutions",248
"international home buying",248
"roof inspection check sheet or checklist buying home",248
"things to know when buying a home",248
"after buying foreclosure home",247
"burlington buying home",247
"buying a manufactured home tips",247
"buying home hamilton mountain",247
"buying house inspect home",247
"buying land and building a home",247
"ins and outs of buying a mobile home",247
"lodo buying a home",247
"personal home buying kansas",247
"tips for home office computer buying",247
"buying manufactured home parks",246
"buying procedures for a foreclosed home",246
"dane county wi home buying",246
"first time home buying tips",246
"home buying as an investment",246
"real estate buying mobil home",246
"buying a home in rural area",245
"buying a home when you are single",245
"home buying help for single mothers",245
"advice buying a second home",244
"before buying a home",244
"buying a home in atlanta georgia",244
"buying home in maplewood nj",244
"closing on buying a home",244
"hud home buying in whitehall brough",244
"lookpilot.com home buying",244
"buying a 2nd home",243
"buying a home owner financed",243
"buying a home that was up for sheriff sale",243
"buying a home theatre",243
"buying a home with poor or bad credit",243
"buying tips for a home computer",243
"fort atkinson wisconsin buying a home",243
"gov help on buying a home",243
"home buying mississippi real estate listings",243
"new jersey laws for buying a home",243
"step buying a home",243
"steps for buying a home in wis",243
"things to look for in a buying a home",243
"tips for buying home owners insurance",243
"advice on buying a vacation home",242
"buying a duplex as a first home",242
"buying a home in a sellers market",242
"buying a home in san antonio tx",242
"buying a home jointly",242
"buying a model home on a leaseback",242
"buying guide hawaii home",242
"buying home orlando",242
"home buying colorado",242
"teacher next door home buying program",242
"tips on buying a model home",242
"average cost of buying a home",241
"bankrupsy home buying",241
"buying 2b first 2b home 2b choosing",241
"buying a home in bequia",241
"buying a home in chambersburg pa",241
"buying a home procedure",241
"buying a home with fiance",241
"buying a mobil home",241
"buying home theater system",241
"conifer buying a home",241
"fort atkinson buying a home",241
"home buying advice mortgages",241
"two closings problems home buying",241
"austin buying home selling",240
"buying a home in england",240
"buying a home in eugene oregon",240
"buying a home with fair credit",240
"compare buying to renting a home",240
"guide to buying a historic home",240
"home buying incentive programs",240
"qualifying for buying land and building home",240
"the abc of buying a home",240
"building a home vs buying existing home",239
"buying a colonial style home",239
"buying a first home tx for dummies",239
"buying a home on st martin",239
"buying a home tax benefits",239
"buying a home with less than perfect credit",239
"buying free grant home",239
"contract problems when buying new home",239
"encouragement and buying a home",239
"fannie mae buying a home",239
"first time home buying grants",239
"grants for first time home buying",239
"guide to home buying",239
