keyword,count
"value of rare book house of the wolfings",4
"free house estimates home value",4
"22great value 2dmtn house base area units22",4
"house value going up or down in long island ny",4
"house value in new jersey",4
"house value michigan",4
"average house value independence ohio",4
"value of house on whittington oval stechford birmingham",4
"what is the resale value of a house that has",4
"pg county house value",4
"house assessed value",4
"charlotte north carolina house tax value",4
"house value for free",4
"improvements add value house",4
"house insurance cash value",4
"looking for the value of my house",4
"bakersville nc land house value in mitchell county",4
"quincy il house value",4
"house report and value",4
"house value avalon park chicago",4
"how much did my value on my house go up",4
"house value dot",4
"house home value in cities",4
"get value of house",4
"house value increase city",4
"house value 977 w cagney meridian idaho",4
"house value on bradlee street in massachusetts",4
"saint leonard md value my house",4
"zaba house value search",4
"house value price",4
"house value tega cay sc",4
"house bill 3555 value added tax",4
"fair market value of house and calculator",4
"my neighborhood house value",4
"house value wisconsin",4
"random house value pub",4
"magnificent homes and value of house",4
"''''diy improvements to increase house value '''' uk",4
"virginia house value trend in next 5 years",4
"value ware house",4
"find out value of your house",4
"house value public record",4
"lorain county find the value od someones house",4
"house value san francisco",4
"insurance high value house",4
"free house value report without an email address",4
"house value estimate report",4
"fair market value house divorce",4
"value house stores",4
"market leader house value",4
"free house value estimates",4
"house value near atlanta ga",4
"value ofmy house",4
"house value in neighborhood",4
"house market value and free and king county washington",4
"value barbies dream house cardboard",4
"how do i know the value of my house",4
"market value of house in hunt drive in horsham",4
"how to estimate house value",4
"portland oregon house value predictions",4
"finding the value of other house",4
"house fair market value calculate",4
"think my house appraiser was bias and inflated market value",4
"mean income and house value los angeles ca",4
"house value abc",4
"homeowners insurance required percentage of value of house",4
"how to find value of house",4
"recommended r value for house location",4
"fair market value vs appriased value house",4
"house value no agent wanted",4
"tax value of your house in gwinnett county",4
"comparative house value",4
"what''''s my house value",4
"house value chart",4
"get the value of a house",4
"house value decrease 2008",4
"islamabad house value",4
"anne arundel county md value my house",4
"free property value of house online",4
"building an affordable house trade secrets for high value",4
"what is the value of house",4
"house illustration for place value",4
"us house market value",4
"house painting affect value by",4
"gaston county house tax value",4
"dept 56 all through the house list retirement value",4
"house value increases pa",4
"estimate the property value of a house in carrolton texas",4
"determine house rental value",4
"value of winchester house",4
"find value of your house",4
"zilo house value",4
"median house value of harrisonburg",4
"shed value for house",4
"house value on line california",4
"average house value increase san antonio",4
"vacaville ca market value house free instant",4
"house value in el paso texas",4
"free house value web sites",4
"add value to your house",4
"average market value my house",4
"finish basement add house value",4
"am looking for the value of my house",4
"house value pinellas",4
"uscensus bureau lowest median house value 2005",4
"instant house value quote",4
"how to calculate house fair market value",4
"nebraska house value",4
"real estate tax and house value",4
"how to find your house value",4
"estimated house price value",4
"house value seach",4
"house market value for sevierville tn",4
"nutritional value of a house salad",4
"loft conversion value house price",4
"house value free estimate tampa",4
"insurance to value for house",4
"taxable value ranch style house",4
"median house value nationwide comparison state",4
"home value house cost",4
"mecklenburg county house tax value",4
"new mexico house value",4
"how to determine the value of house",4
"house value blue book",4
"home value free house",4
"house value burnaby",4
"my house value .com",3
"find the value of the house",3
"washington township indianapolis average value house",3
"way to improve the value of your house",3
"huntingtown value my house",3
"architecture value per house",3
"increasing value of a house",3
"cost of building house value",3
"how to check the value of the house",3
"rateable value of my house in leicester",3
"pittsburgh house value",3
"house value increase city price tucson",3
"how can i add value to my house",3
"house jose market san value",3
"how to find the value of my house",3
"appraised value the house",3
"spillow.com house value",3
"perod house u value",3
"house value calculator usa",3
"online house value free",3
"free property value of house",3
"value increase house",3
"house value internet search",3
"free house value appraisal",3
"how to research the market value of your house selling",3
"estimated value of house",3
"bank of america value house",3
"free house value system",3
"find free house value",3
"house search value",3
"find the value of house",3
"house value lockhart fl area",3
"how to value a house in a divorce",3
"my book house 1920 individual value",3
"sheds adding value house",3
"www. house value .com",3
"house value home value online rating",3
"br house value in bollinger co mo",3
"value of our house site uk",3
"market value for dover house timeshares in delray beach",3
"free online house value estimate",3
"wake county house tax value",3
"house value and ocean county",3
"domanain house value",3
"house online value 20",3
"adding house value",3
"bank owned foreclosures deposit ratio to house value",3
"house value increase near shopping centers",3
"house value trend in virginia",3
"house value free estimate",3
"house value free information",3
"house value apprisal",3
"nutritional value outback steak house",3
"house value san diego",3
"montclair ca average house value",3
"average house value in auburn wa",3
"zillow.com house value",3
"find value of a house before i buy",3
"little elm tx house value",3
"la plata md value my house",3
"house value based on the income",3
"what is the value of the house in laguna hills",3
"determining the value of your house",3
"baltimore house value appraisals",3
"difference between house tax value and appraised value",3
"house value in uk",3
"finished basement added house value",3
"free rate of house value",3
"house value san jose",3
"house value and amenities",3
"house of value in san mateo",3
"my house market value",3
"engine house search tax value",3
"owen sound house value increase",3
"white plains maryland value my house",3
"calvert county value my house",3
"house market value rancho cucamonga september 2005",3
"davie county house tax value",3
"current market value of small bungalow house in scarborough",3
"house value in washington dc",3
"house value options",3
"free house value 20",3
"estimate the value of a house",3
"best house value",3
"house value find out",3
"pinochle round house value",3
"house value bartlett",3
"house value zilo",3
"how can i increase the value of the house",3
"house value estimater",3
"www house value finder com",3
"upper marlboro md value my house",3
"what is a rateable value of my house in leicester",3
"free house value by address",3
