keyword,count
"house value",106691
"value house",45746
"value of my house",3969
"house market value",2772
"value of house",1934
"value of your house",1369
"house value worth appraisal",1064
"house value .com",932
"house property value",804
"maine house value",775
"my house value",775
"value of a house",722
"house value com",716
"www house value",711
"your house value",706
"free house value",698
"house of value",654
"house value university",542
"calculate house value",536
"random house value publishing",514
"house value calculator",502
"find house value",479
"value my house",477
"house value estimator",428
"house boats value",414
"what is the value of my house",413
"find the value of my house",397
"house value min",391
"house value estimate",368
"house value appraisal",334
"house value florida",312
"arizona house value",308
"rental value house",302
"minister27s fair rental house value",301
"value of house to sale",300
"determine house value",299
"free house value estimate",284
"free estimate of the value of my house",281
"online house value",278
"house fair market value",272
"can i sell a house more that appraised value",269
"home valuation finding house value",267
"value house prices",264
"high value house contents insurance uk",259
"appraised house value",258
"finding house value",255
"house value sold",253
"how to calculate house value",252
"house real estate value cartoons",251
"real estate reports house value appraisal",249
"trailer house value",247
"instant real estate reports house value appraisal",247
"salvage value house",246
"home improvement house value",246
"free instant house value",244
"cape cod house value",244
"free house value search",242
"value proposition house",242
"free online house value estimates",242
"business house real estate value cartoons",241
"homeowners house value",241
"comparison house value",241
"house market value houston",239
"estimate house market value",239
"finding house market value",238
"worth house value",238
"manchester ct average house value",237
"value house price comparisons",237
"median house value san diego",237
"pleasanton house value",237
"house value sold mechanicsville va",236
"house value lookup",236
"illinois dupage house value reduced floodplain firm change",236
"appraiser house value",235
"house value dallas",235
"neighborhood house value richmond va",235
"estimating house market value",234
"fayetteville2c north carolina2c house tax value",234
"median house value roselle2c nj",233
"reports house value appraisal",233
"apprasial vs house value",233
"house value inflation",233
"house appreciation value",233
"house appraisal bathroom value",233
"wood interior house value",233
"house value predictions 2005",232
"house value nj",232
"calculate house appreciation value",232
"27estimate house value",231
"place value house chart",231
"house value 18 deerfield avenue2c east hartford2c ct",231
"market value house 18 deerfield avenue2c east hartford2c ct",230
"estimating house value",230
"home additions added house value",229
"gerrards cross house value",229
"power pole house value depreciation",228
"calculate market value of house",227
"house values home value",227
"value of smoke free house in real estate",227
"calculator house values home value",227
"comparable house value",227
"value my house online",227
"finance house for more than appraised value",226
"free house value comparables",226
"postcode house value",225
"chorley house value 1994",225
"house value 26 salary",224
"find the value of a house",223
"increase value of house",223
"value white house vinegar jug hemingray onion",223
"most common house value manchester ct",223
"what adds value to you house",222
"value house in w st paul mn",220
"house value by tax number",219
"increasing the value of a house",218
"value of green house gas market",218
"replacement cost value on a house",218
"does house bolting increase the value of the home",217
"appraised value of my house",216
"see the value of your house",216
"estimate on house value",215
"increase value of your house",215
"looking for the value of a house",215
"appraised value of house",214
"value of green house gas markets",214
"house of value furniture catalog showroom",214
"house fair market value in wisconsin",214
"does crown molding increase the value of a house",213
"what27s my house value in stony plain2c alberta",213
"fair market value of house in dayton ohio",213
"house value and free",212
"renovations and house value",212
"does a garage add value to a house",211
"apprasial lower than house value",211
"lindenhurst tax and house value",211
"what improvments add value to house",210
"house of value south san francisco",210
"value+of+my+house",210
"house value in wellington florida",209
"how to increase the value of your house",208
"my neighbors house value",208
"how to increase house value",207
"how to find the fair market value for your house",198
"how to find out the value of your house",197
"how to improve the resale value of your house",195
"what is appraisal value of house",195
"estimate house value",171
"find value of house",171
"house value finder",166
"find the value of your house",140
"market value of house",124
"release value house",122
"house market value san jose",118
"www house value com",115
"house sale value san jose",115
"rebuild value of my house",114
"house value appraisal san jose",111
"calculate house value san jose",107
"real estate house value",105
"house sale value",104
"house property value san jose",103
"value of house san jose",102
"house value finder san jose",100
"house value hunt",100
"market value house san jose",100
"find house value san jose",93
"house value estimate san jose",91
"house value estimates",89
"house appraisal value",80
"house value report",80
"house value check",71
"increase house value",70
"which home improvements add the most value to a house",65
"instant house value",65
"what is my house value",63
"the value of my house",62
"apprasied value on house",61
"random house value publishing inc",59
"whats my house value",58
"com house value",57
"increase value house",56
"find house value uk",56
"house value uk",55
"maryland house value",53
"find value house",52
"florida house value",52
"market value of my house",50
"any house value",49
"whats the value of my house",47
"house resale value",46
"house rebuild value for insurance",46
"house value calculators",45
"free house value report",45
"house+value",44
"tucson house value",44
"house value tools",44
"market value house",43
"house value online",42
"value your house online",40
"find your home value house values and prices on",40
"house value line passage doorknob",39
"house and value",39
"white house cookbook value",36
"add house value",36
"minnesota house value",35
"find my house value",35
"atlanta house value",34
"value your house",34
"house market value check",34
"selling your house market value",34
"increase the value of your house",33
"value house trailers",33
"new jersey house value",33
"house tax value",33
"house value estimation",32
"find a house value",32
"free house market value",31
"find out the value of your house",30
"austin below house in market sale value",29
"value smoke free house real estate",28
"current house value",28
"find your home value, house values and prices on",28
"house value california",28
"house value by address",28
"free house value calculator",27
"check house value",27
"house value free",27
"estimate the value of my house",27
"appraised value house",27
"adds value house",26
"adding value to my house",26
"house trailer value",26
"nj house value",25
"retail gift cards stored value in house",25
"house insurance high value contents",24
"value green house gas markets",24
"market value of a house",24
"appraisal value of house",24
"how to improve house value",24
"neighbors house value",24
"north carolina house market value",24
"house value  com",23
"what27s house value stony plain2c alberta",23
"house value address",23
"how to value a house",23
"adding value to a house",23
"martindale house value",23
"house value . com",23
"house value tax number",22
"the house on value street",22
"replacement windows effect on house resale value",22
"best value house insurance",22
"house value in martindale",21
"house value sancarlos",21
"house value appraisals",21
"new york house value",21
"house value wellington florida",21
"house value comparison",21
"increasing value house",21
"find fair market value house",21
"house value line double cylinder deadbolt",21
"how to value my house",20
"value house st paul mn",20
"sell house appraised value",20
"house rental value purchase price",20
"adding value to house",20
"pennsylvania house value",20
"value house online",20
"what was the fair market value of my house in 1998",20
"improve the resale value of your house",20
"fair house market value",20
"los angeles house value",20
"house value estimators",20
"washington dc house value",20
"looking value house",19
"appraisal house value",19
"house value ca",19
"estimate free house value",19
"garage add value house",19
"house price value",19
"find value of my house",18
"value house sale",18
"common house value manchester ct",18
"house online value",18
"estimator house value",18
"lancaster house value",18
"yard fence and value of house",18
"value my house in uk",18
"determine your house value",18
"house value in pennsylvania",18
"value green house gas market",17
"how to add value to your house",17
"house value website",17
"house value worth",17
"find the fair market value for your house",17
"free estimate value house",17
"house value in lancaster",17
"crown molding increase value house",17
"how much is my house value",17
"house+market+value",17
"increase the value of a house",17
"assessed house value",16
"value my house uk",16
"house value speculation",16
"add value to house",16
"how to improve the value of your house",16
"finance house appraised value",16
"appraisal value house",16
"stone house r value",16
"increasing house value",16
"house bolting increase value home",16
"house fair market value wisconsin",16
"house assessment value in fishkill ny",16
"radon and house value",16
"improve house value",16
"exterior painting increase the value of the house by percent",16
"median house value",15
"free house value estimates in phoenix az",15
"improve resale value house",15
"house value reports",15
"how to determine a house value",15
"find my house value for free",15
"house value power lines",15
"house value online instant free",15
"msn house value",15
"improving house value",15
"how add addition add value to house",15
"free house value estimator",15
"house value south san francisco",14
"value of house free",14
"yahoo house value",14
"value of the book wild flowers homer house macmillan 1936",14
"replacement windows resale value of house",14
"exterior painting add up percent the value of the house",14
"where can i find the value of my house",14
"random house value publishing incorporated",14
"house value utah",14
"value fencing yard add house",14
"replacement cost value house",14
"find the value of your house free",14
"free house value speculation",14
"compare house value",14
"find out value of my house",13
"what is value of my house",13
"check the value of my house",13
"fair market value house dayton ohio",13
"county court house value des moines post card",13
"zilla house value",13
"apprasial lower house value",13
"see value house",13
"how much does a garage add to the re-sale value of a house",13
"how to add value to a house",13
"popcorn ceiling house value",12
"broward county house value",12
"increase the value of house",12
"house value arizona",12
"value new house",12
"rateable value house leicester",12
"free house value instant",12
"is your house worth more than its appraised value",12
"tax value house",12
"percentage of increasing house value",12
"102 canon morrison co house value",12
"free house value online",12
"value price of american cowboy 1975 oxmoor house inc.",12
"st cloud house value",12
"get house value",12
"house value guide",12
"average house value equal",12
"house value search",12
"worcester massachusetts house sold value",12
"house value web sights",12
"how to value your house",11
"value house 226 senn street west columbia south carolina",11
"appraised value of a house",11
"house value oklahoma homeowners",11
"average house value per city",11
"fair market value of house",11
"chicago title house value",11
"approximate house value",11
"house value comparisons",11
"do mold affects house value",11
"1899 white house cookbook value",11
"home house value",11
"house value com.",11
"house extensions adding value",11
"find free house value report",11
"house nj value",11
"calculate value of a house",11
"area house in value",11
"house value web page",11
"value of white house vinegar bottles",11
"house market value laval",11
"neighborhood house value",10
"how to increase value on a house",10
"value house management",10
"fair market value for house",10
"instant estimate of house value",10
"free house value sites",10
"house value in phoenix",10
"renovations house value",10
"remodel house value",10
"house value history",10
"exterior painting affects the value of the house",10
"california house value",10
"house value canada",10
"value ceiling new house",10
"check your house value",10
"house value increase wayne county pa",10
"how to determine the appraisal value of your house",10
"calculate market value house",10
"how to increase the sell value of your house",10
"what is the property value of my house",10
"how to know the house value",10
"house neighbor value",10
"lindenhurst tax house value",10
"exterior painting recoup the value of the house",10
"free calculate house value",10
"house instant value",10
"value of my house in uk",10
"used house boat value",10
"house increasing value",10
"canada house value",10
"exterior painting recoup the value of the house by percent",10
"house jose property san value",10
"house value websites",9
"house value in mombassa",9
"search nationwide house value",9
"house blue book value",9
"tips to increase value of house",9
"finding the value of your house",9
"geelong suburbs by house value",9
"house value marion ohio",9
"how to find house value",9
"website house value",9
"how to determine house value",9
"house value apprasil",9
"how much should i value my house",9
"house value furniture catalog showroom",9
"house maryland value",9
"adding value to your house",9
"estimating the value of a house",9
"average house value by state",9
"free house value com",9
"house value 353 rugby rd brooklyn 11226",9
"house value in venice los angeles",9
"house value store",9
"house value free report",9
"zillo house value",9
"house value hutchinson minnesota",9
"what is the market value of a house",8
"property value of a house in carrolton texas",8
"house market value free",8
"house sold value",8
"house value addresses",8
"house comp value",8
"house rental value versus purchase price",8
"zip code house value",8
"wooden house value per square foot in north florida",8
"chase bank house value",8
"house need value",8
"value of our house",8
"house value plano",8
"how much will molding increase the value of your house",8
"determine value of house",8
"cnn report on house value 2005",8
"house market value rancho cucamonga",8
"how muck molding raises the value of your house",8
"value play rent house analyzer",8
"lorain county find the value of someones house",8
"buying house market value",8
"find the the market value of a house",8
"""free instant house value""",8
"calculator house value",8
"house value . com 3119 pinehurst dr. montgomery al.",8
"finding your house value",8
"real estate value find my house",8
"wooden house value in florida",8
"see house value",8
"house min value",8
"belle haven average house value",8
"average house value in san diego 2006",8
"how to add value to you house",8
"house value no agent",8
"instant house value free",8
"value of my house for free",8
"house value free instant",8
"website finding the value of the house",8
"improvments add value house",8
"divorce value of house determined",8
"how to up the value of a house",8
"prince georges county house value",8
"house value in mn",8
"what the value of my house",7
"property value of house",7
"estimate my house value",7
"house value in dallas for four bedroom",7
"house value calgary",7
"know the value of your house",7
"appraisal vs house value",7
"do replacement windows add value to house",7
"i am looking for a value on a paticular house",7
"house value oklahoma",7
"garden added value house",7
"free online house market value laval",7
"house value increases wayne county pa",7
"the house value",7
"fair market value on house",7
"house value free appraisal",7
"random+house+value+publishers",7
"determine mls market value house",7
"house value and tax",7
"house home value valuation free",7
"house value scom",7
"free online laval house market value",7
"find value of a home house",7
"san diego house value",7
"house value power lines 2006",7
"house value, estimate",6
"house value near factorys",6
"house value 9611 podium drive vienna virginia",6
"house value depreciation",6
"value of penniman house",6
"median house value avalon park chicago",6
"how do i lookup my house assessed value",6
"house value 9611 polium drive vienna virginia",6
"market value of a house in fairview north carolina",6
"my book house treasure chest 1920 value",6
"how add addition add house value",6
"value house of 1957",6
"free house value comparable",6
"house value corny point",6
"how much house painting increases value of the house",6
"zillion house value",6
"olympia median house value 2005",6
"exterior condition decreases value of the house",6
"fair market value of a house",6
"house value colorado springs",6
"waymart pa median house value 2004",6
"how much exterior condition affects value of the house",6
"''''increase house value projects '''' uk",6
"find out the appraise value of a house free",6
"house value ann arbor",6
"average house value in san diego july 2006",6
"1984 house value",6
"find value of house by address",6
"whole house r value",6
"house value zillow",6
"house value in columbus ohio",6
"how much molding raises the value of your house",6
"fair market value free house rating",6
"online house value assessment",6
"want to know the value of my house",6
"house increase value",6
"house value site",6
"increase in house value due to siding",6
"what is the value of my house real estate",6
"calculate r value house",6
"how to find fair market value for a house",6
"street address house value",6
"steubenville house value",6
"colorado springs co house value",6
"house value in las vegas",6
"free house comparison area value",6
"house value,com",6
"current value of our house",6
"value of whole house surge protectors",6
"baltimore county clerk house value",6
"determining house value",6
"how to find the value of your house",6
"estimate value of house",6
"www value house .com",6
"what is the market value on a house",6
"value new house ceiling cost heat loss",6
"stoneridge complex kings highway price house value",6
"house value appraissal",6
"house value nworlando area",6
"house value calculater",6
"average value house coronado dr spring hill fl",6
"increasing the value of your house",6
"value of a bathroom in house sale",6
"add addition add value to house",6
"value house seattle",6
"house value wood",6
"house value philly",6
"free estimate of house value",6
"home improvement add value to house",6
"median house value in vancouver washington",6
"finding market value of house",6
"auditor county house madison value",6
"house value coupon codes",6
"sell house value",5
"value of a trailer house",5
"house value tax calculator",5
"how can i value my house",5
"the future house value",5
"how do you find the value of a house",5
"place value house",5
"what increases the value of a house",5
"finishing basement to house increases value",5
"value my house for free",5
"house value public records",5
"finding out value of neighbors house",5
"house value cpm",5
"small house big lot value",5
"my house value com",5
"house value online company with name beginning with z",5
"house value black hawk county",5
"value white house vinegar jug hemingway onion",5
"house purchase price deduction for diminution in value",5
"house value on neighborhood",5
"how to raise the value of the house",5
"house r value installation",5
"how to find the value of a existing house",5
"compute market value house",5
"house value across states",5
"house value in atlanta",5
"house value 1991",5
"value any house",5
"whats it worth house value",5
"finish basement add value to house",5
"improving the value of your house",5
"average house value",5
"calculate house value 20",5
"home house value worth",5
"house value increase",5
"tax assessment formulas for house value",5
"pa house value",5
"house rateable value for area hp2 6lb",5
"value of a house in florins in the 1700 period",5
"commerce city, co house value",5
"house value domina",5
"house value weite",5
"area median house value",5
"sheridan wyoming house rental value",5
"house value today",5
"how to add value to house",5
"historical house appreciation value",5
"home value buying house",5
"estimate value house",5
"find out your house value",5
"northridge house market value",5
"how can i findout the value of my house",5
"free house online value",5
"my house value canada",5
"house value zillo",5
"value of adding a bedroom to your house",5
"house of value furniture",5
"house value in states",5
"house value zip code",5
"house value phoenix",5
"assessing house value",5
"value house furniture",5
"low ceilings house value",5
"house value memphis",5
"what is the market value of my house",5
"how to find out the value of my house",5
"figuring house value",5
"arizona house bill value options",5
"merkel tx house value",5
"burlington wisconsin house value",5
"free house value reports",5
"random house value publishers",5
"trees ugly dying house value",5
"house value butler wi",5
"how to get the better value for a hud house",5
"house value based on virginia tax assessment",5
"house value 380 west boston hinckley ohio",5
"house value in wlanut creek",5
"cf church house active value fund",5
"value of you house",5
"how to improve value of a house",5
"median house value year 2005 butte mt",5
"high value house insurance",5
"house value calculate",5
"current value of house",5
"property value of a house",5
"quick house value online",5
"estimate r value house",5
"""house value"" and free and online",5
"find the value of my house in tucson arizona",5
"home house value cost",5
"instant value of house",5
"tax value of house",5
"prince frederick md value my house",5
"house value in salinas california",5
"value of dishes made in patoral, japan, logo harmony house",5
"factors affecting house value",4
"house value using satellite",4
"what should the r value in the roof of house",4
"search house value assessment",4
"value house dot",4
"resale value on trailer house",4
"house for place value",4
"determining value of house",4
"building a house features for resale value",4
"quick house value",4
"house value in my area",4
"value for house",4
"what my house value",4
"my book house 1920 indevual value",4
"house value comm",4
"value of house after addition",4
"how much value does hardwood flooring add to a house",4
"house value texas",4
"house value online calculator",4
"hillsborough county house value",4
"what is the fair market value of my house",4
"house value web sites",4
"optimum value engineered house",4
"find your house value",4
"add value to house 20",4
"house address market value",4
"how to add value to my house",4
"sheds adding value to a house",4
"gottlieb haunted house pinball machine value",4
"house value burnaby bc canada",4
"house value sites",4
"my book house 1920 value",4
"zip house value",4
"nutritional value of house salad",4
"denver house value",4
"what features can boost the value of a house",4
"average house value in san diego",4
"my house value jacksonville",4
"house value and finished basement",4
"house state value washington",4
"finding property value of house with address",4
"logan county ohio house value",4
"want to know the value of my neighbor house",4
"value house color bungalow cottage",4
"107 new haven texas house value",4
"house value on current market",4
"house value spartanburg county",4
"house value newbridge ireland",4
"the assessed value on a house",4
"instant house value appraisal",4
"value of the house",4
"find out house value",4
"value of house at 9405 tiller dr. ellicott city md",4
"putting guardrail in front of house decreases value",4
"exterior painting reduces the value of the house",4
"texas house property value",4
"value of loon lake house dishes",4
"house r value",4
"calculate the rental value of a house",4
"value of a house increasing",4
"house rice value",4
"things that add value to your house",4
"add house value with addition",4
"assessed value on repo house",4
"does lament flooring add value to a house",4
"add a garage to increase the value the house",4
"uk house value search",4
"house value based on tax assessment",4
"selling home house value",4
"house value finder .com",4
"house value just listed.com",4
"fair market value vs appraised value house",4
"divorce house fair market value",4
"house market value and free and washington",4
"how to increase your house value",4
"house value by zip code",4
"rented house next door value",4
"house value increase city price list",4
"how do i find the value of my house",4
"where can i find the value of a house",4
"house value in gurnee illinois",4
"house value dy",4
"archives property value of house in queens n y",4
"finding the value of my house",4
"subdivision amenities affect house value",4
"exterior painting adds percent to the value of the house",4
"house value z",4
"house value in walnut creek",4
"''''house market value",4
"free house propety value",4
"house value in sc",4
"fire damaged house resale value",4
"property value of my house",4
