keyword, count
"learning disability",71269
"nonverbal learning disability",6005
"learning disability program",3137
"learning disability software",2891
"non verbal learning disability",1691
"alexander graham bell learning disability",1180
"learning disability scholarships",1079
"learning disability testing",1057
"comes disability it learning legislation litigation when",1018
"disability health hygiene learning oral plan promotion",1009
"learning disability time line",924
"journal of learning disability",908
"specific learning disability",882
"adult learning disability",856
"learning disability association",799
"famous people with learning disability",705
"learning disability quarterly",646
"learning disability tests",643
"the history of learning disability timeline",598
"texas state learning disability",568
"child learning disability",556
"learning disability disabilities nonverbal",537
"learning disability article",491
"learning disability lesson plan",491
"definition of learning disability",474
"learning disability assessment",466
"celebrity with learning disability",425
"learning disability dyslexia",389
"learning disability in child",362
"adult learning disability testing",356
"cause of learning disability",340
"language based learning disability",327
"learning disability statistics",323
"learning disability grants",319
"math learning disability",318
"tom cruise learning disability",314
"online learning disability nsw",308
"language learning disability",294
"teenage 2b depression 2b family 2b learning disability",294
"learning disability diagnosis",290
"non-verbal learning disability",289
"what learning disability did tom cruise suffer from",288
"learning+disability",285
"what learning disability does tom cruise suffer from",277
"tom cruise 2b learning disability",273
"diagnosing learning disability",263
"college for student with learning disability",259
"teaching student with learning disability",257
"college learning disability",256
"adult learning disability information",255
"student with learning disability",250
"adhd and learning disability",249
"learning disability scholarship",248
"teaching child with learning disability",246
"gifted child with learning disability",243
"characteristic of learning disability",242
"disability georgia in learning profound",241
"softball learning disability home run",238
"adult learning disability vermont",237
"find a colleges for people that have learning disability",236
"birth injury and learning disability",235
"disability learning scholarship",231
"learning disability resource",224
"home school with learning disability",222
"schools for learning disability",222
"learning disability math",219
"learning disability research",219
"software for school children who have a learning disability",219
"learning disability and increasing reading fluency",213
"learning disability denver",213
"combination disability hearing impaired in learning",212
"fat cat video for learning disability",211
"learning disability portland",206
"article disability journal learning",205
"learning disability uk",203
"learning disability school",202
"learning disability salt lake city",201
"type of learning disability",197
"learning disability association of america",195
"learning disability technology",195
"teaching learning disability",194
"case disability learning study",191
"learning disability association of canada",191
"assessment disability independent learning verbal",186
"learning disability research and practice",186
"nonverbal learning disability disorder",183
"national center for learning disability",181
"special education learning disability",179
"council for learning disability",176
"disability learning online",172
"disability learning strategy student teaching",172
"learning disability association of ontario",168
"college disability learning scholarship student",165
"conference disability learning",164
"auditory disability learning",163
"learning disability online",161
"disability game learning",159
"learning disability add",157
"boarding schools learning disability",154
"disability learning scholarship student",154
"learning disability ontario",149
"learning disability and social skill",147
"learning disability canada",147
"diagnosis nonverbal learning disability",145
"history of learning disability",145
"learning disability teacher consultant",145
"learning disability center",143
"coach disability learning nonverbal",140
"learning disability special education",139
"learning disability test",139
"learning disability reading",138
"different type of learning disability",137
"learning disability teaching strategy",137
"severe learning disability",137
"boarding disability learning school",135
"learning disability strategy",135
"reading learning disability",135
"gifted education learning disability",134
"prentiss school learning disability",134
"disability learning simulation",133
"lesson plan student learning disability",133
"association canada disability learning",131
"disability effects esteem learning self",131
"kid with learning disability",130
"law learning disability",130
"learning disability schools",130
"mathematics learning disability",130
"florida learning disability schools",129
"boston disability learning math university",127
"disability kid learning smart",126
"learning disability conference",126
"education and learning disability",125
"what is a learning disability",125
"learning disability specialist training",122
"case study learning disability",121
"self esteem learning disability",120
"disability kc learning school",119
"national institute for learning disability",119
"learning disability home school",118
"learning disability teacher",118
"child book about learning disability",116
"disability learning ontario",116
"compliance disability inclusion learning teacher",115
"learning disability education",115
"learning disability prevention",115
"spina bifida and learning disability",113
"disability fact learning",112
"journal article on learning disability",112
"learning disability testing florida",112
"some type of learning disability",111
"dyslexia learning disability",110
"learning disability web site",110
"test for learning disability",110
"assessment disability learning verbal",109
"definition for learning disability",109
"learning disability college",108
"nursing student with learning disability",108
"college grants learning disability",106
"disability learning severe",105
"learning disability definition",104
"learning disability specialist",100
"movie about learning disability",100
"nonverbal learning disability teen",99
"learning disability great britain",98
"learning disability ontario summer camp",98
"scholarship learning disability",98
"disability esteem learning low self",97
"disability inclusion learning",97
"disability learning type",95
"organizational learning disability",93
"canada disability learning",92
"disability learning maryland school",92
"disability learning modification",92
"meeting the needs of those with a learning disability",91
"college disability learning scholarship",89
"disability learning student teaching",89
"disability learning music school",88
"disability kid learning",87
"disability learning statistics",87
"disability learning symptom",87
"nonverbal learning disability adolescent",85
"colorado disability grant learning",84
"college community disability learning program",83
"learning disability organization",83
"learning disability program college",83
"learning disability writing",82
"blog child disability learning",81
"learning to read with mental disability",80
"nonverbal learning disability readings",80
"nursing in learning disability journals",80
"disability learning nurse role student",79
"case disability learning student study",78
"learning disability scolarships",77
"disability gifted learning",74
"learning disability law",74
"learning disability information",70
"learning disability resources",70
"albert disability einstein learning",67
"learning disability awareness quiz",67
"bifida disability learning nonverbal spina",66
"teacher learning disability",66
"school for learning disability",65
"learning disability sensitivity activities",64
"accommodation disability learning",63
"define learning disability",63
"disability learning picture",63
"learning disability book",62
"college student with learning disability",61
"learning disability journal",61
"learning disability articles",60
"symptom of learning disability",60
"disability history learning",59
"disability learning memory",59
"correcting disability learning",58
"national institute of learning disability",58
"disability learning",57
"disability grant learning",56
"disability learning lesson plan student",56
"learning disability help",56
"different disability learning type",55
"disability in learning math",54
"disability learning media otitis",53
"dyspraxia learning disability",53
"verbal learning disability",53
"albert einstein and learning disability",52
"association disability learning ontario",52
"child disability learning picture",52
"learning disability job",52
"disability learning private school",51
"learning disability journal article",50
"add learning disability",49
"learning disability coherence",49
"child disability learning school",47
"disability learning near school tampa",47
"disability learning strategy teaching",47
"people with learning disability",47
"article on learning disability",46
"disability learning perception visual",45
"college disability learning program",44
"disability essay learning",44
"learning disability aids",44
"learning disability in early childhood education",43
"learning disability reference",43
"article child disability learning",42
"help for learning disability",42
"on line learning disability",42
"disability learning site web",41
"learning and disability",41
"study skill with a learning disability",41
"auditory learning disability",40
"disability learning people",40
"learning disability diagnostic criteris",40
"adhd learning disability",39
"care disability home learning",39
"learning disability visual",39
"non verbal learning disability allergies",39
"albert einstein learning disability",38
"simulation learning disability",38
"activity disability learning",37
"learning disability nursing",37
"book on learning disability",36
"constipation in the learning disability person",36
"cruise disability learning tom",36
"information on learning disability",36
"learning disability adult",35
"learning disability practice",35
"disability instructional learning strategy",34
"learning disability tom cruise suffer",34
"learning disability children tests for assessments",33
"consultant disability learning teacher",32
"disability gifted learning student",32
"disability learning treatment",32
"home school learning disability",32
"child with learning disability",31
"disability job learning nursing",31
"learning disability boarding school",31
"special education or learning disability",31
"child disability help learning",30
"college scholarship for student with learning disability",30
"definition learning disability",30
"disability holiday in learning supported uk",30
"sign of learning disability",30
"city disability fat learning",29
"disability iq learning",29
"learning disability tutors",29
"miami learning disability counseling",29
"mild learning disability",29
"specific learning disability reading",29
"teen learning disability",29
"diagnosis of learning disability",28
"disability learning poem",28
"independent verbal learning disability assessment",28
"activity child disability learning",27
"book disability learning",27
"disability learning strategy student study teaching",27
"language and learning disability",27
"verbal learning disability assessment",27
"america disability learning",26
"adult with learning disability",25
"behavior child disability learning problem",25
"child disability learning strategy teaching",25
"disability esteem learning self",25
"jobs learning disability",25
"learning disability causes",25
"learning disability games",25
"learning disability websites",25
"children and omega 3 learning disability",24
"disability education individual learning resource",24
"disability learning nonverbal school",24
"learning disability educational software fast forward",24
"learning disability memory",24
"scholarship for learning disability",24
"attention deficit disorder and learning disability",23
"fat cat video learning disability",23
"home schooling child with learning disability",23
"learning disability for gifted",23
"nonverbal+learning+disability",23
"sample ieps for a student with a learning disability",23
"accommodation child disability learning strategy",22
"assessment disability learning",22
"education learning disability adults",22
"georgia colleges with learning disability programs",22
"learning disability symptoms",22
"statistics on learning disability",22
"teaching child of learning disability",22
"what is profound learning disability",22
"applying to college, letter explaining learning disability",21
"criterion disability learning",21
"definition disability federal learning",21
"disability disability disabled learning learning learning",21
"journal article about learning disability",21
"journal learning disability",21
"learning disability colleges",21
"learning disability lesson plans",21
"nonverbal learning disability and neurofeedback",21
"ohio department of education and learning disability",21
"online learning disability tests",21
"book child disability learning",20
"disability education gifted learning",20
"learning disability overweight",20
"majicjohnson learning disability",20
"manchester learning disability",20
"alberta disability learning",19
"disability learning line",19
"disability learning resource",19
"hearing disability software for spanish language learning",19
"home schooling and learning disability",19
"learning disability and teen",19
"learning disability association of alberta",19
"learning disability increasing reading fluency",19
"learning disability services",19
"short term memory and learning disability",19
"visually related learning disability",19
"angeles disability in learning los resource",18
"association bc disability learning",18
"auditory disability learning processing",18
"learning disability and loss",18
"learning disability camp",18
"learning disability centers san francisco",18
"magic johnson learning disability",18
"new york learning disability counseling",18
"non-verbal learning disability assessment",18
"academy disability in international learning research",17
"berkshire school learning disability",17
"cognitive disability learning",17
"conducting independent verbal learning disability assessment",17
"learning disability diagnosis austin texas",17
"software school children learning disability",17
"atlanta learning disability counseling",16
"birth injury learning disability",16
"career counseling with learning disability students",16
"categories of learning disability",16
"disability care home learning",16
"disability educating learning student",16
"disability goal learning objective",16
"disability learning theory",16
"learning disability hereditary",16
"learning disability in reading",16
"learning disability nurse",16
"learning disability placement options",16
"math teaching methods for learning disability",16
"private high school learning disability",16
"teaching strategy for learning disability",16
"tom cruise and learning disability",16
"tommy hilfiger and his learning disability",16
"westmark school for learning disability",16
"bbc learning disability",15
"case child disability learning study",15
"child disability home learning schooling",15
"college+for+student+with+learning+disability",15
"(community living learning disability and legislation) and (legislation governing community care)",15
"curriculum disability home learning school writing",15
"disability disorder learning nonverbal",15
"disability home learning schooling",15
"disability learning strategies",15
"disability learning tracking visual",15
"employment with learning disability",15
"history learning disability timeline",15
"info of albert einstein and his learning disability",15
"learning disability alphabet",15
"learning disability centers in providence rhode island",15
"learning disability grants for college",15
"learning disability reading aloud",15
"learning disability services for american indians",15
"learning disability video",15
"4000 learning disability software",14
"child disability learning teaching",14
"disability learning resource teacher",14
"federal definition of learning disability",14
"find colleges people learning disability",14
"gaining admission to college with a learning disability",14
"how to request a learning disability assessment",14
"learning disability and the law",14
"learning disability dyslexia davis",14
"learning disability products",14
"learning disability simulation",14
"learning disability written expression",14
"nonverbal learning disability and iq",14
"adult disability housing learning organisations supported",13
"aid disability financial learning student",13
"a learning disability",13
"child disability learning",13
"child disability learning teach",13
"child with a learning disability",13
"disability learning medication",13
"disability learning nonverbal",13
"disability learning organizational",13
"epilepsy patients learning disability",13
"executive function learning disability",13
"gifted add learning disability",13
"high school diploma + learning disability",13
"how difficult can this be f.a.t city a learning disability",13
"jobs for people with learning disability",13
"learning activities for children with a speech disability",13
"learning disability accommodation",13
"learning disability centers in milwaukee wi",13
"learning disability evaluation request letter",13
"learning disability san jose cal school",13
"lesson plan for student with learning disability",13
"schools for child with learning disability",13
"teen summer camp learning disability",13
"what is the learning disability od",13
"activities learning disability",12
"characteristics of a specific learning disability",12
"colleges with learning disability programs",12
"csm learning disability programs",12
"daniel reed learning disability testing",12
"day services for learning disability",12
"disability florida learning",12
"disability learning mathematics",12
"disability learning spelling",12
"famous people learning disability",12
"higher incidence of pregnant students with a learning disability",12
"homework help learning disability",12
"learning disability for kids understanding",12
"learning disability free help canada",12
"learning disability in mathematics",12
"learning disability services uk",12
"learning disabled or learning disability or learning",12
"newspaper article on learning disability",12
"smart kid with learning disability",12
"specific learning disability defined",12
"specific nonverbal learning disability",12
"visual perception learning disability",12
"adolescent disability language learning",11
"all wales strategy learning disability 1984",11
"anxiety disability learning",11
"bilingual learning disability",11
"caring skills for learning disability practice",11
"child disability does have learning",11
"child disability learning parent",11
"children with learning disability",11
"classroom disability learning recorder tape use",11
"difference between reading disability and learning",11
"disability education and learning aids",11
"disability institute learning national",11
"federal definition learning disability",11
"graphic organizer and learning disability",11
"is add a learning disability",11
"learning disability 20",11
"learning disability in math",11
"learning disability in school age children journal articles",11
"learning disability nursing job",11
"munchausen by proxy learning disability",11
"sra corrective reading research learning disability",11
"student learning disability",11
"support worker for learning disability in uk",11
"test learning disability",11
"unicef care for learning disability",11
"25% patients with epilepsy learning disability",10
"adult city disability ged in learning new program york",10
"alberta canada child disability in learning private school",10
"article on child with learning disability",10
"child learning disability literacy lesson plan",10
"children learning disability",10
"committee disability joint learning national",10
"coping with a learning disability",10
"disability learning summit",10
"dyslexic learning disability",10
"famous people with a learning disability",10
"gifted learning disability",10
"independent non verbal learning disability assessment",10
"jobs within learning disability nursing",10
"learning computer repair for people on disability to go back",10
"learning disability association canada",10
"learning disability colleges programs i",10
"learning disability facts",10
"learning disability health promotion",10
"learning disability history theory",10
"learning disability symotoms",10
"learning disability today",10
"measuring learning disability",10
"non verbal learning disability assessment",10
"services for the learning disability",10
"specific learning disability and staying on task",10
"support worker,uk, learning disability",10
"what does a learning disability nurse do",10
"what is learning disability",10
"what is walt disney 's learning disability",10
"work shop on learning disability",10
"alberta calgary disability in kid learning public school",9
"article disability learning magazine",9
"aspergillus learning disability",9
"association disability learning texas",9
"best child disability function learning",9
"bowie state university learning disability program",9
"carer,uk, learning disability",9
"case study on learning disability",9
"college disability learning",9
"conducting independent verbal learning disability",9
"daniel reed math learning disability testing",9
"disability learning online test",9
"disability learning software",9
"do i have learning disability quiz",9
"holidays learning disability",9
"how many children have a learning disability statistics",9
"identification of learning disability",9
"jobs for learning disability people",9
"kindergarten learning disability",9
"learning disability activity",9
"learning disability and foreign language",9
"learning disability ashford",9
"learning disability awards framework",9
"learning disability foreign language learning",9
"learning disability for elderly",9
"learning disability identification",9
"learning disability psychological freeware",9
"learning disability services in college",9
"learning disability testing daytona beach",9
"nonverbal learning disability pdd",9
"patients with epilepsy have learning disability",9
"reading and learning disability",9
"scholarship for student with learning disability",9
"schwab learning learning disability strategies",9
"specific learning disability definition",9
"sylvester stallone 's learning disability",9
"unicef learning disability in sittingbourne",9
"verbal or non verbal learning disability assessment",9
"visual learning disability",9
"association california disability learning",8
"association disability learning missouri",8
"auditory learning disability freeware",8
"behaviour modification learning disability",8
"boys vs girls with learning disability",8
"causes of learning disability",8
"child disability gifted learning",8
"college with learning disability program",8
"could my child have a learning disability",8
"disability education learning special specific",8
"disability job learning",8
"disability learning allowance",8
"disability learning teaching",8
"learning disability afflictions",8
"learning disability association of manitoba",8
"learning disability caused by specific brain injury",8
"learning disability counseling",8
"learning disability games online",8
"learning disability handout",8
"learning disability in children",8
"learning disability journals",8
"learning disability modification",8
"learning disability nurse jobs",8
"learning disability nursing in norfolk",8
"learning disability nursing vacancies",8
"learning disability physical restraint policy",8
"learning disable disability",8
"leaving son or daughter with learning disability out of the",8
"legislation relevant to learning disability practice",8
"lesson plan about learning disability",8
"magazine learning disability",8
"people with a learning disability",8
"schools learning disability",8
"school to help learning disability",8
"specidic learning disability",8
"stigma of learning disability",8
"strategy for student with learning disability",8
"teaching methods severe learning disability",8
"vcfs, learning disability research",8
"verbal or non-verbal learning disability assessment",8
"what is a learning leaning disability",8
"working memory program learning disability",8
"activities for teens with learning disability",7
"applying to college letter explaining learning disability to",7
"association disability learning nova scotia",7
"carolina child disability home learning north schooling",7
"characteristic child disability learning",7
"characteristics learning disability",7
"child curriculum disability home learning schooling",7
"children learning disability disgraph",7
"college for learning disability",7
"colleges+with+learning+disability+programs",7
"comprehension learning disability",7
"conducting independent non verbal learning disability",7
"critical reveiw parents with learning disability",7
"disability learning math reasoning research",7
"disability learning nassau",7
"disability learning testing",7
"dyslexia learning disability journal",7
"ectodermal dysplasia hypohidrotic learning disability",7
"emba new york learning disability",7
"famous people who have a learning disability",7
"for learning disability",7
"gifted learning disability self esteem",7
"how many children with learning disability in waltham forest",7
"jobs learning disability+",7
