keyword, count
"journal about children with learning disability",7
"learning disability alternative treatment",7
"learning disability com",7
"learning disability fluency reading",7
"learning disability internet tests",7
"learning disability learning styles",7
"learning disability materials",7
"learning disability oral expression what are the goals and",7
"learning disability parents",7
"learning disability picture bank",7
"learning disability thought process",7
"learning disability wisc-iv",7
"national population to learning disability index",7
"number of learning disability citizens",7
"protecting from abuse adults with a learning disability",7
"provision given to the learning disability clients in",7
"reading program for learning disability",7
"sandwell primary care trust learning disability",7
"test online diagnose learning disability testing",7
"types of learning disability",7
"vcfs learning disability research",7
"visual spatial construction learning disability",7
"agatha christie learning disability",6
"are great for kid with learning disability not everyone",6
"article childhood disability in learning middle",6
"association disability learning national",6
"berkshire learning disability",6
"books on learning disability",6
"bruce jenner learning disability",6
"canopy supported worker for learning disability",6
"canopy support worker for learning disability",6
"characteristic disability learning specific",6
"college of southern maryland learning disability",6
"college student with a learning disability",6
"comes disability it learning legislation litigatio",6
"definition disability learning specific",6
"definitions learning disability",6
"developing relationships in learning disability",6
"diagnosing disability learning",6
"disability and learning difficulties",6
"disability health learning sexual",6
"disability journal learning",6
"disability learning study",6
"dyslexia research new clues to learning disability found",6
"grants for children with learning disability",6
"history of people with learning disability in uk to the",6
"independent non-verbal learning disability assessment",6
"kinds of learning disability tests",6
"learning disability and fluency in reading",6
"learning disability and self esteem",6
"learning disability cause",6
"learning disability certification",6
"learning disability challenging behavior",6
"learning disability characteristics",6
"learning disability charity",6
"learning disability checklist",6
"learning disability college programs in maryland",6
"learning disability college scholarship",6
"learning disability employment scheme in hackney council",6
"learning disability in brighton",6
"learning disability info",6
"learning disability in hackney council",6
"learning disability nottingham",6
"learning disability nursing jobs",6
"learning disability oral expression goals and objectives",6
"learning disability partnership board",6
"learning disability psychotherapy",6
"learning disability school ontario",6
"learning disability testing ontario",6
"learning disability treatments",6
"lesson plan for learning disability",6
"ma independant school learning disability",6
"massachusetts learning disability boarding school",6
"msc learning disability",6
"multidisciplinary approach for learning disability",6
"national association for learning disability",6
"non verbal learning disability checklist",6
"nos learning disability",6
"obese learning disability",6
"oklahoma teaching degree learning disability",6
"older people with a learning disability and dementia",6
"older people with a learning disability what help is",6
"online+learning+disability+nsw",6
"pervasive learning disability",6
"picture of child with learning disability",6
"processing speed learning disability",6
"role of a learning disability nurse",6
"scholarships learning disability",6
"schools for kids with learning disability",6
"spcific learning disability",6
"strategy for teaching student with learning disability",6
"sylvester stallone has a learning disability",6
"the learning disability intervention manual 00320",6
"wisconsin learning disability testing",6
"young adult with learning disability",6
"about learning disability",5
"adhd disability learning",5
"adhd processing learning disability",5
"adult article disability learning",5
"adults with a learning disability",5
"advocacy learning disability",5
"article disability learning",5
"association disability learning",5
"auditory learning disability child",5
"bank disability learning people",5
"british institute of learning disability",5
"characteristic disability learning student",5
"child cons disability identification learning pro",5
"cognitive deficit in learning disability",5
"college scholarships for students with learning disability",5
"conducting independent non-verbal learning disability",5
"ct disability law learning",5
"cullum learning disability nurse",5
"definition learning disability australia",5
"department of health learning disability",5
"diagnose learning disability testing washington dc adults",5
"disability educational journal learning",5
"disability education learning special",5
"disability famous learning people picture",5
"disability fot holiday learning supported",5
"disability law learning",5
"disability learning minneapolis",5
"disability learning non verbal",5
"disability learning reading",5
"disability learning school",5
"disability learning some type",5
"disability learning test",5
"einstein learning disability",5
"entertainers who have a learning disability",5
"epilepsy patients patients learning disability",5
"fact about learning disability",5
"fighter pilot learning disability",5
"formal thought process learning disability",5
"free learning disability test",5
"gene testing for learning disability",5
"how to teach a child with learning disability",5
"independent non-verbal learning disability assessm",5
"jobs as learning disability nurse",5
"jobs learning disability people",5
"key competencies learning disability nurse",5
"kline and kline 1975 og learning disability",5
"language-based learning disability",5
"learning disability 6th grade",5
"learning disability accomodations",5
"learning disability and deliquency",5
"learning disability and diagnosis and adolescent and",5
"learning disability and how to assist",5
"learning disability and ssi",5
"learning+disability+association",5
"learning disability association conference hotel",5
"learning disability attention deficit disorder",5
"learning disability benefits",5
"learning disability college admission",5
"learning disability cooperative learning",5
"learning disability courses",5
"learning disability dislexia alberta",5
"learning disability famous people",5
"learning disability grant",5
"learning disability history",5
"learning disability iep",5
"learning disability in high school",5
"learning disability in kids",5
"learning disability physical education",5
"learning disability pratcice",5
"learning disability processing problems",5
"learning disability quick tests",5
"learning disability quiz",5
"learning disability scale",5
"learning disability schools orlando fl",5
"learning disability supplies",5
"learning disability teaching strategies",5
"learning disability tutorials",5
"learning disability wisc-r",5
"mississauga learning disability association",5
"modules on learning disability",5
"nj special education learning disability",5
"nonveral learning disability information",5
"nonverbal learning disability social security",5
"on line school for high schoolers with learning disability",5
"role of community learning disability nurse",5
"sdl learning disability",5
"starting kindergarden with a learning disability",5
"support group for learning disability",5
"technical school for learning disability students",5
"thomas edison with a learning disability",5
"tizard learning disability review 3",5
"top learning disability schools on long island new york",5
"top learning schools for child with disability in new york",5
"university 's modules on learning disability",5
"visual perceptual reasoning learning disability",5
"what is specific learning disability",5
"wisc-r test for learning disability",5
"york learning disability",5
"25% patients with epilepsy have learning disability",4
"a definition of learning disability",4
"adult disability learning test",4
"adult learning disability tutor",4
"agatha christiese learning disability",4
"agatha christies learning disability",4
"anger management mild learning disability",4
"arkansas learning disability",4
"arkansas+learning+disability+504+",4
"arkansas learning disability laws",4
"arkansas+learning+disability+laws",4
"article about learning disability",4
"article disability learning newspaper",4
"articles on learning disability",4
"asberger learning disability",4
"asburger learning disability",4
"auditory verbal learning disability",4
"blackpool learning disability partnership",4
"british psychological society learning disability",4
"brookline high school learning disability program",4
"carolina child disability home learning north schooling 20",4
"cause disability learning",4
"cause of nonverbal learning disability",4
"children s books learning disability",4
"christina milian learning disability",4
"colleges for people with learning disability",4
"communication and learning disability differences bewteen",4
"communication disorder versus a learning disability",4
"community college learning disability help",4
"community learning disability teams",4
"comparing nonverbal learning disability and adhd",4
"day centers learning disability brighton",4
"definition learning disability in new jersey",4
"diagnosis of learning disability in adulthood",4
"did albert einstein have a learning disability",4
"different learning disability",4
"direct disability learning payment",4
"disability fot holiday in learning supported uk",4
"disability grant learning loan student.html",4
"disability home learning school",4
"disability information learning services",4
"disability learning disabilities",4
"'disability learning materials' and canada",4
"disability learning organization",4
"disability learning quarterly",4
"disability learning video",4
"discipline for child with learning disability",4
"early intervention for people with learning disability",4
"eastbourne adult learning disability team",4
"effectiveness of care planning in learning disability",4
"estimation of mild learning disability population",4
"exercises for children learning about learning disability",4
"finacial aid for student with learning disability",4
"foreign language learning disability",4
"free lawyer for child with learning disability in pa",4
"guide to a good assessment for learning disability",4
"hackney social services learning disability",4
"hemolytic uremic syndrome learning disability",4
"hospitals with learning disability facilities",4
"how having a learning disability influences health",4
"how to find a job for a learning disability charity",4
"i didn't know i had a learning disability",4
"i have a learning disability",4
"indicators of a learning disability",4
"interview regarding children with learning disability",4
"jobs for learning disability trained nurses",4
"lancashire council learning disability service",4
"law schools with learning disability programs",4
"learning disability advocacy groups",4
"learning disability and learning hereditary dis",4
"learning disability and mathematics",4
"learning disability and mental health",4
"learning disability and pressure sores",4
"learning disability and schizophrenia",4
"learning disability article 20",4
"learning disability association ontario",4
"learning+disability+asssociation",4
"learning disability award framework",4
"learning disability awareness week",4
"learning disability children",4
"learning disability diagnosticians houston",4
"learning disability disorder",4
"learning disability doctors in louisville",4
"learning disability dyscalculia nsw",4
"learning disability east bridgford",4
"learning disability educational tests",4
"learning disability emd",4
"learning disability enabling projects",4
"learning disability genetics",4
"learning disability graduate programs",4
"learning disability health assessments",4
"learning disability homes in staffs",4
"learning disability laws",4
"learning disability nursing pre admission assessment for",4
"learning disability organizations",4
"learning disability ottawa",4
"learning disability prayer poem",4
"learning disability questionnaire",4
"learning disability, reading",4
"learning disability + reading+ computer software",4
"learning disability resoucee centre london ontario",4
"learning disability school north carolina 12",4
"learning disability schools in ma",4
"learning disability service",4
"learning disability services milton keynes",4
"learning disability sex education magazines",4
"learning disability strategies color",4
"learning disability study skills",4
"learning disability support",4
"learning disability temper tamtrums",4
"learning disability temper tantrums",4
"learning disability testing in chicago area",4
"learning disability testing orlando",4
"learning disability vacancies",4
"learning disability vacancies in nhs",4
"looking for group home for poeple with learning disability",4
"math learning disability computer games",4
"money for a learning disability",4
"my learning disability",4
"neurotherapy learning disability visual therapy",4
"nhs learning disability",4
"nj definition of learning disability",4
"nj idea learning disability",4
"nj learning disability",4
"non specific verbal learning disability",4
"nonverbal learning disability adhd digeorge",4
"nonverbal learning disability adult teenager",4
"non-verbal learning disability impacting adults",4
"nonverbal learning disability infromation",4
"nonverbal learning disability summer camp",4
"nutrition learning disability",4
"nvq in learning disability",4
"older people with a learning disability",4
"ontario learning disability association",4
"opportunities for learning disability nurses in leicester",4
"parenting with a learning disability",4
"percent patients with epilepsy have learning disability",4
"person with a learning disability",4
"preschool learning disability",4
"private schools virginia learning disability",4
"processing disorder and specific learning disability",4
"reading comprehension learning disability",4
"reading learning disability 2005 assessment",4
"regarding learning disability",4
"registered residential care learning disability",4
"resources for the adult with nonverbal learning disability",4
"rick lavoie learning disability",4
"ritalin adhd learning disability stereot",4
"season of birth learning disability",4
"service user guide learning disability care home",4
"sound sensitive learning disability",4
"spatial and learning disability",4
"speech and language delays vs learning disability",4
"sport work with people with learning disability job in",4
"statistics of people with learning disability",4
"st john of gods centre for people with learning disability",4
"supported employment for people with a learning disability",4
"supported living learning disability",4
"supported worker for learning disability in uk",4
"syndromes associated with learning disability",4
"teaching a child with a learning disability",4
"teaching non verbal learning disability",4
"teaching students about their learning disability",4
"the learning disability center of maine",4
"thomas edison with learning disability",4
"tom cruise's learning disability",4
"tutoring children with learning disability in the area of",4
"verbal or nonverbal learning disability assessment",4
"visual disability and learning disabled",4
"walt disney's learning disability",4
"what causes visual spatial learning disability",4
"what is a language based learning disability",4
"what is considered a learning disability in children",4
"what is it like to have a learning disability",4
"what is the role of the learning disability nurse",4
"what kind of learning disability get you ssi check",4
"what percentage of people that have a learning disability",4
"whats a learning disability",4
"writing expression learning disability",4
"www blackpool learning disability partnership",4
"www learning disability co uk",4
"learning disability and employment",3
