keyword,count
"link exchange",97756
"exchange link",25843
"automatic link exchange",21017
"free link exchange",10169
"reciprocal link or exchange links or swap links or link",7453
"reciprocal link exchange",5242
"text link exchange",3322
"exchange link positioning site web",2939
"health spa link exchange",2427
"exercise link exchange",1647
"link exchange fitness program",1520
"link exchange fitness club",1501
"diet link exchange",1406
"fitness link link exchange",1395
"yoga fitness link exchange",1388
"caribbean vacation travel cruise link exchange",1360
"link exchange resources",1347
"fitness link exchange switch",1318
"link exchange program",1314
"internet marketing link exchange",1283
"aerobics link exchange",1234
"raquetball link exchange",1225
"link exchange software",1201
"link exchange pr8",1131
"link exchange directory",1119
"adult link exchange",927
"link exchange reciprocal",924
"banner link exchange",910
"uk link exchange",904
"real estate link exchange",891
"join link exchange",853
"exchange levitra link",777
"christian link exchange",729
"link exchange site",728
"exchange link marketing site web",724
"link exchange programs",719
"credit counseling link exchange",699
"free link exchange software",698
"auto salvage yards free link exchange",691
"henderson real estate link exchange",684
"accessory car exchange link reciprocal",678
"exchange link positioning site software",662
"link exchange script",654
"dating link exchange",652
"exchange link positioning site software web",622
"automated link exchange",620
"link exchange forum",612
"link exchange service",601
"jewelry link exchange",593
"link exchange link exchange partner link exchange program",584
"add url link exchange",576
"search engine optimization link exchange",553
"free text link exchange",541
"exchange hotel link",538
"exchange link seo tool",522
"travel link exchange",522
"alaska real estate link exchange",519
"realtor link exchange",514
"links link exchange",495
"web design link exchange",488
"business link exchange",486
"betting exchange link",482
"arizona real estate link exchange",473
"exchange lingerie link sexy",451
"link exchange partner",449
"link exchange dating service",443
"betting exchange link sport",441
"exchange link silicon valley",439
"design link exchange",435
"gambling link exchange",421
"reciprocal link exchange program",405
"link exchange manager",400
"dolce and gabbana link exchange",385
"dating exchange link service",383
"internet link exchange",382
"free static link exchange",379
"static link exchange free",371
"exchange link student",355
"home link exchange",347
"spyware removal link exchange",345
"link exchange services",343
"free link exchange program",339
"cms static link exchange",336
"gift link exchange",335
"home improvement link exchange",334
"health link exchange",328
"link exchange management",314
"link exchange dating web site",313
"car link exchange",310
"web site link exchange",310
"best link exchange wellness",310
"static link exchange free no obligation no cost link list",309
"rail usa link exchange 27rail27 rail train andnot hotel",309
"plus size women27s clothing link exchange",308
"dating exchange internet link",306
"exchange link site web",306
"exchange link seo software",298
"automotive link exchange free",297
"link exchange with major traffic site",292
"maryland real estate link exchange",289
"advertising network text link exchange",289
"free link exchange auto tools",283
"exchange link program seo",283
"link exchange free",281
"wellness 2b affiliate 2b link exchange",280
"nevada real estate link exchange",279
"celebrity exchange link news",271
"link exchange experts",271
"minnesota mortgage link exchange",271
"website link exchange",271
"california real estate link exchange",268
"link exchange network",266
"casino link exchange",264
"web designer link exchange",262
"reciprocal links partners link exchange trade lead portal",262
"site link exchange",261
"exchange link request",260
"cars free link exchange",260
"credit card link exchange",259
"website design link exchange new york",258
"dating sites link exchange",258
"free reciprocal link exchange",257
"finance link exchange",257
"link exchange internet dating",256
"apparel link exchange",252
"link exchange professional",252
"exchange link paid survey",252
"kings of chaos link exchange",251
"fireplace link exchange",250
"auto link exchange",250
"adult link exchange sites",250
"business exchange exchange link link linkinfo com reciprocal",250
"best link exchange software",249
"football picks link exchange",248
"link exchange partners",247
"diving link exchange",247
"debt consolidation link exchange",246
"diving exchange link",246
"trade leads link exchange tradelead portal",244
"train link exchange 27train27 andnot travel2c toy2c training",244
"women27s shoes link exchange",243
"restaurant link exchange",241
"exchange link page rank tool",241
"lawn care link exchange",240
"link exchange trade lead portal",240
"phpbb best link exchange hack",238
"import export free link exchange",238
"link exchange affiliate site",238
"ads free link exchange",237
"women27s apparel link exchange",237
"women27s clothing link exchange",237
"beads link exchange",236
"search engine link exchange",235
"link website exchange",235
"link exchange gay dating",235
"link exchange trade portal",234
"business business exchange exchange home link link linkinfo",227
"sports related link exchange",225
"link exchange with microsoft",224
"catholic link exchange",221
"financial link exchange",220
"free link url exchange",219
"indian link exchange",218
"checking link exchange",217
"free link exchange sites",217
"technology reciprocal link exchange",215
"discount building supplies link exchange",215
"reciprocal link exchange script",214
"reciprocal link exchange form",214
"link exchange adult dating",214
"india link exchange",213
"link exchange sript",213
"free link exchange form",211
"dark link exchange",210
"link exchange internet marketing",209
"womens link exchange",208
"safey link exchange",207
"leader link exchange",207
"reciprocal link exchange service",207
"exchange fitness link program",206
"handmade business link exchange",205
"free banner link exchange",205
"costa blanca link exchange",203
"natural business link exchange",203
"link exchange tradelead portal",202
"wisdom exchange portal link content",201
"shakespeare link exchange",201
"exchange link pool table",200
"high pr link exchange",200
"link exchange christian dating",199
"free link exchange submit url",199
"wisdom exchange portal link content referenced",198
"the wizard is unable to link to it exchange",197
"link 16 tactical data exchange",195
"url submission crawler link exchange",194
"sports link exchange",192
"new house link exchange",190
"link exchange pr8 only",188
"exchange link page rank",188
"web host link exchange",185
"esl exchange link",181
"cruise exchange link package travel",180
"escort link exchange",178
"instant link exchange",173
"work at home link exchange free",172
"cruise european exchange link travel vacation",172
"automated exchange link reciprocal",163
"link exchange page",163
"cartridge epson exchange inkjet link",160
"submit website for link exchange games",156
"swingers link exchange",154
"exchange link non reciprocal",154
"exchange gambling link",153
"shopping link exchange",153
"hair loss exchange link",151
"link exchange dating site",150
"link exchange free online dating",150
"popular link exchange",149
"care exchange health link product woman",149
"cruise exchange link travel",147
"add exchange link reciprocal site submit url",147
"annuity exchange link",146
"raquet ball link exchange",143
"blog link exchange",139
"link exchange weight lifting web sites",138
"exchange lingerie link woman",137
"link exchange marketing",136
"christian dating exchange link",134
"cartridge exchange inkjet link remanufactured",131
"exchange holiday link",131
"link exchange single dating",130
"recipricol link exchange program",127
"adult personals link exchange",126
"caribbean cruise exchange link travel vacation",124
"link exchange directories",122
"online degree link exchange",122
"dating exchange gay link",121
"barbecue link exchange",119
"education link exchange",115
"link exchange php script",114
"aerobic link exchange",113
"adult sex toys link exchange",112
"catalog exchange gardening link",111
"art link exchange",110
"bali exchange hotel link travel",109
"wedding link exchange",108
"home improvement link exchange website directory",108
"small site link exchange",105
"racquetball link exchange",104
"401k exchange link",104
"directory exchange link seo",103
"link exchange form",102
"sex toys link exchange",102
"dating service link exchange",100
"exchange lace lingerie link",99
"exchange indexation link site",99
"free link exchange script",99
"online link exchange",99
"recipricol link exchange",97
"exchange gardening link shade",96
"baby exchange link",95
"non reciprocal link exchange",95
"request a link exchange",94
"web link exchange",93
"automotive link exchange",92
"exchange link resource seo",92
"diet exchange link",92
"adult dating exchange link",91
"link exchange scripts",89
"hotel madrid link exchange",89
"link exchange sites",89
"exchange link link popularity tool",89
"basket exchange gift link",88
"checker exchange link link popularity",87
"exchange health link spa",86
"exchange wedding link",86
"company exchange link moving",85
"car exchange foreign link reciprocal",85
"exchange link pagerank tool",84
"candle exchange link",83
"link exchange gambling",83
"act exchange link",83
"personals link exchange",83
"recipricol link exchange service",83
"sex link exchange",82
"reciprocal link exchange with web designers",81
"online graduates link exchange",81
"bicycle exchange link shop",81
"email exchange link",80
"exchange link moving services",80
"cs exchange link photo shop",80
"exchange link link popularity software",80
"design exchange fashion link",80
"dating exchange link site",79
"cs exchange illustrator link",79
"guaranteed link exchange",78
"exchange link sensor torque",77
"cartridge exchange link toner",77
"exchange link managed security",77
"exchange link partner",77
"code download exchange link php",76
"computer exchange hardware link software",76
"army exchange knife link swiss",75
"link overseas exchange",74
"exchange link positioning site",74
"diving exchange free link",74
"flower link exchange",74
"cell exchange link torque",73
"exchange link moving storage",73
"e exchange link mail",72
"exchange free link program",72
"coupon exchange link pal pay",71
"exchange hipaa link training",71
"stock exchange link",71
"exchange link natural",71
"exchange link mailto",71
"dating exchange link single",70
"contingency exchange link planning",70
"exchange link u4ia",69
"link exchange php",69
"code download exchange free link php",69
"exchange fitness link link",69
"antiaging hgh resources link exchange",68
"casino exchange link",68
"exchange link msop",67
"exchange link wine",67
"download exchange link mp3",67
"find my mortgage link exchange",67
"exchange link mover",67
"automatic link exchange network",67
"diamonds link exchange",67
"exchange link master web",66
"exchange knife link",66
"link+exchange",65
"link exchange banner network",65
"cartridge exchange ink link",64
"link exchange ecommerce",64
"poker link exchange",64
"exchange link value",63
"escort personals link exchange",63
"link exchange uk",63
"exchange forum link",62
"exchange kite link surfing",62
"baby link exchange",62
"exchange fashion link news",62
"porn link exchange",61
"button exchange link",61
"furniture link exchange",61
"singles link exchange",61
"add engine exchange link outsource search site submit url",61
"free link exchange directory",61
"penis enlarge link exchange",60
"exchange link prometric",60
"antique exchange jewelry link",60
"erotic exchange lingerie link",60
"fexlinks storefront marketplace link exchange",60
"club exchange fitness link",59
"exchange link relocation",59
"link exchange with birthday",59
"canada exchange immigration link",59
"link exchange request",58
"add exchange link submit suggest url",58
"exchange link motel",58
"music link exchange",58
"the banner generator link exchange users",57
"pet link exchange website directory pet website",57
"computer programming link exchange",57
"dating exchange link site web",57
"apartment exchange link prague",56
"auto exchange free link tool",56
"advertising exchange link news reciprocal",56
"singles dating link exchange",55
"car accessory reciprocal link exchange",55
"link exchange dating",55
"mail exchange link",55
"antarctica exchange link property",55
"english link exchange",55
"antique jewelry link exchange",54
"pet link exchange website directory add your l",54
"health insurance link exchange",54
"company exchange link program",54
"merchant account link exchange",54
"exchange link travel",54
"usa link exchange",54
"link exchange advertising",54
"free link exchange scripts",54
"google link exchange",53
"debt exchange link solution",53
"design exchange interior link",53
"exchange link realty",53
"intimate wear link exchange",52
"link exchange website directories travel forum",52
"article exchange link pilates",52
"how to run a link exchange and back link script",51
"cheap cruise exchange link travel",51
"fun links link popularity exchange",51
"link exchange with",51
"exchange free laptop link",50
"foxwoods search results and link exchange inform",50
"exchange link online paid survey",50
"url link exchange",50
"exchange fishing hawaii link",50
"exchange free link script",49
"link exchange exercise web sites",49
"exchange free link",48
"link exchange diecast",48
"body exchange jewelry link",47
"exchange lingerie link plus size",47
"link exchange web",47
"web design link exchange forum",47
"watchmakers international link exchange",47
"link exchange rosacea",47
"christmas exchange link",47
"gym links and fitness link exchange health links",47
"reciprocal search results and link exchange info",47
"link exchange forum register now free",46
"exchange link online single",46
"feet links link popularity exchange",46
"exchange fitness link yoga",46
"hgh antiaging link exchange",46
"properties121 link exchange",45
"cheap exchange link travel",45
"soccer link exchange",45
"property exchange link africa",45
"computer exchange link",45
"costume exchange lingerie link",45
"computer link exchange",44
"auto surf link exchange",44
"exchange financial freedom link",44
"austin estate exchange link real",44
"link exchange computer site",43
"link exchange promotions",43
"art exchange link",43
"car insurance reciprocal link exchange",43
"intitle link exchange personal loan",43
"exchange inmobiliarias link",43
"aromatherapy candle exchange link",43
"free link exchange software free hosting",43
"exchange fine lingerie link",43
"link+exchange+resources",42
"free work at home resources and link exchange",42
"directory exchange link",42
"market place link exchange",42
"exchange link wedding",42
"link exchange dating personals",42
"link exchange service 50",42
"link exchange search engine submission",41
"exchange link loan tenant",41
"exchange jewelry link",41
"exchange home improvement link",40
"arcade link exchange",40
"parenting link exchange",40
"cosmetic laser reciprocal link exchange",40
"dating exchange free link online",40
"exchange link pr8",40
"casino exchange link online",40
"bc exchange link vancouver",40
"computer drawing free submit link exchange internet business",40
"marketplace link exchange",40
"avenue exchange leg link",40
"estate exchange link real",40
"entertainment link exchange",40
"disorder exchange link sleep",39
"link exchange forums",39
"exchange game link mobile",39
"submit website for link exchange humor",39
"exchange lingerie link womens",39
"exchange free home link work",38
"recreation directory with link exchange",38
"bankruptcy link exchange",38
"high quality link exchange",38
"free dating link exchange",38
"to link exchange",38
"luxurious intimate link exchange",38
"adult exchange link",38
"estate exchange link real training",37
"cheapys link exchange",37
"postcards link exchange",37
"exchange link money",37
"san jose furniture link exchange",37
"link exchange taxes",37
"exchange form free link",37
"vietnam link exchange",37
"exchange link news property",37
"find link exchange partners",36
"link exchange personal loan",36
"aerobic exchange link",36
"banners link exchange programs",36
"exchange link uk",36
"request a link exchange program",36
"home directory with link exchange",36
"science directory with link exchange",36
"long term health insurance link exchange",36
"dog products link exchange",36
"education reciprocal link exchange",36
"properties exchange link",35
"exchange link site",35
"dating exchange link",35
"diamond exchange jewelry link",35
"exchange gambling link online",35
"travel cruises link exchange",35
"link exchange with entertainment related sites",34
"business business exchange free link",34
"link exchange for manual directory submission",34
"real estate training link exchange",34
"automated reciprocal link exchange",34
"exchange link loan reciprocal student",34
"link exchange florida",34
"exchange link page",34
"online dating link exchange",34
"antioxidant link exchange",34
"design exchange link template web",33
"link link exchange reciprocal links link management software",33
"link exchange link swap link popularity reciprocal link",33
"business exchange free home link",33
"property exchange link",33
"printerschoice link exchange program",33
"mortgage link exchange",33
"pet link exchange",33
"computer exchange link support",33
"link exchange system",33
"link exchange websites",33
"waterfront link exchange credit informa",33
"yarolds link exchange",33
"bc exchange link victoria",32
"exchange free link site",32
"stop foreclosure link exchange",32
"link exchange attorney",32
"exchange link online survey",32
"link exchange payday loan",32
"forum link exchange",32
"thong underwear link exchange",32
"exchange games link mobile",32
"dating singles link exchange",32
"exchange free link wedding",32
"link exchange management software",32
"link exchange consolidation",31
"link exchange postcards",31
"music news link exchange",31
"dating exchange link online",31
"artist exchange link lyric",31
"christian link exchange programs",31
"business consulting exchange link",30
"link exchange for game",30
"motorcycle link exchange",30
"exchange forex link trading",30
"search+engine+optimization+link+exchange",30
"link exchange request forum",30
"link exchange crafters",30
"exchange foreclosure link stop",30
"editor-based search results and link exchange in",30
"exchange lingerie link store",29
"cell phone link exchange",29
"general link exchange sites",29
"computer exchange link technology",29
"book exchange link sport",29
"link exchange escort",29
"link exchange single online",29
"internet link exchange reciprocal link exchange li",29
"weight loss link exchange",29
"exchange link mp3 music player portable",29
"car loan reciprocal link exchange",29
"boarding exchange kite link",29
"link exchange article",29
"small business link exchange",29
"honeymoon lingerie link exchange",29
"online casino link exchange",29
"exchange home link",29
"exchange health link",29
"medical services link exchange sites",29
"love you link exchange",28
"safety link exchange",28
"real estate investing link exchange",28
"exchange link phone voip",28
"craft link exchange",28
"exchange link software",28
"design exchange link site web",28
"email exchange link master web",28
"lingerie classy link exchange",28
"cellular exchange link ringtone",28
"catalog+exchange+gardening+link",27
"exchange link popularity se",27
"link exchange microsoft",27
"link exchange and marketing resources",27
"overland park, ks realtor link exchange",27
"exchange existing link program",27
"offshore link exchange",27
"add exchange link tourism url",27
"aragon''''s feet links link popularity exchange",27
"link exchange pr",27
"exchange home link loan mortgage reciprocal",27
"link exchange script php",27
"exchange a link",27
"exchange link outwar",27
"link exchange web directory",27
"sexy lingerie link exchange",27
"exchange foreclosure link",27
"plussize lingerie link exchange",27
"home business link exchange",26
"link exchange with las vegas homes",26
"asian brides link exchange",26
"foreclosure link exchange",26
"php link exchange script",26
"black personals link exchange",26
"exchange free link reciprocal",26
"celebrity exchange link news 20",26
"u.s immigration link exchange program",26
"exchange link songwriting",26
"automated link exchange scripts",26
"adult singles link exchange",26
"exchange link online poker",26
"exchange link program",26
"christian web link exchange",26
"pharmfind link exchange add url",26
"best exchange link software",26
"exchange link tool",26
"sales flyers link exchange",26
"limo link exchange",25
"car exchange insurance link reciprocal",25
"link exchange internet market",25
"aragon feet links link popularity exchange",25
"link exchange reciprocal links link populari",25
"exchange link market reciprocal research",25
"casino exchange gambling internet link",25
"automated exchange link",25
"travel link exchange travel",25
"marketing link exchange",25
"php link exchange",25
"link exchange gemstones jewellery",25
"adult site free link exchange",25
"lingerie sexy link exchange",25
"special outfit link exchange",25
"poetry link exchange",25
"asian dating link exchange",25
"intimate gift link exchange",25
"sport related link exchange",25
"honeymoon link exchange",25
"business exchange link",25
"custom design exchange link web",25
"link exchange office supplies",24
"submit website for link exchange puzzles",24
"exchange link reciprocal voip",24
"pc computer link exchange",24
"link exchange directory seo webmasters optimization",24
"gay lesbian link exchange",24
"exchange link mp3 music player",24
"automatic exchange link",24
"white bear lake , mn realtor link exchange",24
"link exchange acne",24
"directory exchange free link web",23
"dolce gabbana link exchange",23
"link exchange pet supplies",23
"affiliate link exchange",23
"match making link exchange",23
"car exchange link loan reciprocal",23
"exchange host link web",23
"xenical link exchange",23
"travel directory link exchange",23
"link exchange org",23
"sheer lingerie link exchange",23
"free link exchange cgi scripts",23
"sexy party link exchange",23
"maryland waterfront link exchange credit informa",23
"google business link exchange",23
"exchange link mortgage protection",23
"reciprocal links partner link exchange trade lead portal",22
"foreign brides link exchange",22
"exchange link sports",22
"scripts to run a link exchange directory",22
"add link or exchange link",22
"kings of chaos link exchange page",22
"ammo link exchange",22
"replica handbags link exchange",22
"golf link exchange",22
"exchange hosting link shared",22
"wahm link exchange",22
"supercomputing link exchange",22
"dallas computer repair link exchange program,",21
"link exchange console underground",21
"link exchange 20",21
"sex toy link exchange",21
"investment exchange link",21
"reciprocal link exchange 43",21
"nj local band link exchange",21
"man health link exchange",21
"free adult link exchange",21
"exchange station seo link exchange",21
"celebrity exchange link news+",21
"design exchange link submit web",21
"mobile phones link exchange",21
"reciprocal link exchange software",21
"link exchange major traffic site",21
"skin care product link exchange",21
"free link exchange adult entertainment",21
"exchange link usa",21
"banner exchange link",21
"design exchange link web",21
"chess exchange free link",20
"serena sailor moon link exchange",20
"adult dating link exchange",20
"ringtone link exchange",20
"exchange laser link tooth whitening",20
"mom link exchange",20
"real estate link exchange sites",20
"free link exchange network",20
"link exchange web traffic web site web site marketing search",20
"reciprocal link exchange directory",20
"exchange link reciprocal",20
"link exchange web hosting",20
"link exchange, reciprocal links, link populari",20
"exchange link make money",20
"acne link exchange",20
"software to run your own link exchange program",20
"link exchange partner 41",19
"playboy link exchange",19
"link tjvnawuydisj https webmailsusquedu exchange",19
"link traffic exchange internet banner traffic exchange",19
"exchange link pet",19
"link exchange z57 real estate",19
"link popularity exchange",19
"exchange link wager",19
"create link exchange",19
"automotive business exchange link",19
"link exchange tool",19
"property link exchange",19
"link exchange directory internet link exchange lin",19
"exchange game link",19
"turkey hotel link exchange",19
"free exchange link",19
"matchmaking link exchange",18
"automatic link exchange management script",18
"relevant link exchange forum",18
"submit website for link exchange entertainment",18
"link exchange sales flyers",18
"add exchange link site submit url",18
"savannah link exchange",18
"link exchange adult",18
"exchange link text",18
"pharmacy link exchange",18
"free manual directory submission link exchange",18
"link exchange online dating",18
"scripts to run a link exchange directory and portal",18
"link exchange with humor sites",18
"black dating link exchange",18
"match link exchange",18
"auto business directory exchange exchange exchange link link",18
"link exchange cloths",18
" web host link exchange",18
"print link exchange",18
"exchange link marriage russian",18
"free and link exchange",18
"link exchange dentist",18
"business exchange link strategy",18
"exchange link reciprocal software",18
"link exchange links",18
"louis vuitton replica link exchange",17
"cialis discount exchange link",17
"buy cialis exchange link",17
"asian ladies exchange link",17
"computer repair link exchange program",17
"link, exchange, directory, seo, webmasters, optimization",17
"exchange fantasy lingerie link",17
