keyword,count
"link exchange hen party",17
"cialis exchange link medicine",17
"parallel computing link exchange",17
"link exchange software reviews",17
"animal care link exchange",17
"reciprocal link exchange 44",17
"australia acne link exchange",17
"body jewelry link exchange",17
"link exchange software analysis",17
"exchange link surfing",17
"body tattoo link exchange",17
"insurance link exchange",17
"billiards candy exchange link stand",17
"exchange link surveillance system",17
"link exchange link",17
"dvd authoring link exchange",17
"intimate plussizelingerie link exchange",17
"what is link exchange",16
"bird exchange link",16
"european cruise travel vacation link exchange",16
"arabian horse link exchange",16
"exchange health link plan",16
"link exchange search engine optimization",16
"direct mail link exchange",16
"related link exchange",16
"editor based search results and link exchange",16
"exchange unisource link",16
"automated business exchange exchange exchange link link link",16
"golf add link reciprocal exchange",16
"link exchange forum request",16
"wedding favors link exchange",16
"exchange hotel link rome",16
"acting link exchange",16
"link exchange ink cartridge",16
"dating link exchange sites",16
"exchange link popular",16
"software to run a link exchange program",16
"exchange gyms home link",16
"link exchange health supplement",16
"add exchange link site",16
"link exchange dentistry",16
"cell phone accessory link exchange",16
"add link link exchange",16
"latin dating singles link exchange",15
"exchange link news property 20",15
"sales flyer link exchange",15
"exchange 2000 b-tree bad page link",15
"mutual link exchange",15
"link exchange popularity",15
"link exchange cell phones",15
"primitive link exchange",15
"betting link exchange",15
"exchange link shopping",15
"link exchange link partners instant links reciprocal links",15
"link exchange form for modelling",15
"easy exchange find gambling link way",15
"submit website for link exchange funny pictures",15
"link+exchange+weight+lifting+web+sites",15
"link exchange dvd authoring",15
"exchange free link software",15
"link exchange with shakirainfo.net",15
"india auto surf link exchange",15
"bathroom lighting link exchange",15
"business exchange insurance link",15
"link span class highlighted exchange span travel travel",15
"cd business card link exchange",15
"postcard advertising link exchange",15
"webhosting link exchange",15
"link exchange add link",15
"web link exchange 20",15
"pantie link exchange",15
"free+link+exchange",15
"thai link exchange",15
"link exchange us auction",15
"chandelier link exchange",15
"horticulture link exchange",15
"link exchange baseball bat",15
"link exchange cagayan portal",15
"link exchange free for all links",15
"directory exchange free have link submission that travel url",15
"horoscope link exchange",15
"link exchange pages",15
"submit website for link exchange jokes",15
"link exchange association",15
"bridal wear reciprocal link exchange",14
"baja link exchange",14
"link exchange web site design",14
"business card cds link exchange",14
"exchange link texas",14
"nudist link exchange",14
"link text link exchange",14
"exchange link quality services",14
"help to traffic business site link exchange",14
"inurl car donation link exchange",14
"arts exchange link visual",14
"free pet link exchange",14
"escort entertainers link exchange",14
"link exchange postcard printing",14
"cagayan internet link exchange",14
"business gift link exchange",14
"link exchange 401k",14
"exchange forum link master web",14
"link exchange with high speed wireless internet isp",14
"postcard marketing link exchange",14
"gay lesbian dating link exchange",14
"astrology horoscope link exchange",14
"exchange link xenical",14
"russian ladies link exchange",14
"link exchange add url",14
"link exchange pet",14
"link exchange cgi scripts",14
"directory exchange link web",14
"host39 com link exchange",14
"designer exchange link web",14
"exchange link loan",14
"artist lyric link exchange",14
"flyer design link exchange",14
"exchange golf link",14
"exchange+fishing+hawaii+link",14
"moms link directory exchange",14
"fishing link exchange",14
"page1 link exchange",14
"merchandise link exchange",14
"exchange hair link transplant",14
"new age link exchange",14
"link exchange retirement annuity",14
"exchange link realtor",14
"home loans after bankruptcy http www.buy.co.uk link exchange",13
"link exchange postcard advertising",13
"business canadian exchange link",13
"banner christian exchange link",13
"discount building supply link exchange",13
"link exchange escort services",13
"automated business exchange exchange exchange exchange link",13
"interior design link exchange",13
"link traffic exchange",13
"exchange fantasy football link",13
"tax exchange link",13
"care exchange health link provider",13
"add url free link exchange submit reciprocal links",13
"hosting link exchange directory",13
"free link exchange 29",13
"mn realtor link exchange",13
"exchange lingerie link",13
"christian exchange link",13
"exchange link amsterdam",13
"italy auto surf link exchange",13
"print promotions link exchange",13
"dating exchange link online service",13
"link exchange pedalpumping.org",13
"american singles link exchange",13
"calling card exchange international link",13
"archangels link exchange page",13
"band exchange link recording",13
"exchange internet link marketing",13
"exchange link request webproworld",13
"contest link exchange",13
"business exchange exchange exchange free link link link",13
"barbecue tools websites for link exchange",13
"cartridge exchange link printer",13
"link exchange patient reminder",13
"postcard printing link exchange",13
"art directories link exchange",13
"link exchange with high speed wireless internet",13
"exchange link share time",13
"edonkey link exchange site porn",13
"link exchange travel",13
"skimpiest link exchange",13
"link exchange home repair",13
"health insurance quote link exchange",13
"direct marketing link exchange",13
"my own link exchange",13
"russian singles link exchange",13
"exchange home link sale",13
"way link exchange",12
"add business exchange link",12
"reciprocal link exchange with web designers sites",12
"exchange free link linkateer reciprocal",12
"asian singles link exchange",12
"exchange ftp hosting link",12
"link exchange postcard marketing",12
"diamond exchange jewelry link 20",12
"link exchange directory 47",12
"best link exchange",12
"corporate exchange gift link",12
"link exchange reciprocal links",12
"travel link exchange pr6 site",12
"friend finder link exchange",12
"dental exchange health link",12
"exchange hosting link web",12
"submit website for link exchange online games",12
"exchange find link links partner swap",12
"link exchange business printing",12
"exchange link personal",12
"link exchange software analysis seo software search engine",12
"artist link exchange",12
"bedding canopy exchange link",12
"link exchange with las vegas wireless",12
"cd business cards link exchange",12
"mixed martial arts link exchange",12
"craft site link exchange",12
"exchange home link work",12
"naturists link exchange",12
"exchange link mail",12
"asian dating exchange link",12
"exchange guaranteed link",12
"patient reminder link exchange",12
"one way link exchange",12
"link exchange program 46",12
"survey link exchange",12
"crack link exchange manager",12
"com exchange leader link",12
"business exchange exchange home link link linkinfo com",12
"free christian link exchange",12
"add business exchange link new",12
"exchange link online psychic",12
"link exchange malls",12
"exchange herbalife link",12
"link exchange altersvorsorge",12
"horse trainer link exchange",12
"non profit link exchange",12
"anastasia link exchange",12
"nudists naturists link exchange",12
"link exchange with wireless internet isp",12
"free automatic link exchange directory",12
"web hosting link exchange",12
"remax savannah link exchange",12
"exchange link omaha poker",12
"link exchange bravenet",12
"senior singles link exchange",12
"link exchange trade",12
"games torrentz link exchange",12
"link exchange pedalpumping",12
"cheap exchange link toner",12
"submit website for link exchange game",12
"colorado website affiliate link exchange",12
"trade leads link exchange trade lead portal",12
"computer hardware software link exchange",12
