keyword,count
"100 martial arts",4
"2 wide martial arts belts",7
"3d martial arts training",9
"80's martial arts movies",5
"a list of all martial arts",46
"a-s-e martial arts supply",4
"academy of martial arts santa barbara",4
"addidas martial arts pad",5
"addidas martial arts pad canada",6
"african martial arts",31
"after school martial arts program",5
"alaska mixed martial arts",7
"aleas martial arts",5
"all martial arts",5
"all martial arts weapons",6
"all muslim martial arts",21
"all-purpose martial arts girl ganematsu",10
"american martial arts academy",5
"american martial arts system",6
"ancient martial arts",4
"ancient martial arts weapons",6
"arizona martial arts",19
"arizona martial arts schools",11
"art of martial arts jefferson city",5
"arts dragon martial red",10
"arts fame hall martial",8
"arts fame hall martial wide world",7
"arvada martial arts classes",5
"arvada martial arts events",6
"arvada martial arts lessons",6
"arvada martial arts school",4
"arvada martial arts studio",22
"arvada martial arts training",4
"ase martial arts supply",5
"asian martial arts",10
"asian world of martial arts",24
"ask tiger martial arts portsmouth",5
"best martial arts",10
"best martial arts for children",5
"best martial arts movies",5
"birmingham academy of martial arts",9
"books on african martial arts",7
"brazilian martial arts",29
"britt's school of martial arts",4
"bulldog martial arts",4
"california martial arts",4
"cambridge martial arts academy",4
"capital city martial arts",5
"carson city mixed martial arts",4
"cary nc martial arts",5
"castle martial arts",5
"cedar rapids martial arts",5
"central pa martial arts",6
"century martial arts",129
"century martial arts gear",64
"century martial arts supplies",9
"century martial arts supply",8
"century martial arts supplys",6
"chad emerson emerson's martial arts",4
"chalmette martial arts college",5
"china martial arts",11
"chinese martial arts",46
"chinese martial arts  trackback from your ownclosed",5
"chinese martial arts books",9
"chinese martial arts clothing",10
"chinese martial arts fights",6
"chinese martial arts in washington state",6
"chinese martial arts movies",7
"chinese martial arts weapons",8
"christian martial arts",20
"christian martial arts atlanta",5
"christian martial arts fresno",4
"christian martial arts in cincinnati ohio",4
"christian martial arts ministries",7
"christianity and martial arts",13
"chuck norris martial arts pictures",4
"church martial arts georgia",6
"cindy gibson martial arts",5
"clip art of martial arts",4
"clovis martial arts",11
"cobra kahn's martial arts",4
"colorado martial arts classes",6
"colorado martial arts events",6
"colorado martial arts instruction",6
"colorado martial arts lessons",27
"colorado martial arts school",23
"colorado martial arts studio",16
"colorado martial arts training",6
"comparing popular martial arts",6
"craig oxley martial arts",4
"cross certification in martial arts",4
"cute martial arts gif",4
"d&d 3rd.ed rpg: martial arts styles",4
"dallas martial arts",5
"dallas mixed martial arts",5
"dana miller martial arts",10
"dayton martial arts",5
"deadliest style of martial arts",46
"denver martial arts classes",5
"denver martial arts events",5
"denver martial arts lessons",8
"denver martial arts school",17
"denver martial arts studio",20
"denver martial arts training",5
"denwakan martial arts center",6
"department of defense martial arts training",11
"different types of martial arts",9
"east asian martial arts",5
"eastren star martial arts wv",13
"elite martial arts",8
"elk grove martial arts",4
"executive martial arts nashville tn",6
"extreme martial arts",8
"family martial arts",4
"family martial arts academy in feeding hills, ma",6
"family martial arts aurora, co",5
"farber martial arts milwaukee",5
"female martial arts",4
"fight science mixed martial arts part 3",4
"filipino martial arts",5
"filipino martial arts sticks",5
"filipino martial arts toronto",10
"first american to teach martial arts in northern american",4
"floor mats martial arts",4
"forms of  martial arts",4
"forms of martial arts",11
"fountain valley martial arts",9
"francis fong martial arts",6
"free martial arts template",5
"free martial arts videos",7
"free martial arts web template",6
"free online martial arts lessons",8
"fresno martial arts",9
"gillette martial arts center",6
"glenrothes martial arts centre",4
"golden martial arts classes",25
"golden martial arts events",27
"golden martial arts lessons",25
"golden martial arts school",28
"golden martial arts studio",27
"golden martial arts training",28
"gospel tracts martial arts",7
"greek martial arts",10
"greek martial arts + pressure points",11
"guys martial arts",4
"harrisburg martial arts academy",4
"history martial arts",5
"history of all styles of martial arts",4
"history of chinese martial arts",5
"history of martial arts",25
"hojo rope tying martial arts books",12
"how have hits from martial arts destroyed the brain",7
"hurricane martial arts",4
"hwang's martial arts",4
"hybrid martial arts",9
"hybrid martial arts  trackback from your ownclosed",5
"hybrid martial arts my response is on myclosed",4
"hybrid martial arts roanoke virginia",4
"hybrid martial arts trackback uriclosed",6
"hybrid martial arts uri to trackbackclosed",4
"income from martial arts school",4
"indianola martial arts",9
"inexpensive martial arts mats",5
"institute of african martial arts",5
"insurance for martial arts tournaments",6
"internal martial arts",5
"internal martial arts in washington state",4
"iowa martial arts",24
"irish martial arts",5
"israeli martial arts",16
"isshinryu martial arts of central new york",9
"james mcneil martial arts",4
"janesville martial arts",4
"japan martial arts",4
"japanese martial arts",31
"japanese martial arts in baltimore",6
"japanese martial arts in north carolina",11
"japanese martial arts uniforms",5
"jenkins academy of martial arts in alvin",5
"jet li martial arts",4
"jo martial arts",9
"john graden martial arts videos",4
"john latham martial arts",5
"jonie martial arts supply",4
"kali martial arts",10
"kalispell martial arts",5
"kansas city martial arts",4
"karl krolak martial arts",12
"katy martial arts",5
"kendo training at martial arts studios in kennesaw, ga",4
"kengo martial arts",4
"kenneth funakoshi and hawaii and martial arts and karate",4
"kettleball martial arts",4
"kicks martial arts supplies calgary",4
"kid martial arts classes palm beach county",7
"knee problems martial arts",4
"korean martial arts",31
"lakewood martial arts classes",6
"lakewood martial arts events",6
"lakewood martial arts lessons",17
"lakewood martial arts school",22
"lakewood martial arts studio",14
"lakewood martial arts training",6
"lamkins martial arts",4
"large martial arts schools",5
"learn martial arts",4
"lehigh valley martial arts kung fu",4
"leslie + martial arts",5
"lion attacking martial arts instructor",6
"list of martial arts styles",19
"lists of african martial arts",7
"macho martial arts",5
"male winner of martial arts",6
"mankato internal martial arts",6
"mankato school of internal martial arts",5
"marine corps martial arts",13
"marine corps martial arts program",5
"marine martial arts drill training",5
"martial arts",839
"martial arts  'larry cowen'",4
"martial arts  in columbus ohio",5
"martial arts  in nelson",4
"martial arts  james sisco",4
"martial arts + cancer",6
"martial arts + schaumburg",4
"martial arts 1-3 reps",5
"martial arts actors",4
"martial arts actress",4
"martial arts alberta",9
"martial arts alpine texas",4
"martial arts america",19
"martial arts america fayetteville ga",4
"martial arts and christian",5
"martial arts and mark glenn in new england",17
"martial arts and prescott, az",4
"martial arts and st. louis, missouri",4
"martial arts animal cartoon characters",4
"martial arts animal characters",6
"martial arts anime",9
"martial arts arizona",11
"martial arts around the world",5
"martial arts at home",4
"martial arts babes",7
"martial arts bad guys",5
"martial arts belt display",5
"martial arts belt rack",8
"martial arts belts",17
"martial arts billing",5
"martial arts birthday party",8
"martial arts board breaking machine",4
"martial arts boards",27
"martial arts books",8
"martial arts cake",4
"martial arts cary nc",5
"martial arts catalog",4
"martial arts celebrities",10
"martial arts certificates",7
"martial arts champion mark glenn in new england",4
"martial arts charlotte",4
"martial arts chat rooms",5
"martial arts clarksville tennessee",6
"martial arts clarksville tn",7
"martial arts classes",5
"martial arts classes berks uk",5
"martial arts classes in byram, ms",5
"martial arts classes in michigan",24
"martial arts clay roberts north carolina",5
"martial arts clip art",20
"martial arts clipart",14
"martial arts clothing",10
"martial arts conditioning",11
"martial arts connecticut",5
"martial arts contracts",17
"martial arts dallas texas",5
"martial arts demonstration routine",7
"martial arts drawings",7
"martial arts drills",13
"martial arts dummy",6
"martial arts dvd",10
"martial arts dvd,choi kwang do",5
"martial arts dvds",7
"martial arts equipment",44
"martial arts equipment edmonton",5
"martial arts exercises",8
"martial arts experts",7
"martial arts female",11
"martial arts fight",7
"martial arts fight gear",10
"martial arts footwork",8
"martial arts for women",8
"martial arts fort campbell",6
"martial arts frisco texas",7
"martial arts ft campbell",6
"martial arts ft. lauderdale",10
"martial arts gear",35
"martial arts genital protection",6
"martial arts gi",9
"martial arts girls",18
"martial arts gloves",13
"martial arts graphics",15
"martial arts hall of fame",9
"martial arts head bands",5
"martial arts history",14
"martial arts in chicago",5
"martial arts in corpus christi texas",6
"martial arts in los angeles",5
"martial arts in loveland colorado",6
"martial arts in plymouth in",7
"martial arts in rochester, michigan",5
"martial arts in san diego",6
"martial arts in texas",6
"martial arts in walla walla wa",5
"martial arts injury prevention and treatment",5
"martial arts instruction in paradise valley arizona",6
"martial arts instructional dvds",5
"martial arts instructor",9
"martial arts instructor training",6
"martial arts insurance",6
"martial arts jackson michigan",9
"martial arts jerseys",10
"martial arts karate louisville ky",5
"martial arts kentucky",6
"martial arts layouts",6
"martial arts leeds",10
"martial arts lessons in vancouver washington",9
"martial arts lessons online",5
"martial arts list",10
"martial arts magazine",7
"martial arts manual",5
"martial arts maple grove mn",6
"martial arts masters belt",7
"martial arts mats",19
"martial arts melbourne",6
"martial arts mike kurth",7
"martial arts minnesota",5
"martial arts mission viejo",5
"martial arts missions wu kung",5
"martial arts moves",8
"martial arts movie photos",8
"martial arts movie pictures",10
"martial arts movies",14
"martial arts music",12
"martial arts myspace graphics",5
"martial arts naples florida",6
"martial arts novelties canada",5
"martial arts offered for college credit",5
"martial arts pants",5
"martial arts party",5
"martial arts pc",6
"martial arts personals dating tai chi",5
"martial arts photography service",15
"martial arts photos",9
"martial arts pictures",13
"martial arts pittsburgh",5
"martial arts plano",6
"martial arts pressure points",27
"martial arts punch",5
"martial arts quotes",6
"martial arts raleigh north carolina",5
"martial arts rash guards",10
"martial arts review",5
"martial arts ri",7
"martial arts ronin",8
"martial arts roseville",5
"martial arts routine",5
"martial arts scholarships, awards, grants high school",5
"martial arts schools",8
"martial arts schools that teach kendo in kennesaw, ga",8
"martial arts schools/ dojos rochester, ny",6
"martial arts schools/ dojos spencerport, ny",8
"martial arts self defense ga",5
"martial arts shoes",98
"martial arts software",5
"martial arts sound fx",7
"martial arts south africa",8
"martial arts sparring gear",8
"martial arts spring texas",6
"martial arts stances",6
"martial arts stars",5
"martial arts store",11
"martial arts styles",62
"martial arts supplier",11
"martial arts suppliers toronto",6
"martial arts supplies",69
"martial arts supply",32
"martial arts symbols",7
"martial arts t-shirts",10
"martial arts tattoo",5
"martial arts teachers on teaching podcast",5
"martial arts techniques",16
"martial arts tomball",8
"martial arts torrents",10
"martial arts tournaments",5
"martial arts training",18
"martial arts training clarksville tennessee",7
"martial arts training clarksville tn",7
"martial arts training equipment",7
"martial arts training fort campbell",6
"martial arts training ft campbell",6
"martial arts training in stokes county, north carolina",7
"martial arts training on line",7
"martial arts tshirts",15
"martial arts uniform",14
"martial arts uniforms",62
"martial arts va",5
"martial arts values and codes",12
"martial arts video free",6
"martial arts videos",14
"martial arts wallpaper",25
"martial arts wallpapers",10
"martial arts weapons",77
"martial arts weight training reps",5
"martial arts women",6
"martial arts work outs",5
"martial arts workout",9
"maryland martial arts schools",7
"maximal strength increase and martial arts",6
"minnesota martial arts",8
"mix martial arts",13
"mixed martial arts",224
"mixed martial arts clothing",11
"mixed martial arts conditioning",9
"mixed martial arts dallas texas",6
"mixed martial arts fight gear",10
"mixed martial arts fighting",9
"mixed martial arts gear",25
"mixed martial arts gloves",23
"mixed martial arts illinois",5
"mixed martial arts in georgia",5
"mixed martial arts in ny",6
"mixed martial arts info",6
"mixed martial arts jerseys",8
"mixed martial arts long island new york",11
"mixed martial arts rash guard",10
"mixed martial arts schools",6
"mixed martial arts training",20
"mixed martial arts training colorado",9
"mixed martial arts training equipment",14
"mixed martial arts video",9
"mixed martial arts web sites",5
"movie: mute martial arts killers",5
"muslim martial arts",11
"muslim martial arts books",5
"nike martial arts mat shoes",5
"non profit martial arts",6
"obscure martial arts",5
"ohio martial arts champions",7
"online martial arts",9
"online shuri-ryu martial arts",13
"origin of martial arts",6
"palazzo martial arts",10
"paradise valley arizona martial arts schools",5
"petaluma martial arts",6
"philippines martial arts",7
"phoenix martial arts",8
"phoenix martial arts instruction",5
"phonetic martial arts terms",8
"pilates and martial arts",5
"plains cree martial arts",5
"powerlifting and martial arts training",6
"premier martial arts",12
"raleigh martial arts",12
"real martial arts fights",14
"red dragon martial arts",7
"revolution martial arts",5
"robertson's martial arts photography",5
"ronin martial arts gear",5
"russian martial arts",20
"russian martial arts training",8
"russian system of martial arts",5
"samurai martial arts",5
"sandusky martial arts",6
"science on martial arts",7
"self defense martial arts videos",30
"songs martial arts",6
"syracuse martial arts",7
"systema martial arts",10
"tai chi martial arts",6
"texas martial arts supply",8
"the history of martial arts",5
"the martial arts store",5
"things mixed martial arts",5
"tiger martial arts",6
"tmk martial arts",7
"top five martial arts",5
"torre martial arts",5
"tri star martial arts",5
"tristar martial arts",5
"tucson martial arts instruction",5
"types of martial arts",73
"united tiger martial arts in virginia",8
"us martial arts hall of fame",9
"usa martial arts hall of fame",6
"victory school of martial arts",7
"waverly martial arts",5
"wesley snipes martial arts",421
"west coast martial arts",5
"western martial arts",7
"women in martial arts",7
"women in martial arts blog",6
