keyword, count
"mortgage insurance",666255
"mortgage life insurance",253261
"mortgage insurance quote",135039
"private mortgage insurance",43037
"mortgage protection insurance lead",33624
"home mortgage insurance",22705
"income protection mortgage payment protection insurance",21149
"mortgage protection insurance",21128
"insurance mortgage protection",17441
"mortgage insurance protection",10848
"mortgage life insurance lead",10191
"mortgage payment protection insurance",8793
"mortgage insurance calculator",8508
"mortgage unemployment insurance",7986
"mortgage insurance lead",7959
"mortgage disability insurance",7606
"mortgage insurance rate",7418
"mortgage payment insurance",6722
"personal mortgage insurance",6275
"mortgage protection life insurance",5819
"mortgage+insurance",5418
"mortgage insurance company",5109
"insurance lead life mortgage",4961
"private mortgage insurance calculator",4920
"pmi mortgage insurance co",4879
"mortgage insurance leads",4821
"online mortgage life insurance company",4798
"property mortgage insurance",4718
"pmi mortgage insurance",4470
"fha mortgage insurance",4453
"ge mortgage insurance",4401
"primary mortgage insurance",4319
"income insurance mortgage protection",4097
"private mortgage insurance rate",4048
"mortgage life insurance leads",3920
"broker commercial insurance mortgage wisconsin",3731
"insurance life mortgage quote",3698
"insurance life mortgage online quote",3686
"insurance mortgage",3615
"private mortgage insurance quote",3515
"mortgage insurance uk",3404
"private mortgage insurance calculation",3348
"home insurance mortgage owner",3264
"insurance mortgage protection lead",3241
"private mortgage insurance pmi",3226
"mortgage insurance premium",3216
"mortgage+insurance+quote",3196
"american insurance mortgage",3179
"life insurance mortgage cover",3132
"mortgage insurance premium refunds",3110
"mortgage insurance california",3050
"general electric mortgage insurance",2976
"insurance mortgage rate uk",2941
"mortgage insurance southern california",2939
"cover insurance life mortgage quote",2914
"insurance life marketing mortgage system",2838
"insurance lead mortgage protection",2762
"california insurance mortgage",2756
"mortgage title insurance",2744
"online mortgage insurance protection",2702
"agency american insurance mortgage",2695
"company insurance mortgage pmi",2680
"mortgage life insurance uk",2664
"unemployment mortgage protection insurance",2540
"insurance mortgage texas",2533
"insurance mortgage pmi",2516
"insurance mortgage quote",2470
"mortgage protection insurance uk",2418
"fha insurance mortgage refunds",2404
"disability insurance mortgage unemployment",2388
"alberta mortgage insurance",2332
"cost insurance mortgage private",2271
"mortgage insurance refund",2268
"private mortgage insurance law",2234
"mortgage payment protection insurance uk",2226
"mortgage life insurance quote",2132
"ge insurance mortgage",2123
"best insurance mortgage protection",2106
"principal mortgage insurance",2058
"mortgage insurance rate uk",2047
"mortgage protection insurance premium",2046
"online mortgage life insurance protection",2044
"mortgage protection insurance leads",2043
"insurance mortgage mortgage protection",2023
"mortgage insurance cover",1985
"job loss mortgage insurance",1954
"mortgage calculator taxes insurance",1920
"mortgage insurance companies",1876
"mortgage term insurance",1849
"insurance mortgage private refunds",1834
"advantage insurance mortgage tax",1804
"mortgage loan insurance",1794
"insurance lead life mortgage request wetleads",1788
"mortgage insurance calculation",1782
"mortgage protection life insurance lead",1771
"mortgage protection insurance quote",1770
"mortgage insurance quotes",1759
"insurance mortgage payment protection",1746
"lenders mortgage insurance",1720
"calculating private mortgage insurance",1718
"mortgage term life insurance",1702
"mortgage insurance canada",1699
"fha mortgage insurance refund",1693
"mortgage life insurance rate",1676
"pmi private mortgage insurance",1655
"radian mortgage insurance",1652
"home insurance mortgage",1622
"private mortgage insurance rates",1609
"mortgage insurance australia",1574
"mortgage insurance protection plan",1569
"mortgage insurance online uk",1534
"mortgage life insurance cover",1532
"england mortgage life insurance",1453
"file insurance mortgage private single",1448
"insurance mortgage premium protection",1440
"calgary mortgage insurance",1428
"compare mortgage insurance quote",1419
"fha insurance loan mortgage",1417
"advisor financial insurance life mortgage",1409
"mortgage lender insurance rate",1400
"mortgage insurance rates",1390
"insurance life mortgage",1366
"unemployment mortgage insurance",1366
"mortgage life insurance quotes",1364
"primerica mortgage insurance agents",1357
"mortgage calculator with tax and insurance",1338
"calculator insurance mortgage tax",1334
"chase insurance mortgage",1323
"from insurance lead life mortgage request wetleads",1312
"hazard insurance mortgage",1267
"fha mortgage insurance premium",1210
"mortgage life and disability insurance",1209
"cancellation insurance mortgage",1157
"mortgage insurance broker",1114
"decreasing term mortgage life insurance",1095
"mortgage life insurance rates",1069
"mortgage guaranty insurance corporation",1063
"mortgage+life+insurance",1058
"pmi mortgage insurance company",1052
"gmac insurance mortgage",1042
"ge capital mortgage insurance",1029
"principle mortgage insurance",1023
"private mortgage insurance company",998
"co insurance mortgage pmi",987
"credit insurance life mortgage",973
"mortgage repayment insurance",951
"mortgage payment insurance uk",936
"life insurance mortgage",930
"insurance mortgage private quote",925
"mortgage completion insurance",921
"home income insurance mortgage protection",920
"from insurance mortgage private refunds",913
"insurance mortgage mortgage protection uk",910
"insurance life mortgage protector",907
"calculate private mortgage insurance",884
"mortgage disability protection insurance",883
"mortgage and life insurance uk",866
"broker independent insurance life mortgage",859
"cheap insurance mortgage protection",842
"cover insurance life mortgage quote uk",833
"no mortgage insurance",830
"9 9 9 9 ge insurance mortgage",822
"disability insurance mortgage",803
"9 9 9 9 insurance mortgage quote",801
"9 9 9 9 insurance mortgage texas",796
"agency american insurance mortgage protection",786
"what is mortgage insurance",773
"mortgage insurance cost",768
"cover insurance mortgage protection",767
"company insurance life mortgage",762
"insurance life mortgage quotation",748
"mortgage cancellation insurance",743
"cost insurance mortgage",732
"mortgage insurance companies in washigton state",730
"mortgage payoff insurance",726
"life insurance mortgage cover uk",723
"calculate mortgage insurance",722
"mortgage insurance premium refund",721
"insurance life mortgage tesco",720
"mortgage life insurance analysis",698
"insurance mortgage us unemployment",697
"mortgage protection insurance companies",696
"insurance mortgage life",695
"mortgage repayment protection insurance",687
"private mortgage insurance uk",672
"mortgage indemnity insurance",652
"mortgage protection insurance denver colorado",652
"republic mortgage insurance company",651
"calculating mortgage insurance",650
"cheap mortgage insurance",650
"calculate insurance mortgage",636
"mortgage life insurance protection",628
"calculate mortgage insurance rates",618
"republic mortgage insurance",612
"gmac mortgage insurance",608
"insurance mortgage private uk",607
"mortgage calculator tax insurance",606
"canada insurance life mortgage",603
"triad mortgage insurance",603
"uk mortgage insurance",602
"income insurance mortgage payment protection",600
"mortgage protection insurance us",599
"private mortgage insurance companies",595
"insurance mortgage premium refund",590
"mortgage insurance companies of america",590
"insurance mortgage protection usa",587
"canadian mortgage insurance",583
"insurance investment life loan mortgage",579
"insurance mortgage protection term",578
"insurance mortgage protection unemployment",578
"mortgage protection insurance provider",578
"company insurance life mortgage online",577
"calculation insurance mortgage private",575
"income protection and mortgage payment protection insurance",555
"mortgage guaranty insurance",540
"mortgage income protection insurance",533
"insurance mortgage mortgage protection us",531
"mortgage life disability insurance",527
"redundancy mortgage insurance",525
"insurance bulk mailing for mortgage leads",524
"insurance money mortgage policy save",523
"private mortgage insurance laws",521
"insurance job loss mortgage protection",520
"canada ge insurance mortgage",518
"mortgage insurance companies in packwood washigton state",518
"lead generation life mortgage insurance leads",513
"calculator insurance mortgage payment tax",512
"mortgage insurance us",512
"calculation insurance mortgage",509
"fha mortgage insurance premium refund",509
"income protection and mortgage payment insurance",508
"what is private mortgage insurance",506
"debt insurance mortgage securities",504
"mortgage credit life insurance",502
"mortgage insurance pmi",502
"mortgage insurance information",500
"insurance credit mortgage loans card earn",499
"save money mortgage insurance policy",497
"cancelling private mortgage insurance",492
"mortgage calculator insurance taxes",490
"illinois mortgage life insurance",487
"mortgage life insurance list",487
"cheap insurance mortgage pro",486
"mortgage insurance unemployment",486
"broker insurance mortgage",483
"insurance mortgage private refund",483
"a private mortgage insurance calculator",482
"cost of private mortgage insurance",482
"canada home insurance mortgage",481
"guaranty insurance mortgage",479
"amp insurance insurance loan mortgage protection",477
"french french french insurance mortgage property",477
"insurance lead mortgage",476
"mortgage insurance companies in packwood washigton",476
"instant insurance life mortgage quote",470
"insurance life mortgage unemployment",470
"calculator insurance mortgage pmi",466
"cmhc mortgage insurance rates",464
"insurance mortgage private rate",458
"electric general insurance mortgage",457
"insurance mortgage payment",444
"mortgage insurance company of america",443
"mortgage payment protection insurance unemployment",443
"mortgage life insurance lead system",441
"term mortgage insurance",441
"income protection mortgage payment insurance",439
"home insurance life mortgage",438
"insurance mortgage much private",438
"insurance job loss mortgage",435
"quotes life insurance vs mortgage",435
"mortgage hazard insurance",432
"commercial insurance lender mortgage",430
"insurance mortgage payment protect unemployment",429
"mortgage insurance quotes only",429
"how to calculate mortgage insurance",427
"insurance job loss mortgage payment protection",427
"mortgage insurance refinancing",424
"free mortgage insurance leads",423
"ge mortgage insurance canada",415
"indemnity insurance mortgage",412
"mortgage life insurance us",411
"us mortgage protection insurance",411
"private mortgage insurance removal",410
"mortgage life insurance company",407
"save money mortgage insurance cover",407
"calculate insurance mortgage private",405
"insurance mortgage payment protection us",405
"mortgage life insurance protection online",405
"mortgage insurance ottawa ontario",403
"mortgage insurance ca",402
"mortgage insurance lead system",401
"mortgage closings insurance leads california",400
"private mortgage insurance minnesota",397
"buy insurance mortgage",395
"about mortgage insurance",393
"lender paid mortgage insurance",392
"life insurance for mortgage protection",392
"us mortgage insurance",392
"what is mortgage life insurance",392
"redundant mortgage insurance",384
"florida mortgage insurance",380
"save money mortgage insurance",380
"chart insurance mortgage private",378
"database of mortgage life insurance payouts in tampa florida",378
"disability mortgage insurance",378
"mortgage insurance ontario",378
"mortgage life insurance faq",377
"fha insurance loan mortgage rate calculator",376
"life insurance vs mortgage insurance",376
"protection mortgage insurance",375
"mortgage insurance laws",373
"insurance mgic mortgage",371
"insurance mortgage tesco",371
"fha insurance mortgage premium refund",370
"insurance mortgage policy protection",370
"mortgage decreasing term life insurance",370
"insurance leads sales mortgage",369
"how much is private mortgage insurance",368
"insurance mortgage mutual washington",368
"employment insurance mortgage payment",367
"cheapest insurance mortgage",366
"fha mortgage insurance premiums",366
"current insurance mortgage private rate",362
"job loss insurance mortgage",362
"mortgage insurance premiums",362
"calculator home insurance mortgage",359
"family mortgage life insurance company",359
"new york mortgage insurance",359
"private mortgage insurance georgia",359
"best mortgage protection insurance",357
"mistakes to avoid with mortgage life insurance",357
"gemico mortgage insurance",355
"mortgage life insurance for senior citizens",353
"insurance,loans,mortgage,credit,finance",352
"mortgage insurance san diego",352
"mortgage insurance definition",351
"mortgage life insurance software",351
"decreasing term mortgage insurance",349
"mortgage life insurance saskatchewan",349
"mortgage protection insurance cover",349
"private mortgage insurance texas",349
"employment insurance mortgage",347
"mortgage employment insurance",347
"mortgage calculator insurance",346
"foreclosure pmi private mortgage insurance",345
"about mortgage protection insurance",344
"private mortgage insurance estimate",344
"ge mortgage insurance rates",343
"uk mortgage payment protection insurance",340
"cancel fha insurance mortgage",339
"mortgage insurance jobs",339
"insurance life mortgage protection uk",338
"mgic mortgage insurance",337
"hud mortgage insurance refunds",336
"insurance uk mortgage",336
"mortgage saving investment isa insurance",335
"private mortgage insurance pmi 80 10 10 home mortgage loan",335
"buy job loss mortgage insurance",334
"mortgage life insurance lead programs",332
"mortgage insurance requirements",331
"quotes andnot insurance mortgage loan",331
"private mortgage insurance ga",329
"uk mortgage protection insurance",329
"insurance mortgage principal",327
"private mortgage insurance information",327
"save money mortgage insurance premium",325
"private mortgage insurance remove",323
"calculator including insurance mortgage tax",321
"mortgage calculators with property taxes and insurance",320
"insurance mortgage protection tesco",318
"cancel mortgage insurance",316
"life insurance mortgage scams",315
"insurance mortgage premium unemployment",314
"louisiana mortgage title insurance fee schedule",314
"private mortgage insurance history",313
"us mortgage payment protection insurance",310
"guaranty insurance mortgage united",309
"mortgage insurance refunds",309
"mortgage insurance va loan",309
"united guaranty mortgage insurance",308
"principle mortgage insurance fha",307
"what is mortgage protection insurance",307
"mortgage payments insurance",306
"mortgage life insurance divorce death threat worry",305
"quote for mortgage insurance",305
"current private mortgage insurance rates",304
"mortgage insurance ohio",303
"mortgage payment insurance protection",303
"insurance for mortgage payments",302
"lenders commercial mortgage insurance",302
"insurance mortgage debt securities",301
"insurance mortgage protections",301
"louisiana mortgage title insurance online fee schedule",301
"mortgage insurance ga",300
"mortgage insurance rebates",299
"mortgage insurance estimator",297
"private mortgage insurance ohio",297
"avoiding mortgage insurance",295
"what is primary mortgage insurance",295
"mortgage acceleration life insurance",294
"ugric mortgage insurance",294
"why do i need mortgage insurance",294
"mortgage insurance calculators",293
"disability and unemployment mortgage insurance",292
"mortgage calulator private mortgage insurance lond",292
"mortgage title insurance companies in wv",292
"private mortgage insurance calculated",292
"federal mortgage insurance",291
"guaranteed mortgage title insurance philadelphia",291
"mortgage insurance debt securities",291
"mortgage insurance deletion",290
"mortgage protection insurance usa",290
"new york life mortgage insurance",290
"private mortgage insurance wisconsin",290
"calculate mortgage insurance premium",289
"decreasing insurance life mortgage term",288
"definition of mortgage insurance",288
"job mortgage insurance quote",288
"mortgage insurance ompare online",288
"veteran27s mortgage life insurance",288
"life insurance company real estate healthcare mortgage loans",286
"michigan mortgage term insurance",285
"mortgage insurance wales",285
"insurance life mortgage uk",284
"mortgage calculators including insurance and property taxes",284
"canadian insurance mortgage",282
"insurance mortgage protection provider uk",282
"commercial insurance lender mortgage rate calculator",281
"mortgage insurance new york",281
"mortgage insurance new zealand",281
"private mortgage insurance rates schedule",281
"independent insurance mortgage repayment us",280
"jobless mortgage insurance",280
"what does private mortgage insurance cover",280
"fha insurance mortgage premium",279
"mortgage accidental death insurance",279
"mortgage insurance companies aig",279
"insurance mortgage protection services",278
"michigan mortgage protection insurance",278
"mortgage company insurance proceeds",278
"mortgage insurance advice",278
"discount mortgage insurance",276
"ge mortgage insurance litigation",276
"how does mortgage insurance work",276
"mortgage insurance about",276
"mortgage insurance layoff protection",276
"mortgage insurance required",276
"calculating insurance mortgage",275
"fha mortgage protection insurance refund",274
"financial institution mortgage insurance",274
"fhlm mortgage flood insurance",273
"insurance mortgage protection quotation",273
"average fha mortgage insurance premium",272
"low mortgage rates for home insurance",272
"mortgage insurance in australia",272
"private mortgage insurance payoff",272
"death disability insurance mortgage",271
"hartford insurance aarp home mortgage",271
"definition of private mortgage insurance",270
"canada construction mortgage insurance",269
"farmers insurance mortgage",269
"mortgage continuation insurance",268
"mortgage protection continuation insurance",268
"united kingdom buying private mortgage insurance",268
"calculate mortgage insurance taxes payment",267
"direct line mortgage insurance",267
"mortgage insurance pricing",267
"mgic mortgage insurance for southern california",266
"mortgage insurance empire online",266
"new york state mortgage insurance",266
"pmi mortgage insurance rules",266
"job loss mortgage payment protection insurance",265
"life insurance mortgage protection",265
"mortgage insurance formula",265
"mortgage insurance investment property",265
"private mortgage insurance define",264
"barb huber mortgage insurance",263
"fargo insurance mortgage well",263
"life insurance vs mortgage insurance canada",263
"mortgage insurance value loan australia",263
"insurance agencies selling mortgage protection",262
"lsw mortgage insurance",262
"mortgage payment disabilty insurance",262
"mortgage taxes and insurance calculations",262
"fha mortgage insurance rate",261
"mortgage insurance letter",261
"mortgage protection insurance i connecticut",261
"life insurance mortgage canada",260
"removing primary mortgage insurance",260
"louisiana mortgage insurance premiums schedules",259
"upfront mortgage insurance closing costs",259
"mortgage insurance principal",258
"how much does mortgage insurance cost",257
"new york mortgage insurance requirements",257
"genworth financial mortgage insurance company canada",256
"mortgage and insurance advisory services",256
"mortgage calculator include taxes 26 insurance",256
"mortgage insurance rip off",256
"explain personal mortgage insurance",255
"how much is mortgage insurance",255
"insurance that pays off my mortgage if i die",255
"mortgage acceleration life insurance presentation software",255
"mortgage protection insurance canada",255
"mortgage protection unemployment insurance",255
"ohio no private mortgage insurance",255
"how is private mortgage insurance calculated in california",254
"mortgage insurance versus line of credit",254
"private mortgage insurance cancellation guidelines",254
"fha mortgage insurance laws",253
"insurance mortgage reverse",253
"private mortgage insurance approximate cost2bmaine",253
"home mortgage insurance guide",252
"mortgage creditor insurance",252
"mortgage insurance payment",252
"australia insurance mortgage",251
"canadian insurance mortgage private",251
"fha hospital mortgage insurance program",251
"first mortgage insurance",251
"louisiana mortgage insurance premiums",251
"mortgage and insurance advisory service",251
"mortgage protection insurance in us",251
"ge mortgage insurance bbva",250
"glossary mortgage insurance met life",250
"mortgage and pmi insurance",250
"mortgage insurance georgia",250
"mortgage insurance matrix",250
"london term insurance vs mortgage insurance",249
"mortgage insurance glossary",249
"time limits for private mortgage insurance",249
"laws on private mortgage insurance in pa",248
"mistakes to avoid with mortgage insurance",248
"tax advantage mortgage insurance",248
"calgary insurance and mortgage",246
"cmhc mortgage insurance",246
"getting rid of mortgage insurance",246
"mortgage protection insurance due to accident or injury",246
"private mortgage insurance michigan",246
"rds mortgage insurance refunds",246
"lisa galbraith pmi mortgage insurance co",245
"mortgage insurance mi",245
"mortgage insurance versus second loan via line of credit",245
"starting private mortgage insurance company pmi",245
"dropping private mortgage insurance in pa",244
"mortgage and insurance licenses",244
"mortgage errors 27federal deposit insurance corporation27",244
"private mortgage insurance and definition",244
"private mortgage insurance in hawaii",244
"removing private mortgage insurance in pa",244
"flood insurance at wells fargo mortgage",243
"ge mortgage insurance company",243
"insurance cover for mortgage",243
"mortgage insurance at closing",243
"mortgage insurance premium2bfha",243
"pmi mortgage insurance company website",243
"spin off ge mortgage insurance",243
"mortgage protection insurance in connecticut",242
"mortgage banking errors 26 omissions insurance",241
"section 242 hospital mortgage insurance program guide",241
"mortgage and insurance business opportunities",240
"insurance and job layoff and mortgage",239
"lawsuits against ge mortgage insurance",239
"mortgage protection insurance and americo financial",239
"calculate mortgage payments including tax and insurance",238
"do i need to pay mip mortgage insurance",238
"do you need mortgage insurance",238
"mortgage insurance leads for sale",238
"federal tax on mortgage insurance",237
"ge mortgage insurance not aaa rated",237
"mortgage and insurance andnot pmi",237
"mortgage protection insurance and the hartford",236
"mortgage insurance mn",235
"truth in lending mortgage insurance",235
"insurance to pay your mortgage if you lose your job",234
"mortgage protection insurance in the usa",233
"mortgage life and disability insurance kc2cmo",232
"cover insurance mortgage payment",231
"mortgage closing costs and insurance",230
"state farm workers compensation insurance mortgage brokers",230
"calculator insurance mortgage property tax",229
"cover insurance life mortgage",228
"defaulting on mortgage2c private mortgage insurance",228
"insurance mortgage leads",227
"buying mortgage insurance",226
"deffered vs not deferred mortgage insurance payment",224
"hurricane insurance and mortgage co27s",224
"fha mortgage insurance requirement",223
"insurance life mortgage term",222
"calculator insurance mortgage",221
"insurance mortgage payoff",221
"insurance mortgage redundancy",221
"jobs in the mortgage insurance field",221
"mortgage protection life insurance leads",221
"sle and mortgage insurance",221
"how to avoid mortgage insurance and home insurance",220
"how to get rid of mortgage insurance",220
"jobs in mortgage insurance field",219
"mortgage protection insurance payment protection",219
"private mortgage insurance oh",219
"protection mortgage payment insurance",219
"colorado mortgage insurance",218
"how to cancel pmi private mortgage insurance",218
"mortgage insurance explained",218
"poems about mortgage insurance",218
"lender mortgage insurance",217
"mortgage insurance companies of",217
"company insurance mortgage protection",216
"fha loan and mortgage insurance",216
"how to process home mortgage insurance refunds",216
"private mortgage insurance cancellation",216
"disability insurance life mortgage",215
"compare mortgage protection insurance",213
"direct mortgage insurance offer",213
"mortgage calculator with insurance",213
"coverage insurance mortgage protection",210
"mortgage disability unemployment insurance",210
"redundancy mortgage insurance cover",210
"employed insurance mortgage protection self",209
"top mortgage insurance companies",209
"insurance lender mortgage paid",208
"job loss mortgage protection insurance",208
"insurance mortgage term",207
"credit union teachers and no private mortgage insurance",206
"mortgage redundancy insurance",206
"disability mortgage protection insurance",205
"removing mortgage insurance protection",204
"e o insurance mortgage broker",201
"ugi mortgage insurance",201
"cancel fha insurance mortgage rate calculator",200
"life insurance cover uk mortgage rate calculator",200
"mortgage insurance michigan",200
"mortgage protection insurance policy",200
"payment insurance mortgage rate calculator",200
"insurance irish life mortgage",199
"mortgage insurance illinois",199
"insurance mortgage preferred protection services",196
