keyword, count
"insurance mortgage repayment",196
"mortgage home reverse annuity insurance",196
"fha insurance premium refund mortgage rate calculator",194
"pmi mortgage insurance agency in florida",193
"account bank herm insurance loan mortgage northern online",192
"fha insurance premium mortgage rate calculator",192
"rench mortgage loan insurance and bridging finance",190
"private mortgage insurance mi",188
"tesco mortgage protection insurance",188
"insurance lead lead mortgage",185
"mortgage insurance minnesota",185
"private mortgage insurance company directory",183
"information insurance mortgage rate calculator",182
"mortgage insurance policies",182
"company insurance mortgage republic",181
"insider mortgage insurance report",180
"insurance mortgage protection uk",180
"payment protection insurance mortgage rate calculator",180
"insurance to cover mortgage",179
"payment protection insurance uk mortgage rate calculator",179
"private mortgage insurance providers",179
"income insurance mortgage payment protection protection",178
"mortgage payment protection insurance us",178
"and life insurance uk mortgage rate calculator",177
"insurance lender mortgage",175
"mortgage protection insurance in massachusetts",175
"protection insurance uk mortgage rate calculator",175
"and mortgage insurance",174
"insurance company mortgage guaranty",174
"commercial mortgage insurance",173
"corp guaranty insurance mortgage",171
"wells fargo insurance mortgage rate calculator",171
"fha insurance refund mortgage rate calculator",170
"insurance mortgage private unemployment",169
"lee papier life insurance mortgage leads",169
"colorado denver insurance mortgage protection",168
"coverage insurance mortgage",167
"insurance money mortgage work",166
"mortgage insurance no physical exam",166
"insurance mortgage protection provider us",165
"fha insurance mortgage rate calculator",164
"mortgage calulator private mortgage insurance in",164
"payment insurance uk mortgage rate calculator",164
"insurance uk mortgage rate calculator",163
"mortgage guaranty insurance company",162
"best us mortgage insurance",161
"private mortgage insurance mn",161
"mortgage and insurance",160
"definition insurance mortgage private",158
"french mortgage loan insurance and bridging finance",157
"canada mortgage insurance",156
"mortgage insurance online",156
"cheap mortgage protection insurance",155
"mortgage protection insurance services",155
"insurance mortgage rate calculator",154
"easy mortgage insurance cover",153
"advanced mortgage insurance tool kit",152
"joint life insurance mortgage",152
"insurance mortgage uk",150
"mortgage insurance florida",150
"mortgage insurance co",149
"private mortgage insurance illinois",149
"buying mortgage insurance cover",148
"cover insurance money mortgage save",148
"fha insurance refunds mortgage rate calculator",147
"payment mortgage insurance",146
"insurance mortgage unemployment",145
"zion mortgage protection insurance",145
"instant insurance life mortgage online quote",144
"independent mortgage life insurance brokers",143
"insurance mortgage protection repayment",143
"mortgage insurance and",141
"buy insurance mortgage protection",139
"flood insurance mortgage",138
"mortgage indemnity guarantee insurance",138
"of mortgage insurance",137
"accident mortgage insurance cover",136
"exam insurance medical mortgage no",136
"free mortgage insurance quote",136
"private mortgage insurance risk",136
"independent insurance mortgage repayment uk",133
"london private mortgage insurance",133
"low cost mortgage insurance",133
"cheap mortgage insurance us",132
"insurance kingdom mortgage protection united",132
"insurance mortgage plan protection",132
"insurance term life mortgage canada",132
"mortgage insurance brokers",132
"mortgage insurance disability",132
"mortgage payment insurance cover",132
"private mortgage insurance online quote",132
"mortgage insurance career",131
"mortgage insurance refund uk",131
"financial ifa insurance mortgage services",130
"buying mortgage insurance policy",129
"private mortgage insurance chart",129
"canada capital ge insurance mortgage",127
"ge mortgage protection insurance unemployment",127
"insurance money mortgage premium save",127
"insurance mortgage protectio",127
"is private mortgage insurance",127
"mortgage calculator including tax and insurance",127
"mortgage insurance payment us protection",127
"fha insurance mortgage xxasdf",126
"cancellation insurance law mortgage private",125
"fha mortgage insurance refunds",125
"joint life insurance quote mortgage",125
"mortgage protection insurance company",124
"mortgage protection insurance quotation",124
"buy mortgage insurance",123
"mortgage professional indemnity insurance",123
"pmi mortgage insurance agency",123
"unemployment mortgage protection insurance us",123
"best deal insurance mortgage",122
"insurance lead mortgage multiple",122
"interest and mortgage insurance",122
"life insurance mortgage protection term insurance",122
"england mortgage employment insurance",121
"monthly mortgage insurance",121
"mortgage payment insurance us",121
"insurance life mortgage rate",120
"mortgage life insurance in england",120
"news about excessive private mortgage insurance charges",120
"easy mortgage insurance quote",119
"us mortgage life insurance",119
"mortgage protection insurance quotes",118
"mortgage payment cover insurance",117
"insurance mortgage protection provider",116
"insurance mortgage unemployed",116
"buying mortgage insurance policies",114
"genworth mortgage insurance",114
"mortgage insurance bc",114
"mortgage insurance for",114
"save money mortgage insurance premiums",114
"do i need mortgage protection insurance",113
"easy mortgage insurance policies",113
"compare insurance mortgage protection",112
"credit mortgage disability insurance",112
"ge mortgage insurance australia",112
"mortgage guaranty insurance software",112
"mortgage insurance policy",112
"california insurance mortgage southern",111
"insurance life mortgage payment protection",111
"insurance mortgage rate",111
"sickness mortgage insurance cover",111
"easy mortgage insurance",109
"home and house also mortgage and insurance",109
"insurance mortgage payment plus protection",109
"mortgage insurance texas",109
"best insurance mortgage",108
"calculator insurance mortgage private",108
"insurance mortgage premium private",108
"cover insurance mortgage payment uk",107
"insurance mortgage principle",107
"finance insurance mortgage",106
"hud mortgage insurance",106
"private mortgage insurance cancellation laws",106
"free insurance mortgage quote",105
"insurance against mortgage",105
"insurance loan mortgage payment protection",105
"mortgage insurance premiums refund",105
"calculator car cheap finance home insurance loan mortgage",104
"mortgage insurance corporation",104
"private mortgage insurance rates in england",104
"income insurance mortgage",103
"mortgage guaranty insurance corporation us",103
"cost insurance low mortgage",102
"decreasing insurance mortgage term",102
"easy mortgage insurance policy",102
"mortgage guarantee insurance",102
"mutual mortgage insurance",102
"texas home mortgage hidden insurance in contracts",102
"goodfellows mortgage payment protection insurance",101
"insurance mortgage premium protection uk",101
"mortgage broker error and omission insurance",101
"mortgage insurance critical illness",101
"mortgage insurance oh",101
"company insurance mortgage",100
"compare insurance mortgage quote",100
"cover insurance life mortgage uk",100
"insurance lead life mortgage system",100
"insurance lead mortgage us",100
"mortgage protection insurance quotations",100
"term mortgage decreasing life insurance",100
"wholesale price decreasing term mortgage life insurance",100
"cost private mortgage insurance",99
"insurance mgic mortgage settlement",99
"job loss mortgage payment insurance",99
"doctor insurance medical mortgage",98
"mortgage insurance law",98
"banking and insurance savings mortgage",97
"company ge insurance mortgage",97
"mortgage calculator pmi insurance",97
"cover insurance mortgage payment us",96
"norwich union mortgage life insurance",95
"decreasing insurance mortgage protection term",94
"insurance mortgage private",94
"mortgage guarantee insurance corporation",94
"insurance for mortgage",93
"mortgage insurance chart",93
"much is mortgage insurance",93
"paid mortgage insurance",93
"insurance brokers or agents mortgage guarantee",92
"life insurance mortgage protection due to unemployment",92
"mortgage insurance fha",92
"calculate mortgage insurance premiums",91
"eliminate mortgage insurance",91
"insurance mortgage tax",91
"mortgage calculator with property tax and insurance",91
"arizona mortgage insurance",90
"eisenhower mortgage brokers insurance group",90
"mortgage insurance job loss",90
"mortgage protection insurance plans",90
"home house also mortgage insurance",89
"insurance job mortgage payment protection",89
"insurance mortgage repayments",89
"mortgage insurance agency",89
"mortgage insurance saskatchewan",89
"private mortgage insurance calculators",89
"remove mortgage insurance",89
"fha eliminate mortgage insurance",88
"home mortgage insurance canada",88
"illinois private mortgage insurance calculator",88
"mortgage default insurance",88
"mortgage insurance tax",88
"mortgage irish life insurance",88
"agent insurance mortgage",87
"default mortgage insurance",87
"england home mortgage insurance",87
"french mortgage loan finance insurance and prop",87
"mortgage insurance and income protection insurance",87
"mortgage insurance utah",87
"mortgage protection insurance cost",87
"fha loans requirements to eliminate mortgage insurance",86
"mortgage insurance underwriters",86
"private mortgage insurance is required",86
"save on mortgage insurance",86
"employment mortgage protection insurance",85
"london cost private mortgage insurance",85
"mortgage insurance in",85
"calgary insurance mortgage",84
"errors omissions insurance mortgage banking",84
"farmers home adminastration mortgage insurance refunds",84
"halifax insurance mortgage",84
"insurance mortgage triad",84
"fha insurance mortgage",83
"how good a deal is your banks mortgage insurance plan",83
"mortgage insurance second lien",83
"mortgage life insurance canada",83
"what is fha mortgage insurance",83
"critical illness mortgage insurance",82
"england private mortgage insurance risk",82
"french mortgage loan finance insurance and property",82
"ge mortgage insurance pty",82
"london mortgage indemnity guarantee insurance",82
"mortgage insurance certificate",82
"jog loss mortgage payment insurance",81
"mortgage guaranty insurance software in britain",81
"mortgage guaranty insurance software in england",81
"mortgage insurance processing us",81
"paying mortgage life insurance",81
"borrowing from whole life insurance for a mortgage",80
"gmac auto insurance and mortgage center",80
"private mortgage insurance legislation",80
"second mortgage protection insurance program",80
"cheap mortgage life insurance",79
"england mortgage guaranty insurance software",79
"fha condo mortgage insurance",79
"free mortgage insurance quotes",79
"insurance lead life mortgage request wet leads",79
"life insurance mortgage protection due to unemploy",79
"mortgage insurance advantages",79
"cmg insurance mortgage",78
"england life insurance mortgage protection",78
"home mortgage insurance in britain",78
"mortgage calculator insurance in the united kingdo",78
"mortgage guaranty insurance software in london",78
"mortgage insurance job loss lloyds in engl",78
"mortgage insurance unemployment uk",78
"insurance monthly mortgage",77
"private mortgage insurance benefits",77
"compare mortgage insurance",76
"life insurance mortgage protection london",76
"london mortgage insurance processing",76
"mortgage insurance calcuations",76
"mortgage insurance homeowners",76
"mortgage insurance united states",76
"private mortgage insurance united states",76
"save on mortgage protection insurance",76
"bank mortgage insurance",75
"cheapest insurance mortgage protection",75
"corporation guaranty insurance mortgage",75
"disability insurance designed to pay mortgage",75
"e commerce in mortgage and insurance industry",75
"insurance mortgage leads in england",75
"london term mortgage insurance",75
"mortgage protection insurance companies in orlando",75
"no medical mortgage life insurance",75
"buy private mortgage insurance",74
"cancellation insurance mortgage private",74
"insurance life mortgage protection",74
"insurance mortgage refund trace",74
"insurance mortgage ug",74
"premium mortgage insurance",74
"private mortgage insurance jobs in london",74
"cheaper mortgage payment insurance",73
"england homowners mortgage insurance",73
"foreclosure,mortgage,insurance",73
"homowners mortgage insurance in england",73
"mortgage calculators taxes insurance",73
"mortgage insurance rates mgic",73
"quote mortgage protection insurance",73
"advice insurance mortgage private",72
"home mortgage protection insurance",72
"homeowners insurance with mortgage",72
"insurance mortgage protection quote",72
"mortgage insurance processing",72
"cancelling insurance mortgage private",71
"england insurance mortgage",71
"england mortgage insurance processing",71
"general electric mortgage insurance company",71
"home mortgage loan insurance price renters",71
"insurance mortgage payment protection unemployment",71
"mortgage insurance coverage",71
"mortgage job loss insurance",71
"mortgage term life insurance london",71
"the affordable mortgage insurance expert",71
"ace ina insurance mortgage lending",70
"best mortgage insurance",70
"calculate total mortgage payment property tax and insurance",70
"calculating home mortgage insurance and taxes",70
"find my mortgage california insurance",70
"london principal mortgage insurance",70
"sample mortgage insurance rates",70
"united kingdom private mortgage insurance rates",70
"capital mortgage insurance",69
"default mortgage insurance london",69
"fha primary mortgage insurance",69
"hartford mortgage insurance",69
"how to underwrite mortgage insurance",69
"life insurance mortgage insurance compare",69
"mortgage guaranty insurance software in the us",69
"mortgage insurance house property",69
"mortgage insurance information london",69
"mortgage payment protection insurance job",69
"rate private mortgage insurance",69
"save money mortgage insurance policies",69
"association investments commercial mortgage life insurance",68
"best canadian mortgage insurance",68
"calculating insurance mortgage private",68
"compare mortgage insurance quote uk",68
"ge casualty insurance company job loss mortgage payment",68
"insurance life mortgage pay",68
"london mortgage insurance job loss",68
"london mortgage insurance underwriters",68
"mortgage insurance underwriting",68
"nd insurance life mortgage property",68
"of private mortgage insurance",68
"private mortgage insurance jobs uk",68
"houston insurance mortgage protection quote",67
"insurance mortgage private removal",67
"london property mortgage insurance",67
"one time mortgage insurance premium",67
"private mortgage insurance calculator 20",67
"private mortgage insurance requirements",67
