keyword, count
"new jersey home rentals",349
"virtual home tours for sale louisiana new orleans",349
"2005 new home design trends furnishings rustic",348
"construction home new salem",348
"new home warranty ontario",348
"home buying in new hanover county",345
"new home brokers",345
"new home builders in georgia",345
"home for sale in queens new york",344
"new home residential contractors in las vegas",344
"new jersey modular home",344
"orlando new home developer",344
"building your new home",343
"new home grants",343
"purchase new home wilmington nc",343
"real estate granite bay california ca new home for sale",343
"home equity new hampshire",342
"new home construction in illinois",341
"new home construction in wilmington nc",341
"new jersey home tax rebate",341
"new work at home",341
"sonara new home community las vegas nevada",341
"new jersey rental home",340
"odessa texas new home builder",340
"builders sonara new home community las vegas nevada",339
"new england home plans",339
"construction home in new nj",338
"home exchange in las vegas new mexico",338
"mountain27s edge new home builders las vegas nevada",338
"new home developments burlington county nj",338
"tampa new home",338
"las vegas new home construction statistics 2004",336
"mobile home park new jersey",336
"new home buyers guide",336
"new home communities las vegas",336
"home depot new jersey",335
"new home buyer forgiveness loan",335
"new orleans home show",335
"signature loans bad credit for a new home",335
"work from home in new zealand",335
"kansas city new home",334
"new braunfels tx custom home builder",334
"new home loan bad credit ms",334
"new jersey home schooling",334
"tucson new home builders",334
"leads new home sales az",333
"home schooling new mexico",332
"new home loans for people with bad credit",332
"real estate elk grove new home for sale",332
"sonora community new home development las vegas",332
"southern california new home",332
"buy a home new jersey",331
"las vegas new home sales",331
"new home construction in pennsylvania",331
"home rental new jersey",330
"raleigh new home",330
"estimating new home construction cost",329
"home health aide trainning in new york city",329
"new braunfels texas custom home builder",329
"1031 property taxes on new home",328
"home heating oil 2b suffolk county new york",328
"new home builders houston texas",328
"new home design plans",328
"new york home builders",328
"new home construction birmingham alabama",327
"gas home heating service contract new york",326
"home alarm systems new mexico",326
"video home security systems new york",326
"how to build a new home",325
"illinois new home construction loan",325
"new home construction houston",325
"new home construction in chicago",325
"new home construction prices",325
"consumer financing home new report",324
"new balance shoes home",324
"new home builders virginia",324
"new home finance",324
"new home sales in las vegas",324
"virginia new home loan",324
"new england patriots home",323
"new home in georgia",323
"new home sales orlando florida",323
"new home southwest florida",323
"new orleans home mortgage rate",323
"phoenix new home builders",323
"home and garden show new orleans",322
"home schooling new york state",322
"mobile home loans in new hampshire",322
"new home sacramento california",322
"ameritania hotel new york home page",321
"new braunfels tx home site",321
"new home loan interest rates",321
"new home builders phoenix",320
"new jersey home health aide certification",320
"new jersey state home page",320
"buy a home realtors new jersey",319
"buying home new steps",319
"colorado springs new home builders",319
"new braunfels custom home builder",319
"new york jets home page",319
"elk grove new home for sale",318
"home security systems ratings new jersey",318
"new home communities in southern california",318
"new home construction mn",318
"home builders las vegas new homes",317
"new home architecture",317
"new home builder in orlando",317
"new home construction in louisiana",317
"home equity lines of credit new york",316
"jacksonville fl new home",316
"modular home builders in new jersey",316
"new home builder in arizona",316
"ankeny iowa new home",314
"beach home new smyrna",314
"colorado new home builders",314
"louisiana new home warranty act",314
"new braunfels texas home site",314
"new home builders ohio",314
"new home dallas",314
"new jersey new home builders",314
"new york shopping home",314
"new zealand home automation nz",314
"building new home rain",313
"buying a new mobile home",313
"golf course home for sale new bern north carolina",313
"home builder new york",313
"house plans future new home construction san antonio",313
"michigan new home builders",313
"new home and blue print",313
"new jersey lottery home page",313
"sacramento new home developments",313
"building a new home and costs",312
"houston property ready for new home site",312
"new home inspection list",312
"new home sales training denver",312
"phoenix new home builder",312
"home heating oil prices new haven",311
"new home builder in pa",311
"new home for sale in las vegas",311
"new jersey home heating oil prices",311
"cheap new home theatre systems",310
"home equity loan new mexico",310
"jacksonville home new",310
"new home designs includes floor plans",310
"new home in houston",310
"waterfront home new bern nc",310
"10025 capital for new home construction or remodeling",309
"home gyms and new jersey and discount",308
"new home builder illinois",308
"new home heating",308
"ontario new home owners warranty",308
"recent home sales new jersey",308
"designing a new home",307
"golf course home for sale new bern nc",307
"home office furniture new jersey store",307
"house plans new home design",307
"new home phone services",307
"new concorde home entertainment company",306
"new frontier mobile home park",306
"new home builder arizona",306
"new home central air conditioner ratings",306
"new home tucson az",306
"new zealand monitored home alarms",306
"post and beam new home construction",306
"in home personal training in new york",305
"new braunfels home site",305
"new home builders jacksonville florida",305
"new orleans home remodeling",305
"your new home based business online or offline",305
"az new home builders",304
"buying a new built home",304
"home heating oil new jersey",304
"new bern north carolina golf course home for sale",304
"real estate new hampshire vacation home",304
"floor plans new home builders florida",303
"home equity loan rate new hampshire",303
"home heating oil price new jersey",303
"new home blue prints",303
"new home construction seattle",303
"new york mortgage home loan",303
"awesome new home floor plans",302
"home heating oil prices new jersey",302
"new construction home chicago",302
"new construction home design",302
"new home builders tampa florida",302
"new home dallas acre lots",302
"new york city hotel pennsylvania home",302
"buy a new home in suffolk va",301
"home builders 2b new jersey",301
"new home construction and floor plans",301
"new home floor plans in la",301
"new home sales training colorado",301
"new mobile home sales florida",301
"new orleans vacation home rentals",301
"home heating oil delivery long island new york",300
"new york bar exam preparation home study",300
"american home mortgage corp of new york",299
"new hampshire home rentals",299
"new home builders wilmington nc",299
"new frontier mobile home community and santee",298
"new home loan bad credit",298
"new jersey physical therapy home care employment",298
"new types home insulation",297
"new york yankees home",297
"online home equity loan new hampshire",297
"new home construction maryland",296
"new jersey new home",296
"stores home office furniture northern new jersey",296
