keyword, count
"new home",639931
"new home builder",143560
"new home builders",116534
"new home loan",96646
"new home based business idea",95170
"new home business idea",88358
"las vegas new home",80270
"new home loans",76142
"new home construction",68070
"new home in las vegas",46053
"florida new home",34281
"home new",34017
"buying a new home",31552
"new home based business opportunity",24188
"home loan new",21876
"new home plan",20677
"new jersey home inspectors",20462
"new hampshire home equity loan",19158
"new home construction loan",18067
"decorating a new home",14139
"home insurance new york",13402
"new home decorating",13140
"new jersey home equity loan",12979
"new home for sale",12690
"atlanta new home",11672
"home new sale",11492
"new home floor plan",11305
"new home sales",11290
"new home search",11287
"home loan mortgage new rate york",10989
"new home building",10963
"new home mortgage",10855
"new york home equity loan",10186
"new home development",10048
"home equity loan new jersey",9540
"new home plans",9495
"buying a new home in illinois",9098
"new home building plan",8787
"buying new home",8320
"real estate new home in chesapeake virginia",8169
"new jersey home refinance",8134
"chicago new home",7589
"new home sewing machine",7438
"california new home construction",7187
"new home buying guide",7059
"new home page",6998
"building a new home",6811
"new home design",6569
"new home guide",6513
"new york home",6290
"new line home entertainment",6158
"new jersey home",5838
"home office new",5690
"new jersey home refinancing",5684
"new home construction cost",5544
"new home buyers",5477
"new home plan iowa",5417
"new home community",5266
"new jersey home inspection",5081
"new jersey home mortgage",4913
"orlando new home",4859
"new jersey home financing",4769
"new jersey home for sale",4725
"new home construction louisville ky",4498
"home improvement grants in new jersey",4487
"mobile home new roof construction",4400
"california home loan new",4294
"california new home",4120
"new home orlando",4005
"new jersey home equity loan rate",3997
"new jersey nursing home",3992
"eden park nursing home albany new york",3959
"new home construction florida",3953
"new home las vegas",3934
"home insurance albany new york",3875
"home improvement grants new york",3830
"new home arizona",3767
"new construction home",3714
"new home construction south florida",3684
"buena vista home entertainment new york phone",3653
"buy new home",3653
"arizona new home builder",3620
"home buying new jersey",3603
"home insurance rochester new york",3596
"buying construction home new",3586
"plan for new home construction",3572
"home buying in new jersey",3538
"home owner insurance in new jersey",3503
"vegas new home",3460
"tip for decorating a new home",3435
"new home buying tips",3427
"frankfort il new home construction",3426
"new york abc television home page",3419
"new home purchase",3411
"new construction home illinois",3396
"new home buying tip",3386
"san diego new home",3300
"atlanta new home construction",3296
"new home construction financing",3292
"new line home entertainment logo",3290
"new home floor plans",3243
"new home video release",3236
"nursing home in new jersey",3116
"austin new home",3109
"new jersey home mortgage loan",3097
"new home magazine",3086
"financing a new home",3070
"new york home mortgage",3020
"new home construction in louisville ky and surronding areas",3000
"american home mortgage new york",2982
"new mexico home",2960
"new home development pace fl",2946
"new jersey home owner insurance",2925
"new home construction in florida",2909
"new york home loan",2833
"new home warranty",2822
"asheville buying home new tip",2808
"new home finder",2808
"new home builder tampa florida",2800
"new york state department of corrections home page",2752
"houston new home",2740
"home land new sugar tx",2725
"new home in orlando",2717
"new home listing",2710
"new construction home in illinois",2694
"new jersey home loan",2666
"new jersey home health care",2664
"construction financing home loan new",2661
"new home buyer",2654
"arizona new home",2640
"new+home+based+business+idea",2619
"home health care new york",2606
"construction home new new york",2574
"home for sale in new jersey",2566
"new+home+business+idea",2564
"new home construction loans",2541
"new home sewing machines",2514
"new home owner",2493
"home equity loan in new hampshire",2484
"electronics home new york",2467
"new home construction loan rate",2429
"new orleans home",2380
"orange county new home",2360
"acreage new custom home collin county texas",2345
"new construction home orlando florida",2345
"building new home",2341
"new jersey home builders",2328
"new home construction lexington kentucky",2324
"new home tampa",2238
"new home financing",2203
"cost of building a new home",2202
"surveillance equipment for new home builders",2199
"new york home owner insurance",2197
"new construction home loan",2158
"new home in arizona",2157
"construction home maryland new",2154
"new york times home delivery",2130
"home appraisal monmouth new jersey",2108
"home improvement loan new hampshire",2087
"custom new home",2086
"new construction home clermont florida",2076
"new construction home michigan",2065
"new home construction pa",2062
"california new home builder",2059
"new home communities",2055
"new home decor",2050
"buying home new",2027
"ontario new home",2001
"new york home insurance",1995
"new home houston",1887
"new home florida",1886
"bad credit new home loan",1857
"new england patriots home page",1856
"new jersey home equity loans",1844
"new home inspection checklist",1837
"mobile new home",1835
"new jersey home improvement loan",1811
"new home michigan",1785
"bad credit home loan mobile new york",1781
"new home serger",1762
"new home refinance cash-out mortgages",1754
"new home real estate",1741
"construction of new home las vegas",1721
"new home austin texas",1708
"new jersey refinance home",1708
"new mobile home",1699
"new jersey home loan calculator",1693
"new home real estates",1656
"orlando new home builder",1626
"new jersey home equity line of credit",1623
"new york home improvement contract",1623
"new hampshire vacation home rental",1622
"home new ready search",1615
"connecticut new home construction",1613
"home mortgages new jersey",1606
"build a new home",1590
"business home new opportunity work york",1583
"new home construction virginia",1575
"nursing home attorney new york",1574
"brighton home listing new",1561
"florida new home builder",1550
"new home in florida",1547
"new home business ideas",1539
"new home designs",1525
"new home in michigan",1516
"new home construction in michigan",1503
"construction home inspection new",1496
"new york home loans",1479
"new motor home",1473
"new jersey home equity loan rates",1470
"maryland new home",1463
"new home builder in michigan",1460
"new jersey home rental",1457
"new construction home is san diego",1456
"new home builders in florida",1454
"new mexico home equity loan",1449
"buying new home illinois",1442
"new jersey new home construction",1441
"michigan new home builder",1439
"new home loans united kingdom",1438
"new jersey home equity",1432
"new hampshire home loan",1431
"mercer new jersey home additions",1427
"long island new home construction",1425
"find new home",1409
"tucson new home",1405
"new home buying",1403
"home new york",1396
"new secured home loans",1395
"new home business",1382
"new home in pennsylvania",1371
"new home california",1370
"advice buying new home",1363
"new jersey home owners insurance",1359
"california new home construction loan",1355
"new home gift basket",1336
"phoenix new home",1335
"new hampshire home loans",1328
"new home in maryland",1317
"new jersey refinancing home",1314
"modular home new york",1308
"home owner insurance new jersey",1291
"modular home new jersey",1291
"new york bad credit mobile home loan",1290
"new york home improvement",1287
"home land new",1271
"new jersey home improvement contractor",1262
"new york home mortgage loan",1262
"new home inspection",1257
"new jersey home insurance",1254
"new home building checklist",1249
"home equity loans new jersey",1243
"new mexico home loan",1242
"chicago new home construction",1238
"new york state home page",1226
"care health home new provider york",1225
"new jersey home loans",1225
"home loan new construction",1221
"scottsdale new home",1221
"builder home new",1219
"home sale new jersey",1219
"home michigan new sale",1211
"new home gift",1206
"home land new sugar",1201
"new home construction in new jersey",1200
"construction home loan new rate",1194
"new home in atlanta",1182
"colorado new home",1176
"new single family home construction loans",1170
"new hampshire home",1151
"home equity loan new york",1150
"home equity line of credit new york",1139
"loomis california ca new custom home",1121
"refinance home new jersey",1117
"ontario new home warranty program",1115
"new construction home loans",1104
"home loan new york",1094
"new home loan florida",1094
"temecula new home",1088
"real estate loomis new home for sale",1084
"new home interior design",1075
"new york home for sale",1065
"new hampshire home equity loans",1058
"florida new home builders",1056
"new jersey home mortgage calculator",1044
"south florida new home",1043
"new home construction in cary nc",1037
"new jersey home mortgage rate",1033
"new home sewing machine company",1028
"new jersey hud home",1024
"new home sale",1023
"loomis california ca new home for sale",1021
"home loan refinance new york",1016
"home security new york",1012
"home land new sugar texas",1011
"new england home show",1010
"new home construction orlando",1002
"real estate loomis california ca new home for sale",1002
"new home maryland",977
"buying home new york",974
"phoenix arizona new home",973
"construction home in nc new wilmington",972
"dogs looking for a new home",971
"new mexico home for sale",966
"new home phoenix",960
"development home new",952
"new home phone service",945
"denver new home",943
"new home purchase loan",939
"home new rochester security york",933
"mobile home new york",933
"ontario new home warranty",932
"new home in california",930
"new home southern california",930
"construction home new",929
"new york city home values",929
"home owners insurance new jersey",928
"new jersey home builder",923
"new+home+arizona",917
"home improvement loan new jersey",916
"vacation home new york",911
"federal home loan bank of new york",909
"new home developers reno nevada",909
"construction home new seattle",908
"new york funeral home",907
"home for sale by owner in new jersey",903
"home equity loan new hampshire",898
"home improvements for senior citizens in ozone park new york",898
"new home businesses",898
"new hampshire home equity",888
"new home sewing machine manual",880
"decorating new home",879
"construction home loan mortgage new",877
"nursing home new york",877
"lake las vegas new home",874
"home garden product furniture dealer new",872
"decorating ideas for a new home",862
"new+home+loan",861
"orlando new home construction",858
"henderson new home",852
"new jersey home inspector",851
"loomis new home for sale",849
"new home virtual tour",847
"new home communities orlando",846
"building plans for new home",840
"new mexico home loans",833
"illinois new home",829
"las vegas new home builders",816
"dallas new home",806
"new orleans home loan",805
"las vegas new home for sale",799
"antique new home sewing machine",798
"buy a new home",798
"new home building kits",794
"new home new jersey",794
"home new hampshire",793
"new york home mortgage rate",792
"new home in tampa",789
"new york home equity loans",788
"based business home new opportunity",787
"prestigious new home construction",787
"new home texas",786
"texas new home builders",783
"loomis new custom home",779
"home shopping new york",772
"home loan mortgage new rate refinance york",763
"new home developments",762
"sacramento new home",762
"new home construction nj",761
"new hampshire home additions",760
"las vegas new home construction",759
"new home announcements",759
"new home buyer loan florida",759
"new home gifts",756
"new home buyer loans atlanta georgia",750
"new home subdivision",750
"orlando florida new home",748
"new mexico home equity loans",747
"home inspection new york",746
"new orleans vacation home",742
"home for sale in new york",738
"1st new home loan bad credit",730
"new jersey funeral home",729
"norco new home",729
"new balance home page",728
"new mobile home loan",728
"new home sales training",727
"buying home new tip",726
"questions when planning for new home addition",726
"new orleans home for sale",720
"new home in sacramento",718
"new home listings",716
"jacksonville new home",714
"new home developments in san diego",714
"buying home in jersey new",713
"new home blessing",712
"costs of building a new home",710
"charlotte new home",709
"home equity line of credit new jersey",707
"mission viejo new home",707
"new home owners list",707
"new home blue print",706
"modular home new england",704
"new jersey residential new home warranty",702
"floor plans new home",700
"new jersey home remodeling",700
"real estate roseville california ca new home for sale",700
"virginia beach new home",700
"jacksonville florida new home",699
"home mortgages in new jersey",698
"roseville new home for sale",697
"new home inspectors las vegas",696
"new home inspections",693
"new home in jacksonville",691
"new home builders colorado",689
"better home and garden new cook book",685
"san diego new home starts",685
"equity home jersey loan new",680
"information on find a new home",679
"new construction home nj",678
"new bern home",677
"new home in san diego",673
"motor home new",670
"new home mortgage refinance",670
"new home denver",666
"new home insurance",666
"roseville california ca new home for sale",666
"new home designing",665
"new motor home for sale",663
"funeral home new york",661
"new home builder in florida",656
"new home for sale in florida",651
"build new home",650
"new home sales jobs",647
"at home in new york",643
"new york times home page",643
"san diego new home development",643
"new home insurance texas",642
"new comer funeral home",640
"eden park nurse home albany new york",636
"new home chicago",636
"tips on buying a new home",632
"buying construction home new tip",631
"new home additions",631
"hot new design preview home style furnishings trends 2005",629
"new jersey home inspections",627
"florida new home for sale",624
"new home nj",624
"new home in new jersey",623
"new home in phoenix",623
"new home inspection check list",623
"new home based business",622
"new york modular home price list",622
"new horizon home loans",620
"home brewing new jersey",619
"new jersey home mortgage rates",618
"new home subdivisions in boise idaho",617
"new york home inspection",614
"arizona new home construction",612
"modular home new hampshire",612
"federal home loan bank new york",611
"atlanta new home builder",610
"home mortgage loan new york",610
"new albany home",610
"new hampshire home for sale",610
"new+home+henderson+nevada",610
"new+mexico+home",610
"home+for+sale+new+hampshire",609
"new york home equity line of credit",609
"orlando new home builders",609
"new+jersey+home",608
"calgary new home",607
"new+hampshire+home+equity+loan",607
"modular+home+new+hampshire",605
"new home business opportunity",605
"new home construction advice",605
"new+hampshire+home",604
"atlanta new home search",602
"new home in colorado",599
"colorado springs new home",595
"new home in las vegas nevada",594
"new home builders orlando florida",593
"new home agents orlando",588
"new home in orlando florida",585
"new mexico home equity line of credit",584
"new jersey home page",583
"omaha new home",581
"new mobile home prices",576
"new england home",572
"montgomery county pa new home construction",570
"roseville new custom home",568
"buying guide home new",566
"new home uk",564
"home mortgage loan new jersey",563
"new mobile home sales",563
"roseville california ca new custom home",563
"new hampshire home equity line of credit",562
"new mobile home financing",558
"new home construction in nj",557
"new home builders las vegas",555
"new home checklist",555
"new world home cooking",555
"buying a home in new jersey",552
"game home legality new poker york",552
"new york home equity",551
"new mexico home rental",550
"construction financing home new",541
"new home building plans",541
"new home mortgages",539
"home loan new hampshire",538
"maryland new home builders",537
"new home in mn",536
"new home utah",536
"new shows of extreme home makeover",535
"new balance home",534
"texas new home builder",534
"new hampshire home mortgage",533
"calgary new home sales",532
"new home buyer grant",531
"california new home loan",528
"new castle home",527
"bad credit new home purchase loan",526
"new home construction illinois",523
"home expo in new albany indiana 2004",522
"arizona new home for sale",519
"new home builders in new jersey",518
"home depot new york",517
"new home austin",515
"new home construction plans",515
"home inspection new jersey",513
"florida home in investment new opportunity",512
"home equity loan rates new jersey",512
"new home buyer loans florida",512
"new home mortgage loan",511
"sarasota new home",511
"bad credit new home loans",510
"granite bay california ca new home for sale",510
"new home listings michigan",510
"new order home page",510
"buying home jersey new",508
"financing for new home construction",508
"home builders new york",507
"mobile home new",506
"new home sacramento",506
"new jersey certified home inspection",506
"atlanta new home builders",505
"new york city home page",505
"new mobile home for sale",504
"new haven home",502
"credit home loan new poor",500
"home equity loans in new jersey",499
"arizona new home builders",498
"new jersey home listings",497
"real estate roseville new home for sale",497
"mlm opportunities new home businesses",496
"new home builders in las vegas",493
"new home lincolnshire",492
"new jersey home loan rates",492
"new york custom home builders",492
"fresno new home",491
"new home construction costs",489
"new line home video",488
"north carolina new home",488
"new england home mortgage",487
"new home construction plan",487
"new mexico vacation home",487
"new home buyer guide",484
"home new jersey",482
"new home for sale arizona",482
"new home purchase loans",481
"new home toronto",480
"buying home in new york",479
"home automation new orleans",478
"memphis new home",478
"find a new home",477
"lincolnshire new home builder",477
"new construction home in nj",475
"new york home security",475
"florida new home construction",472
"new home tax deductions",472
"home builders new jersey",471
"new home sewing",471
"fitness trainer in home personal training in new york",470
"home loan new mexico",469
"new home advice",465
"home owners insurance albany new york",462
"new home deals",462
"new home sewing machine part",462
"nc new home",460
"new home building tips",459
"home mortgages new construction",458
"new bern nc waterfront home for sale",458
"new home builders in arizona",458
"new home loan california",458
"new home windows",458
"guide to buying a new home",457
"what to expect when you bring a new puppy home",456
"home equity loan in new jersey",455
"home equity loan rates in new jersey",455
"michigan new home construction",455
"new home boston uk",455
"birmingham new home",453
"first time home buyer new york",452
"how to buy a new home",451
"new home vegas",451
"new home sleaford",449
"new yahoo home page",449
"new york yankees home page",449
"new home builders orlando",448
"new orleans home builder",447
"carlsbad new home",445
"new home construction loan nc",445
"dallas texas tx new custom home",444
"equity home loan new york",444
"new home east anglia",441
"rocklin california ca new home for sale",441
"work from home new jersey",441
"new home construction in south florida",440
"new home mortgage rate",439
"new detach home listing",437
"new home heckington",437
"new bern north carolina waterfront home for sale",436
"new home in denver",435
"granite bay new home for sale",432
"nevada las vegas new home",432
"new home constructions",432
"new mexico home insurance",431
"nj new home construction",430
"new home builders southern california",429
"licensed new jersey home inspection",428
"new home communities ocala florida",428
"new york yankee home page",428
"new hampshire home mortgage rate",427
"new home colorado",427
"real estate new homes home builders longview texas",427
"real estate rocklin new home for sale",427
"temecula real estate new home communities",426
"home equity line of credit 2b new jersey",423
"new home builders florida",422
"buyer florida home loan new",419
"new home builder in lincolnshire",418
"new home construction new jersey",418
"new+home",417
"new home construction arizona",416
"albany ny bad credit new home loans",415
"new england home plan",413
"new home buyers las vegas",412
"home fitness equipment in new jersey",410
"home insurance new jersey",410
"garden home new york",409
"real estate rocklin california ca new home for sale",409
"home equity loans in new hampshire",408
"houston new home builders",408
"new home builders houston",408
"september 2004 new orleans home improvement grants september",408
"dodge county wi new home",407
"home improvement jersey loan new",407
"las vegas new home search",407
"new umbro england home shirt",407
"rocklin california ca new custom home",407
"construction home new phoenix",405
"motor home new zealand",405
"dodge county new home",404
"new home builders in texas",404
"questions to ask when building a new home",404
"scottsdale arizona new home",403
"home loan new zealand",402
"new hampshire home rental",402
"new home gift baskets",402
"modular home new mexico",400
"work from home niger kenya plea over athlete defection new",399
"new home builders arizona",398
"new home palm beach garden",397
"west virginia new home",397
"\xe2 new home tampa",397
"home equity lawsuit new york",396
"dodge county wisconsin new home",395
"new york bad credit mobile home loans",395
"rocklin new custom home",395
"new home in southern california",394
"new home virginia",394
"home inspections new jersey",393
"new home construction inspection",393
"new home loans bad credit",393
"new jersey home sales",393
"new mexico home mortgage",393
"building home new",392
"home equity loans new york",392
"home rental in new jersey",391
"minnesota real estate new home construction",391
"free new home inspection checklist",390
"georgia new home builder",390
"home furnishing new york",390
"motor home rental new jersey",390
"new mexico home builders",390
"new home search in virginia beach",389
"new mexico home mortgage rate",389
"hilton head south carolina new home real estate",388
"home alone 2 lost in new york",388
"new home in nj",388
"new home builders illinois",387
"new home warranty insurance",387
"bankruptcy home loan new",386
"houston new home builder",386
"janome new home sewing machine",386
"alberta new home warranty",385
"calculator home loan new",385
"granite bay new custom home",385
"new home office furniture",385
"new work from home",385
"waterfront home new bern north carolina",385
"builder home new york",384
"georgia new home",384
"new york home rental",384
"\xe2 new home sale",384
"new home south florida",383
"buying home new thinking",382
"new home builder pennsylvania",382
"new home construction design plans",382
"new home construction pennsylvania",382
"new home construction in maryland",381
"home furniture new york",380
"new home builders maryland",380
"first time home buyer new jersey",379
"new home owner loan",379
"new home in jacksonville florida",378
"new home in utah",378
"new home loan calculator",377
"home for sale new jersey",376
"home builders in new jersey",375
"home owners insurance in new jersey",375
"new home blueprints",375
"new log home plans",375
"home equity new york",374
"home schooling new jersey",374
"southern california new home builder",374
"new zealand home loans",373
"state of new jersey home page",373
"new port richey home",371
"top 10 things to know before buying a new home",370
"new home builders in michigan",369
"new home builder wilmington nc",369
"new orleans historic home",369
"new orleans home and garden show",369
"santa clarita new home",369
"home builders in ny ny new york",368
"home horizon loan new",368
"new home builders new jersey",368
"new home for sale in georgia",367
"new york teacher home loans",367
"new home floorplans",366
"new used mobile home prices",366
"new home builders northern california",365
"tampa new home builders",365
"new home builders in maryland",364
"new york new york las vegas home",363
"new york times home",363
"atlanta new home communities",362
"home builders new homes",362
"albuquerque new mexico home",361
"las vegas new home contractors",361
"builder home log new",360
"construction home il new",360
"new century home loan",360
"new home janome sewing machines",358
"construction home loan new",357
"minnesota new home construction",357
"new home builders ocala florida",357
"home new homes",356
"rocklin new home for sale",355
"home equity new jersey",354
"how to finance a new home",354
"home new phoenix",353
"real estate granite bay new home for sale",353
"home health aide new jersey",352
"modular home in new york",352
"new home builders california",352
"new home builders in reno nevada",352
"new home construction contracts",352
"new home developers",352
"new home ornament",352
"appraisal home new york",351
"las vegas new home builder",351
"new home builders in pennsylvania",351
"dallas new home builders",350
"new hampshire home builders",350
"new home construction california",350
"new jersey home health aide",350
"real estate new home mississippi coastal",350
"california new home builders",349
"elk grove california ca new home for sale",349
"new home in seattle",349
