keyword, count
"night vision",1079770
"night vision goggles",61320
"night vision camera",36337
"cheap night vision",33591
"night vision binoculars",29263
"night vision iraq war video clips",24935
"3d software for night vision",21232
"night vision scopes",17274
"night vision googles",16638
"night vision scope",14108
"night vision equipment",12831
"eye strain night vision",12531
"night vision monocular",9478
"vision night club",6621
"night vision security camera",6536
"night vision rifle scope",6056
"night vision monoculars",6044
"free pass to vision night club in atlanta",5970
"cheap night vision goggles",5779
"night vision glasses",5237
"sony night vision",4580
"night vision optics",4576
"night vision binocular",4106
"night owl night vision",3966
"night vision goggle",3881
"atn night vision",3676
"moonlight night vision",3538
"night vision gogles",3303
"harley night vision patch",3255
"zyprexa night vision",3193
"night vision teen foursome",3132
"microsoft night vision",3071
"us night vision",3067
"free pass vision night club atlanta",3058
"mercedes benz night vision",3045
"digital night vision",2970
"itt night vision",2907
"homeland security cameras wireless infered night vision",2864
"night vision google",2837
"itt night vision rifle scopes",2787
"night vision webcam monitoring software",2764
"infrared night vision",2578
"binoculars2c monoculars 26 night vision equipment",2521
"bushnell night vision",2514
"night vision devices",2401
"night vision rifle scopes",2379
"harley davidson night vision patch",2307
"night vision glass",2306
"long range night vision telescope",2258
"vision binoculars night",2254
"night vision sees through clothes",2237
"night vision changes",2041
"daft punk night vision mp3",2016
"night vision flashlight",2015
"night vision camcorder",1934
"cheap night vision scope",1909
"night vision systems",1908
"hyundai night vision scope",1870
"night vision products from ohio",1848
"night vision security cam",1834
"night vision gear",1825
"night vision monocular las vegas buy",1805
"russian night vision",1773
"amt night vision",1752
"night vision camera phones stills",1751
"tasco night vision",1739
"riffle mounted night vision scopes",1723
"night vision goggles cheap",1720
"night vision forum",1655
"night vision equipment company",1584
"night vision pictures",1566
"night vision video camera",1549
"equipment night vision",1545
"famous trails night vision",1519
"night vision device",1500
"night vision cameras",1492
"binoculars night vision",1491
"night vision in nocturnal animals",1485
"night vision riflescopes",1463
"night vision reviews",1457
"night vision photos",1453
"how does night vision work",1449
"night vision review",1446
"night vision comparison",1442
"generation 4 night vision",1439
"yukon night vision",1428
"poor night vision",1421
"night vision view of the earth",1396
"used night vision",1383
"homemade night vision",1359
"night vision images",1340
"2nd generation night vision",1328
"night vision canada",1325
"generation 2 night vision",1320
"night vision secury camera",1314
"cheap night vision with ir",1313
"prices night vision",1308
"night vision goggles2c for sale2c less than 20024",1300
"testing night vision agc",1291
"night vision sites",1289
"testing night vision",1286
"night vision mini",1284
"night vision 3rd gen",1280
"moonlight brand night vision",1275
"night vision video",1255
"night vision videos",1251
"x ray night vision",1250
"thermal night vision",1248
"night vision camcorders",1244
"baird2c night vision",1241
"atn nzt 6 night vision",1237
"sensor fusion night vision",1237
"thermal imaging raytheon system co night vision",1236
"night vision rearview camerasa0",1228
"belarus night vision",1227
"us night vision guardian",1226
"digital camcorders with night vision",1221
"night vision generation 4",1221
"night vision facts",1214
"pvs14 night vision",1200
"bull night vision",1199
"pvs 4 night vision",1199
"pvs 14 night vision",1198
"chinese made third generation night vision",1197
"night vision goggles2c for sale",1191
"meade digital night vision",1189
"night vision virtual",1187
"how to build night vision",1185
"sony night vision camera",1184
"thermal night vision equipment",1176
"night vision raytheon",1168
"night vision technology",1161
"night vision equip",1152
"us navy flight training night vision goggles",1150
"usb night vision",1144
"apache night vision video",1137
"electronics night vision police scanner",1129
"automobile night vision",1098
"apache night vision video enemies",1096
"gec cats eyes night vision goggles",1094
"night vision uk",1093
"night vision spy camera",1092
"wireless night vision camera",1089
"cadillac night vision",1083
"moonlight night vision paramount",1078
"infra red night vision",1077
"how night vision works",1076
"night vision cam",1067
"litton night vision",1065
"raytheon night vision",1034
"discount night vision goggles",1030
"night owl vision",1020
"night vision ski goggles",1014
"camera night security vision wireless",1008
"microsoft wireless intellimouse explorer night vision",1005
"vision night club atlanta",1003
"day night vision rifle scopes",981
"night vision car additon",980
"night vision binochulars",975
"night vision manufacturers",958
"night vision labs",957
"improving night vision",940
"12ghz wireless night vision camera gold",933
"night vision eyes",927
"vision night club chicago",923
"cheap night vision scopes",917
"night vision repair",903
"weaver nightview digital night vision",902
"military night vision",897
"seeing stars night vision",890
"atlanta club night vision",883
"weaver night vision",881
"apache night vision",875
"retron night vision",874
"do it yourself night vision",871
"weaver night vision nz",857
"bushnell night vision binoculars",834
"3d software night vision",828
"computer night vision cams",819
"night vision american flag",819
"ne6015 night vision scopes",814
"military night vision goggles",802
"equipment for night vision",798
"ohio night vision",797
"night vision iraqi video",795
"night vision test equipment",791
"automotive2c night vision",783
"enhance night vision",771
"night vision and photoelectric effect",769
"goggles night vision",764
"night vision see thru",762
"surveillance system with night vision",758
"night vision equipment co",744
"discount night vision",727
"night blindness and vision conditions",722
"maxsight night vision",709
"hmd night vision",708
"night vision recorders",703
"night vision mini internet camera drivers",701
"night vision sniper scope",696
"bnv 3 night vision binocular goggles scope w ir",686
"night vision security cameras",686
"russian night vision rifle scopes",681
"night vision compare",680
"digital imaging night vision",672
"inexpensive night vision goggles",670
"measuring night vision",668
"night vision camers",667
"atn night vision cyclop",664
"bushnell night vision monocular",661
"meade night vision",661
"night leopard night vision monocular",661
"night vision com",661
"night vision generations",661
"night vision claroxan",660
"coyote night vision picture",657
"night vision equipment uk",655
"intensified night vision",650
"swiss army night vision watch",647
"cheapest night vision",645
"night vision homebreaux",644
"night vision scopes for the m162fm4",643
"night vision weapon sight",626
"how do night vision goggles work",610
"home security camera with night vision",607
"chicago club night vision",605
"night vision outdoor security camera",604
"how to make night vision goggles",601
"how night vision goggles work",598
"night watch night vision binoculars",592
"atn rifle scopes night vision",583
"night vision compatable light",581
"night vision device training",579
"atn nzt 6 night vision spotting scope",577
"famous trails night vision scope",566
"night vision mini scopes",562
"night vision googles online shop",544
"howstuffworks spy night vision goggles",538
"night vision digital video recorder",518
"an2fpvs 7b night vision goggles",515
"toyota night vision mirror",508
"night vision optic",501
"night vision goggles buy",497
"night vision store",491
"night vision rifle scopes gen 3",486
"night vision spotting scopes",486
"litton night vision scopes",485
"night vision digital camera",483
"night vision surveillance equipment",482
"itt night vision goggles",481
"night vision voyeur",477
"how to build night vision goggles",476
"d 510 night vision rifle scopes",475
"itt night enforcer 160 night vision",475
"cop chase night vision",474
"underwater video system night vision camera portable",472
"night vision contacts",471
"night vision security camera accessories",469
"security night vision camera w2f infared",468
"night owl night vision goggles",464
"night vision lenses",462
"long range night vision surveillance",461
"gen 3 night vision",458
"discount night vision scopes",453
"cheap night vision binoculars",452
"night vision bedding",452
"36x night vision scope",448
"swiss army night vision",446
"discussion night vision binoculars",444
"night vision zoom security systems",444
"ir m18 army issue night vision binoculars",443
"itt night vision gen 3",443
"night vision goggles in the uk",443
"atn night vision scopes",441
"laser eye surgery and night vision",439
"spy store night vision",437
"night vision goggles tempest",436
"night vision greys",436
"night vision litton electronics and nightvision",436
"military night vision scope",425
"night 2b vision 2b scopes",424
"night vision comparison table",421
"home security first alert night vision cameras",418
"vizzion night vision binoculars",418
"helicopter night vision safety",415
"night vision sights",413
"harbor freight night vision binoculars",412
"night vision for automobiles",409
"coyote brown night vision goggles pouch",408
"night vision weapon sights",408
"night quest night vision",406
"human night vision",404
"night vision laser sight",404
"zenit night vision",404
"26 night vision equipment",401
"amt night vision optics",401
"devices optics night vision",401
"night vision handycam",400
"anvis night vision goggles",399
"night vision lighting aviation",399
"night vision sex",397
"night vision tv",397
"night vision customize",395
"night vision surveillance camera",392
"night vision wireless security camera",391
"m1a2 mbt night vision equipment",389
"coleman night vision monocular",388
"site www.defensereview.com maxsight night vision",387
"thermal night vision goggles",387
"soligor night vision binoculars",381
"night vision binoculars uk",380
"infrared night vision goggles",379
"bushnell digital night vision",374
"moon light night vision",374
"club night saugus vision",372
"camera night surveillance vision",371
"ferranti night vision goggles",371
"night vision video cameras",371
"bushnell night vision goggles",369
"picture of night vision goggles",367
"aviation night vision goggles",366
"night vision goggles smallest",366
"paris hilton night vision",366
"night vision goggles safety",365
"night vision safety warning",365
"night vision goggles helicopter operations",364
"night vision equipment for aerospace organization",361
"improving night driving vision",358
"infrared night vision binoculars",358
"camera night vision wireless",357
"night vision binocular review",357
"night vision goggles history",357
"military surplus night vision",354
"night vision binocular mfg",354
"commando night vision binoculars",349
"frangible night vision goggles mount",349
"army aviation night vision goggles history",348
"binoculars night vision scorpio ii",347
"night vision binocular reviews",346
"airplane night vision",344
"anvis 6 night vision goggles",344
"retailers for night vision binoculars",344
"vision night club in atlanta",344
"binoculars mariner itt night vision",341
"night vision spy equipment",341
"anvis 9 night vision goggles",339
"magnetism night vision goggles",339
"nzt 625 night vision spotting scope",339
"spy night vision goggles",338
"camera night security vision",337
"cheap night vision aimpoint",337
"inventor of night vision goggles",337
"rigel night vision goggles",336
"cobra handy night vision binoculars",335
"south africa store buy night vision binoculars",333
"future of night vision goggles",332
"houston binoculars night vision",332
"anvis 5 night vision goggles",331
"night vision binoculars 30x50",330
"night vision training",330
"night vision drivers training",329
"night vision binocular comparison",327
"night vision goggles for kids",327
"tactical night vision",327
"4th generation night vision goggles",326
"freestyle predator night vision watch",326
"history of night vision goggles",323
"night vision compatible displays",321
"night vision works",321
"amt night vision goggles",320
"homemade night vision goggles",319
"morro vision and itt night quest 210",319
"night vision gated video driving",319
"night vision voyeur vids",319
"night vision goggles operators manual",318
"thermal imaging raytheon system night vision",317
"atn cougar night vision goggles",316
"night vision infared equipment",316
"night vision monocular night spy",316
"prices cheap night vision goggles",316
"commando night vision 20x50",314
"inexpensive night vision binoculars",314
"night vision alert",314
"using night vision equipment",314
"model 3250 riegel night vision goggles",313
"night vision accessories",313
"range night vision 3rd generation thermal targeting sight",313
"second hand night vision goggles",313
"cheapest night vision binoculars",312
"itt night vision g3",311
"night vision attack video",310
"night vision binoculars for children",310
"night vision goggles training",310
"electronics police scanners night vision",309
"full color night vision camera",309
"night vision camouflage bedding",309
"see through night vision",309
"atn night vision goggles w2fheadgear",308
"history of night vision",308
"low priced night vision binoculars",308
"night vision goggles review",308
"hidden camera night vision",307
"night vision binoculars reviews",307
"night vision goggles order purchase",307
"technology aviation night vision goggles",307
"apache crash night vision video",306
"intevac night vision goggles",306
"night vision equipment company nvec 850",306
"night vision goggle vision problems",306
"night vision surveliance cameras",306
"night vision virtual military lens",306
"night vision goggles akron ohio",305
"night vision goggles generation iii omnibus iv",305
"night vision mini video cameras",305
"arms use of night vision goggles",304
"boston club night vision",304
"renting night vision goggles",304
"night vision goggles star gate",303
"sniper country m993 ranger night vision sight",303
"how to use commando night vision binoculars",302
"night vision camera site3astoreyahoocom",301
"an pvs 1 night vision",300
"army special operations and night vision goggles",300
"law enforcement night vision goggles",300
"m993 ranger night vision sight",300
"night vision goggles night vision",300
"night vision goggles with ir",300
"camera night vision",299
"first alert night vision cameras",299
"how does the on off switch on night vision goggles",299
"itt industries night vision",299
"night vision goggles operations",299
"heli night vision crash video",298
"shopping night vision goggles",298
"army aviation evolution of night vision goggles",297
"prices night vision goggles",297
"who invented night vision goggles",297
"ciba vision day and night contact lenses",296
"rotating mini video cameras night vision",296
"outdoor night vision cameras",295
"night rifle scope vision",294
"night vision equipment accessories",294
"www night vision com",294
"compare night vision monocular",292
"night vision cartoon",292
"night vision automobile",291
"atmospheric transmittance and night vision goggles",290
"night vision goggles kid afordabel",290
"night vision goggles used in stargate atlantis",290
"army aviation and night vision goggles",288
"famous quotes while flying night vision goggles",288
"night vision camara itt",288
"night vision goggles in michigan",288
"night vision goggles kid affordable",286
"what year was night vision goggles invented",286
"next generation night vision goggles",285
"generation four night vision goggles",284
"when were night vision goggles discovered",284
"windshield in car night vision 2f heads up display",284
"what company invented night vision goggles",283
"an2favs 9 night vision goggles anvis",282
"camcorder night vision pictures",277
"where do you buy night vision goggles",277
"see through night vision camera pics",273
"how to make your own night vision goggles",269
"club night vision",267
"how to make my own night vision goggles",266
"night vision canada ir light",262
"financial night report vision",261
"night vision goggles sale",256
"night scope vision",254
"night vision camera phone stills",254
"car night vision",253
"googles night vision",249
"gogels night vision",248
"lasik night vision",243
"night vision goggles uk",241
"bushnell night vision uk",237
"glasses night vision",237
"binocular night vision",236
"night vision lighting conversions",235
"night vision technologies",234
"camcorder night vision",232
"night vision history",232
"apache night video vision",230
"night optics vision",228
"newcon night vision",226
"night vision products",224
"aries night vision",223
"night vision nzt 1ri",222
"atlanta club georgia night vision",220
"goggles night russian vision",220
"camera hidden night vision",219
"chicago club in night vision",219
"night vision cheap",219
"camera night video vision",218
"monocular night vision",218
"night and vision and monocular and goggles",218
"night vision see through",218
"goggles infrared night vision",216
"night shadow night vision",216
"np75 night vision",214
"vision night club saugus",213
"hilton night paris vision",212
"night vision riflescope",212
"waterproof night vision",212
"gear night vision",211
"marine night vision",211
"night vision infrared",211
"night vision lens",211
"cobra night vision equipment",210
"sony night vision see through",210
"cheap goggles night vision",209
"night+vision",208
"gen iii night vision",207
"night vision video surveillance",207
"night vision scope rifle",205
"night vision gogle",200
"atlanta club ga night vision",199
"best night vision",198
"coleman night vision",198
"color night vision",197
"ciba vision night and day",195
"atlanta club georgia in night vision",194
"atlanta club in night vision",193
"nait night vision",193
"night vision pics",193
"vision night",192
"atlanta club ga in night vision",190
"night vision telescope",187
"camera night outdoor security vision",186
"orion night vision scopes",186
"generation 3 night vision",185
"girl night vision",185
"night vision binoculors",185
"ciba vision focus night and day",182
"homeland security camera wireless infered night vision",182
"night vision australia",182
"camera digital night video vision",181
"vision night club atlanta ga",181
"vision night club in atlanta ga",181
"night vision camera filters",180
"vision night club in saugus",180
"binoculars bushnell night vision",179
"night vision products from",179
"night vision sale",179
"seben night vision",179
"goggles night sale vision",178
"goggles itt night vision",176
"build goggles night vision",173
"camera lens night vision",173
"cheap night scope vision",172
"company equipment night vision",172
"radio night vision optics",172
"how to make night vision",171
"contact lens night vision",170
"camera night sony vision",169
"night vision photography",169
"cam night spy vision",168
"night owl optics night vision",168
"army night swiss vision watch",166
"night vision gun scopes",166
"night vision sight",166
"night vision filters",165
"night vision goggles for sale",164
"night vision system",163
"camera night spy vision",162
"cam night vision web",162
"improve night vision",162
"club ma night saugus vision",161
"night vision buy",160
"night vision wireless camera",159
"army night swiss vision",158
"splinter cell night vision",158
"generation night vision",157
"night sex vision",157
"night video vision",157
"vision night club saugus ma",157
"night vision goggels",156
"night night optics owl vision",155
"night vision contact lens",153
"osprey night vision",153
"who invented night vision",153
"night vision nudes",151
"buy night vision goggles",149
"3rd generation night vision",148
"yukon night vision scopes",147
"camera cheap night vision",146
"club kim lil night vision",146
"russian night vision goggles",146
"army night vision",145
"industry itt night vision",145
"night russian vision",145
"targets goggles night vision",145
"night vision web cam",144
"night vision xray",144
"vision night club boston",144
"2 generation night vision",143
"atl club night vision",143
"club ma night vision",143
"night vision sony",143
"night vision nude",142
"night vision security camera system",142
"night vision binoculars discounted",141
"night vision filter",141
"prk retreatement night vision",141
"club in night saugus vision",140
"night vision cctv",140
"freestyle night vision watch",139
"club madison night vision",138
"night vision for sale",138
"night vision lab",138
"night vision work",138
"buy night vision",137
"gogles night vision",137
"wholesale night vision goggles",137
"3 generation night vision",136
"night vision webcam",136
"raptor night vision",136
"4 generation night vision",135
"cobra night vision",135
"gsci night vision",135
"night vision x ray",135
"rigel night vision",135
"elf night vision",134
"night vision information",134
"photos of night vision goggles",134
"equipment night selection vision",133
"night vision goggles assembly",133
"night vision web",133
"cam mini night vision",132
"ghost recon night vision",132
"how to photography with night vision",132
"military night scope vision",132
"night vision goggles schematic",132
"google night vision",131
"wireless night vision security camera",131
"calypso night vision",130
"contact night vision",130
"owl night vision",130
"glasses night sun vision",129
"night vision optics bushnell",129
"device night vision",128
"boston club in night vision",127
"camcorder night see through vision",127
"camera color night vision waterproof",127
"night photography vision",126
"night vision contact lenses",126
"night vision monocular buy",126
"bow night vision",125
"driving glasses night vision",125
"info on night vision",125
"night vision mecury camera",125
"camcorder night sony vision",124
"ciba day night vision",124
"2 night tvs vision",123
"animal night strong vision",123
"bushnell night vision scope",123
"camera digital night vision",123
"cam night vision",123
"night scope spotting vision",123
"digital night vision scopes",122
"sony camcorder night vision",122
"1.2 camera ghz night vision waterproof",121
"club madison night vision wi",121
"goggle night vision",121
"nightowl night vision",121
"excalibur night vision",120
"night vision tubes",120
"2.5x42 binoculars bushnell night vision",119
"night technology vision",119
"vision night club in chicago",119
"3 gen night vision",118
"night thermal vision",118
"ox night vision",117
"x night vision",117
"bushnell monocular night vision",116
"military night surplus vision",116
"night sony vision",116
"scopes night vision",116
"zeiss night vision",116
"digital camera night vision",115
"ir night vision",115
"night vision digital cameras",115
"night vision view of the",115
"soviet night vision",115
"night vision binoculars camera",114
"russian night vision binoculars",114
"full screen night vision",113
"gen2 night vision",113
"surplus night vision",113
"army night vision lab",112
"bushnell night vision binoculars 2.5x42",112
"monoculars night vision",112
"gen3 night vision",111
"lighting night vision",111
"night night shadow vision",111
"night picture vision",111
"an pvs 4 night vision scope price used",110
"gen iii omni iv pinnacle night vision",110
"night vision generation",110
"night vision for algeria",109
"cheap night vision cameras",108
"famous night trail vision",107
"night product vision",107
"night system vision",107
"night vision online forum",107
"night vision yukon",107
"how to build your own night vision device",106
"manufacturers of night vision binoculars",106
"rigel 3200 pro night vision goggles",106
"night vision for owl",105
"night vision laboratory",105
"oldelft night vision",105
"pvs 7 night vision",105
"viper night vision",105
"canada night vision",104
"ebay australia night vision",104
"night us vision",104
"night vision car",104
"uk night vision",104
"night vision itt",103
"night vision weaver",103
"generation ii night vision",102
"mono night vision goggles an pvs 14 used surplus",102
"night night owl vision",102
"forum night vision",101
"kayak night vision",101
"night poor vision",101
"night vision improvement",101
"night vision military",101
"russia night vision",101
"night osprey vision",100
"night+vision+googles",100
"ciba vision night",99
"night review vision",99
"nvec night vision",99
"goggles night vision work",98
"night sight vision weapon",98
"night vision price",98
"pns night vision",98
"digital night vision camera",97
"hell is for heroes night vision",97
"lomo night vision",97
"american night vision",96
"amt nightscout night vision optics",96
"atn viper night vision goggles",96
"camera home night security vision",96
"laser target night vision",96
"us night vision 241m",96
"camera mini night spy vision",95
"night vision problems",95
"cobra meteor night vision binoculars",94
"simrad night vision",94
"sony night vision infared camcorders",93
"toy night vision goggles",93
"camera night security surveillance system vision",91
"night scope vision weapon",91
"vital night vision",91
"night vision texas",90
"fullscreen night vision for ghost recon",89
"night vision blow",89
"cars with night vision",88
"us manufacturers night vision goggles",88
"camera home night security system vision",87
"night vision baby camera",87
"purchase night vision binoculars",87
"night vision lyrics",86
"oldelft night vision goggles",86
"loss of night vision",85
"used night vision goggles",85
"ir m18 army issue night vision binocular",84
"1.2ghz wireless night vision camera gold",83
"animals night vision",83
