keyword, count
"gen ii night vision goggles",83
"goggles kid night vision",83
"night vision chat rooms",83
"night vision rifle",83
"1998 night vision cam corder",82
"gen 2 night vision",82
"goggles make night vision",82
"laser eye surgery night vision",82
"night vision goggles education",82
"night vision movie",82
"night vision mall",81
"security cameras night vision",81
"xray night vision",81
"compact night vision goggles",80
"night vision binnoculars",80
"night vision pic",80
"see through clothing night vision",80
"star tron optics night vision",80
"night owl night vision binoculars",79
"dark fruit night vision",78
"harbor freight night vision binocular",78
"free better night vision pills",77
"m983 night vision",77
"vision night club houston",77
"wholesale night vision",77
"compare night vision",76
"how night vision devices work",76
"night vision animal",76
"atn night vision goggles with headgear",74
"night vision battery",74
"night vision binoculars monoculars scopes",74
"night vision camera filter pictures",74
"night vision camera photos",74
"night vision ccd panasonic conversion",74
"sony camcorder with night vision",74
"generation 2 night vision binoculars",73
"goggles military night vision",73
"hidden cameras with night vision",73
"night vision picture",73
"visual performance with night vision goggles",73
"wamco night vision filters",73
"night vision and goggles or glasses or spy and kid",72
"night vision europe",72
"free passes to vision night club",71
"night vision animals",71
"video cameras with night vision",71
"1400 select night vision scope",70
"ir laser sight night vision",70
"weapons sights night vision",70
"foxbat 4 night vision carson",69
"generation four night vision devices",69
"kidpower real working night vision goggles",69
"lightwedge night vision",69
"night vision lens goggles",69
"spi and night vision",69
"vision saturday night",69
"29wildlife night vision surveillance camera",68
"camcorder night vision see through",68
"digital camcorder with night vision",68
"electro magnetic spectrum and night vision goggles",68
"head mount night vision",68
"night vision device test",68
"night vision goggles reviews",68
"russian trade night vision",68
"the history of night vision goggles",68
"carson night vision",67
"clover oc 275 color outdoor night vision ccd camer",67
"father of night vision",67
"free passes vision night club",67
"hammerhead night vision by freestyle 660ft",67
"laser use with night vision",67
"nightview digital night vision",67
"night vision blindness",67
"night vision gm",67
"wireless night vision spy video camera",67
"wireless night vision surveillance",67
"hawkeye night vision",66
"inpro nightfall night vision binoculars",66
"litton night vision devices",66
"night vision guide",66
"night vision video enemies",66
"night vision wife",66
"optical systems night vision",66
"prk+retreatement+night+vision",66
"3rd generation night vision binoculars",65
"baygish night vision",65
"bushnell night vision binocular",65
"buy night vision here",65
"digital camera night vision motion sensitive",65
"night vision monocular sale",65
"night vision prk",65
"night watch night vision binocular",65
"self powered night vision",65
"soligor night vision binocular",65
"apple night vision optics",64
"binoculars itt mariner night vision",64
"binoculars night uk vision",64
"night vision comparisons",64
"night vision goggles australia",64
"n-vision sierra 2 night vision monocular",64
"thermo imaging night vision",64
"infrared night vision camera",63
"night vision an tvs",63
"night vision driving systems",63
"night vision goggles pvs 31",63
"n-vision 29sg night vision monocular",63
"osprey international night vision",63
"ratings for night vision",63
"scopesnmore gen 1 night vision monoculars",63
"weaver nightview digital night vision monocular",63
"aviation accidents involving night vision goggles",62
"build night vision",62
"build night vision goggles",62
"camcorder night vision lens",62
"night vision helmet mount",62
"pro con night vision",62
"rate night vision",62
"sony night vision infrared camcorders",62
"thermal night vision scope",62
"1st generation night vision",61
"amatuer night vision",61
"aurora dnv night vision",61
"control products corporation night vision",61
"houston binocular night vision",61
"marine corps night vision oif",61
"night vision 190",61
"night vision camcorder lens",61
"night vision for existing rifle scopes",61
"night vision goggle presentations",61
"pot plants can be seen with night vision",61
"dedal night vision",60
"infared night vision reviews",60
"night vision by the n-vision optics company",60
"night vision computer monitor",60
"night vision goggle presentation",60
"night vision goggles2c for sale2c less than",60
"night vision scope rifle sniper",60
"pvs 7d night vision",60
"science fair optical night vision",60
"uk night vision cheap",60
"uk night vision optics",60
"what stores night vision goggles",60
"zenit nv 100 night vision scope",60
"home security cameras with night vision",59
"metron nv 323 night vision",59
"night vision equipment set",59
"night vision monoculars night vision",59
"tvs 5 night vision",59
"wireless night vision cameras",59
"cheap night vision equipment",58
"itt night vision scopes",58
"night vision aviation",58
"yukon pigmy night vision monocular with infrared illuminator",58
"history of the night vision google",57
"how is night vision use",57
"night vision mt 1",57
"photo of night vision",57
"remanufactured night vision",57
"stalker night vision",57
"binoculars discussion night vision",56
"club lounge night vision",56
"goggles night surfing vision",56
"looking for night vision equipment",56
"night vision artist management",56
"night vision goggles in world war two",56
"night vision schematics",56
"night vision viewer",56
"nitemax night vision equipment",56
"three way flashlight night vision",56
"united states air force night vision goggles",56
"home night vision cameras",55
"increasing night vision diet",55
"make night vision",55
"marine night vision system",55
"night vision nz",55
"camping gear night vision optics",54
"horse night vision",54
"m 16 night vision scopes",54
"tm 11 5855 262 10 2 night vision goggles",54
"wirless night vision surveillance camera",54
"electronic night vision police scanner",53
"night vision goggles night vision devices",53
"video night vision rifle scope",53
"2 4ghz 4 channel receiver 4 wireless night vision colour",52
"nighthawk night vision",52
"night vision comparision",52
"animals night vision photography",51
"binoculars discount night vision",51
"binoculars houston night vision",51
"clover bw indoor night vision audio cameras with 15 range",51
"goggles helicopter night vision",51
"goggles night night owl vision",51
"night vision goggle accessories",51
"night vision site",51
"night russian scope vision",50
"night vision goggles work",50
"night vision scopes generation 4",50
"night vision goggles art bell",49
"night vision rail system",49
"compact night vision scope",48
"design night vision",48
"night owl flipup night vision goggles",48
"night+vision+goggles",48
"search yahoo com/search p night vision",48
"clover bw mini professional camera with 30 night vision rang",47
"night vision scope uk",47
"johnson s criteria night vision goggle",46
"night vision laser scope",46
"night vision problem",46
"night vision security cameras shipped cod",46
"swiss armya night vision watch",46
"infrared night vision binocular",45
"infrared night vision technology",45
"night owl 31x night vision monocular",45
"night vision long range security cameras",45
"night vision vids",45
"night rifle russian scope vision",44
"night vision combat",44
"night vision made in pa",44
"night vision nzt 22",44
"goggles history night vision",43
"night vision astronomy",43
"night vision imaging system",43
"night vision vomz",43
"night vision photos gen 1",42
"tasco binoculars night vision",42
