keyword,count
"online paralegal degree",171271
"paralegal degree online",14348
"online+paralegal+degree",1940
"associate degree online paralegal",1034
"paralegal bachelor degree online",953
"online associate paralegal degree",877
"online paralegal degree program",516
"aba approved paralegal degree online",489
"bachelor degree online paralegal",469
"online paralegal bachelor degree",465
"degree online paralegal",347
"accredited paralegal degree online",138
"degree online paralegal program",108
"paralegal online degree",94
"paralegal+bachelor+degree+online",56
"associates degree paralegal online legal assistant",51
"paralegal+degree+online",43
"online paralegal degree united states",42
"online paralegal degree programs",39
"bachelor degree in paralegal study online",35
"online paralegal degree california universities",33
"paralegal seminar online paralegal degree new york paralegal",29
"online paralegal associates degree",28
"online+paralegal+degree+program",28
"http online paralegal degree",25
"online+associate+paralegal+degree",25
"paralegal online accredited degree",24
"online degree paralegal",23
"aba+approved+paralegal+degree+online",20
"paralegal degree online paralegal education",18
"new york paralegal certificate online paralegal degree",16
"online paralegal associate degree",16
"1 degree degree degree education online online paralegal",12
"online paralegal degree paralegal degree paralegal resume",12
"online medical billing coding paralegal transcription degree",12
"1 degree education online online paralegal paralegal",12
"1 degree education online paralegal paralegal paralegal",12
"online paralegal master degree",12
"aba approved degree online paralegal",12
"paralegal degree online university of phoenix",11
"online paralegal degree delaware",10
"online paralegal degree paralegal school totalparalegal.com",10
"bachelor degree in online paralegal study",9
"ac online paralegal degree",9
"aba approved paralegal online paralegal degree",9
"online paralegal degree 20",9
"an online course for a master degree in paralegal",8
"p online paralegal degree",8
"online paralegal degree paralegal san diego paralegal",8
"online paralegal degree new york paralegal certificate",8
"accredited online paralegal degree",8
"online paralegal degree alaska",8
"online paralegal degree georgia paralegal school paralegal",8
"ociates degree paralegal online legal istant",7
"online paralegal degree alabama",7
"online paralegal degree online paralegal education paralegal",7
"online paralegal degree arizona",7
"accredited+paralegal+degree+online",7
"online paralegal degree wisconsin",7
"online associates degree in paralegal",7
"online paralegal degree paralegal seminar totalparalegal.com",7
"online paralegal degree hawaii",6
"get my associates degree in paralegal studies online",6
"1 degree degree online online paralegal paralegal paralegal",6
"2 online paralegal degree",6
"online paralegal degree wyoming",6
"paralegal san diego online paralegal degree paralegal resume",6
"1 degree degree online paralegal paralegal",6
"online paralegal degree online paralegal degree",6
"1 degree online paralegal paralegal paralegal resume seminar",6
"online paralegal degree nevada",5
"online paralegal degree ohio",5
"online paralegal degree vermont",5
"kansas paralegal degree online nfpa",5
"georgia paralegal school online paralegal degree georgia",5
"online paralegal education paralegal degree new york",5
"5 online paralegal degree",5
"online paralegal degree nebraska",5
"paralegal resume online paralegal degree paralegal seminar",5
"online paralegal degree illinois",5
"accredited degree online paralegal",5
"online paralegal degree kansas",5
"online paralegal degree new mexico",5
"paralegal degree paralegal degree paralegal degree online",5
"online paralegal degree colorado",5
"accociates degree in paralegal studies online",5
"online paralegal degree utah",4
"online paralegal degree aba approved paralegal paralegal san",4
"online paralegal degree idaho",4
"hiv online paralegal degree",4
"cheap online paralegal degree",4
"online paralegal degree louisiana",4
"online paralegal associate degree aba approved",4
"online paralegal degree online paralegal degree online",4
"online paralegal degree oklahoma",4
"online paralegal degree rhode island",4
"addwords online paralegal degree",4
"paralegal san diego online paralegal degree",4
"online course for paralegal master degree",4
"online paralegal degree florida",4
"online paralegal degree montana",4
"online paralegal degree prices fees cost",4
"paralegal san diego paralegal school online paralegal degree",4
"online paralegal degree nursing school",4
"online paralegal degree maine",4
"homemaking online paralegal degree",4
"online paralegal degree georgia paralegal school aba",4
"online course for paralegal degree master",4
"online paralegal degree spring city utah",3
"online degree in paralegal from kaplan",3
"minidisc player online paralegal degree",3
"phoenix university online paralegal bachelors degree",3
"online paralegal degree online psychology degree",3
"online paralegal degree escalante utah",3
"online associates degree in paralegal studies",3
"online paralegal graduate certificate degree",3
"paralegal+online+accredited+degree",3
"online paralegal degree michigan",3
"online paralegal degree accredited school",3
"paralegal online bachelor degree accredited",3
"online college degree paralegal",3
"7 online paralegal degree",3
"ohio online paralegal degree",3
"online paralegal degree accredited",3
"associate+degree+online+paralegal",3
"online intellectual property paralegal degree",3
"online paralegal degree phpsessid",3
"paralegal degree online paralegal education paralegal degree",3
"paralegal online degree program",3
"online associate degree paralegal",3
"online paralegal degree georgia paralegal school",3
"ociate degree online paralegal",3
"paralegal associate degree online in georgia",3
"paralegal online associate degree",3
"online paralegal degree indiana",3
"paralegal associate degree program online",3
"online paralegal degree boulder city nevada",2
"paralegal degree online military discount",2
"online paralegal degree maryland",2
"paralegal degree california online",2
"online paralegal degree paralegal seminars online paralegal",2
"online paralegal degree logandale nevada",2
"online paralegal degree north dakota",2
"online paralegal degree mountain view wyoming",2
"online paralegal degree whitingham vermont",2
"online paralegal degree paralegal seminars",2
"online paralegal degree arkansas",2
"get an online degree in paralegal",2
"online paralegal degree massachusetts",2
"paralegal resumes online paralegal degree totalparalegal.com",2
"online paralegal degree minnesota",2
"paralegal degrees online paralegal degree online paralegal",2
"online paralegal studies associates degree",2
"online paralegal degree derby vermont",2
"online paralegal degree wilmington vermont",2
"online associates of science degree in paralegal studies",2
"online bachelors degree in paralegal studies",2
"online paralegal degree frederica delaware",2
"online paralegal degree with job placement",2
"lo online paralegal degree",2
"online degree paralegal studies",2
"r online paralegal degree",2
"ac ac online paralegal degree",2
"online paralegal degree mississippi",2
"paralegal degree online paralegal certificate leg",2
"online paralegal degree west rutland vermont",2
"paralegal seminars paralegal school online paralegal degree",2
"online paralegal degree paralegal san diego",2
"online paralegal degree georgia paralegal school georgia",2
"online paralegal degree tuscarora nevada",2
"online ny paralegal degree",2
"online paralegal degree dubois wyoming",2
"new jersey online paralegal degree schools",2
"online paralegal degree barrington rhode island",2
"degree online paralegal 20",2
"online paralegal degree west virginia",2
"pa online paralegal degree",2
"online paralegal degree bradford rhode island",2
"paralegal seminars online paralegal degree online paralegal",2
"online paralegal degree warwick rhode island",2
"online paralegal studies bachelors degree",2
"online paralegal degree virginia",2
"online paralegal degree fruitland utah",2
"online paralegal degree texas",2
"online paralegal degree tennessee",2
"online paralegal degree round mountain nevada",2
"georgia paralegal school online paralegal degree paralegal",2
"online college degree paralegal california",2
"paralegal degree online psychology",2
"11 online paralegal degree",2
"online paralegal degree iv",2
"paralegal school online paralegal degree online paralegal",2
"online paralegal degree south carolina",2
"paralegal degree atlanta online degree",2
"online paralegal degree in wi",2
"online paralegal degree nursing degree",2
"online paralegal degree west burke vermont",2
"online paralegal degree new hampshire",2
"online paralegal degree in miami florida",2
"my ebay bidding online paralegal degree",2
"online degree in paralegal",2
"seap debt counseling online paralegal degree",2
"bachelor+degree+online+paralegal",2
"online paralegal degree minden nevada",1
"online paralegal degree kentucky",1
"online paralegal degree orwell vermont",1
"online paralegal degree west danville vermont",1
"online paralegal degree port alexander alaska",1
"online paralegal degree pennsylvania",1
"online paralegal degree lingle wyoming",1
"online paralegal degree woodbury vermont",1
"online paralegal degree manhattan nevada",1
"online paralegal degree white mountain alaska",1
"online paralegal degree west wendover nevada",1
"homeowners online paralegal degree",1
"online paralegal degree center harbor new hampshire",1
"online paralegal degree dorset vermont",1
"suny online paralegal degree",1
"online paralegal degree mercury nevada",1
"cruise travel/ online paralegal degree",1
"online paralegal degree west charleston vermont",1
"online paralegal degree nenana alaska",1
"online paralegal degree west dummerston vermont",1
"online bachelor''''s degree in paralegal studies",1
"paralegal degrees paralegal degrees online paralegal degree",1
"online paralegal degree nunapitchuk alaska",1
"best online degree in paralegal",1
"online paralegal degree cobalt connecticut",1
"online paralegal degree croydon utah",1
"online paralegal degree makaha hawaii",1
"online paralegal degree montchanin delaware",1
"paralegal degree aba approved paralegal online paralegal",1
"online paralegal degree paradise valley nevada",1
"am online paralegal degree",1
"online paralegal degree levan utah",1
"online paralegal degree eden idaho",1
"online paralegal programs for an associates degree",1
"online paralegal degree las vegas nevada",1
"paralegal degree online military spouse",1
"online paralegal schools associate degree",1
"3 online paralegal degree",1
"online paralegal degree levelock alaska",1
"online college degree paralegal california aba approved",1
"online paralegal degree orovada nevada",1
"online paralegal degree osage wyoming",1
"online paralegal degree port penn delaware",1
"online paralegal degree westford vermont",1
"online degree paralegal accredited",1
"online paralegal degree point baker alaska",1
"online paralegal degree fairlee vermont",1
"online paralegal degree island pond vermont",1
"online education degree prgrams paralegal",1
"online paralegal degree pelican alaska",1
"online paralegal degree genoa nevada",1
"lawyer legal paralegal online degree",1
"online paralegal degree zephyr cove nevada",1
"online paralegal degree new jersey",1
"online paralegal degree online degree",1
"vermont college online paralegal degree",1
"online paralegal degree deeth nevada",1
"get your paralegal degree online",1
"online paralegal degree indian hills nevada",1
"online paralegal degree nome alaska",1
"online paralegal degree point lay alaska",1
"paralegal degree online paralegal certificate legal",1
"online paralegal degree lovelock nevada",1
"boston seap debt counseling online paralegal degree",1
"online paralegal degree nikolski alaska",1
"online paralegal degree georgia",1
"online paralegal degree mills wyoming",1
"online paralegal degree johnston rhode island",1
"paralegal degrees online paralegal degree",1
"online paralegal degree brookside delaware",1
"associate degree online paralegal program",1
"online paralegal degree east hardwick vermont",1
"online paralegal degree abington connecticut",1
"online paralegal degree peacham vermont",1
"online paralegal degree nightmute alaska",1
"paralegal degree online legal studies",1
"online paralegal degree dutch harbor alaska",1
"add online paralegal degree",1
"online paralegal degree wadsworth nevada",1
"online paralegal degree keaau hawaii",1
"online paralegal degree medicine bow wyoming",1
"online paralegal degree annabella utah",1
"os online paralegal degree",1
"online paralegal degree leiter wyoming",1
"online paralegal degree monroe connecticut",1
"online paralegal degree dover delaware",1
"online paralegal degree moose pass alaska",1
"online paralegal degree lysite wyoming",1
"online paralegal degree jay em wyoming",1
"online paralegal degree antler north dakota",1
"online paralegal degree portsmouth rhode island",1
"nikko r online paralegal degree",1
"online paralegal degree noorvik alaska",1
"online paralegal degree bethany beach delaware",1
"online paralegal degree south tamworth new hampshire",1
"online paralegal degree passumpsic vermont",1
"glasnost online paralegal degree",1
"online paralegal degree florence vermont",1
"online paralegal degree connecticut",1
"online paralegal degree menan idaho",1
"r r online paralegal degree",1
"online paralegal degree little america wyoming",1
"college degree online paralegal",1
"online undergraduate degree paralegal",1
"online paralegal degree kellogg idaho",1
"online paralegal degree pawtucket rhode island",1
"online paralegal degree sandy hook connecticut",1
"paralegal school online paralegal degree",1
"online paralegal degree powell wyoming",1
"bachelor degree online programs for paralegal students",1
"online paralegal degree saunderstown rhode island",1
"online paralegal degree parkman wyoming",1
"online paralegal degree pavillion wyoming",1
"online paralegal degree paralegal san diego paralegal degree",1
"paralegal degree online college",1
"online paralegal degree in florida",1
"addwords addwords online paralegal degree",1
"online paralegal degree derby line vermont",1
"online paralegal degree nuiqsut alaska",1
"online paralegal degree north pole alaska",1
"online paralegal degree kenyon rhode island",1
"paralegal san diego online paralegal degree paralegal school",1
"online paralegal degree naknek alaska",1
"8 online paralegal degree",1
"online paralegal degree verdi nevada",1
"online paralegal degreeonline paralegal degree",1
"online paralegal degree antimony utah",1
"online paralegal degree linch wyoming",1
"online paralegal degree palmer alaska",1
"online paralegal training school degree course",1
"online paralegal degree paralegal degree totalparalegal.com",1
"online paralegal degree fort washakie wyoming",1
"online paralegal degree middletown rhode island",1
"online paralegal degree morgan vermont",1
"online paralegal degree missouri",1
"online paralegal degree caliente nevada",1
"online paralegal degree grayling alaska",1
"i online paralegal degree",1
"online paralegal degree worthington massachusetts",1
"online paralegal degree south burlington vermont",1
"university of pheonix paralegal degree online",1
"online paralegal degree claremont new hampshire",1
"earn paralegal degree online",1
"online paralegal degree east carbon utah",1
"online paralegal degree carpenter wyoming",1
"online paralegal degree sun valley nevada",1
"online education degree programs paralegal",1
"paralegal degree online north carolina",1
"online paralegal degree paralegal san diego aba approved",1
"blockbuster logo online paralegal degree",1
"online paralegal degree cabot vermont",1
"online paralegal degree sparks nevada",1
"online paralegal degree washington",1
"online paralegal degree morristown arizona",1
"paralegal degree online paralegal education online paralegal",1
"online paralegal degree pinedale wyoming",1
"associates degree paralegal online classes",1
"online paralegal degree big horn wyoming",1
"online paralegal training school degree",1
"online paralegal degree unalakleet alaska",1
"online paralegal degree college fund",1
"paralegal associates degree online",1
"online paralegal degree carefree arizona",1
"ac tv online paralegal degree",1
"online paralegal degree port alsworth alaska",1
"online paralegal degree port lions alaska",1
"online paralegal degree shelton connecticut",1
"online paralegal degree coffman cove alaska",1
"online paralegal degree new york",1
"online associate paralegal degree 20",1
"online paralegal degree petersburg alaska",1
"online paralegal degree saint albans bay vermont",1
"online paralegal degree allakaket alaska",1
"online paralegal degree ocean view delaware",1
"online paralegal degree milford connecticut",1
"online paralegal degree coventry connecticut",1
"online paralegal degree pilot station alaska",1
"n 2 online paralegal degree",1
"online paralegal degree glenbrook nevada",1
"online paralegal degree battle mountain nevada",1
"online paralegal degree noatak alaska",1
"online paralegal degree moodus connecticut",1
"gift ideas online paralegal degree",1
"online paralegal degree opal wyoming",1
"online paralegal degree leupp arizona",1
"online paralegal degree new haven vermont",1
"pro online paralegal degree",1
"online paralegal degree metlakatla alaska",1
"cruise travel online paralegal degree",1
"online paralegal degree napakiak alaska",1
"online paralegal degree yerington nevada",1
"online paralegal degree hope rhode island",1
"online paralegal degree keene new hampshire",1
"paralegal degree online paralegal certificate, legal",1
"online paralegal degree cheyenne wyoming",1
"associates paralegal online degree",1
"online paralegal degree somers connecticut",1
"online paralegal degree marshall alaska",1
"online paralegal degree hopkinton rhode island",1
"online paralegal degree lewiston idaho",1
"paralegal online degree programs",1
"online paralegal degree providence rhode island",1
"ac ac dc tv online paralegal degree",1
"online paralegal degree iowa",1
"online paralegal degree nellis afb nevada",1
"online degree in paralegal studies",1
"online paralegal degree windsor connecticut",1
"paralegal san diego online paralegal degree paralegal san",1
"online paralegal degree yoder wyoming",1
"online paralegal degree pleasant grove utah",1
"online paralegal degree west dover vermont",1
