keyword,count
"auckland supplies birds pet",2
"best pet birds",2
"birds pet link",2
"buyer's guide to pet birds",3
"chinese pet birds",2
"do pet birds effect human allergies",4
"exotic pet birds",5
"feather loss in pet birds",4
"free classified ads for pet birds in ontario",3
"free pet birds in wilkes barre, pennsylvania",3
"good pet birds",4
"great pet birds sale loves year female",2
"how to get pet birds out of trees",2
"importing/exporting pet birds into europe",3
"kinds of pet birds",4
"medium  pet birds",4
"medium sized pet birds",4
"names for pet birds",2
"new york pet birds sale",3
"orlando pet store fish birds",2
"pet birds",173
"pet birds and polyurethene vapors",2
"pet birds ellis",2
"pet birds finch",3
"pet birds for sale",2
"pet habitat birds for sale bc",2
"pet names birds",37
"pet store birds minnesota",4
"types of pet birds",8
