keyword,count
"aetna ppo plantar warts",3
"after plantar warts surgery",2
"are plantar warts contagious",3
"cost of laser foot surgery for plantar warts",2
"detecting plantar warts",2
"duct tape for plantar warts",3
"effective home remedy plantar warts",2
"home remedies for removal of plantar warts",3
"how do you get plantar warts",2
"how do you get rid of plantar warts",9
"how much is laser foot surgery for plantar warts",6
"how to get rid of plantar warts",6
"how to remove plantar warts",4
"laser foot surgery for plantar warts regrets",2
"laser surgery for plantar warts recovery time",3
"laser treatment on plantar warts",3
"naturally remove plantar warts",2
"plantar tea tree warts",2
"plantar warts",168
"plantar warts  photo emedicine",3
"plantar warts + tcm",2
"plantar warts and formaldehide",3
"plantar warts and formaldehyde",2
"plantar warts and vitamin a",4
"plantar warts complications",3
"plantar warts cure",2
"plantar warts on hand",2
"plantar warts potato",2
"plantar warts removal",3
"plantar warts symptoms",3
"plantar warts tea",2
"plantar warts throw out shoes",2
"podiatrist treatments for plantar warts",6
"regret laser surgery for plantar warts",3
"removal plantar warts",4
"removing plantar warts",9
"treat plantar warts duct tape",3
"what do plantar warts look like",4
"where do plantar warts come from",2
