keyword, count
"prostate cancer",828017
"cancer prostate",153580
"prostate cancer treatment",17905
"cancer prostate testosterone",16475
"prostate cancer survivor",10813
"prostate cancer information",10005
"prostate cancer treatment florida",9562
"erectile dysfunction prostate cancer impotence",8365
"bloated stomach and prostate cancer",6164
"prostate cancer symptoms",6076
"prostate cancer support group missouri kansas city",5843
"what is prostate cancer",5681
"cancer of the prostate",5083
"hyaluronic acid for prostate cancer",4866
"prostate cancer symptom",4555
"prostate cancer metastasis",4453
"prostate cancer treatments",3404
"prostate cancer vitamin d",3352
"cancer prostate masturbation",3313
"prostate cancer surgery",3066
"prostate cancer causes",3015
"advanced prostate cancer",2882
"prostate cancer prevention",2824
"prostate cancer support group meetings",2745
"prostate cancer screening",2524
"prostate cancer prognosis",2494
"prostate cancer alternative medicine",2467
"psa prostate cancer",2426
"treatment for prostate cancer",2302
"prostate cancer cure",2246
"metastatic prostate cancer",2229
"symptoms prostate cancer",2172
"health promotions programs prostate cancer",2171
"prostate cancer symtoms",2166
"prostate cancer research",2160
"prostate cancer radiation",2054
"pictures of prostate cancer",2036
"treatments for prostate cancer",2027
"prostate cancer diagnosis",1996
"prostate cancer test",1996
"bracelet cancer prostate silicone",1987
"prostate cancer support",1937
"information on prostate cancer",1921
"prostate cancer staging",1895
"proscar prostate cancer",1889
"cancer de la prostate",1887
"prostate cancer awareness",1871
"prostate cancer statistics",1864
"prostate cancer recurrence",1810
"bracelet cancer prostate rubber",1794
"prostate cancer psa",1746
"bracelet cancer prostate",1743
"prostate cancer detection",1728
"john kerry prostate cancer",1711
"causes of prostate cancer",1691
"symptoms of prostate cancer",1622
"prostate cancer support group",1599
"american cancer society prostate cancer",1585
"american cancer society prostate cancer research",1567
"masturbation seniors prostate cancer",1559
"stages of prostate cancer",1559
"prostate cancer vaccine",1557
"prostate cancer diet",1514
"cause of prostate cancer",1490
"curing prostate cancer",1422
"prostate cancer tests",1416
"prostate cancer survivors",1406
"impotence prostate cancer",1397
"stage iv prostate cancer",1393
"prostate cancer gleason",1387
"aggressive prostate cancer",1373
"late stage prostate cancer",1371
"psa levels prostate cancer",1348
"prostate cancer size",1347
"chicago prostate cancer center",1325
"history of prostate cancer",1321
"prostate cancer survival rate",1294
"advanced prostate cancer treatment",1292
"cancer prostate treatment",1279
"stage iv prostate cancer 2b prognosis",1278
"prognosis for stage 4 prostate cancer",1274
"vasectomy prostate cancer",1272
"prostate cancer stage",1265
"prostate cancer bracelet",1245
"prostate cancer spread",1244
"information of prostate cancer",1237
"state iv prostate cancer 2b mortality",1237
"advanced prostate cancer 2b life expectancy",1235
"advanced prostate cancer 2b prognosis",1234
"prevention prostate cancer",1234
"dying from prostate cancer",1233
"early symptoms prostate cancer",1232
"mortality 2b advanced prostate cancer",1231
"stage iv prostate cancer 2b bone mets",1228
"prevention of prostate cancer",1222
"prostate cancer hormone therapy",1222
"treatment prostate cancer",1220
"prostate cancer survival",1218
"prostate cancer 2b mets",1217
"prostate cancer and etiology",1205
"prostate cancer caused by pten",1203
"prostate cancer cures",1200
"fast travelling prostate cancer",1184
"life expectancy 2b advanced prostate cancer",1183
"androgen independent prostate cancer",1182
"prostate cancer 2b stage iv",1180
"cryo prostate cancer",1174
"stage iv prostate cancer 2b mortality",1167
"prostate cancer support groups",1166
"lupron 2b prostate cancer",1161
"treatment of prostate cancer",1152
"prostate cancer 2b aggressive",1151
"prostate cancer stages",1146
"zyflamend prostate cancer",1141
"leukine and prostate cancer",1135
"malignant prostate cancer",1135
"prostate cancer radiation treatment",1135
"prostate cancer new treatment",1127
"prostate cancer 2b mortality",1113
"prostate cancer 2b bone mets",1105
"prostate cancer foundation",1093
"signs of prostate cancer",1093
"prostate cancer stage d",1091
"end stage 2b prostate cancer",1089
"pictures of where prostate cancer affects",1062
"prostate duke comprehensive cancer center2cvaccine trial",1059
"advanced prostate cancer 2b bone mets",1044
"prostate cancer gleason scale",1044
"dan fogelberg prostate cancer",1032
"prostate cancer drug",1022
"preventing prostate cancer",1020
"prostate cancer and treatment",1012
"prostate cancer hope at last",1011
"prostate cancer therapy",999
"prostate cancer and cryotherapy",990
"brachytherapy for prostate cancer",986
"chemotherapy for prostate cancer",974
"prostate cancer info",972
"warning signs of prostate cancer",956
"start for prostate cancer, national cancer institute of",949
"picture of prostate cancer",943
"prostate cancer research institute",942
"dan fogelberg and prostate cancer",937
"prostate cancer news",931
"red wine and prostate cancer",924
"prostate cancer questions and answers",915
"recurring prostate cancer",908
"prostate cancer rating",907
"prostate cancer cell pictures",896
"latest treatment on prostate cancer",894
"cancer clinical trial results for prostate",885
"health promotions programs for prostate cancer",877
"laparoscopy prostate cancer",874
"prostate cancer treatment options",863
"prostate cancer metastasis organs",861
"cancer nutrition prostate supplement",858
"what causes prostate cancer",847
"prostate cancer blood test",843
"prostate cancer subjective and objective data",838
"cancer hormone prostate treatment",809
"facts about prostate cancer",807
"chemotherapy prostate cancer",806
"canine prostate cancer",803
"prostate cancer treatment option",802
"symptons of prostate cancer",794
"prostate cancer cryosurgery",792
"pathophysiology of prostate cancer",791
"prostate cancer treatment center",776
"casodex and prostate cancer",774
"cryotherapy for prostate cancer",771
"garygitner28at29ssagov prostate cancer",770
"prostate cancer signs",758
"prostate cancer biopsy",750
"prostate cancer arm pain",743
"prostate cancer 2b bone pain",740
"lycopene prostate cancer",737
"cancer prostate symptom treatment",736
"best cancer prostate treatment",732
"advanced prostate cancer 2b mortality",725
"life expectancy for prostate cancer",724
"the va and prostate cancer",719
"terminal prostate cancer",710
"prostate cancer impotence",707
"hyperthermia for prostate cancer",704
"cancer bone prostate",700
"hormone refractory prostate cancer",681
"alternative prostate cancer treatment",675
"prostate cancer medication",646
"prostate cancer clinical trial",644
"prostate cancer masturbation",643
"2c4 treatment for prostate cancer",642
"prostate cancer education",633
"radiation therapy for prostate cancer",630
"prostate cancer signs and symptoms",627
"national prostate cancer coalition",626
"signs for prostate cancer",601
"prostate cancer 2b aggressive 2b questions 2b doctor",596
"prostate cancer treatment info",594
"prostate cancer warning signs",592
"awareness prostate cancer",587
"prostate cancer cause",587
"radiation treatment for prostate cancer",586
"prostate cancer bone metastasis",583
"herbal remedies for prostate cancer",570
"metastasis of prostate cancer",568
"prostate cancer and tomatoes",556
"masturbation cancer prostate",555
"prostate cancer radiation therapy",549
"prostate cancer and nutrition",531
"prostate cancer alternative treatment",530
"prostate cancer risk factors",520
"cancer masturbation prostate",509
"hormone therapy for prostate cancer",499
"end stage prostate cancer",494
"recurrent prostate cancer",490
"progesterone treatment of prostate cancer",486
"hormone therapy prostate cancer",484
"prostate cancer bone scan",484
"vitamin d prostate cancer",481
"prostate cancer awareness month",478
"incidence of prostate cancer",474
"flax seed and prostate cancer",472
"prostate bone cancer",471
"symptoms of advanced prostate cancer",466
"prostate cancer hormone treatment",464
"prostate+cancer",460
"prostate cancer life expectancy",459
"sign of prostate cancer",451
"prostate cancer natural cure",445
"prostate cancer stage 4",444
"cancer finasteride prostate",439
"vitamin e prostate cancer",432
"prostate cancer hormone",431
"hormone treatment for prostate cancer",429
"gleason score prostate cancer",428
"prostate cancer bracelets",427
"best prostate cancer treatment",426
"cancer d prostate vitamin",423
"cancer effects prostate side treatment",418
"prostate cancer testing",418
"signs and symptoms of prostate cancer",416
"prostate cancer death rate",414
"prostate cancer back pain",412
"zyflamend help prostate cancer",410
"bone cancer prostate",406
"prostate cancer 2b survival",406
"prostate cancer survival rates",401
"cancer of prostate",399
"gary gitner prostate cancer",399
"mt1 melatonin receptor prostate colon cancer",399
"bone metastatic prostate cancer 2b survival",395
"cleveland clinic radiation dose prostate cancer",386
"treatment options prostate cancer",383
"ixabepilone prostate cancer",380
"prostate cancer advisory board",380
"herbal breakthrough for prostate cancer",379
"state iv prostate cancer 2b survival",379
"natural cures for prostate cancer",377
"symtoms of prostate cancer",377
"propecia 2b prostate cancer",376
"prostate cancer lycopene",375
"advanced prostate cancer 2b survival",374
"surgery for prostate cancer",373
"cancer herbal prostate treatment",372
"prostate cancer to death",372
"castle rock colorado prostate cancer",371
"mt1 receptor prostate colon cancer",371
"symptoms of metastatic prostate cancer",371
"cancer prostate symptom",370
"prostate cancer 2b lupron",370
"prostate cancer surgery recovery",365
"lymph nodes pelvic prostate cancer",363
"prostate cancer prevention strategies",362
"prostate cancer 2b bone mets 2b mortality",360
"impotence after prostate cancer treatment",359
"questions to ask doctor prostate cancer",358
"john hopkins 2b prostate cancer",357
"prostatectomy prostate cancer",357
"prostate 2b cancer 2b alternative",354
"what to ask about prostate cancer",353
"aggressive prostate cancer definition",352
"arizona prostate cancer imrt brachytherapy",352
"blood test for prostate cancer",352
"prostate cancer blood in stools",352
"watching and waiting and prostate cancer",351
"aua stage and prostate cancer",350
"herbal prostate cancer treatment",349
"psa test for prostate cancer",349
"sex after prostate cancer",347
"early hormone therapy radiation prostate cancer",346
"cancer de prostate",345
"prostate cancer psa level",345
"research about prostate cancer in lebanon",344
"statistics on blacks and prostate cancer",344
"environmental issues for prostate cancer",342
"prostate cancer percent treated by brachytherapy",341
"prostate cancer herbal cures",339
"prostate cancer treatment green light pvp laser procedure",339
"depo lupron for prostate cancer",337
"hormone therapy 26 prostate cancer",337
"howard hospital prostate cancer",336
"coconut townsend letters prostate cancer",335
"cancer prostate proton treatment",333
"environmental issues of prostate cancer",332
"end stages 2b prostate cancer",331
"cancer natural prostate treatment",330
"advanced metastatic prostate cancer",329
"stage iv prostate cancer life expectancy",329
"vasectomy and prostate cancer",326
"prostate cancer diagnosis symptoms",325
"prostate cancer nutrition",323
"standards of care prostate cancer",321
"natural treatment for prostate cancer",316
"finasteride and flutamide in prostate cancer treatment",315
"masturbation prostate cancer",315
"prostate cancer gleason score",315
"prostate cancer treatment complications",313
"cancer level prostate psa",312
"cancer drug new prostate",311
"donations for prostate cancer",311
"side effects prostate cancer androgen hormone therapy",311
"alternative cancer cure prostate",308
"prostate cancer new treatments",308
"bladder cancer prostate",307
"sign and symptom of prostate cancer",307
"advanced cancer prostate symptom",306
"cancer freezing prostate treatment",306
"prostate gland cancer",305
"prostate cancer symptom treatment",299
"advanced prostate cancer symptoms",298
"dattoli surviving prostate cancer without surgery",298
"the va and prostate cancer compensation",298
"bone metastasis of prostate cancer",297
"prostate cancer longevity",291
"information about prostate cancer",290
"prostate cancer symptons",290
"ketoconozole prostate cancer",289
"lupron prostate cancer",288
"prostate cancer institute",288
"cancer laser prostate treatment",287
"prostate cancer hormone therapy survival rates",287
"prostate cancer treatment radiotherapy clinics of georgia",287
"detecting prostate cancer",285
"prostate cancer and blood in the urine",284
"prostate cancer natural treatment",283
"biopsy for prostate cancer",282
"prostate cancer treatment prostate cancer",281
"prostate cancer and sex",275
"prostate cancer exam",275
"prostate cancer external beam radiation",274
"prostate cancer psa ranges",273
"treatment prostate cancer alternative",273
"prostate cancer and treatment and journal articles",272
"expected life span of prostate cancer patients",270
"taxotere prostate cancer",270
"prostate cancer and symptoms",269
"prostate cancer detection treatment",268
"whats prostate cancer",268
"oncology 2b prostate cancer",266
"patient 2b cost 2b prostate 2b cancer 2b proton 2b",265
"alternative treatment prostate cancer",263
"nutritional prostate cancer treatment",263
"prostate cancer freezing",261
"treatment advanced prostate cancer",261
"prostate cancer brachytherapy",260
"treatment for advanced prostate cancer",260
"alternate treatments prostate cancer",259
"new prostate cancer drugs",259
"post prostate cancer surgery orgasms",259
"outcome studies seeding therapy prostate cancer",258
"seed implants for prostate cancer",258
"prostate cancer and natural treatment",256
"hormone therapy 2b prostate cancer",255
"lycopene and prostate cancer",255
"pill effective treatment prostate cancer",255
"prostate cancer drugs",255
"prostate cancer post treatment",254
"stanford research prostate cancer herbal treatment",254
"health prostate cancer",253
"mdanderson cancer research center2c prostate cancer",253
"prostate cancer horomone treatment",253
"prostate cancer 2b symptoms",252
"testicular cancer prostate metastasis",252
"ed 2b prostate 2b cancer 2b treatment 2b stats 2b",251
"enlarged prostate prostrate cancer",251
"post prostate cancer surgery",251
"proton therapy prostate cancer",251
"brachytherapy prostate cancer",250
"prostate cancer humor",250
"symptoms of prostate bone cancer",250
"advanced prostate cancer 2b longevity",249
"prostate health cancer lycopene",249
"new england journal of medicine prostate cancer",248
"veteran benefit prostate cancer",248
"advanced prostate cancer 2b bone mets2b life expectancy",247
"blood tests psa enlarged prostate prostrate cancer",246
"prostate cancer diagnosis 26 treatment",245
"prostate cancer fighting herbal formula hp",245
"prostate cancer hormone therapy treatment",245
"hormone therapy and prostate cancer",244
"msma prostate cancer test",244
"prostate cancer information sweden",244
"cancer cryosurgery prostate",242
"cryogenic prostate cancer treatment",242
"herbal health prostate cancer",242
"metastatic prostate cancer treatment",242
"milk thistle 2b jaundice 2b prostate cancer",242
"pictures of prostate cancer treatment",242
"prostate cancer laser treatment",242
"prostate cancer president",242
"prostate cancer supplements",242
"prostate cancer treatment alternatives",242
"prostate cancer treatment success rate",242
"advance prostate cancer symptoms",241
"prostate cancer and new hormone therapy",241
"early symptoms of prostate cancer",240
"glucosamine and chondroitin and prostate cancer",240
"laser surgery for prostate cancer",240
"prostate disease cancer prostrate",240
"testicles testicular cancer prostate spread",240
"fighting prostate cancer with alternative medicine",239
"prostate cancer radiation treatment denver",239
"cryo surgery for prostate cancer",238
"impotence from prostate cancer and functional dyspepsia",238
"proton treatment for prostate cancer",238
"symptoms of prostate cancer that has metastisized to brain",238
"advanced prostate cancer 2b lifetime",236
"enlarged prostate cancer symptoms",236
"prostate 2b cancer 2b treatment 2b ed 2b odds",236
"symptoms of dying from prostate cancer",236
"famous people with prostate cancer",235
"survival rate for prostate cancer",235
"27results of caffiene on prostate cancer cells27",234
"prostate and cancer",234
"prostate cancer treatment in germany",234
"prostate surrounds cancer of the urethra symptoms",234
"radiation pellets for treatment of prostate cancer",234
"high level of enzymes in liver and prostate cancer",233
"latest prostate cancer treatments",233
"prostate cancer in older men",233
"radiation prostate cancer",233
"advanced prostate cancer 3d treatment",232
"prostate cancer alternative treatments",232
"cancer prostate radiation",231
"cure for prostate cancer",231
"prostate cancer experimental treatments",231
"alternatives treatment for prostate cancer",230
"blood in stool prostate cancer",230
"dog prostate cancer",230
"prostate cancer and agent orange exposure",230
"prostate cancer bone metastasis survival",230
"prostate cancer research versus breast cancer research",230
"nutritional health for prostate cancer",229
"prostate cancer 2b hormone treatment",229
"prostate cancer hormone treatment canada",229
"prostate cancer surgery film",229
"prostate cancer vitamin",229
"abx egf monoclonal antibody in treating prostate cancer",228
"end state symptoms 2b prostate cancer",228
"home test for prostate cancer",228
"prostate 2b cancer 2b treatment 2b radiation",228
"prostate 2b cancer 2b treatments",228
"prostate cancer treatment canada",228
"relieving swollen legs from prostate cancer",228
"apoptosis prostate cancer blood in stool",227
"cancer of the prostate gland",227
"new prostate cancer treatment",227
"prevalence of uterine and prostate cancer",227
"prostate 2b cancer 2b treatment",227
"prostate cancer research at iu",227
"prostate cancer treatment seed",227
"prostate masturbation prostrate cancer",227
"prostate cancer surgery top hospital",226
"prostate cancer treatment like russian roulette",226
"treatment cancer detection prostate",226
"alternate prostate cancer treatment",225
"bone metastases in prostate cancer",225
"cancer detection prostate treatment",225
"laparoscopic surgery prostate cancer",225
"prostate cancer chemotherapy",225
"the effects of lycopene on prostate cancer",225
"prostate cancer types",224
"symptoms prostate masturbation prostrate cancer",223
"men and prostate cancer and exam and age",222
"prostate cancer awareness bracelet",222
"clinics options prostate cancer treatment",221
"prostate cancer bead treatment",220
"prostate cancer risk factor",220
"natural treatment of prostate cancer",217
"prostate cancer cryo treatment",217
"qadvanced prostate cancer 3d treatment",217
"cancer prostate radiation treatment",216
"prostate cancer lupron",216
"canadian 2b treatment 2b proton 2b prostate 2b cancer",215
"prostate cancer picture",215
"supplemental short term hormone treatment prostate cancer",215
"hair loss a sign of prostate cancer",214
"metastasized prostate cancer",214
"prostate cancer 2b treatment 2b proton emission",214
"options for prostate cancer surgery",213
"prostate cancer treatment with serumin etc",212
"treatment for early prostate cancer",212
"canadians who have had proton therapy for prostate cancer",211
"herbs used for the treatment of prostate cancer",211
"bone scan prostate cancer",210
"prostate 2b cancer 2b treatment 2b latest 2b 2004 2b",210
"anti cancer oxidant prostate treatment",209
"early symptom prostate cancer",209
"pathology of prostate cancer",209
"prostate cancer and surgery",209
"stage 2 prostate cancer treatment",209
"proton therapy for prostate cancer treatment",208
"diagnosis and treatment health prostate cancer",207
"ketaconazole for treatment of prostate cancer",207
"recovering from prostate cancer surgery",207
"the screening and treatment of prostate cancer",207
"treatment relieving swollen legs from prostate cancer",207
"current treatments for hormone resistant prostate cancer",206
"prostate cancer treatment pictures",206
"prostate cancer warning sign",206
"hydrocortisone as a treatment for prostate cancer",205
"don27t rush to treatment for prostate cancer",204
"prostate cancer treatment in virgina",204
"prostate cancer and rudolph guliani treatment",202
"side effects and percentages for prostate cancer treatment",202
"prostate cancer bone metastasis prognosis",201
"prostate cancer in dogs",201
"surgery of prostate cancer",201
"what is the fifth stage of prostate cancer",201
"prostate cancer risk",200
"us news and world report and prostate cancer",200
"natural remedies for prostate cancer",199
"tomato prostate cancer",199
"ketoconazole treatment for prostate cancer",198
"prostate cancer drug treatment",198
"cancer info prostate",192
"lupron for prostate cancer",189
"radiation treatments prostate cancer",186
"stage iv prostate cancer death",184
"effects of prostate cancer",183
"gleason score for prostate cancer",183
"about prostate cancer",181
"progesterone prostate cancer",181
"how to prevent prostate cancer",180
"prostate cancer cure rates",179
"alternative prostate cancer treatments",176
"abbott prostate cancer drug therapies",175
"cryosurgery for prostate cancer",174
"prostate cancer clinical trials",174
"prostate cancer and estrogen dominance",173
"prostate cancer bone",173
"green tea and prostate cancer",171
"cancer effects prostate radiation side",168
"how does prostate cancer spread",168
"prostate cancer and calcium",167
"prostate cancer chat room",166
"lupron and casodex as prostate cancer fighters",164
"diagnosing prostate cancer",163
"prostate cancer cryotherapy",163
"cancer deniro prostate robert",162
"prostate cancer fact",162
"prevent prostate cancer",161
"prostate cancer facts",160
"stage of prostate cancer",160
"surviving prostate cancer without surgery",160
"diet for prostate cancer",159
"prostate cancer center",159
"cell genesys and prostate cancer",158
"ketokonazole and prostate cancer",158
"latest research prostate cancer",157
"prostate cancer patient",156
"prostate cancer and impotence",155
"lupron treatment for prostate cancer",154
"stage iv prostate cancer survival",154
"cure prostate cancer",153
"alternative treatment for prostate cancer",152
"metastic prostate cancer",152
"cancer cure natural prostate",151
"stage 4 prostate cancer",150
"alternative cures for prostate cancer",149
"cancer propecia prostate",149
"prostate cancer vacine trial",148
"alternative treatments for prostate cancer",146
"prostate cancer meetings and conferences",145
"stage iv prostate cancer rapidly rising psa",145
"cancer hormone prostate therapy",144
"cancer cryotherapy prostate",142
"prostate cancer charity",142
"treatments prostate cancer",142
"cancer fact prostate",141
"cancer prostate recurrent treatment",141
"gleason prostate cancer",141
"prostate cancer pictures",141
"prostate cancer in young men",140
"prostate cancer mortality",139
"prostate cancer medicine",137
"prostate cancer australia",136
"prostate cancer canada",136
"treating prostate cancer",136
"impotence and prostate cancer",135
"pictures on prostate cancer",135
"prostate cancer seed implant",134
"radiation therapy after prostate cancer surgery",134
"advanced prostate cancer mb",133
"prognosis prostate cancer mb",133
"african american prostate cancer",131
"cancer imatinib prostate",131
"prostate cancer recovery",131
"prostate cancer sex",130
"quadramet or samarium 153 prostate cancer",130
"test for prostate cancer",130
"metastatic prostate cancer dexamethasone",129
"prostate cancer treatment robotic",128
"best treatment for prostate cancer",127
"prostate cancer stories",127
"www prostate cancer org",127
"bone cancer cancer prostate",126
"herbal treatments for prostate cancer",125
"metastasized prostate cancer prognosis",125
"treating recurrent prostate cancer",124
"colon prostate cancer",123
"metastasis prostate cancer",123
"prostate cancer patients",122
"surgery prostate cancer",122
"cancer prostate impotence radiation surgery",121
"prognosis and prostate cancer",121
"propecia prostate cancer",121
"tp prostate cancer",121
"alternative medicine for prostate cancer",120
"biopsy cancer prostate",119
"prostate cancer cells",119
"prostate cancer power point",119
"kerry prostate cancer",118
"propecia and prostate cancer",118
"prostate cancer best doctors",118
"excess zinc prostate cancer",117
"prostate cancer wrist bands",117
"last stages of prostate cancer",116
"prostate cancer d bone metastasis treatment",116
"prostate cancer pin",116
"stage 3 prostate cancer",115
"survival stage iv prostate cancer bone metastasis",115
"alkaline phosphatase prostate cancer",114
"flutamide for prostate cancer",114
"cancer early prostate symptom",113
"cancer prostate treatments",113
"cancer new prostate treatment",112
"prostate cancer bladder removal",112
"prostate cancer treatment side effects",112
"4 cancer prostate stage",111
"celebraties with prostate cancer",109
"prostate cancer articles",109
"prostate cancer bone metastasis life expectancy",109
"prostate cancer medications",109
"prostate cancer mets mortality",109
"quercetin prostate cancer 2002",109
"screening for prostate cancer",109
"cancer end prostate stage",108
"prostate cancer ribbon",108
"signs of prostate cancer in men",108
"stage d2 metastatic prostate cancer",108
"using lupron for prostate cancer",108
"cancer ketoconazole prostate",107
"cancer prostate sewer workers",107
"metastatic d2 prostate cancer",107
"prostate cancer bone metastasis lupron",107
"prostate cancer cure rate",107
"youngest age for prostate cancer",107
