keyword, count
"cancer chemotherapy prostate",106
"prostate cancer breakthrough",106
"biopsy prostate cancer",105
"cancer flax prostate seed",105
"cryogenics in prostate cancer",105
"prostate cancer african american",105
"prostate cancer seeds",105
"prostate cancer spinal cord compression symptoms",105
"saw palmetto prostate cancer",105
"staging prostate cancer",105
"diagnosed with prostate cancer",104
"article cancer prostate",103
"cancer implant prostate seed",103
"chinese herbs for prostate cancer",103
"fighting prostate cancer with ph therapy",103
"medical search engines prostate cancer",103
"prostate cancer and advances and treatments",103
"cancer medicine prostate",102
"prostate cancer and select",102
"prostate cancer and stories",102
"st louis prostate cancer treatment",102
"cancer canine prostate",101
"metastasized prostate cancer bone pain",101
"proton therapy for prostate cancer",100
"radiation therapy prostate cancer",100
"stage iv prostate cancer lupronprognosis",100
"prostate cancer and awareness and advertisements",99
"is prostate cancer genetic",98
"advanced stage prostate cancer",97
"mechanism of the initiation of prostate cancer",97
"prostate cancer gleason grade stage iv bone mets",97
"prostate cancer psa testing",97
"advanced prostate cancer d survival",96
"bone cancer prostate scan",96
"cancer cure prostate rate",96
"hdr for prostate cancer",96
"john hopkins prostate cancer",96
"localized prostate cancer",96
"lupron and prostate cancer",96
"metastasized prostate cancer rising psa",96
"prostate cancer at last",96
"prostate cancer uk",96
"reoccurance of prostate cancer",96
"cancer foundation prostate",95
"cancer hormonal prostate treatment",95
"cancer prostate sex",95
"causes prostate cancer",95
"prostate cancer d survival",95
"cancer hormone prostate refractory",93
"cancer prostate recurrent",93
"herbal supplement prevent prostate cancer",93
"cancer survivor walk breast prostate colon",92
"prostate cancer month",92
"prostate cancer rapidly rising psa",92
"prostate cancer stage iv life expectancy",92
"prostate density indicative of prostate cancer",92
"advanced prostate cancer bone metastasis mortality",91
"alternative cancer prostate therapy",91
"life expectancy of stage prostate cancer",91
"metastasised prostate cancer bone",91
"natural treatments for prostate cancer",91
"prostate cancer metastasis prognosis",91
"prostate cancer mets life expectancy",91
"prostate cancer symptom back",91
"cancer dattoli prostate surgery surviving without",90
"cancer metastatic prostate treatment",90
"cancer prostate sign symptom",90
"prostate cancer and diet",90
"prostate cancer conference",90
"the and prostate cancer",90
"vegetarian diet and prostate cancer",90
"jerry orbach prostate cancer",89
"prostate and testicular cancer",89
"prostate cancer medical malpractice settlement",89
"prostate cancer settlement malpractice",89
"johns hopkins prostate cancer",88
"progression of prostate cancer",88
"prostate cancer and hormone therapy",88
"va compensation prostate cancer message boards",88
"vitamin d and prostate cancer",88
"cancer nutritional prostate supplement",87
"cancer prevention prostate",87
"finasteride for prostate cancer",87
"mayo clinic prostate cancer",87
"small cell prostate cancer",87
"prostate cancer age risks",86
"prostate cancer seed",86
"prostate+cancer+treatment",86
"after cancer prostate sex",85
"after prostate cancer radiation",85
"cancer alaska prostate",85
"prostate cancer and red grapefruit",85
"prostate cancer article",85
"prostate cancer erection",85
"prostate cancer robotics",85
"stage iv prostate cancer prognosis",85
"vitamin d prostate cancer prevention",85
"2c4 treatment prostate cancer",84
"chemotherapy protocol for prostate cancer",84
"metastatic prostate cancer life expectancy",84
"prostate cancer bone metastasis mortality",84
"prostate cancer wristband",84
"atrial fibrillation prostate cancer treatment",83
"dean arnish prostate cancer diet",83
"fighting prostate cancer",83
"info on prostate cancer",83
"prostate cancer and psa",83
"prostate cancer forum",83
"prostate cancer of the bone",83
"prostate cancer research centers",83
"advanced prostate cancer symptom",82
"developed prostate cancer health news green",82
"metastasized prostate cancer back pain",82
"prostate cancer chat",82
"testicular and prostate cancer",82
"www prostate cancer",82
"young men and prostate cancer",82
"cancer dog prostate",81
"hormone and radiation for prostate cancer",81
"prostate cancer and ejaculation",81
"prostate cancer in african american males",81
"prostate cancer onco seed side affects",81
"cancer prostate radiation seed",80
"prostate cancer physicians rhode island",80
"prostate cancer teaching for illiterate patient",80
"what are early symptoms of prostate cancer",80
"year old with prostate cancer",80
"alternative cancer prostate treatment",79
"canadian prostate cancer",79
"hydrocort use in metastatic prostate cancer",79
"prostate cancer colorado springs",79
"rate of death prostate cancer",79
"ultrasound prostate cancer imaging",79
"variable focusing hifu system for prostate cancer",79
"vincristine to treat prostate cancer",79
"women support group prostate cancer",79
"article on prostate cancer",78
"diet for person with prostate cancer",78
"final stage prostate cancer",78
"flomax and prostate cancer prevention",78
"metastasized prostate cancer life expectancy",78
"prostate cancer genetics",78
"advanced prostate cancer bone metastasis statistics",77
"advanced prostate cancer trearment",77
"prostate cancer and dairy",77
"prostate cancer zometa",77
"soy milk prostate cancer",77
"cancer john kerry prostate",76
"incontinence cancer prostate",76
"new prostate cancer test",76
"prostate cancer golf bag",76
"prostate cancer hormonal therapy by injection",76
"prostate cancer side effects",76
"prostate cancer treatment risks bph",76
"www web md prostate cancer",76
"advanced cancer prostate treatment",75
"cancer gleason prostate",75
"gleason grading of prostate cancer",75
"latest prostate cancer treatment",75
"link colon cancer to prostate cancer",75
"metastasized prostate cancer prognosis lupron",75
"progesterone and prostate cancer",75
"prostate cancer charms bracelet",75
"prostate cancer in african american men",75
"prostate cancer recurrance",75
"secondary bone cancer from prostate cancer",75
"advanced prostate cancer life expectancy",74
"after cancer prostate surgery",74
"bipsy prostate cancer",74
"cancer following potency prostate treatment",74
"cancer gland prostate",74
"metastatic prostate cancer prognosis",74
"prostate cancer canada message boards",74
"prostate cancer wristbands",74
"survival stage iv prostate cancer",74
"vitamins for prostate cancer",74
"prostate cancer ct",73
"signs prostate cancer",73
"patient education for prostate cancer",72
"prostate and cancer and treatment",72
"prostate cancer screening gelmann",72
"youngest prostate cancer",72
"cancer metastasis prostate",71
"cancer prostate surgery",71
"prostate cancer and vitamine a",71
"prostate cancer holistic",71
"prostate cancer treatment centers",71
"advanced prostate cancer bone treatment",70
"aubrey prostate cancer alternative treatments",70
"bone cancer mets prostate",70
"cancer journal prostate scholarly",70
"prostate cancer contra costa county",70
"prostate cancer recovery diet",70
"prostate cancer tomato",70
"prostate cancer treatment risks bph prostatitis",70
"vascectomy and prostate cancer",70
"analyse comparative traitement cancer prostate",69
"casodex prostate cancer",69
"osteoporosis from hormone therapy for prostate cancer",69
"prostate cancer and erections",69
"prostate cancer and italians",69
"prostate cancer treatment ultrasound",69
"after radiation for prostate cancer",68
"information prostate cancer",68
"national prostate cancer",68
"nmr prostate cancer",68
"test for telomerase prostate cancer",68
"urology prostate cancer metastasis to kidney",68
"advanced prostate cancer bone metastasis",67
"american cancer cancer prostate society",67
"ben cancer carson dr prostate",67
"cause prostate cancer",67
"iressa prostate cancer",67
"lupron advanced prostate cancer",67
"prostate cancer bands",67
"prostate cancer coalition",67
"prostate cancer of the",67
"advanced prostate cancer bone metastasis prognosis",66
"awareness bracelet cancer prostate rubber",66
"cancer center prostate",66
"cancer option prostate treatment",66
"diet prostate cancer",66
"killing prostate cancer cells",66
"progesterone for treating prostate cancer",66
"prostate cancer cell picture",66
"prostate cancer low fat diet",66
"reoccuring prostate cancer treatments",66
"stage iv prostate cancer lupron",66
"cancer celebrex prostate",65
"cancer curing prostate",65
"cancer investigational prostate treatment",65
"cancer photo prostate",65
"cancer prostate survival",65
"cures for prostate cancer",65
"prostate cancer alternative",65
"prostate cancer d intense pain survival",65
"prostate cancer pics",65
"advanced prostate cancer treatment news",64
"agent orange and prostate cancer",64
"glutamine prostate cancer",64
"herbs to cure prostate cancer",64
"life after prostate cancer",64
"metastasized prostate cancer lupron",64
"prostate cancer and celebrex and 2004",64
"prostate cancer bone metastasis spinal cord compression",64
"prostate cancer bone mets mortality",64
"prostate cancer power point presentation",64
"prostate cancer suvival statistics",64
"prostate cancer t",64
"prostate cancer treatment using vitamins",64
"radiation treatments for prostate cancer",64
"research prostate cancer",64
"antioxidant prostate cancer radiation",63
"chemotherapy for advanced prostate cancer",63
"early stage prostate cancer",63
"economic impact prostate cancer",63
"herbs prostate cancer",63
"male urinary incontinence prostate cancer",63
"prostate cancer and eye tumor",63
"prostate cancer and injectable hgh",63
"prostate cancer radiation surgery impotence",63
"cancer dog in prostate",62
"hydrogen peroxide and prostate cancer",62
"imrt prostate cancer",62
"metastatic prostate cancer mortality",62
"nsat prostate cancer",62
"prostate cancer and estrogen dominance andnot dr lee",62
"prostate cancer bone metastasis statistics",62
"best multivitamin supplement for prostate cancer",61
"brachytherapy versus radiation prostate cancer",61
"cancer prognosis prostate",61
"forum prostate cancer",61
"genetics of prostate cancer",61
"prostate cancer lymph node",61
"prostate cancer magnet",61
"prostate cancer message boards",61
"prostate cancer multivitamin antioxidant powder",61
"prostate cancer question and answer",61
"prostate cancer robot surgery",61
"prostate cancer scale",61
"cancer latest prostate treatment",60
"david mclean on herbal treatments for prostate cancer",60
"prostate cancer and history of coronary artery disease",60
"prostate cancer ejaculate",60
"prostate cancer medicines",60
"prostate cancer org",60
"prostate cancer warnings",60
"radiation for prostate cancer",60
"alternative cancer medicine prostate",59
"cancer prostate test faq",59
"flax seed oil prostate cancer",59
"gamma tocopherols in colon and prostate cancer",59
"john blanchard prostate cancer",59
"prostate cancer bone metastasis lupron death",59
"prostate cancer diagnosis information",59
"prostate cancer diethylstilbestrol",59
"prostate cancer screenings",59
"prostate cancer treatment radiotherapy clinics of",59
"recurrence of prostate cancer",59
"recurrent prostate cancer young men",59
"cancer prostate wristbands",58
"gleason scale 9 prostate cancer",58
"prostate cancer and viagra",58
"prostate cancer computers",58
"prostate cancer death",58
"prostate cancer diary",58
"prostate cancer images",58
"prostate cancer in italy",58
"prostate cancer surgeons",58
"taxotere and prostate cancer",58
"treatment options for prostate cancer",58
"types of prostate cancer",58
"cancer diagnosis prostate",57
"incurable prostate cancer",57
"laproscopic surgery for prostate cancer",57
"luprone prostate cancer",57
"prostate cancer help colorado springs",57
"prostate cancer stages of",57
"prostate comprehensive cancer center2cvaccine tria",57
"rating prostate cancer research organizations",57
"robotic surgery for prostate cancer",57
"advanced prostate cancer lupron",56
"enlarged prostate cancer",56
"high dose rate hdr brachytherapy prostate cancer",56
"hormone therapy prostate cancer nausea",56
"physicians prostate cancer",56
"prostate cancer com",56
"prostate cancer conferences",56
"radiology and prostate cancer",56
"stage iv prostate cancer psa rising",56
"stage iv prostate cancer rising psa survival",56
"herbal remedies prostate cancer",55
