keyword,count
"""critical reading strategies""",16
"""reading strategies at home""",11
"12th grade reading strategies",9
"1st grade reading strategies",1728
"3rd grade elementary reading strategies",9
"3rd grade reading strategies",42
"6th grade reading strategies",1299
"8th grade reading strategies",18
"academic reading strategies",12
"accommodation strategies for reading",19
"accounting reading strategies",105
"accredited reading strategies for teaching kids to",16
"accredited reading strategies for teaching kids to read",130
"activate prior knowledge and reading strategies",20
"active learning strategies and reading or writing",113
"active learning strategies teach reading",27
"active learning strategies to teach reading",2018
"active reading strategies",1698
"active reading strategies for elementary students",10
"active reading strategies for of the plantation",12
"activities reading comprehension strategies",1106
"adhd writing and reading strategies",853
"adhd writing reading strategies",27
"advanced college reading strategies",24
"advanced level reading strategies for students",807
"advanced level reading strategies students",27
"advanced reading strategies",13
"after reading strategies",100
"all reading strategies",29
"allington reading strategies",11
"alternative strategies round robin reading",16
"alternative strategies to round robin reading",743
"an egg not a table reading strategies",207
"aphasia reading strategies",12
"applied research reading strategies",426
"applying sociological reading strategies in lesson",19
"applying sociological reading strategies in lesson plan",112
"applying sociological teaching strategies to reading",161
"appropriate reading strategies",132
"apraxia and reading instruction strategies",9
"art reading strategies",9
"article directed reading learning strategies",28
"articles about reading strategies",15
"articles effective reading strategies",9
"articles on effective reading strategies",197
"articles on nonfiction reading strategies",12
"articles on reading strategies",1364
"articles on reading strategies for elementary esl students",18
"articles on reading strategies in content areas",920
"articles on reading strategies in elementary",582
"articles on reading strategies in elementary schoo",108
"articles on reading strategies in elementary school",25
"articles on reading strategies in elementary schools",672
"articles on reading strategies in teaching",438
"articles on test taking strategies in reading",10
"articles reading strategies",25
"articles reading strategies content areas",23
"articles reading strategies elementary",19
"articles reading strategies elementary schools",19
"aspergers children and reading strategies",598
"aspergers children reading strategies",25
"author reading strategies leap frog viola swamp",283
"b e s t reading strategies",11
"balanced approach reading strategies",403
"barbara birch nurturing bottom up reading strategies",117
"bda reading strategies",294
"before during after reading strategies",20
"before during after strategies for guided reading",659
"before during and after reading strategies",983
"before reading strategies",633
"before reading techniques and strategies",72
"before, during and after reading strategies",99
"beginning reading strategies",318
"best practices reading strategies",186
"best reading strategies",225
"best reading strategies in first grade",114
"best strategies for reading workshop classes",116
"bible reading strategies",481
"book and brain reading strategies",408
"book brain reading strategies",31
"book comprehensive assessment of reading strategies",440
"book comprehensive assessment reading strategies",17
"book report reading strategies",42
"booklists by reading comprehension strategies",98
"bookmarks for reading strategies",289
"bookmarks reading strategies",15
"books to support reading strategies",275
"building fluency lessons and strategies for reading success",16
"building strategies for college reading",38
"building strategies for college reading textbook a",27
"building strategies for college reading textbook answers",122
"business education reading strategies",63
"capt reading strategies",225
"cars and stars reading strategies",20
"categories of reading comprehension strategies",428
"children ''''s literature reading strategies",30
"children literature reading strategies",16
"children reading strategies",705
"children''''s literature reading strategies",217
"childrens reading strategies",629
"classroom reading group strategies",11
"clerc center reading strategies",217
"cloze reading strategies",604
"cognitive reading strategies",259
"cognitive reading strategies for english language learners",16
"cognitive strategies in reading",12
"college reading strategies",368
"college textbooks reading strategies",832
"columbus reading strategies",179
"comic books and reading strategies",702
"comic books reading strategies",45
"comparison of reading strategies",9
"comprehending strategies for reading",370
"comprehension reading strategies",149
"comprehension reading strategies for primary stude",110
"comprehension reading strategies for primary students",840
"comprehension reading strategies primary students",23
"comprehension strategies and teaching reading",1104
"comprehension strategies reading",663
"comprehension strategies teaching reading",17
"comprehensive assessment of reading strategies",463
"comprehensive assessment of reading strategies cars series",16
"comprehensive assessment reading strategies",9
"content area reading and learning instructional strategies",16
"content area reading strategies",1037
"content area reading strategies article",89
"content reading strategies",391
"corrective reading strategies",314
"criss reading strategies",211
"critical reading strategies",1657
"critical reading thinking strategies",162
"current elementary reading strategies",143
"database of reading strategies",215
"deaf reading strategies",470
"decoding reading strategies",327
"decoding strategies for reading",466
"decoding strategies reading",23
"developmental reading strategies",172
"developmental strategies for reading",30
"diagnostic reading strategies",146
"discussion reading strategies",32
"dr jean ''''s super strategies for beginning reading",70
"dr jean super strategies reading",11
"dr jean''''s super strategies for beginning reading",330
"dr jean27s super strategies for beginning reading",131
"during reading strategies",1297
"dyslexia reading strategies",60
"early reading strategies",75
"early years january 1984 reading strategies",180
"education reading comprehension strategies",162
"education reading development strategies",583
"education reading strategies",1561
"educational reading strategies",334
"educational reading strategies for good readers",80
"effective instructional strategies for reading in k 3",20
"effective oral reading strategies",234
"effective reading strategies",1462
"effective reading strategies using closed captioni",57
"effective reading strategies using closed captioning",238
"effective strategies for teaching reading",540
"effective strategies for varying the rate of reading",264
"effective strategies teaching reading",12
"effective strategies varying rate reading",10
"effective teaching reading strategies",740
"egg table reading strategies",14
"ela reading strategies",15
"elementary art reading strategies",116
"elementary classroom reading strategies",63
"elementary lesson plans and reading strategies",12
"elementary reading comprehension strategies",711
"elementary reading strategies",1130
"ell reading strategies",17
"emergent reading strategies",391
"encoding decoding modell hall reading strategies",10
"esl and reading strategies",20
"esl reading skills reading strategies vocabulary building",10
"esl reading strategies",511
"esol reading strategies",620
"esol reading strategies articles",839
"exit exam reading comprehension strategies",54
"explicit instruction reading strategies",9
"expository reading comprehension strategies",24
"expository reading strategies",863
"fact and opinion reading strategies",239
"fcat reading strategies",17
"find reading strategies",184
"first grade reading strategies",592
"first year teacher reading strategies",123
"flanagan high school fcat reading strategies",223
"florida reading strategies",138
"fluency building strategies in reading",9
"fluency reading strategies",390
"fluent reading strategies",9
"four reading strategies",202
"fourth grade reading strategies",594
"free online strategies for praxis 1 and reading",149
"free posters for reading and writing strategies",212
"free posters reading writing strategies",9
"free reading strategies",187
"free reading strategies for fourth grade",572
"fun activities for teaching reading strategies",479
"fun activities teaching reading strategies",14
"fun activity for teaching reading strategies",17
"good reading strategies",9
"good reading strategies summarizing",10
"good reading strategies, summarizing",18
"grade reading strategies",19
"group experimental design reading strategies",22
"guide reading strategies",1120
"guided reading classroom strategies",91
"guided reading comprehension strategies",967
"guided reading ideas and strategies",10
"guided reading management strategies",57
"guided reading strategies",2935
"guided reading strategies 6 2",34
"guided reading strategies 6.2",185
"guided reading strategies 62",60
"guided reading strategies activities",1117
"guided reading strategies activities lessons",187
"guided reading strategies activity",14
"guided reading strategies first grade",12
"guided reading strategies for content area teachers",11
"guided reading strategies for middle school",450
"guided reading strategies in teaching",439
"guided reading strategies jr high",15
"guided reading strategies middle school",11
"guided reading strategies qar",20
"guided reading strategies teaching",20
"guided reading strategies using basal readers",270
"guided repeated reading strategies",9
"high school reading strategies",1117
"high school reading strategies lesson plans",13
"high scool reading strategies",103
"houghton mifflin reading skills and strategies",238
"houghton mifflin reading skills strategies",9
"houghton mifflin reading strategies",11
"how to teach reading strategies",321
"i need strategies for teaching guided reading",220
"identifying reading strategies practice",100
"identifying reading strategies printables",154
"improving reading comprehension strategies",142
"improving reading strategies",162
"improving reading strategies and resources",11
"independent reading strategies",18
"independent secondary reading strategies",463
"inferences reading strategies",103
"inflected endings -ed; -ing reading strategies",11
"instruction for reading comprehension strategies",203
"instruction guided reading management strategies",311
"instruction strategies reading",21
"instructional reading strategies",497
"instructional strategies and reading researched based",10
"instructional strategies for improving reading",44
"instructional strategies for reading comprehension",102
"instructional strategies for the 5 stages of reading",9
"instructional strategies in reading",10
"instructional strategies in reading for at-risk students",9
"instructional strategies pre k to third grade reading",115
"instrumental music and reading strategies",164
"intermediate reading strategies",19
"intervention strategies to follow informal reading inventory",10
"intuitive reading strategies",209
"journal articles about reading strategies",438
"journal articles on reading comprehension strategies",397
"journal articles reading comprehension strategies",17
"journal articles reading strategies",13
"journal topics on reading strategies",208
"journal topics reading strategies",11
"junior high writing and reading strategies",96
"junior high writing reading strategies",117
"keene reading comprehension strategies",29
"kelly fonner technology tools and strategies in reading",18
"kentucky department of education and reading strategies",257
"kinder reading strategies",194
"kindergarten reading strategies",1394
"learning reading strategies",287
"lesson plans for reading strategies",31
"lesson plans for reading strategies to match stand",10
"lesson plans for reading strategies to match standards",58
"lesson plans on reading strategies",156
"lesson plans reading strategies",10
"lesson plans shared reading strategies",12
"lessons on reading strategies",20
"letter recoding reading strategies",75
"list of reading comprehension strategies",9
"list of reading strategies",258
"listing of reading strategies",168
"literature reading strategies",262
"look think predict reading strategies",246
"lsat reading comprehension strategies",14
"make your own test reading strategies",10
"margin notes reading strategies",206
"math and reading strategies",20
"math reading strategies",281
"memory strategies for reading",13
"metacognition strategies for reading",129
"metacognitive awareness of reading strategies inventory",9
"metacognitive reading strategies",441
"metaphors, similes, and analogies in reading strategies",11
"methods strategies reading comprehension",22
"middle high school reading strategies",24
"middle school reading instruction strategies",255
"middle school reading strategies",243
"middle school reading strategies informational tex",23
"middle school reading strategies informational text",393
"middle school reading strategies lesson plans",609
"middle school science reading strategies",170
"multisensory reading strategies",180
"music content area reading strategies",42
"nlp and reading strategies",230
"nlp reading strategies",308
"nonfiction reading strategies",691
"nonfiction reading strategies teacher",9
"notes on reading strategies",10
"nurturing bottom up reading strategies by barbara",15
"nurturing bottom up reading strategies by barbara birch",106
"omission reading strategies",140
"on solid ground strategies for teaching reading k",25
"on solid ground strategies for teaching reading k 3",108
"online training for reading comprehension strategies",10
"open court reading strategies",242
"open court reading strategies and skills",20
"oral language strategies in early reading and writing",76
"oral language strategies in emergent reading",92
"oral reading strategies",623
"paper on reading fluency strategies",12
"par reading strategies",15
"parent reading strategies",87
"parent training interactive reading strategies",189
"patricia cunningham reading strategies",132
"phonemic awareness reading strategies",46
"phonics teaching reading strategies",451
"polar opposites reading strategies",270
"poor reading strategies",10
"post reading strategies",175
"powerpoint reading strategies",9
"powerpoint reading strategies first grade",9
"pre during post reading writing strategies earth science",9
"pre reading reading strategies",12
"pre reading strategies",1779
"pre reading strategies activities",323
"pre teaching strategies in reading",9
"preventive reading strategies",14
"preview before reading strategies",14
"primary reading strategies",297
"printable bookmark and reading strategies",38
"prior knowledge reading strategies",282
"prior knowledge reading strategies egg table",30
"prior knowledge reading strategies ships",34
"prior knowledge reading strategies three",42
"process chart reading strategies",175
"process notes as after reading strategies",127
"profound deaf reading strategies",157
"pssa reading strategies",10
"pssa reading strategies grade",11
"pssa reading strategies grade 3",258
"psychological strategies for reading",82
"question and answer reading strategies",18
"questioning reading strategies",405
"questioning strategies from open court reading pro",48
"questioning strategies from open court reading program",455
"questioning strategies open court reading program",18
"questions reading strategies mosaic",146
"quickdraw quickwrite and reading strategies",126
"reading accommodation strategies",18
"reading aloud strategies for children",11
"reading and comprehension and strategies",50
"reading and parent and strategies",419
"reading and strategies",164
"reading and writing in math strategies",14
"reading and writing strategies",607
"reading and writing strategies emergent learners",12
"reading and writing strategies for drta",31
"reading and writing strategies for gifted students",262
"reading as problem solving3a an investigation of strategies",868
"reading assessment strategies",107
"reading clarifying strategies",129
"reading comphrehension strategies",1922
"reading comprehension fix it up strategies for first grade",11
"reading comprehension fourth grade strategies",136
"reading comprehension instruction issues and strategies",111
"reading comprehension instuctional strategies",187
"reading comprehension paper bag lady strategies",237
"reading comprehension questioning strategies",34
"reading comprehension strategies",3730
"reading comprehension strategies adults",71
"reading comprehension strategies and foreign langu",17
"reading comprehension strategies and foreign language",73
"reading comprehension strategies and study skills",14
"reading comprehension strategies articles",221
"reading comprehension strategies autisitc children",13
"reading comprehension strategies before during and after",114
"reading comprehension strategies dyslexia",145
"reading comprehension strategies first grade",125
"reading comprehension strategies for autisitc chil",30
"reading comprehension strategies for autisitc children",386
"reading comprehension strategies for parents",252
"reading comprehension strategies for teachers",14
"reading comprehension strategies grade 2",77
"reading comprehension strategies inference",48
"reading comprehension strategies journal articles",151
"reading comprehension strategies l2",23
"reading comprehension strategies list",12
"reading comprehension strategies math",135
"reading comprehension strategies posters",317
"reading comprehension strategies powerpoint presentations",94
"reading comprehension strategies ppt",100
"reading comprehension strategies rereading",172
"reading comprehension strategies s c e n e",11
"reading comprehension strategies s.c.e.n.e",34
"reading comprehension strategies secondary schools",33
"reading comprehension strategies struggling readers",60
"reading comprehension strategies that work adolescents",33
"reading comprehension strategies tips",10
"reading comprehension strategies toolbox",109
"reading content strategies",172
"reading curriculum strategies",51
"reading decoding strategies",155
"reading development strategies",164
"reading first comprehension strategies predict",10
"reading first strategies",9
"reading fix up strategies",193
"reading fluency free strategies",1413
"reading fluency strategies",825
"reading fluency strategies scholastic",20
"reading fun strategies",263
"reading improvement strategies",99
"reading improvement strategies and resources",137
"reading instruction strategies",334
"reading instruction strategies activities",10
"reading instruction strategies and activities",224
"reading instructional strategies",244
"reading instructional strategies pre k 3",120
"reading intervention strategies",342
"reading intervention strategies for elementary",10
"reading interventions and strategies",21
"reading language strategies",100
"reading learning strategies",712
"reading lesson plans using cooperative learning strategies",18
"reading math strategies article",14
"reading memory strategies",268
"reading motivation strategies",305
"reading narrative strategies",119
"reading non fiction strategies",163
"reading parent strategies",19
"reading problem solving3a investigation strategies",16
"reading problems strategies",216
"reading recovery strategies",71
"reading remediation strategies",274
"reading research content reading strategies",72
"reading resourse strategies",142
"reading skill strategies",9
"reading skills and strategies",522
"reading skills reading strategies",39
"reading skills strategies",21
"reading strategies",11784
"reading strategies 2b worksheets 2b middle school",224
"reading strategies 2nd grade",9
"reading strategies 7 habits",173
"reading strategies according to the age",17
"reading strategies across the curriculum",97
"reading strategies adhd",190
"reading strategies adolescents",11
"reading strategies aid comprehension",512
"reading strategies and building background",26
"reading strategies and classroom management",433
"reading strategies and current research",131
"reading strategies and drawing conclusions",9
"reading strategies and elementary and teaching",207
"reading strategies and high school",65
"reading strategies and history",153
"reading strategies and lesson plans",10
"reading strategies and practices 7th edition",14
"reading strategies and teaching history",333
"reading strategies and teaching with books",91
"reading strategies and worksheet",160
"reading strategies before during after",44
"reading strategies bookmark",502
"reading strategies bookmark printable",12
"reading strategies bookmarks",226
"reading strategies building fluency",20
"reading strategies by debbie miller",157
"reading strategies cat hat",11
"reading strategies characterization",136
"reading strategies chart",17
"reading strategies charts",14
"reading strategies checklist",24
"reading strategies children",161
"reading strategies classroom management",20
"reading strategies college",128
"reading strategies college textbooks",31
"reading strategies comprehension math",159
"reading strategies conent areas",136
"reading strategies connections",96
"reading strategies connections inferring visualizi",34
"reading strategies connections inferring visualizing",221
"reading strategies content areas",10
"reading strategies content areas elementary",195
"reading strategies critical analysis",12
"reading strategies data chart",26
"reading strategies determine importance",14
"reading strategies determining importance",155
"reading strategies effectiveness",73
"reading strategies elem school",426
"reading strategies elementary",707
"reading strategies elementary comprehension",16
"reading strategies elementary school teachers",26
"reading strategies elementary students",13
"reading strategies elementary teaching",14
"reading strategies ell",10
"reading strategies employed by an intermediate rea",70
"reading strategies employed by an intermediate reader",288
"reading strategies employed intermediate reader",9
"reading strategies esl",12
"reading strategies esl primary",153
"reading strategies esl special needs",424
"reading strategies expressing theme",11
"reading strategies finding support for main ideas",10
"reading strategies first grade",34
"reading strategies fluency",841
"reading strategies for 1st grade",94
"reading strategies for adolescents",551
"reading strategies for art",19
"reading strategies for asian students",79
"reading strategies for before, during and after reading",15
"reading strategies for beginning readers",896
"reading strategies for bilingual children",10
"reading strategies for building fluency",602
"reading strategies for business education",9
"reading strategies for children",1632
"reading strategies for children with fas",9
"reading strategies for children with mental retardation",39
"reading strategies for college",76
"reading strategies for college and everyday life",24
"reading strategies for college students",125
"reading strategies for college textbooks",883
"reading strategies for comprehension",21
"reading strategies for critical analysis",408
"reading strategies for deaf children",98
"reading strategies for different grade levels",10
"reading strategies for dyslexia",397
"reading strategies for elementary",136
"reading strategies for elementary level",23
"reading strategies for elementary school teachers",975
"reading strategies for elementary students",563
"reading strategies for ell students",44
"reading strategies for ells",16
"reading strategies for emotionally impaired students",11
"reading strategies for esl students",238
"reading strategies for esol students",62
"reading strategies for extended curriculum",17
"reading strategies for fcat",230
"reading strategies for first grade",21
"reading strategies for first graders",325
"reading strategies for foreign languages",272
"reading strategies for fourth graders",40
"reading strategies for grade 8",10
"reading strategies for grade one",11
"reading strategies for grades one and two",9
"reading strategies for guide o rama",723
"reading strategies for guided reading",191
"reading strategies for hearing impaired",9
"reading strategies for helen keller",91
"reading strategies for high school",798
"reading strategies for high school students",447
"reading strategies for hispanic learners",218
"reading strategies for improving reading comprehen",18
"reading strategies for improving reading comprehension",78
"reading strategies for information",84
"reading strategies for kids",31
"reading strategies for kindergarten and first grade students",17
"reading strategies for ld",257
"reading strategies for learning disabled",11
"reading strategies for listening game",24
"reading strategies for listening games",511
"reading strategies for low achievers",14
"reading strategies for low readers",16
"reading strategies for math",734
"reading strategies for mentally handicapped children",199
"reading strategies for mentally retarded",11
"reading strategies for middle school",603
"reading strategies for middle school students",10
"reading strategies for native american literature",9
"reading strategies for non fiction",17
"reading strategies for nonfiction",492
"reading strategies for parents",975
"reading strategies for parents of special education students",10
"reading strategies for parents of young children",71
"reading strategies for poor readers",614
"reading strategies for reluctant readers",125
"reading strategies for schools",11
"reading strategies for science k12",20
"reading strategies for second grade",255
