keyword,count
"reading strategies for second language learners",202
"reading strategies for secondary education",27
"reading strategies for secondary students",342
"reading strategies for special education",699
"reading strategies for special need learners",216
"reading strategies for standardized test",250
"reading strategies for standardized tests",91
"reading strategies for standerized tests",87
"reading strategies for struggling readers",35
"reading strategies for students",125
"reading strategies for students with learning disa",40
"reading strategies for students with learning disabilities",438
"reading strategies for substantially deficient stu",39
"reading strategies for substantially deficient students",150
"reading strategies for synthesizing",12
"reading strategies for teachers",1092
"reading strategies for teaching children with dysl",36
"reading strategies for teaching children with dyslexia",427
"reading strategies for teaching esl students",618
"reading strategies for teaching kindergarten",461
"reading strategies for teaching students reading",215
"reading strategies for teaching varying the rate o",36
"reading strategies for teaching varying the rate of reading",395
"reading strategies for technical applications",96
"reading strategies for the children",20
"reading strategies for the middle school",80
"reading strategies for the social studies classroo",10
"reading strategies for the social studies classroom by",12
"reading strategies for the struggling reader",665
"reading strategies for upper elementary",587
"reading strategies for vocational high school stud",13
"reading strategies for vocational high school students",60
"reading strategies for volunteers",126
"reading strategies for young readers",648
"reading strategies forms",271
"reading strategies from journal articles",563
"reading strategies grade 1",302
"reading strategies grade 3",269
"reading strategies guided reading",17
"reading strategies handouts middle school",261
"reading strategies high school",553
"reading strategies high school students",28
"reading strategies holes louis sacher",9
"reading strategies in classroom",19
"reading strategies in content areas",17
"reading strategies in math",24
"reading strategies in physical education",18
"reading strategies in science",949
"reading strategies in spanish",269
"reading strategies in the content area",154
"reading strategies in the library media center",353
"reading strategies increase test scores",10
"reading strategies infer",9
"reading strategies information",11
"reading strategies informational text",10
"reading strategies inventory",10
"reading strategies journal articles",29
"reading strategies k 12",11
"reading strategies kwl",10
"reading strategies lesson plan",429
"reading strategies lesson plans",1644
"reading strategies lesson plans elementary school",550
"reading strategies lessons",19
"reading strategies level 3 readers",197
"reading strategies library media center",9
"reading strategies listening games",18
"reading strategies listening stories",207
"reading strategies logs",203
"reading strategies main idea",535
"reading strategies material",314
"reading strategies materials",68
"reading strategies math",319
"reading strategies mathematics",1521
"reading strategies mentally handicapped children",20
"reading strategies middle school",305
"reading strategies minilessons",20
"reading strategies mosiac of thought",131
"reading strategies note taking summarizing",274
"reading strategies online activities",44
"reading strategies paragraph frames",9
"reading strategies paraphrasing",20
"reading strategies parents",113
"reading strategies physics",160
"reading strategies picture books",14
"reading strategies pictures",12
"reading strategies poor readers",14
"reading strategies poster",32
"reading strategies poster inferencing",523
"reading strategies posters",435
"reading strategies power point",321
"reading strategies ppt",269
"reading strategies predicting",20
"reading strategies prediction chart",10
"reading strategies pssa",356
"reading strategies questiong the author",15
"reading strategies questionnaire",36
"reading strategies quiz",21
"reading strategies read aloud",10
"reading strategies reading first",13
"reading strategies reading methods for minorities",9
"reading strategies reluctant readers",10
"reading strategies research paper",72
"reading strategies rhyme rhythm poetry",17
"reading strategies right there questions",141
"reading strategies science",39
"reading strategies secondary",87
"reading strategies secondary students",17
"reading strategies semantic mapping",367
"reading strategies skip it and go on",317
"reading strategies social studies",210
"reading strategies standardized test",9
"reading strategies steps",18
"reading strategies student",179
"reading strategies students learning disabilities",23
"reading strategies suggestions",114
"reading strategies summarizing",17
"reading strategies survey",14
"reading strategies teachers",29
"reading strategies teaching children dyslexia",16
"reading strategies teaching esl students",19
"reading strategies teaching history",21
"reading strategies teaching kindergarten",19
"reading strategies teaching students reading",15
"reading strategies teaching varying rate reading",21
"reading strategies techniques",232
"reading strategies techniques elementary",312
"reading strategies tests",13
"reading strategies that children love and learn",11
"reading strategies that effect test scores",65
"reading strategies that promote literacy",12
"reading strategies that work",382
"reading strategies that work for teenagers",95
"reading strategies think aloud",10
"reading strategies to help construct meaning",190
"reading strategies to help fluency",65
"reading strategies to increase test scores",143
"reading strategies to use at home",81
"reading strategies to vary round robin reading",117
"reading strategies upper elementary",596
"reading strategies using bloom ''''s taxonomy",32
"reading strategies using bloom ''''s taxonomy to question",36
"reading strategies using bloom''''s taxonomy",181
"reading strategies using bloom''''s taxonomy to quest",39
"reading strategies using bloom''''s taxonomy to question",144
"reading strategies using cat in the hat",469
"reading strategies using pictures",209
"reading strategies using prior knowledge",12
"reading strategies vocabulary",217
"reading strategies webquest",45
"reading strategies whole class small groups ononone",10
"reading strategies with bloom ''''s taxonomy",25
"reading strategies with bloom''''s taxonomy",158
"reading strategies with holes by louis sacher",291
"reading strategies with rain forests articles",36
"reading strategies word study",90
"reading strategies workbook",15
"reading strategies worksheets",902
"reading strategies young readers",11
"reading survey cognitive strategies",408
"reading taks strategies",755
"reading teaching strategies",418
"reading teaching strategies 2nd grade",9
"reading test strategies",253
"reading test taking strategies",17
"reading theory 2b strategies for teachers of readi",54
"reading theory 2b strategies for teachers of reading",422
"reading theory 2b strategies teachers reading",26
"reading tutoring strategies",353
"reading with meaning comprehension strategies",114
"reading workshop strategies",523
"reading writing strategies",60
"reasearch on reading strategies",383
"related phrases are reading strategies",20
"remedial reading strategies",890
"research articles on reading comprehension strategies",605
"research articles reading comprehension strategies",23
"research baed reading strategies",181
"research based reading and math strategies",475
"research based reading math strategies",12
"research based reading strategies",245
"research on reading strategies",344
"research on reading strategies and practices",165
"research paper student owned reading strategies",172
"research reading strategies",15
"revisit reflect retell strategies for improving reading",13
"rhyming reading strategies",197
"rules strategies for teaching reading",195
"sample literature review on reading effective strategies",151
"sample reading strategies",17
"sc exit exam reading comprehension strategies",771
"scan and run reading strategies",316
"school improvement plans reading strategies",34
"school improvement reading strategies",503
"school improvement strategies for reading and math",51
"science 2b reading strategies",221
"science and reading and writing strategies",741
"science grades k 2 nonfiction reading strategies",207
"science grades nonfiction reading strategies",25
"science pre reading strategies",20
"science reading strategies",1334
"science reading writing strategies",32
"scientific strategies for reading",15
"second grade lesson plans for reading strategies",18
"second grade reading strategies",331
"secondary reading strategies",402
"sedondary reading strategies good readers use",103
"self questioning reading comprehension strategies",221
"seven reading strategies",199
"shared reading strategies",361
"silent reading strategies",175
"skills middle school reading strategies",69
"social studies reading strategies",718
"sociological teaching strategies to reading",57
"speed reading and study strategies program",10
"speed reading strategies",139
"sq3r reading strategies",11
"step by step reading strategies",154
"strategies and reading comprehension",122
"strategies books content reading",171
"strategies checklist for students when reading",168
"strategies computer asisted reading instruction",12
"strategies content area reading",9
"strategies for computer asisted reading instruction",239
"strategies for content area reading",155
"strategies for elementary reading",238
"strategies for fluency and reading comprehension",598
"strategies for guided reading",350
"strategies for improving inference while reading",197
"strategies for improving reading",28
"strategies for improving reading comprehension",722
"strategies for improving reading scores",137
"strategies for increase reading achievement",21
"strategies for increasing reading fluency",442
"strategies for kids with reading difficulties",703
"strategies for kindergarten differentiated reading",14
"strategies for learning styles for reading development",322
"strategies for novel reading in high school english",578
"strategies for oral reading",36
"strategies for practical reading",571
"strategies for purpose in reading",374
"strategies for reading",843
"strategies for reading a work of literature",124
"strategies for reading assessment and instruction",490
"strategies for reading assessment and instruction helping",11
"strategies for reading college textbooks",215
"strategies for reading comprehension",652
"strategies for reading comprehension ell with disabilties",16
"strategies for reading disabilities in children",11
"strategies for reading disablilties",187
"strategies for reading fluency",598
"strategies for reading k 3",27
"strategies for reading literature",95
"strategies for reading numbers",136
"strategies for reading recovery",112
"strategies for reading success",12
"strategies for reading teachers",1134
"strategies for remedial reading",82
"strategies for success in reading",20
"strategies for teaching dyslexics reading",16
"strategies for teaching primary grades reading on sat 10",246
"strategies for teaching reading",761
"strategies for teaching reading comprehension",18
"strategies for teaching reading to esol students",12
"strategies for teaching reading vocabulary",367
"strategies for the reading comprehension",598
"strategies for the teaching of reading",761
"strategies good questions when reading",114
"strategies help kids reading comprehension",12
"strategies improve reading skills",11
"strategies improve student learning in reading",22
"strategies improving reading comprehension",13
"strategies in reading",21
"strategies in reading comprehension",121
"strategies in reading using bloom ''''s taxonomy",30
"strategies in reading using bloom''''s taxonomy",121
"strategies in teaching reading",31
"strategies in teaching reading language",95
"strategies increase reading achievement",15
"strategies increase student achievement reading",9
"strategies increasing reading fluency",14
"strategies kids reading difficulties",21
"strategies learning styles reading development",20
"strategies novel reading high school english",23
"strategies of reading",15
"strategies of teaching reading",844
"strategies on guided reading",497
"strategies practical reading",13
"strategies reading",19
"strategies reading assessment instruction",12
"strategies reading college textbooks",17
"strategies reading comprehension",35
"strategies reading fluency",18
"strategies reading research based",70
"strategies reading teachers",30
"strategies reading work literature",10
"strategies skim reading",116
"strategies teach reading students autism",11
"strategies teaching primary grades reading sat 10",21
"strategies teaching reading",573
"strategies teaching reading alternative methods",214
"strategies that can be used to improve reading com",12
"strategies that can be used to improve reading comprehension",79
"strategies that understand reading",141
"strategies that work visualization lesson plans for reading",310
"strategies that work visualization reading lesson",275
"strategies to achieve reading success",172
"strategies to correct reading problems",130
"strategies to help improve reading comprehension",162
"strategies to help kid with reading comprehension",28
"strategies to help kids with reading comprehension",565
"strategies to improve reading comprehension",89
"strategies to improve reading skills",317
"strategies to increase reading comprehension",199
"strategies to increase reading fluency",144
"strategies to increase student achievement in reading",140
"strategies to promote reading comprehension",142
"strategies to teach in guided reading",149
"strategies to teach reading",143
"strategies to teach reading comprehension to junior learner",31
"strategies to teach reading to students with autis",22
"strategies to teach reading to students with autism",374
"strategies to use during reading hard text",52
"strategies used before during and after reading",11
"strategies used to improve fourth grade reading scores",9
"strategies work visualization lesson plans reading",11
"student owned reading strategies research",122
"studies on reading strategies",645
"studies reading strategies",12
"study skills and reading strategies",196
"summarizing reading strategies",74
"summarizing strategies in teaching reading",945
"summarizing strategies teaching reading",40
"summer reading strategies for at risk youth",11
"synthesis reading strategies",131
"taks reading strategies",1164
"talking reading strategies",146
"tasp reading strategies",283
"taxonomy critical reading strategies",230
"teach reading strategies",39
"teachers reading strategies",10
"teaching aphasia reading strategies",14
"teaching kindergarten reading strategies",459
"teaching multiple meanings reading strategies",18
"teaching prediction reading strategies",13
"teaching primary reading strategies",9
"teaching reading comprehension strategies",1420
"teaching reading strategies",3069
"teaching reading strategies and exceptional learne",16
"teaching reading strategies and exceptional learners",105
"teaching reading strategies homeschooling",494
"teaching reading strategies in science",11
"teaching reading strategies meaning comprehension",142
"teaching reading strategies visualizing inferring",370
"teaching strategies for reading",106
"teaching strategies for reading difficulties",178
"teaching strategies for reading fluency",619
"teaching strategies for reading in 8th grade",9
"teaching strategies in reading",12
"teaching strategies in second language reading",359
"teaching strategies reading fluency",19
"teaching strategies second language reading",29
"techniques skim reading strategies",371
"textbook reading strategies",1140
"the fluent reader oral reading strategies for building word",18
"think aloud studies reading strategies",153
"thinking strategies for reading",404
"thinking strategies reading",11
"third grade reading strategies",586
"third grade reading strategies and fluency",552
"third grade reading strategies fluency",22
"top strategies for passing the virginia sol reading",142
"trading cards reading strategies",278
"treasure island reading strategies",33
"treasure island worksheets reading strategies",24
"tucker reading strategies",260
"tucker signing strategies for reading",358
"tucker signing strategies reading",11
"types of reading comprehension strategies",149
"visual reading problems children strategies",227
"visual strategies and reading",170
"visual strategies reading",10
"visualization strategies reading",106
"visualize infer reading strategies",143
"visually representing reading strategies",155
"vocabulary and reading strategies",11
"vocabulary development reading strategies",265
"vowel dipthongs ou; ow reading strategies",12
"webbing social studies reading strategies lesson",236
"what are before reading strategies",23
"what are reading comprehension strategies",24
"what are reading strategies",18
"what are reading strategies for first graders",12
"what are some methods for teaching reading strategies",13
"what are syntex strategies in reading",246
"what are the basic reading skills strategies",10
"what are the seven reading strategies",12
"what are the six reading strategies",23
"whole language reading strategies",97
"why do we use strategies for reading easy text",26
"with in group experimental design reading strategies",596
"word attack strategies for students struggling with reading",422
"word attack strategies students struggling reading",14
"word attack strategies used in reading instruction",146
"word recognition teaching reading strategies",13
"worksheets pre reading strategies",22
"writing and reading strategies",16
"writing reading and oral strategies in social studies",10
